id,time,title,author,score,num_comments,text
as9t6q,1550578768.0,bernie sander announces running president  2020 ,Gwiilo,831,56,genuine question foreigner problem old whole succession parade set gracefully deal president unable continue term deleted thought people got second chance one got away movie please tell deleted bernie still win poor bernie american deserve love idea another bernie run everyone saying old pitted trump together stress test bernie would win hand great hear conservative side reddit right would  79  taking office fear would old four year term age  whoever win democratic primary  2020  honor sacrifice get good vp cause love bernie aint making  4  year look job aged obama great entertainment trump begin arguing sander isnt healthy enough presidency reagan  69  took oath bernie would  79  think hope win must want  4 th house deleted afraid might old plus people jumping making harder candidate gain much ground deleted cult rabid economy drop donald blame bernie sander hope andrew yang win exactly america need right bernie would best bernie trust trump get  2 nd term know certain american masochist stupid maybe anyone really better trump bernie seems primo choice side aisle point democrat nominee already hand picked party insider democrat primary voter caucus attendee say whomever get nomination crowder jsut fist pumped material next  2  year least probably old found vp could really motivate base consider please bernie love god hope pick decent vp fine otherwise wait till democrat fix best news today gerontocracy deleted go bernie go deleted voted  2016  primary think field lot stronger probably vote harris warren  2020  primary thing stand part hope win nomination inevitably loses wo listen bernie would kid anymore  good luck ya commie bastard guy seems pretty upbeat versatile age maybe age wo problem still think old socialism fucking retarded collectivism responsible  100  million death sorry kid never learned  suspect actually think win probably want help set tone debate managed influence hillary quite bit policy wise old odds win bet therr dozen democrat likely already right news  2 nd time charm wait hillary reveal next week seriously want trump  2 nd term retreading shit  1 st time around exactly get trump  2 nd term god sake ca come someone  20  year younger hell even  10  year younger would work thats still riding line old taste everyone keep yapping person person wise people none work u believe say greed career politics ensured work none get better changing president ruling party work someone else quit old talk thing said bob dole ran still kicking running america fuck time deleted already lost going lose matter going survive  2020  anyway deleted wish could benjamin button age  50  easy vote deleted 
aztvzt,1552313444.0,trump would win  98  vote ran israeli election american politics,InterestingVolume,125,17,guy stupid manages almost every single day deleted trump also attacked democratic party saying hate jew understand jew vote democratic party please go find trump israel ag trump really want take chance going attorney general mindless sycophant thing dumber donald trump defending truly dim mother fucker point know backlash american politician get criticizing israel surprised called forcefully biggest insult israel ever heard jesus christ want cookie somehow doubt bunch jew country jew would overwhelmingly vote supposed presbyterian seems rather unlikely donnie would get vote would even ballot citizen israel qualify become one unless prove born jewish family saying donnie would demand see birth certificate   98  wow humble good go run big oof go run good riddance sorry israel like thinner situation get rid feeding sort pie bit exaggeration yes probably would win easily long pretended jewish convincingly pretend christian 
bck3d0,1555110266.0,law enforcement security official reveal u leader executive allowed company hacked china without consequence worried confrontation causing trade stock price drop,,55223,84,apparently google wanted fight back could get single company stand former top google official closely involved managing hack told npr google infuriated company would come forward leaving google challenge china alone wanted company name said official spoke condition name used permission google speak incident one company called said yeah tracking month unbelievable legal department talked u felt like stood right thing former official said felt like helm deep battle lord ring impossibly surrounded severely outnumbered james mcgregor former chairman american chamber commerce china time say company kept even business organization like speaking done held press conference say  35  business hacked would put right back china say mcgregor instead hid rock pretended happen mcgregor say silence left little room punishment worse say hid extent problem worked american government certain virus discovered state government computer virus one thing whenever anything created autocad design software virus sent design server china virus discovered revealed operating undetected long time year infected basically everyone ever used software design anything everything designed autocad product road bridge military equipment everything state nothing try keep public finding edit woah blew posted time one ever noticed way hell speaking reporter however calm thing design military equipment never connected net literally everything else though ten year ago left people learned allowed tell nothing reporter chase could tell reporter start asking question though virus embedded autocad file manipulated program transmitting incredibly sophisticated impressed programming never seen anything like edit  2  fine real reporter major organization contact verify credential ill talk guy realize manager news agency intelligence payroll kill story like going nowhere edit  3  everyone affected link autocad security team say autocad team told  2007  discovered might done something like tell everyone blog virus found file untouched since  2003  autocad one program found sort virus operating damn npr hitting u friday news drop big fucking deal let let break law might make much money want idiot leader exec profit people one weirdest thing ever read stock price transient would blown month chose sacrifice right litigation reactionary stock dip news done across corporate landscape weird time live know ever surreal time national security even mean anything stock price important pathetic seems like big deal name shame company held accountable preet interviewed someone involved government level actually went business showed evidence shocked government revealed already knew response thought could keep competitive advantage stay black  2025  reaching critical underestimated china expecting decline revenue loss market share early  2020  fuck edit u government step another instance something nearly enough people talking international scale plutocrat robber baron control global economy longer believe concept sovereign nation society think thing artifact era think abstractly term market labor group political vector power term country citizen culture longer invested protecting particular sovereignty social idea financial calculus lifestyle value group different across border matter insofar affect profit growth risk etc hacked china existential importance citizen term safety national pride private sector importance mainly competition market share advancement tech disconnect going get billion people killed needlessly deleted ive always wondered good nsa tla agency actually going stop threat anyone remember aspect cyberpunk reminds mr robot white rose seriously many string pulled behind curtain without consequence country leader celebrity influencers idiot held accountable russia china making america bitch repeatedly without firing single shot aided abetted u citizen one damn thing greatest nation earth eh yeah right hope people recognise consequence always profit highest motive see irony coming stratum people strong invective thing socialist company interested revenue ethic leader executive criminal china pushing luck international stage decade keeping focus crime humanity economic theft etc vital short attention span within month even week forgotten news world consequence breaking law violating human right dangerous one need pressure representative government level take effective action punish china edit even start whataboutism edit  2  truly pathetic awful see china defender either need go country crime punished logic violent sociopath deleted make canada arrest huawei cfo capitalist sell u rope use hang sound right tbh ramification sourcing manufacturing china accumulating debt creeping u every year another step path cant stand country make shit keep economy moving also cant threaten one hold debt without full warfare officially oligarchy control sold majority line pocket want national firewall prevent thing idea like entering country provide measure defence others trying hack rest world firewall allow zero connection come country connect rest world want isolate protect help issue course action intent never protection control power concerned keeping big buck surprise china made concession trade talk cloud technology plus side chinese sell nude everybody tell spouse last thursday night surprising everyone china bitch even though commit countless atrocity make u cheap shit awful evil dictatorship one care explains bottom falling cybersecurity suicide seminar rip aaron swartz many others fighting stupidity let talk trade currency war next anyone remember micro thing feel like part reason people decided fake company denied people said well nobody would lie hacked chinese government despite fact rely china crucial part supply manufacturing chain u created monster remember clown  90  saying free trade gon na liberate unfree world beyond pathetic company let consumer information get stolen nothing held liable stripped right business state mean politician good people surprise bunch coward selling country money let guess political party ceo believe called corporatism interning u attorney office chance speak counter intelligence official issue attitude basically thing pretty sure nsa thing alright show hand surprised nobody surprise jack complete lack surprise almighty dollar anyone actually shocked people power chose comfort money safety security  4 pm friday chose publish bury story well also explains china steal intellectual property regard usa govt give fuck innovation america getting walked want cheap sweatshop good shelf yay least toy gadget thanks nixon one scariest article read long time demonstration stranglehold america corporate culture everyone future bunch chicken shit capitalist sell u rope hang feel like quote fit situation perfectly lady gentleman live dystopian future run corporation chinese powerful better give power absolutely absurd need new stock market system getting abused canada incredible moment capitalism government become cowardly rather protect people dumbing greater priority educating paying citizen well developing great productivity providing strong leadership world dianne feinstein employed chinese spy  2  decade american style capitalism threat america national security land free home brave usa sale china bought leadership lobbyist blame investment market company afraid upsetting investor anything keep stock fall american empire united state america infamous history meddling country one meddled national scale every way federal government way situated deal busy devouring every last dollar find said stand still today people publicly hanged treason especially executive lockheed allowed shit happen top secret technology consistently fucking year change unless dire consequence introduced obviously first offender consistently allowing happen even reporting much le taking action prevent may well foreign agent make feel like story china putting tiny chip electronics back every company denied knowledge legit fucked man typical comment section nobody putting responsibility obama failing act rich exec fault sort amazed press could even print justifies hard line china aka maybe trump completely crazy way corruption greed government knew jeez america grow back bone greedy people care short term goal shortsighted china number  1  soon one reason america downfall let see american public reacts  2  people want call treason show little u government care sovereignty u truly oligarchy jesus fuck country shit show country run pussy currently completely understand google blocked china til jesus fucking christ ca think worse time alive country right ruined internet whole thing read like rape scandal enough shit fucking people go word power money continue exploit threaten manipulate control mass one anything call people know country attack responsible defense country nothing deleted money important environment money important health money important democracy money important international espionage money bring america rarely say trump right say china usual bullshit say alot culture really pathetic government law official sold u money surprise level high greed fall capitalism 
bhtrid,1556326600.0,brazilian bank commercial highlighting country diversity pulled following request president jair bolsonaro bank confirmed,DoremusJessup,1014,15,conservatism wearing floppy pimp hat labeled nationalism walking street girl labeled fascism  1  arm girl labeled racism wearing big coat say oligarchy wondering bad reputation bolsonaro trash brazil probably ethnically diverse country planet government owned bank private bank still wrong though understand happened country like austria poland estonia iceland brazil really country like biggest melting pot world u talk everyone pussy snowflake like offended yet always far right offended demand shit censored like banned ad banco brasil state owned bank  54  created  1808  president saying sure much bet duty cop take puke people colour term stupid everyone skin colour even far right country half population black half indigenous mean nationalist brasil even mean context edit many butthurt imperialist ignorant metaphor good highlight diversity diversity fine really hate start pushing face want see commercial diversity want watch presentation work diverse company embrace diversity diverse shut fuck talking misleading title expected leftist propaganda reason bolsonaro asked removal strong lgbt message bolsonaro always said people orientation want would upmost stop gender identity sexuality politics school public medium lgbt equal everyone else also request stop used flag everyone reason use sexual orientation add bank every propaganda left right banned public access let free channel see arm keeping mainstream personal life choice minority people brazil really diverse south america got african asian diversity like north america dont emphasize diversity nonsense people get along people call american america get along 
bz2kmw,1560197032.0,chimpanzee meat eaten wedding sold market stall britain dr jane goodall dr ben garrod warned bush meat brought uk,syuk,3215,103,pick disgustingly nasty parasite get even tiny bit careless w bush meat incurable whole point bush meat cheap accessible earth people going time expense smuggling great britain already better option available  fish chimp classic british delicacy oh man always wondered ebola would spread europe know want outbreak get outbreak fucked believe human first contracted aid might wrong probably google vacuuming want aid get aid  50  year ago maybe today everything human know get info mammal eating distant cousin fucking sad human got aid get aid people disgusting destructive tradition need destroyed bit specific meat sold almost like intentionally ahh one revolting bit television ever seen one border security show uk someone brought rotting bush meat exploded baaggae carousel christ fucking bike awful also whole foot mouth disaster saw million farm animal destroyed early  2000 s get traced back someone bringing pork asia pig uk fuck would bring pork luggage apparently get electric avenue market brixton know talk isnt got aid ebola actual fuck humanity one day someone going get contagious prion disease eating chimp zombie apocalypse start chimp damn near human disgusting nothing surprise anymore live london whole horse meat scandal went vegan month disgusting day age pretty close canabalism prefer see better source mirror doubt happens trying see could profitable somehow kill chimpanzee likely challenging track kill cow preserve meat ship uk earth buying chimp meat eating fucking bonkers wonder anything london le british  99  cannibalism  28  day later wow yall know tower babel story fuck done news today thanks want new type hiv raise chance cause african love chimp meat think apartheid race seperating bush civilized matter time first ebola outbreak want ebola great britain get ebola great britain chimp burger extra prion please removed article completely omits reference eats chimpanzee meat wedding buy stuff market wtf happened uk diversity  6  degree seperation away cannibal started anyone eli 5  prion bushmeat acquisition buy bush meat african district brussels well  look date article historical work extensively west africa looking bushmeat trafficking amongst thing whilst exists threat chimpanzee gorilla pangolin crocodile nearly horrendous problem like make innumerable reason bushmeat consumption bushmeat cover huge variety animal helped using term bushmeat replace meat see different article sound poor article apparently usual poor research seizure figure one operation  2010  please adding bias surrounding bushmeat coupled distinct misunderstanding around capability law enforcement interpol combat issue wanted jungle people got jungle food congrats either got ebola need stop eating subway happened banger mash ebola people want latest bushmeat acquired disease even deliver wedding get ebola fuck really need strict shit cameroon interesting pidgin english sign eating bush meat chop dis kind bushbeef dem go finish small seen monkey part sale various market africa south america deleted say would racist let eat bush meat cop send people jail opposing removed diversity strength allowing immigrant eat meat ethnocentric racist wan na hannibal lecter start small tarzan bring back eating buying meat btw asking friend easy get bush meat  20  year ago least east london would imagine nothing changed fuck uk ebola marburg spread improperly handled prepared bush meat good stuff ebola coming uk next real question tf market uk funny reminds  28  day later take place uk aid became thing demand monkey meat coming soccer hooligan stumbling pub go nosh chimp burger shit price per kg eaten wild donkey count bush meat fuck would want eat feel like borderline cannibalism like dog eating wolf meat would anyone want eat chimpanzee meat reappears even year usually claim evidence mmm tasty rat stick snack really want taste exotica even resort african pop budgens buy better eating neighbour seems pretty honest elite  wtf wrong prime rib think reason anyone right mind would eat primate day age interest eating chimp curious taste like british ekkhh sopa de macaco uma entire thread utter nightmare fuel sorry britain haram hope idiot take anyone else along ride sound like start bad zombie movie hey got monkey information first bush meat delicacy africa sometimes eaten rich african city special occasion second main problem ebola similar disease spread bushmeat chimp meat associated ebola much whole problem start bringing type meat old joke q hardest part aid convincing mother haitian typical scientist trying take away monkey meat today science got  8  lb quality chimp thigh freezer going nowhere belly next gon na stop kicking goose border cannibalism mind shit thats basicially cannibalism one reading article bush meat mean chimpanzee primate last case primate meat found uk back  2011  according article buy legally sourced bush meat supermarket restaurant article people illegally transporting local game activity specific one culture user often report submission site ask u ban sensationalized article oppose blanket banning news source reader responsibility skeptical check source comment flaw help improve thread linking medium verifies question article claim link could help reader better understand issue find evidence article title false misleading contact moderator review bot action performed automatically please contact moderator subreddit question concern bush meat call dink sole exposure uk week consisted royal baby blimp monkey meat strange bunch oh yeah boris guy definitely gotten monkey meat disgusting uk u slowly becoming cesspool animal right violation equal cannibalism book real question chimp good please answer farm critter difference cow idea eating chimp skeeves banana deleted 
c38x4n,1561112779.0,debate school shut trend towards intolerance different opinion warns uk office standard education child service skill chief,ManiaforBeatles,205,14,love uk country imprisons people saying mean thing stop tolerating isi belief stop allowing climate wrecker sponsor shit worrying trend towards intolerance different opinion warns ofsted chief coming uk contributed lot element contemporary liberal democracy thanks magna carta interesting trend pretty sure whole fake news pandemic result opion fact fallacy opinion particular  1984   2024  thought police round disturbing trend people want bathe moral superiority truth majority opinion based evidence logic biology eventually confront sociology may bloody since dna wont denied goal arrived must agree mind one hail fearless leader since part school remember lol even allowed talk issue anymore wtf world good debate fact opinion well researched opinion evidence solid argument take issue something thinking opinion equally respected deleted lgbt taught school taught home intolerance different opinisons refer teacher student refusing go school waste dump site 
