id,time,title,author,score,num_comments,text
agcgzd,1547581792.0,brexit vote jeremy corbyn table vote confidence may suffers historic defeat,Idontlikethisstuff,1667,33,u yank tabled america un apparently til mean withdrawn tabled everywhere else mean presented oh word corbyn confidence motion dup back may need least  10  tory rebel vote government regardless outcome brexit clearly sold british people false promise hopefully remember next election someone give summary happens may government loses vote dissolved law student uk brexit absolute shit show nobody know fuck happening could seriously harm many u wish study stay uk law student semester full debating shitshow thing considered form brexit end badly live stream savage mp holding back dup back tory wo pas know confirmed confidence vote last month brexit deal got  200  vote last month  1  month deal still got  202  vote deal dead brexit deadline coming march someone else take two month time left end role brexit honestly would say know take take job saying handled whole mess well amount hatred vitriol unleashed upon whole fustercluck ordeal astronomical may preempetively saying fine confidence vote time debate kinda dampened corbyn speech power move right question understand already confidence vote government another confidence vote take place soon anything fact went something believe inspire confidence god jeremy corbyn music someone eli 5  whole shitshow completely alien come eu politics please allow dumb question may brexit true look bad people voted brexit feeling regret decision likely brexit end happening corbyn role make may look bad december something keep bringing sorry unclear uk political procedure unfortunately country bigger joke government corbyn stepping made labour unelectable mean uk wo leaving eu confused af people clamoring uk deal mean ect realize eu want ok leaving uk position completely fucked set presedent country leaving eu goal entire brexit fiasco strap gigantic black dildo give uk serious anything offer brexit deal well fucked like corbyn gesture ineffectual election would solve nothing brexit take u kind clarity labour even bothered split brexit set discernible position may seen resolution brexit mean last unify party hell country corbyn see opportunity grab power hell brexit oh look corbyn something capitalise someone else failing fucking odds despite well documented fact pro brexit voter tricked outrageous lie put russia corrupt mp may determined run gb cliff people want serve people played putin every bit outrageously friend trump ca believe actually want brexit really stupid enough think better deal table cameron stupid campaign promise uk could ofcourse decide undo whole article  50  thing turn brexit bremain undemocratic thing agree really worth shitstorm opportunistic shit stain stayed fence debate wo come favour second referendum belief negotiate better deal offer nothing different tory making power grab need shit even everything happened still trail may  6  point poll welp coryin one lied much better going uk left eu somebody else jeremy corbyn antisemite democracy dy amidala edit quote perfectly balanced 
ahh5zc,1547859524.0,cnn mueller office dispute buzzfeed report trump directed michael cohen lie congress,JTP709,60713,75,incredibly tired endless clusterfuck removed buzzfeed still standing version event interesting see play turn buzzfeed good mueller office speaking ca imagine much pressure team stage really get impression trying turn every corner squarely stand reporting source informed urge special counsel make clear disputing special counsel nah give mueller investigation even integrity stuff like make trust muller investigation utmost scrutiny looking fight trump digging correct fact much powerful simple attack administration day  728  fuck going get next time shit getting comical everyone actually trust buzzfeed country boiling point mueller better hurry get crazyyyy really need get upvoted front page reddit everyone see truth told even people like buzzfeed really ton credibility line dunno dumb enough publish without solid lot theory little cynical optimistic others personally seems like fairly reasonable guess would mueller team saw story could potentially provoke action within congress simple reminder wait report making official decision article outside source embarrassment smh deleted buzzfeed yikes wow buzzfeed circle jerk last long fuck everyone thread hating people asking evidence exact reason important believe  1  source even part true part conveys kind integrity mueller investigation single interest report truth matter inconvenient might might deleted ouch many reddit front page post got nut punched point time would like remind everyone nobody including pulitzer finalist pulitzer winner posting le accurate article every single journalist scrutinized utmost ability people never allow journalist benefit doubt believe writing like truth teller capable writing le accurate information hope turn event raise level evidence require journalist breaking story good night everyone mean article mueller comment true make case special enough comment think believe buzzfeed news pulitzer winning news division mueller whole afternoon top mind reddit telling reputable also informed trump presidency legally around  5  hour ago someone tell actually gilded thread gild one fair truth important wait see come original report wrong major account minor error  48 k upvoted article website called abovethelaw article say opening statement last night buzzfeed ended legal speculation whether president donald trump committed high crime misdemeanor buzzfeed report accurate literally reason believe mueller proof trump impeached removed office congress buzzfeed buzzfeed touted torch holder irrefutable ironclad truth apparently literally reason doubt butt million clickbait joke thousand redditors ate nay slobbered gluttony greater fat cartoon character disputed office man know within eight hour ridiculous medium incompetence continues trump greatest ally deleted removed u internal politics willing remove trump investigation news violating u politics rule listening cnn talking head discussting right mueller make peep year half fucking max guy ca accept embarrassing remember everyone reddit day jumping onto story trump getting impeached deleted washington post new yorker journalist saying mueller think trump directly instructed cohen lie part inaccurate fact mueller never make statement journal touching make think buzzfeed fucked get refund sending reddit gold user thought buzzfeed article going nail impeachment coffin simply waiting till cohen testifies people yesterday screamed pulitzer prize journalist clear mueller disputing cohen say trump told lie disputing line corroborating evidence taken trump organization email text etc idiot standing buzzfeed mueller language let discus context first buzzfeed published credible source high government would wapo nyt reject first choice leak bombshell detail answer reputable publication probably refused publish report due lack credibility first time happened buzzfeed known muckrake second mueller vague lawyerly speak might actually mean correcting small detail rather outright discrediting entire statement almost dumb even honor seen people waste money gilding post push statement mueller specific want say little possible outright discrediting report used lawyerly language fucking lawyer pr guy get twisted goal discredit entire report revealing little possible team know hard figure motive point take serious mental gymnastics somehow preserve credibility buzzfeed mueller contradict hard believe buzzfeed overreached source publish inaccurate information edit thanks gold proud one masturbation joke got last time like feel like buzzfeed telling stuff want hear always reliable maybe understatement would cohen confirm got downvoted hell yesterday telling people quick jump propaganda pushed without verifiable fact biggest issue reddit upvoting thing single sound good rather upvoting truth simply upvote want truth imagine extremely dangerous people read truth rather speculative eye get worldview day day trump literally hitler good article upvoted  1  nice see two year let keep norm think greater cosmic irony buzzfeed party involved coverage ongoing case would one trip mueller finishing line spiral medium trainwreck oddly fitting one site could find responsible maybe trust idiot buzzfeed article like  16  celebrity ex became really woke breaking wait hear mueller entirely surprised like buzzfeed known journalistic integrity accurate reporting lol buzzfeed credible news lol lol reddit reporter pulitzer prize winner fucking around yes turn indeed fucking around everyone get refund reddit  19 k megathread buzzfeed using disgraced journalist reporting unverified information got important story wrong rush show people serious journalistic venture site tell house harry potter would shocker shitty thing whatever come next wo taken seriously buzzfeed shit reddit democrat screaming impeachment trusting term anonymous source dangerous extremely important case american politics treated like tabloid garbage medium outlet boost click story broke questioned earlier cnn one writer story history making source providing false information reporter questioning said independently verified source video never trusted buzzfeed anything serious nature known reporting politics known silly test make kind mythical creature celebrity gossip garbage information matter let cautionary tale take serious story buzzfeed grain salt oh god people knee jerking buzzfeed top tier news organization last night lol almost got reddit try tomorrow going get buried feel fairly confident trump knew today story going discredited emboldened whatever confidence led decide make whatever big announcement tomorrow w buzzfeed story given confidence booster needed going tomorrow exactly people decide buzzfeed reliable source got ta say surprised buzzfeed ran something base mueller team came public statement shocked think strange buzzfeed considered reputable source well yeah duh buzzfeed joke one thinking weird trusting buzzfeed massive breaking news reddit last night thanks gold deleted get  50 k upvotes tho desperate reaching comment fucking gold stay reddit reddit fuck life american vote anyone trying truly get figured every detail fml shit show really start check balance journalist buzzfeed buzzfeed article cohen buzzfeed completely legitimate news source literally every buzzfeed news buzzfeed hahahhaha missing something confirm leak coming sdny seems obvious make think wrong aka buzzfeed lost credibility well goodbye buzzfeed credibility forever remember post whenever come everyone oooooh going disappointed redditors tomorrow good reassurance mueller unbiased perspective even face someone like trump trust guy fair many fool give story lol  12  reason buzzfeed done jesus christ help part fucking part wrong tell u going help anyone get truth edit anybody read release buzzfeed description specific statement special counsel office characterization document testimony obtained office regarding michael cohen congressional testimony accurate beyond vague read buzzfeed story get statement hope lot point referring documentation inaccurate mischaracterized statement far anything helpful literally made comment defending buzzfeed news go credibility ca pulling kind unconfirmed shit story level deleted anybody questioning source yday crucified hate trump much people rather stick solid fact 
ata6gu,1550792320.0,prepare accelerating climate threat military official warn threat real already see threat grow temperature rise,LongDickMick,258,12,acknowledging job prepare worst case scenario interesting note prediction form going get worse need work make sure get even worse going likely enough probability warrant consideration planning best tl dr could make original reduced  87  bot hague military must prepare deal frequent disaster new conflict risk accelerating climate change brings threat could draw troop home abroad military defence official said politics united state preparation difficult despite worsening flood wildfire storm president donald trump  039  administration reluctant accept climate change risk military official said retired navy rear admiral ann phillips sits advisory board center climate security said climate threat including country  039  military facility clear force already addressing extended summary faq version tl drs far feedback  23 autotldr pm comment monitored constructive feedback welcome top keywords climate  1  country  2  military  3  security  4  risk  5  people simply mentally prepared fast going ramp many scientific journal incredibly reserved statement timeline mix constant discovery new feedback worked model model recognizing dozen arctic feedback exponential contribution wildfire make global emission feedback result got nasty situation engrossed scientist seen coming people still point finger calling everything doomsday genuinely feel sadness reality could handle accepted gradually people closing issue mind end traumatized decade restore ice arctic extent gone saying referee journal literature illustrating bold fashion tumbling tumbling tumbling live northeast last couple winter warmer used get couple sporadic winter storm mellows weird snow couple day ago today think supposed get  50  military threat using military relief work fighting war op username cold global warming sad mentally challenged person might say address root problem duh european bureaucrat making comment climate change climate conference rub shoulder rich people eat fancy steak climate change business good news folk business destroying country shoveling refugee european street suck like shift brown people invisible enemy climate threat 
aucxnq,1551044367.0,japan probe successfully touch asteroid,,158,9,honestly think pretty righteous huge news nobody talking documented proof tie fighter exist solar system best tl dr could make original reduced  86  bot japanese probe sent examine asteroid  300  million kilometre earth clue origin life solar system landed successfully friday scientist said advertising data probe hayabusa 2  showed change speed direction indicating touched asteroid blasting back holding position according official japan aerospace exploration agency scientist already receiving data probe deployed surface asteroid extended summary faq version tl drs far feedback  23 autotldr pm comment monitored constructive feedback welcome top keywords asteroid  1  probe  2  hayabusa 2   3  surface  4  earth  5  hopefully time head scientist wont forced teary eyed apology wore would shirt feminist didnt like completely overshadowing achievement nippon banzai fire projectile gather material woot get sweet gold get look much porous esa one 
b0tsga,1552523971.0,european parliament vote suspend turkey eu membership bid,Master_Bruno_1084,251,11,pig fly turkey becomes eu member long erdogan power go back line walk door come back learned behave thought ship already sailed totally dictatorship erdogan even want admitted sad come clearly right move happened turkey real travesty lol nobody turkey belief eu membership since like ten year futile effort without erdogan many naysayer guess making official finally next nato sooner lol ah new election propaganda tool sweet good never considered illegal occupation cyprus eu member ended kind hypocritical pi poland orban hungary 
b4o643,1553374726.0,disneyland paris evacuated tourist stay indoors,YouAreTheDishes,109,14,nothing false alarm france apparent escalator failure mistaken gunshot boy situation escalated quickly cant find informatiom n anywhere else mean park already clear since  9  pm closed  8   30  ai lot evacuate holy shit literally yesterday glad hear false alarm level security place intense scan bag carry metal detector every time enter village park miss fun looting rioting blah seems like terrorist people panic failed elevator good evening remain indoors let hope one bad iconic parc europe let see one turn wonder happened please kill day two user often report submission site ask u ban sensationalized article oppose blanket banning news source reader responsibility skeptical check source comment flaw help improve thread linking medium verifies question article claim link could help reader better understand issue find evidence article title false misleading contact moderator review bot action performed automatically please contact moderator subreddit question concern like  10  year france going crushed islamist edit downvote want kid  20  going take general opinion seriously hanged thousand innocent men already led dozen nation ruin 
b9cg3h,1554383035.0,boeing emergency procedure runaway stabilizer inadequate since  1982 ,,807,12,detailed instruction conceivably could saved ethiopian plane provided  1982  pilot manual old  737  described extract posted australian pilot require pilot something counterintuitive let go control column brief moment lem explains make nose drop bit relax force elevator jackscrew allowing pilot crank stabilizer trim wheel instruction old manual say pilot repeatedly release control column crank stabilizer wheel release crank release crank stabilizer swiveled back  1982  manual refers roller coaster technique trim airplane mean get back required flight path force pushing away path trim required raise nose well horizon elevator control slowly relax control column pressure manually trim allow nose drop horizon trimming manually repeat sequence airplane trim manual state australian pilot also posted extract boeing airliner magazine published may  1961  describing similar technique applied boeing first jet  707  clearly unusual circumstance move stabilizer manually maintaining high stick force control column demand significant piloting skill learned maneuver pilot wrote online forum yet inexplicable reason boeing manual since deleted still vital handling information flight aviation safety consultant john cox chief executive safety operating system formerly top safety official air line pilot association said later  737  model followed called runaway stabilizer ceased problem cox said trained roller coaster technique back  1980 s deal possibility since product got reliable failure said cox however added introduction mcas  737  max creates condition similar runaway stabilizer potential manual stabilizer wheel seize high airspeed returned cox said failure boeing faa warn pilot possibility big issue ethiopian crash evaluated make pilot manually fly god damn plane need pilot turn anti stall system multiple time would turn back system failing making plane crash wouldnt turn man boeing keep comac actually find niche market trying show second defect cause day mocked downvoted like tried say mcas system causing second defect system nobody talking going get people killed pilot friend dave spotted trying inform people nobody listen asked help spread word changed layout emergency cutoff useless cutting runaway autopilot cut pilot well pilot way separate automatic trim connected together older model two switch control main autopilot flip right switch kill control trim leave pilot authority continue fly max cut switch replaced primary secondary give power system pilot throw right switch left switch continues give power defective pilot throw switch loses control currently way pilot separate automatic trim control wired together left right switch clearly defective design computer controlled trim connected right switch leave pilot primary case avionics malfunction common sense anyone seen copy mentour pilot video taken one described article someone want see want know edit explains gone seen yet time go short boeing long airbus guess best tl dr could make original reduced  93  bot pilot ethiopian airline  737  max crashed last month appear followed emergency procedure laid boeing federal aviation administration cutting suspect system could regain control avert plunge killed  157  board new software fix boeing proposed likely prevent situation recurring preliminary investigation confirms ethiopian pilot cut automatic system still nightmarish outcome boeing faa would suggest emergency procedure laid boeing passed along faa lion air crash wholly inadequate failed ethiopian flight crew wednesday ceo muilenburg joined boeing test pilot aboard  737  max  7  flight boeing field demonstration mcas software fix test various failure condition extended summary faq version tl drs far feedback  23 autotldr pm comment monitored constructive feedback welcome top keywords pilot  1  boeing  2  stabilizer  3  manual  4  control  5  created fundamentally unstable plane centre gravity centre wing lift distance apart read larger engine needed move many passenger still maintain two engine cheaper cost effective configuration think created aircraft cost effective first safe second happens company protected government cut corner get complacent billion dollar contract always come regardless quality offer r 2  astromech droid option glad accident brought oversight light corrected future pilot article obscure ww 2  kamikaze reference failed understand 
bnz4rs,1557723517.0,german voter see climate biggest eu challenge,,289,10,know government world give two shit taught climate damage stuff school  30  year ago hardly anything done whats believe second government follow recent wave climate nearly every single time seen past repealed pushed aside year later furor dy doubt environment harmed perhaps irreparably western nation lead charge protect greatest damage done developing nation want take action two major obstacle know many additional unintended consequence westerner pay  5 x  10 x everything developing nation remain standard living one west would stand convincing rest world take action even bigger challenge well feeling smug emission cut nothing poorer place ca afford change probably put much energy closing nuclear plant rather coal plant ot allow german car industry drag foot regard going electric dessert forming brandenburg co 2   400  ppm time take climate catastrophe seriously absolutely funding something like defense budget smug country help correct rest world delusional think give hoot planet yeah voting die dont know enough vote parliament yeah main topic medium removed removed 
