id,time,title,author,score,num_comments,text
hioypt,1593529243.0,scientist say new strain swine flu virus spreading human china,,875,44,may missed something entire article seemed speculation read something different morning two confirmed case capable spreading people  eh way year shaping would surprised announce santa dropping napalm year instead present worried u great job handling current pandemic oh sorry thinking different fucked anything seems possible hi arbiass submission behind metered paywall metered paywall allows user view specific number article requiring paid subscription article posted accessible everyone submission removed flaired user discouraged upvoting commenting information see wiki page paywalls please try find another source news site reporting story contact moderator bot action performed automatically please contact moderator subreddit question concern given people mostly every country already mitigation strategy quarantine place hopefully take badly covid already swine flu make immune dear everyone stop using world scientist source unanimous unified collective sincerely also everyone trump really worry shit almost assume coming going fucked hey least trump smudge makeup ffs china wash fucking hand got ta say way  2020  going seen coming scrapped murder hornet jump shark script mess fuck china oh fuck already  2020  wait turn swine flu even finished first plague yet  2020  best guy calm airport closed anyway china controlling least edit title reflect fact study stop spreading misinformation last thing need middle pandemic circulating pig year report circumstance mutates way easily infect human right little risk proactive smart monitoring virus make theoretical jump bingo even y 2 k bingo card cool good year ever feel like mother nature want u put thing back came china help well course great source willing shed money paper first sent review dec  2019  found worker work pig infected new strand swine flu surprising pig historically popular intermediary animal human transmission confirmed evidence human human transmission yet confirmed evidence biggest concern focal point spreading human human worried swine flu worried turtle flu oh course misleading headline one listen late need keep u distracted longer take hk taiwan china sea india wont long headline trump rage quits virus ravage usa op title pretty misleading china please please note world health organization china work closely together urge china close border early pandemic china said virus wasnt contagious china destroyed evidence virus china put politics way let taiwan talk virus taiwan warned virus early china put politics way pandemic admitted failure china suffers world suffers fuck china please stop filthy thanks damnit china away go nothing law nature forbids two even global pandemic happening time wtf china fucking cool plague still figuring feature old one trying push new shit u removed china fucked year home hong kong life might well die diesease tomorrow 
hjmllj,1593649117.0,say leaking nuclear waste dome safe marshall island leader believe,hopopo,3205,52,yeah either significant mean wo fix wo kill people mutate fish otherwise wreck environment feel bit like ford pinto moment think cheaper clean mess later fix response directive congress department energy released report week assessing risk cracking crumbling concrete nuclear waste repository marshall island finding little ease concern marshallese leader central pacific doe report found runit dome repository atomic waste united state produced cold war weapon testing sound radioactive leakage nearby lagoon significant congress grew concerned last year leaking dome ordered doe produce report dome structural integrity amid climate change rising sea level report noted sea level rise could increase storm surge swell lead lower section dome enough definitive data determine event might impact one marshallese leader disappointed doe downplayed risk declined take responsibility runit dome leaking content expect enewetak community feel safer based report contain new information seen trust said rhea chairperson marshall island national nuclear commission nuclear waste radiation oversight panel report offer nothing new le expected see said lamenting senate redaction critical line house mandate stipulated department energy provide plan detailing removal radioactive waste safer stable department energy report signed dan brouillette agency secretary advertisement terry hamilton department lead contractor project said report show hard fact radiation science existing data information show risk posed runit dome unlikely impact health status people living near dome november last year time published investigation lingering radiation legacy marshall island refusal authority take ownership hazard posed runit dome betrayed marshall island kindling next nuclear disaster december congress signed national defense authorization act  2020  required doe provide plan repair dome evaluate environmental effect dome lagoon next  20  year ass structure potential risk people live near advertisement department also required ass rising sea level could affect dome noted data gap report well including level radiation groundwater leaking dome lagoon  2019  presentation delivered marshall island marshallese official doe contractor hamilton mentioned elevated level radioactivity giant clam living near dome new report mention clam state enough information available understand leakage dome affecting marine life however according energy department study people living nearby show normal level radiation suggesting adversely affected advertisement absence data show risk mean said main takeaway report many risk still  1946   1958  united state detonated  67  nuclear weapon marshall island bomb detonated enewetak atoll runit dome located nowhere else united state saddled another country much nuclear waste product cold war atomic testing program waste site known alternatively tomb hold million cubic foot  35  swimming pool radioactive soil debris including lethal amount plutonium advertisement radioactive material collected moved contained soldier late  1970 s many veteran say unaware content wear protective equipment new report include plan repair dome required congress instead report author state maintenance dome required time beyond conducting occasional maintenance dome cracking exterior including removal vegetation report claim visible cracking spalling provide hazard message seems concerned alarmed said michael gerrard legal scholar columbia university law school runit like radioactive sore middle pacific one get foreseeable future unless find doe author also maintain lagoon sediment contaminated radioactive element additional spillage dome would undetectable advertisement remains seen whether marshallese accept report american given poorly treated marshallese many way since  1945  said gerrard report also note may  2019  marshallese official requested department energy build fence around island dome located keep people july  2019  doe official responded claiming funding build fence installation perimeter would logistically complex  1981  government declared report island quarantined indefinitely possibility would always exist high level subsurface soil could exposed wave storm action many redditors automatically assume scientist determined structure safe wrong people enewetak community right ehhhh specific reason u claiming dome site safe soil area around dome higher radiation dome dome failing ca actually contaminate something far contaminated already set island used nuclear test site period  12  year small portion cleaned much later entombed one place really le radioactive surrounding area even calling leaking kind misnomer extremely biased article give islander point view u report give absolutely detail america actually pretty decent history avoiding nuclear meltdown mean history le  15  people died russia china id worried safe continental usa america dumpster fire course believe doe official say concrete stay water proof  50  deleted nothing safe combination e dont worry reddit kidding radiation perfectly safe lol american care human right brown people island even care black people home lol project marshall island imagine forced home asshole wanted drop radiation bomb look good front everyone else give back without damn thing clean except couple grant conveniently ran money asking another chernobyl marshall island like dollar u money rich people tax haven use money clean fix offense interest marshallese dome dangerous many people income come disability check u government see moved paper towel rake flex seal u usually tell truth unless suit find situation alarming indigenous people even belief government fucker say full shit ton radioactive dirt leaking safe like distance u mainland big enough want pay fuck ups caused past u used islander test subject nuclear weapon warned radioactive fallout day explosion many suffered terrible fate due intentional act immoral wicked act payed islander  150  million dollar many still waiting today receive compensation died receive compensation say something point people think word worth shit send trump best tl dr could make original reduced  88  bot congress grew concerned last year leaking dome ordered doe produce report dome  039  structural integrity amid climate change rising sea level quot  039  expect enewetak community feel safer based report  039  contain new information  039  seen  039  trust quot said rhea chairperson marshall island  039  national nuclear commission nuclear waste radiation oversight panel  2019  presentation delivered marshall island marshallese official doe  039  contractor hamilton mentioned elevated level radioactivity giant clam living near dome extended summary faq version tl drs far feedback  23 autotldr pm comment monitored constructive feedback welcome top keywords dome  1  report  2  doe  3  level  4  risk  5  let forget group people subjected nuclear bomb testing advocating compensation recognition military put reason marshallese blowing whistle get screwed radiation care would look good print narrator marshall island leader right obama administration say maybe government right fuck government though still find iraqi wmd credibility based u history area going go marshall island leader one easy way prove waste safe take waste dump white house safe issue easy dump shit want someone backyard claim safe safe enough waaaay fuck laugh unison eating last known buffalo totally safe people america america world leader talking shit nonstop shit let nuke shit place bury bunch waste pretend fine government probably fairly certain safe government standard mean within acceptable limit nuclear radiation like much human body take negative impact appear right look like affect mainland usa  0  american believe anything fucking say sure anymore well safe long near marshall island u government wo lift finger save entire state certain death moron honestly expects right thing otherwise right reason nuclear way renewable energy look like  2021  glowing year american say something assume opposite safe looking yeah u also conveniently failed tell marshallese people dangerous nuclear radiation started testing bigger badder nuke island literally trust american take responsibility rip everything nuclear waste bad everyone everything fucking capitalist pig greedy fucking mind trying avoid every problem ever fix free god damn hate american way life bullshit live could tested nuke territory safe figured would mind check military dude working electrical engineer style electrocuted death accidentally guy executioner career like course leaking nuclear waste dome safe american doubt many american used line knew condom broke bet nuclear disaster july perfectly safe put funny dome hat top move along taking deep deep breath nothing see always one headline proceeds awful thing course safe declared u president hell retorted marshall island president flipping quadruple bird 
hsvjgm,1594991937.0,secret trump order give cia power launch cyberattacks,DoremusJessup,5105,79,secret long trump know authorize cia covert ops without trump knowing great without future real president knowing lil dangerous imo best tl dr could make original reduced  95  bot central intelligence agency conducted series covert cyber operation iran target since winning secret victory  2018  president trump signed amount sweeping authorization activity according former official direct knowledge matter even trump signed directive administration official already encouraging cia aggressively interpret preexisting secret authority help prosecute administration  039  quot maximum pressure quot campaign tehran campaign includes punishing economic sanction also involved cia cyberattacks iranian infrastructure said former official extended summary faq version tl drs far feedback  23 autotldr pm comment monitored constructive feedback welcome top keywords official  1  former  2  cia  3  operation  4  cyber  5  scream leak make trump look like tough assumed cia along russian troll factory nkoreans go instead half assing wrote secret cia much power enough oversight hate propagate calling place work great people responsible country biggest human right violation cia since  2018  many explosion incident accident since time suddenly make much sense escalating cyber warfare might backfire nasdaq kept afloat domestic tech company much secret secret huh odd lot newb account complaining secret secret read nothing ever secret nothing ever revealed maybe strategy make cyberwarfare confusing people ignore secret reddit know haha cool clickbait title clever hopefully cia started detecting usb plugins hardware haha good china country u constantly humbly submit macho man consideration theme song made image tell spy wh anything anyone watched alex gibney zero day secret huh wonder long took get attention could explain like five make wonder twitter fiasco yesterday secret liberal joe biden ally secret already would cyberattacks happen knock fuck svr fsb ahhhh fuck kidding really secret article russia excluding russia trump crony every country care apt group trump worst president u history good move clearly secret discussed reddit really think needed sarcasm tag since trump already requested received russian assistance spy dnc attempted extort ukrainian assistance dig dirt biden toss belated probably better keep knowing go time american first cia suspect stuff u guess okay fucking good u lagging behind current cyber war want kill everyone thats kill everyone already ah yes stuxnet huge success trump supporting deep state stop thumbnailing kind elevated evil strong man blood red iconography corrupt selfish incompetent greedy bully tendency towards banal pettiness mean msm portray unstoppable omnipotent evil keep feeding bullshit simply must stopped ridiculed good number one threat world currently done u everyday need forefront spam ad goya bean device secret yahoo news could brought u story diaper love brag intelligence anything know everybody ic love dealing central intelligence agency conducted series covert cyber operation iran target since winning secret victory  2018  president trump signed amount sweeping authorization activity according former official direct knowledge matter good please use china cause kind feel like u paying deleted damn huawey chinese oh wait happened looking forward seeing attempted request cyberattacks directed democrat political opponent yeaaaaaaaah party cia article fail name actual person always former official expert usually nameless hell people getting secret day thank christ much cia cost expect least superiority chinese russian area cyber attack case far secret secret landed yahoo news reading make secret trust cia trump least loyal u hello cia fuck terrorist u reddit level secret u internal politics glad finally thrown prohibition u internal news politics worked real well iran iraq cia first mission prevent russia china hacking election help trump love see trump cheating scheme undone executive order lol know administration coming end trump would never give ok spy russia know tape awe sad u calling asshole day signed president free go anytime anywhere fear people enemy day unsigned president oh attack request fuck sake shall ask first never mind cover clean neat hmm make russia china care moron blinded hatred rather weaken country rather defend attack threat insane ha secret well secret secret order front page reddit might well start genocide like china shit good need beat china game good china russia want play ca sit idle two country engaging cyber warfare world 
htuyul,1595134398.0,japan instantly scramble jet china fujian,Hoosier_Jedi,2457,26,easy airforce unit maintain posture indefinitely best tl dr could make original reduced  65  bot tokyo japan immediately scrambling fighter jet chinese military aircraft taking air base fujian province tension continue two country senkaku island government source said saturday distance asdf  039  base okinawa prefectural capital naha japan scramble jet chinese military aircraft  410  km requiring travel time  25  minute air force  039  fighter japan scrambled fighter jet chinese military aircraft  638  time fiscal  2018   675  time previous fiscal year march according defense ministry extended summary faq version tl drs far feedback  23 autotldr pm comment monitored constructive feedback welcome top keywords chinese  1  fighter  2  jet  3  military  4  japan  5  stop playing around japan send gundams russia shit sweden norway finland eastern eu country constant harrasment letting japan fully rearm provide defense big card dc sleeve nothing scare china hell even korea like armed japan lot way lot like letting germany rearm letting iran participate middle east without sanction russia hair would turn white germany turned towards defense keep pulling jenga block nato saudi israel keep iran bottle japan due break long bad run thing economically time beginning interesting think china playing attrition game got military aviation industry near parity japan west deleted china intention attacking japan want everyone butt take claim south sea envelop territory likely make move taiwan look taiwan sentiment afraid u administration favor ccp taiwan past  30  year seems certain u politician made unwise choice benefit u china starting jimmy carter sponsoring wto clinton china using wto attack u dating back  10  year ago japan able build stealth fighter become thorn china quest controlling south sea maintain air superiority removed good thing adiz taiwan almost cover entire fujian province sharing intelligence japanese literally notified within second chinese jet taking need support japan  100  fuck china unsustainable culture power move china internal problem shit far often day region time get hit fuck ccp maybe time coming japan kick fucking ass would like know chinese jet compare japanese jet japanese using variant american made jet important ally deleted ww 3  come china want start war everyone removed foreshadowing showdown trying boost oil usage crisis flight called upon wo need justify send missile instead would real coup develop unmanned inexpensive set drone missile could round trip short time human pilot maximum acceleration limit le fuel deleted response exactly china want know exact capability japanese air force defence network common tactic delay response hide true capability additionally force japan increase military spending leaving le improve rest society seen u china playing long game removed bad chinese could scramble resistance japanese time rape nanking side evil remains seen japan allowed carry unchecked speaking japanese dead already 
hw5t07,1595464489.0,china say uk citizenship pathway hong kong resident violates international law,LynnK0919,255,33,china care following international law get fucked yeah nah get fuck china valid logic say another country immigration naturalization policy get fucked china violates international law every day lol china suddenly belief international law lol like michael bay calling firework show explosive china afraid fuck china nobody care say china proof china want punish citizen hong kong audacity think special ideology western democracy thrived two system one country china wish eradicate make people believe right heard china understood hong kong would become financial ghost town went passing law anyway authority important money think china make example hong kong citizen forcing stay hong kong watch prosperity dry suffer china want extinguish flame independence decade semiautonomy may lit actual fuck work swear god china turning spoiled little angry shit child playground make new rule game whenever anyone else might losing paying attention claiming island south china sea land india also violate international law china play rule nope violate international law simply making easier hk people get better treatment faster integration every country earth decide policy china act like  3  year old get angry start naughty go way rally childish give image china mature seems pretty clear china behavior toward hong kong ending order felt subservient western power almost symbolic end humiliation began opium war china abrogated treaty expect others respect agreement china care international law thats rich coming china fucking irony line china say lot shit ah praise caesar britain made decision despite opposition beijing china would respond strongly reversed yikes opposition beijing china article poorly written fluff somehow manages give zero insight international law britian supposedly breaking pretty sure one biggest red flag raise whether country failing shithole dictatorship preventing citizen leaving suck cccp u hoe mad hypocritical considering violated term deal signed hong kong okay basically beijing trying argue violating treaty china creating citizenship pathway according qualifies interference chinese domestic policy fucking nonsense course breaking international treaty give hong kong self governance  50  year handover uk even britain offer china recognize passport valid document mainland entry resident hong kong returned chinese rule  1997  instead required use travel permit issued china problem china offer british citizenship hong kongers essentially circumvents blockage bno document pretty sure want start stampede exit say first american second argument done anything care internal administration plain bullshit romanianian country communist regime  50  year happy outside power intervened influenced revolution country btw romania invade anyone done anything done plenty harm romanian people stop treating totalitarian country leader mormal one stop normalizing fascism communism fucking asshole west invaded china  20  year ago installed democracy fear late make decent country china especially rabid pooh dictator china say appease domestic audience secretly laughing as uk taking markes hong kong hong kong love peace quiet people leave whoever left focus working hard developing economy let go stir pot uk china would say 
i2c3gf,1596375124.0,thousand demonstrate netanyahu israel protest gain strength,,109,1,mean ca office  24  year seem like dictator year older long power 
i5nsdu,1596839965.0,well  100  people banned flying delta refusing wear mask,,245,15,wear mask  8  hour day work hot uncomfortable know worse killing family give coronavirus suck  3  hour flight karen one want look ugly mug anyway deleted banning people mask refusal minimum standard airline pandemic glad least one american airline flew delta seattle slc ontario ca flight attendant tell one guy pull nose bad anecdotal situation honestly relieved much anxiety flying work american wonder one want coming respective country right flown  6  time  1  layover per trip past month half zero people refuse wear mask flight fid see guy tell woman put mask midway thru flight lol said shit motherfucking real gave ol thumb know someone flight detroit mentioned article guy got banned extremely high leveled frequent flier million mile belt refused keep mask would bring newspaper front face hide pulled making childish face cabin crew saying neener neener turned flight around banned entitled man child wear fucking mask even think bullshit plenty reason treat airplane coffin cruise ship well bus mean fuck anti masker may rot say idiot native language anti mask anti vax see good news thought number would much higher guarantee  90  passenger named karen math guy curious know many fly without issue versus right phruck bunghole amoral compass tell biden going walk election people stead fast willing kicked put fly list simple mask imagine people begrudgingly 
i8v80b,1597302116.0,large blue butterfly flutter cotswold first time  150  year,grr,549,8,damn nature scary taken underground red ant myrmica sabuleti duped believing parasitic larva one ant carry nest protect caterpillar even singing turn herbivore carnivore feast ant grub winter ready pupate finally good news  2020  good job best tl dr could make original reduced  82  bot biggest reintroduction date large blue led rare butterfly flying cotswold hillside seen  150  year year painstaking work prof jeremy thomas david simcox led butterfly successfully reintroduced site somerset recently gloucestershire quot simcox research ecologist common management plan said quot butterfly need high density red ant crucial role play lifecycle butterfly extended summary faq version tl drs far feedback  23 autotldr pm comment monitored constructive feedback welcome top keywords butterfly  1  ant  2  condition  3  year  4  common  5  give one blather found agatha raisin bloxby beautiful recording singing ant put smile face 
