id,time,title,author,score,num_comments,text
dvbbu6,1573571823.0,millennials track die faster gen x thanks mental health,protekt0r,57230,59,millenials killing millenials industry report actually list obesity unhealthy lifestyle  1  cause mental health listed second may linked first case finally reason hate millennial thing looking u millennials killing nursing home industry yet another thing millennials killed joke boomer going look care home die first completely dead inside advantage gen x one thing learned early care anything cool healthy environment produce population obese drug addicted lost interest breeding plummeted sperm count female fertility problem joking constantly wishing die something extremely wrong environment human developed country live social environment microplastics hormone water something else know ca pretend happening bequeath as corporate overlord one really owned anyways donate porn history science use tissue sample clone armpit skin carry use liberally every conceivable way continue ruin everything beyond grave mount participation trophy headstone epitaph read entitled little shit comic sans put funeral instagram story make rager donate leftover ssri need shit aint cheap find cupboard next coffee labeled bootstrap eulogy want done rick impersonator extra drunk please actually ok hope future really need fix shit reading comment people celebrating dark time man fucking zoomers jealous u suck zoomers oh thank god tired edit yay first shiny thank kind redditor even death forgets u gen x er truly forgotten one ignored one misplaces one boomer track die lot faster keep writing article saying crazy decided awhile ago punch damn ticket enough make old age wont keeping around shit pant cause level control force people see mental decline dementia fuck gon na shoot much fucking fentanyl gon na saturn taken care people declining year want part making burden someone else want able choose get shitty ride bright side least one blame u killing funeral industry xd  2  job still cant pay bill happy right winning millenials need cheered listen cheerful gen x music alice chain nin marlyn manson soundgarden prodigy portishead got hit maybe got something inflated education cost saddling people  5  figure debt ripe age  22  simultaneously gutting value healthcare system maybe gon na quote fight club one movie way time god damn entire generation pumping gas waiting table slave white collar advertising u chasing car clothes working job hate buy shit need middle child history man purpose place great war great depression great war spiritual war great depression life raised television believe one day millionaire movie god rock star wo slowly learning fact pissed honest see good future people love die people knew grow apart get older medical expense compound employment opportunity dwindle tell living long age great thing rather thing want rather save entire life saving go medical bill good luck getting medical debt corpse diabetes already taking average  11  year might well live fast still alive well planning cashing soon looked parent end life tried make thing le pain as whoever deal fallout yeah wow wouldve thought paying next nothing would make suicidal there nothing better depression able afford anything u data well gesture everything finally gen x winning something amazing culture fear hate despair lifespan always thought stress symptom caused stress biggest killer generation late boomer lifetime world sped extent impossible keep appears millenials cope realise never get treadmill order want see better future generation parent least retirement look forward know never retire  20  something today feel money left left existence dying planet thanks generation came truly dystopian  40  faster wtf seems like came someone as real talk actually see retiring dying old age like people assume end early climate change dystopia economic collapse literally incase consider important plan alright friend finally good news going leave nightmare lot earlier scheduled make sure help others get bullshit stay hydrated going make almost like entirety society dedicated wealth thing actually make life enjoyable family friendship good balance people start suffer cultural sink creation lazy pull  34  great career loving wife highly suicidal anxiety anger hard control even medication guess year traffic bill speaking people hate taken toll almost  24  hr social cycle bad aka millennial retirement plan yet company think retirement age  65  thanks since even close good mental health finally good news house price rising area wage staying time dad thinking selling house excess rental property bought back  1999  brother living brother gf  3  kid brother solution try move mom way would work kick ive saving  3  year house price go le saving matter could buy house right would house broke massive monthly payment cant get apartment big dog housing market went hell  2  year degree thats paying  4  year degree ive job hunting way earn money go back school another field taking job farther away pay extra  2  hour sitting traffic hour one way increased gas cost increased wear tear car stress dealing would lower quality life make extra  2  yeah death looking pretty relaxing right entirety mortality difference accident include suicide wonder much overdoses example mean fair seems like millennials getting absolutely fucked government least u never ending debt increasing work hour underpaid plus stuck social medium trap constant comparison others top daylight saving time making dark already rail mentally  4 pm really mental health problem always worried safe warm place go away deadly cold would think country least kind literal safety net people thing go south u alone confirm millennial want die kinda feel like millennials experimental generation shit went wrong hell yeah best news heard week great news dead sound relaxing solve climate change generation dy faster last boom emission decline oh fuck someone reddit acknowledging thing exists still beating fucking heart love hate thread time feel angry towards higher force u live repressed life destroying world process depressed feel ca anything wanting kid worst suicidal many u part inside u repeatedly tell life mean nothing death would bad use advantage let say fuck society fuck worthless job fuck paying back ridiculous amount debt fuck dedicating life raising kid broken system instead fix fucking thing first power generation u power communicate internationally instantly power organise succesfully hold international wide could show  1  happens people decide stop playing rule let take back life planet fucking future edit people ask help honk kong let help joining also people might forgetting bias baby boomer mentally ill insane probably killed got decade ago police attribute mental health suicide rather accident hell sure lot american baby boomer probably went vietnam intentionally got shot purpose like variant suicide cop except case suicide vietcong know millennial stereotype want die millennial thankful soon feel seen suicidal yet kind want die feel like ghost haunting place hoping release prediction far worthless idea next fifty year gon na go think dying said death think leaving early avoid rush well fair  100 k student loan unaffordable house skyrocketing healthcare fee stagnant wage u millennials exactly looking forward longer life millennial disagree cried three time today one anxiety attack please keep gen x whole generation generation conversation enemy busy working bicker detail thank mean millennial joke throwing bridge daily probably substance theory 
e37i42,1574990608.0,tiktok huawei helping china campaign repress uighur report,cc_hk,7426,51, 2  chinese company need watch inspur server maker ranked  3 rd biggest server supplier world china government behind data storage equipment company subsidy provided grasp big market share offering low price strategy china back hwawei security issue addressed yet storing data chinese server knew tiktok evil shocker anyone surprised every company china communist party representative report directly government activity dealing chinese company mean dealing communist government separation private business state best tl dr could make original reduced  88  bot bytedance also working xinjiang authority program called quot xinjiang aid quot whereby chinese company open subsidiary factory xinjiang employ local detained camp case huawei locked existential battle trump administration evidence extensive direct work chinese security organ xinjiang including helping authority quot digitisation requirement quot public security project xinjiang public security department huawei signed agreement establish quot intelligent security industry quot innovation lab regional capital urumqi last year local official said huawei supplying quot reliable technical support quot department according report extended summary faq version tl drs far feedback  23 autotldr pm comment monitored constructive feedback welcome top keywords xinjiang  1  report  2  security  3  chinese  4  huawei  5  tik tok song ke ha  repress strong enough word every company run china huawei basically extention chinese government yeah china stop human right violation state capitalism state nearly unlimited regulatory power result corporation vitally depend maintaining support state consequently corporation operate state capitalist country effectively invisible arm state state capitalism bad yeah shit chinese company get huge chinese company without heavily involved chinese government despicable hope start crush tiktok stand want work monetizing platform oh fuck chinese government serious question possible individual stop supporting china corporation chinese cooperate chinese state would effective way put pressure complicit government corporation made attempt buy good manufactured china piecemeal effort enough faced clear evidence oppression genocide complacent sick complacent want act offer meaningful support people xinjiang hong kong elsewhere suffering dying hard know start first step yo millenials urself favor delete app break hip chinese farm face real talk mean ccp funded business helping ccp image wtf gong man china need get told every dictatorship around world take note everyone sick shit meanwhile canada wanting roll  5 g network huawei could knew tiktok bad bad needed another reason hate tiktok simple saudi arabia iran ban china oil suffer america refuse utilize thing made tiktok huewei need set market cap tiktok huawei little lower supposed help government owns glad talked gf buying huawei found china gulagging million wiggers damn shit suck chinese company helping chinese censorship propaganda say ai good know wont buy huawei product future tencent wish used tiktok purely could boycott hearing ever horrifying news china xinjiang region reportedly systematically persecute muslim citizen alive note several republican want adress agree good conscience focus miller still creepily cosplay nazi official joseph goebbels imitating haircut facial expression fyi likely hoping settle similarly bloodthirsty purge u non white people goddammit wait china economy tank gon na dance merry little jig lot country including u face china infiltration taiwan close lose democratic life hong kong protest woken taiwanese wonderful chinese dream sure philippine maybe write senator highlight risk hopefully philippine senator bow china something uighur muslim trump give rat as vine always better tiktok fuck chinese government fuck xinnie pooh op actively engaged sharing narrative hostile china post paint china negative image actively participated lihkg coordinating vote manipulation push hong kong riot post front page take word look seem like obvious smear campaign undermine chinese tech company remove competition american tech company huawei make  5 g first u government everything stop dominating market removed url find hypocrisy reddit really funny usually arab islam particular hated used tool sudden supper important worth fighting dont let distract fact tencent owns portion reddit even bit funny final count worldwide sensation trying stay away chinese product pay thing better human even cant afford there ppl africa worse part even mean eat day stand china remember happened toshiba huawei phone fucking hate chinese government ilk safe deleted amazon facebook helping usa detain thousand immigrant continue maintain global hegemony sooo alternative title u saudi arabia fueling separatism china tutting reading article excellent matebook x pro everything complicated would like apple amazon google actively working american agenda 
ee4v30,1577021218.0,hong kong police clash protester uighur rally,ar499,152,1,best tl dr could make original reduced  83  bot hong kong riot police protester disperse crowd heart city  039  financial district largely peaceful rally support china  039  ethnic uighur turned chaotic dozen police marched across public square overlooking hong kong  039  harbour sunday confront protester hurled glass bottle rock saturday hong kong riot police swept several shopping mall chasing arresting demonstrator pressing demand peak shopping weekend christmas extended summary faq version tl drs far feedback  23 autotldr pm comment monitored constructive feedback welcome top keywords hong  1  kong  2  protest  3  police  4  china  5  
eibwzq,1577841292.0, 750  soldier  82 nd airborne headed centcom additional troop expected deploy iran tension mount,,1828,84,hey  16  year sure get settle eventually going back iraq told trump withdrawing middle east justified stabbing kurd back hand territory turkey fucking reason deleted american told pulling completely  2020  thing never change mic one ike warned u many decade ago quit trying make war iran thing best tl dr could make original reduced  74  bot watch marine gear reinforce embassy baghdad newsbreak roughly  750  soldier army  039   82 nd airborne division slated wheel soon headed kuwait additional american troop expected deploy later week defense official confirmed military time quot direction commander chief authorized deployment infantry battalion immediate response force  82 nd airborne division central command area operation response recent event iraq quot secretary defense mark esper said tuesday evening written statement deployment additional force add nearly additional american troop deployed central command area operation last six month confront iranian malign behavior extended summary faq version tl drs far feedback  23 autotldr pm comment monitored constructive feedback welcome top keywords  1  force  2  state  3  embassy  4  command  5  israeli know game leader nation investigation election coming pesky opposition politician making hard stir base good time start war cuz dead troop brown people get keep power deleted military time putting  82 d already got ta please saudi overlord warmonger iranian iraq mad troop going send troop deleted endless war another war war profiteering company politician fighting time start another overseas war distract everyone political also make fucktons money uuuuugggh pathetic way seen maga account try spin twitter something somehow prevent iran getting nuke stop spread chinese influence sound like somebody told trump starting war great way win reelection war half life nothing profiteering contractor making killing burning money every day money could spent every missile launched every bullet fired theft american lost meal lost shelter lost education people could get rich eisenhower right ok trump trying war tactic green corvette haha time run classic republican play start another deflection war got defend murcia freedom iraq protesting presence country supposedly want u abusive boyfriend relationship let get fuck use resource betterment offense win game defense win super bowl feed american war economy war money sad way pay freedom sad disturbing another generation getting fed mincer war behest politician washington world exists outside usa watch disbelief carnage president causing war win election know absolute insanity american show sort protest however small complicit madness beating continue morale improves huh saudia arabia pay remember bragged renting u army mercenary work hate much bone spur hella hard overcompensate sorry boy president moron oh lookie another insane murderous american president actually surprise seems like article comment people confusing iran iraq korea known forgotten war iraq forgotten without even ending one seems care hold anyone accountable disaster plan laid decade ago banking system iran n korea last country understanding arent run central banking cartel parachute collapsed collapsed jumping jrtc  1999  crushed l 1  popped surrounding disc busted right heelbone live lifelong backpain wake trouble getting bed  40  best thing ever happen least ptsd related accident trump supporter finished bragging trump deployed soldier middle east even though already even fact ignore attacking u embassy even proxy one way iran get war america avoiding kill american without response hawk live another trump lie american understand rest world see shit like like really dumb cheesy action movie plot recycled like quagmire part  2  coming summer cj meme oh boy go money spent still end sight every gun made every warship launched every rocket fired signifies final sense theft hunger fed cold clothed world arm spending money alone president dwight eisenhower april  16   1953  usa succeeded one point bring iran iraq together usa foreign interfering country keep sending people fight war oil take care get home aka clusterfuck thats va u war machine going grind quick halt hail hydra happy new year couple million could probably invade fucking tension besides one politician ass thought prayer go back around go war machine thirsty hear gear rolling delivering made u democracy election coming might truly year finally try stage event get u war iran fantastic nobody could ever seen coming let hope coverage war even better last  4 k hd step better way secure election go war find suspicious happened shortly undisclosed call putin time trump need huge distraction anyone else israel saudi arabia clapping back finally john bolton suddenly want job back bet election coming get war people support troop let troop go back iraq iraqi protest iran tension saudi attack nyc dc invade iraq government really whatever fuck want putin support iran way let donnie go war money money money america retain global superiority deploy world end time  100  time shock paging marcus licinius crassus crassus come crassus trump itching excuse go war could imagine listen order commander chief domestic problem impeachment looming light international fire rally people fool time trumpian cause itt people getting fooled thinking iran behind see kid fell wmd crap fall iran crap good see nothing changed thing never change long divide going middle east people acting like career soldier want bring troop home give break well guy managed impeach guy liberated iraq democracy mission accomplished need oil invaded county want u leave u want troop area put kurdistan still welcome  4000  troop protester set tree hanging embassy wall fire know else went fire probably burned ten minute could put garden hose really worth oil weapon money silence protester u started bombed even trumpians wanted intervention people know started shit protest gotten line response u attack sunday every country operating area condemned u attack except israel includes iraq u government try pin iran keep mind iraq pm criticized u response rocket shelling american mercenary got killed group attacked said responsible rocket pompeo say bombing behalf mercenary group also beyond trump political trouble start war got ta love reddit fucking know everybody read  3  headline whole situation feel plight poor brown people know fucking evil america go enjoy circle jerk stop account deleted interesting stark contrast obama hillary quizzled benghazi trump made call right away look difference outcome hate want leader true leader obama wanted world like first year life leadership role like obama wanted liked human nature level stick around long enough learn get far trump figured spite flaw love iran several despicable thing year sub scream trump act like iran innocent kid getting bullied world stage nothing wrong really think one iran massive asskicking coming long time nation run backwards degenerate terrorist getting big britches custer last stand trump make call impeachment trial impeached someone else calling shot hope iran kick as bad ca elect somebody like tulsi gabbard would pull region never stop even liberal get mad pull ridiculous iran tension mount usa usa terrorise iran airstrikes blaming repercussion embassy starting rest world removed 
f00gtp,1581028485.0,global warming speeding earth massive ocean current,,196,7,good time surfer best tl dr could make original reduced  89  bot oceanographer suspected climate warming affecting ocean circulation far observation  039  shown trend say hu shijian oceanographer chinese academy science  039  institute oceanology lead author study atlantic ocean  039  gulf stream may weakening arctic melt slows driver sinking salty water north atlantic whereas current pacific ocean seen strong uptick instead hu  039  team turned reanalyses combine observation ocean atmosphere computer model fill gap produce global picture extended summary faq version tl drs far feedback  23 autotldr pm comment monitored constructive feedback welcome top keywords ocean  1  current  2  warm  3  oceanographer  4  data  5  reason tap potential energy put good use huh day tomorrow taught global warming would slow ocean current saying hollywood lied shocked pikachu krypton shit gon na blow told exact opposite would happen current would stop warm water would stop moved around globe causing new ice age  1990   2013  energy current increased  15  per decade really huge increase wow think really good time plastic reclamation pirate nurdle herder unite 
f812vl,1582415175.0,renowned catholic figure jean vanier accused sexual manipulation abuse,BobbingForSmegma,740,27,guy famous work intellectually disabled adult report released charity founded kudos guess brand public figure religion day seems someone met talked time trosly founding community back shock also thinking probably know woman heard many case happening catholic community may seem like another case many jean least young  20  year old kid back seemed genuinely good easy talk grandfather community never even perceived hint anything negative devastating news good see slow clapping thumbnail shocker surprised face shocked wait thing seeing exactly expected catholic church anyone tell exactly denying happened article pretty vague interested least time victim adult glad left catholicism anyone surprised come catholic church highschool named rapist odd coming high school named end faith nothing new another example abuse power coming representative catholic church heinous act like always come light wrongdoer subordinate try find way silence truth religion bad removed next least surprising news catholic catholic church child raping cult tax exemption stripped well status religion wealth taken distributed victim everyone bishop higher imprisoned remainder natural life rat disgusting religion end faith probably charge vatican official let prove innocence stage guilty proven innocent seems legitimate another one another one another one disgusting pig wow fuckin surprise another catholic paedophile hold press imagine kind person stay part pedophile church despicable alleged sexually abused six woman well refreshing change catholic good work maybe someday stop abusing anyone 
