id,time,title,author,score,num_comments,text
ect0om,1576761205.0,boris johnson ten thousand voting making photo id mandatory law polling station queen speech reveals,nnnarbz,43637,79,deleted op article hint free charge document without photo id article confirms scheme anyone photographic id able apply free document proving identity however tell u someone without permanent address apply free document edit lot reply saying vote currently without fixed address wrong northern ireland already provide photo id vote really problem germany always take id voting letter polling station show driver license voted canadian election month ago thought standard country prove identity vote otherwise lol mandatory yet belgium required id year showing vote also obligatory canada ok much voter suppression tell bad get one vote prove vote give hard get photo id understand driver license still get id card pretty useful thing many situation mean ok already book get petty wrong exactly come zimbabwe mandatory person get id turn  16  simple requirement people take id voting station going limit anyone country like zim system adult even income id would biggie uk germany completely normal get big deal uk edit never mind see used country suppress minority population making harder vote economy germany get recession could lead problem minority face currently america big thanks thorough explanation feel like fair every single person know registered postal vote reason go polling station would show kid democracy work perfectly sensible thing sound like exaggeration id issued national electoral institution photo finger print security feature valid many year ten thousand photo id got ta honest think crazy show type id country document voting longest time could vote without would penalized vote recently changed system finger print scanner even show id picture know burocracy hitch think wrong norway photo id debit card everyone debit card problem solved beacuse everyone already goddamn passport outrageous imagine asking someone id vote matter national importance hide authority try stop people voting multiple time ca believe basically nazi germany full oppression everything fucking absolute someone explain id vote big deal need id canada vote everything go well enough driver license cool age majority card one get free government may unpopular opinion expect incoming vote responsible adult world identification uh good god forbid someone prove identity prior voting leader country horror want vote say get friggin id apparently ordering photo id something either escape capacity something ca bothered allowed inflict opinion rest country tragic even turkey requires government id photo tell california people say like fuck requiring id racist never understood meant bad could someone please explain deleted removed absolutely turned told woman address name start crossing housemate name nothing like mine stop wait erase line put name got thinking easy would effectively steal someone vote id requirement pretending asking people verify identity selecting leader ultimately direction country somehow bad thing asinine moron would want people voting illegally seems reasonable fair american please stop spreading nonsense world nothing wrong request photo id photo id western country get job without get social security without son  16  photo id school big deal someone polling clerk election going cause problem number voter year tried vote someone else name  3  least one senile pensioner going cause queuing well place burden council spend extra money raising awareness training staff even importantly people pay attention news position likely end unable vote mean vulnerable isolated pensioner disabled etc robbed vote plus considering lack photo id far common poor act deterrent voter also see easily enforced scotland local government electoral registration method polling devolved matter photo id seriously considered bad thing nothing wrong voter id id easily obtainable uk id easily obtainable low fee make available free afford si gle reason would bad idea carry photo id last year uk  266  case electoral fraud investigated one convicted another  2  handed caution compare  266  country population see although illegal necessary problem uk ploy stop student voting next election heavily side labour let see many faux outrage post one generate reddit always waiting wing outraged great fun truckload bullshit generally allowed vote provide id much le hurdle register reregister vote effort make thing much easier future ridiculous american claim voter id lead disenfranchisement manipulation voter register one main way people get disenfranchised u would photo id though citizen biggest takeaway article meanwhile limit expat voting general election lifted allowing uk citizen living abroad continue casting ballot rest life traditionally seen way boosting conservative vote though mr johnson risk backlash uk citizen eu overwhelmingly supported remain  2016  referendum denied vote uk excluded million citizen voting brexxit even though citizen would one affected vote fake news cant even open bank account without id id voting least worry opposition  100  committing fraud need id literally anything important life different netherlands always show id voting anything important know say rightfully everything bj automatically shit case make sense uk clearly behind boris johnson ten thousand voting making photo id mandatory law polling station queen speech reveals stopping anyone voting trying prevent voter fraud sound related homeless vote address oh well go vote drive go abroad photo id wondering photo id must never stood line dmv almost like tory u gop working exactly playbook person lazy get id deserve vote idea people prove identity order vote absurd medium framing discussion opposite way extremely dishonest earth uk u function without national id system like identify bank lawyer employer government office generally life carry freaking birth certificate everywhere monster honestly garbage article photo mandatory canada seems backwards uk place removed done long long time ago silly people want complain boris johnson without even looking done proxy voting like cancer democracy hilarious co year ago british newspaper claiming mandatory photo id card would enforced eu eurosceptic point remarkable none announcement regarding increased funding nh new easily obtained visa qualified business rate cut attempt help save included headline even referenced article instead ever impartial independent highlight considered good announcement totally appalling announcement aim hinder democracy even headline baffling top journalist trying steal mail mantle year user often report submission site ask u ban sensationalized article oppose blanket banning news source reader responsibility skeptical check source comment flaw help improve thread linking medium verifies question article claim link could help reader better understand issue find evidence article title false misleading contact moderator review bot action performed automatically please contact moderator subreddit question concern removed know think realise compulsory voting country may bad thing suprised scrolled almost entire thread without seeing written everyone talking id bad thing problem uk never needed electoral fraud problem uk look number key finding case alleged electoral fraud  2017  headline figure data case alleged electoral fraud  2017   31  january  2018  one conviction connection allegation personation polling station suspect eight case accepted police caution four relation registration offence two personation voting post one false statement nomination form one return election expense case alleged electoral fraud  2017  outcome allegation number action  207  locally resolved  82  investigation  44  prosecution advice awaited  7  court proceeding initiated  2  acquitted  1  caution  8  conviction  1   13  almost half  165  case case alleged electoral fraud reported campaign offence majority imprint offence  96  case majority case  289  either resulted action  207  locally resolved  82  offence type offence number registration  36  nomination  25  campaign  165  voting  104  administration  3  miscellaneous  3  download analysis allegation electoral fraud  2017  general election vote cast number potential case voter fraud  2017   112  potential almost  400  electoral fraud case  2017  voter fraud one conviction  8  police caution mean everyone voted  2017  potentially fraudulent requiring photo id solution problem exist well need drive voting bigger impact yeah good start breaking news increasing validity vote many carry photo id id free poll tax leftist style title british really know boris sort look like trump lost brother god forbid verify identity person voting ensure legitimate vote real election anonymous fraudulent real vote verify proper identity seems like logical demand voter id help prevent fraud hard get photo id lol god forbid people need prove identity get decide leader country ofcourse every citizen able get photo id free aswell imo face accusation move designed suppress voting young people disadvantaged group experience one thing people know obtain photo id drinking age voting age uk probably late posted one person wanted sway election substantial degree polling station would go polling station polling station vote people name could realistically vote polling station poll clark presiding officer likely recognise returning voter would mean would  1  know people live call name get polling station wrong going look suspicious  2  know people pretending going vote later  3  know people pretending already voted  4  hope person pretending known polling staff polling staff may ward often quite local fuck way increase chance falling apart bunch polling station geographic proximity reporting potential fraud mark area group people attempting group involved hope none get caught hope keep quiet practice realistically speaking assuming success significant insider knowledge could possibly small group people flip  100  vote  99  time nothing general election could probably get caught pretend people different ward even vote although likely marked likely going substantially impact anything ballot secretive traced disqualified fraud suspected anyone asks ballot tracked earth would prevent anyone voting unless cheating lying criminal left insane west able law free official photo identification given everyone voting age country  4  million people  0  migrant issue already requires id voting thought common practice worldwide make issue conservative practice confused 
ekghol,1578247353.0,iran say enrich uranium without restriction according need,SubParNoir,470,42,great success trump cool well done art deal big brain genius obama help country got  159  page detailed nuclear treaty iran inspection team ground iran verify iran complying deal first summit north korea trump got  1  page vague signed statement north korea detail inspection team ground north korea u left iran nuclear deal trump became president u ally stayed deal thought good deal even trump loses  2020  iran probably wo come back table next democratic president negotiate deal thank trump iran get nuke one day never mind potential possible war iran short term point hard see rational reason iran would sprinting towards nuke u repeatedly demonstrated without nuke iran vulnerable sort attack rest world shown wo anything change sure sprinting towards nuke risk far tell iran pretty much backed corner way nuke see trump must invade evil terrorist country iran stop developing nuclear weapon mass destruction trumpsters trump dangerously ignorant incompetent man world ever seen deleted nuclear holocaust easy win believe cool easy unfortunately u russia proven nuclear weapon guarantee sovereignty ca blame iranian fear orrible feelling used pretext future invasion obama strike iran brokered great deal trump strike iran deal torn know insane follower mental gymnastics head come stuff like tremendous victory trump must ecstatic removing everything obama worked isolating u better deal worst deal ever right guy ca say blame seems way stave u invasion north korea certainly threat invasion could seen coming trump foreign policy unmitigated dumpster fire every front deleted good deal sham moment u withdrew everyone involved especially europe continued suck dick happy person right trump bad news everyone possible world becomes le safe everyone trump still president year khamenei get nuke like kim shocker surprise best tl dr could make original reduced  66  bot iran finalize fifth step back nuclear deal sunday spokesman said retaliation withdrawing multilateral accord reimposing sanction nuclear accord iran united nation security council  039  five permanent member britain china france russia united state plus germany agreed  2015  response iran recently exceeded stockpile uranium heavy water allowed deal started enriching uranium purity level beyond permitted extended summary faq version tl drs far feedback  23 autotldr pm comment monitored constructive feedback welcome top keywords iran  1   2  step  3  united  4  killed  5  fallout world let goooooo would get bomb war proven well go nuclear deal perhaps next president strike new nuclear deal let state jcpoa iran nuclear deal iran could make nuke month jcpoa iran would able make nuke  1  year however effort would heavily hindered due requirement deal well outside observation verify meeting obligation absolutely frightening got ta wonder israel feel chuckle fuck president goddammit target  1  established heck easy would better continuing deny uranium enrichment look like middle east back menu iran going way north korea good job trump interesting video happens nuclear bomb set city rate iran getting nuclear weapon would best way avoid another endless war would create power balance israel force look diplomatic solution brazil shut imperalists want take amazon putin rub hand maybe russia make thing fun sell iran nuke would fantastic way make trump look like complete fool deleted wonder jcpoa nation feel right iran making enemy move saudi sure upset basically going stop pretending deleted removed saying already knew complying deal would able quickly 
epzopt,1579263784.0,eu eye temporary ban facial recognition public place,bilefreebill,3814,33,deleted facial recognition seems appeared nowhere perhaps ignorant date seemed pipe dream like wow delay definitely would good thing make sure law place make sure people protected private company government use malicious purpose step right direction imo watching vice report facial recognition china day implementation scary fuck understand technology never go away need tightly regulated becomes commonplace especially government access facial recognition data limited temporary shame uk leaving point privacy right atleast u large written time modern technology inconceivable new invasive tech get pas people back could concieve power computer internet smartphones rely court stretch archaic clause include today threat get shit like glove compartment inviolable vault privacy smart phone fair game best tl dr could make original reduced  86  bot eu could temporarily ban use facial recognition technology public place train station sport stadium shopping centre fear creeping surveillance european citizen proposal new regulatory framework artificial intelligence could quot include ban use facial recognition technology public space quot paper state quot use facial recognition technology private public actor public space would prohibited definite period sound methodology assessing impact technology possible risk management measure could identified developed quot extended summary faq version tl drs far feedback  23 autotldr pm comment monitored constructive feedback welcome top keywords technology  1  recognition  2  facial  3  intelligence  4  artificial  5  let make temporary shiny forever straight banned without warrant worry pedo kidnapper terror plot something require unbanning near future deleted worry also worry mass harvesting face related data internet many people face somewhere internet many people face rather exist let say nude hosted amateur porn website people safe internet huge image largely tagged anyone life really going find nude uploaded  10  year ago world  1000000 th used porn site many people internet tagged information name event many people face profile pic dating app social medium account worry service future illegal otherwise someone obtain photo someone simply run service unlike google get dirt imagine creep going bar taking photo someone basically running background check may able find name work hobby social medium account information may leak well perhaps something compromising even something like x 200 b prior face recognition tech ability choose whether identify someone trying dig dirty fresh luck gave photo would ever find current technology face becomes valid form id anyone identify nothing phone facial recognition public place would happen matter people like like american people stop regime mass surveillance  5  eye burger fry facial recognition breach privacy way honest whether want whether make law day privacy long gone never come back talking china china reality already live police state camera gps data tracking security search national id accepted easily facial recognition everywhere next step whether good separate discussion ha fuck anyway cut face educated like topic since see mentioned anywhere else yet run lecture heard issue back social ethic class last semester facial recognition technology deeply problematic lot ethical reason beyond privacy right withhold medium consent bigger issue accuracy reliability like think technology operating outside human bias fact code unchecked vulnerable bias programmer algorithm yet standardized even adequately mean fuck news article found site one study validity one study need allowed test shampoo rat let alone publish algorithm could ultimately sending human jail facial recognition technology adequately tested wide enough variety face yet bias checking method yet standardized either consequentially though algorithm excel differentiating caucasian face substantially le accurate literally everyone else quote one news source see link bottom bias evident majority face recognition algorithm compared performance white algorithm  100  time likely confuse two different unacceptable exceptionally dangerous technology outside consensual personal use one device ought outlawed everywhere forever source theme park couple year save queuing think technology unfortunately alluring get cause eye face use recognize problem thatas long video footage exists apply afacial recognition algorithm need ban facial recognition rather ban camera public space would ideally include cellphone camera make banned bitch gdpr eu created begin guy still really beleive anonymity possible future kind technology constitutionally banned national level meaning need  66  country respective legislature allow constitutional amendment able track anyone anywhere real time like read orwell thought instruction manual eu citizen never voted facial recognition passport control either forced nonetheless deleted facial recognition everyone print dna known catch many criminal would deter lot people crime could talk get real government one coming idea put guarantee  100  want every single place possible ever england camera everywhere uk want leave eu lmao effective identifying actual criminal want focus arresting people saying thing like robber rapist definitely another red valuing safety preserved security may supported end reality due recent scandal around world leading skeptical attitude 
evqkg1,1580321333.0,germany proof huawei worked chinese intelligence handelsblatt,Substantial-Truth,116,11,supposed work chinese intelligence requirement huawei equipment chip would seem global monitoring key party assured reason security course handelsblatt report cited confidential foreign ministry document intelligence shared official represented smoking gun meant chinese company unsafe partner building  5 g mobile network proof uhh knew already like lot tech company thing branch chinese government worked another branch chinese government inconceivable proof somehow never made uk look like trump right trump supporter happy see bipartisan concern transcends politics huawei chinese government controlled spying operation reason  1  basically agree build  5 g infrastructure free would product free product ca believe canada eu falling allow china unfettered access data period shocking everyone business china work chinese intelligence least matter regarding mainland china discussed could course install u hardware report u chinese ask nicely sure better deleted 
eyes05,1580766963.0,germany current account surplus remains world largest fourth successive year  293  billion japan next biggest  194  billion,green_flash,223,12,really wwii  99  reddit idea current account biggest surplus  1  germany  293  billion gdp  2  japan  194  billion gdp  3  china  183  billion gdp biggest deficit  1  united state  490  billion gdp  2  united kingdom  117  billion gdp  3  brazil  51  billion gdp global trade remains extremely unbalanced germany currently negative interest rate would nice surplus american one way look german wage low average hence internal demand lower could japan surplus maybe actually pay debt wow someone winning least big surplus socialized healthcare apparently done wish make deutschebahn run time surplus money make scomos  5  billion raf look pretty paltry deleted people germany hate money help anywhere used area needed like education currently like  1  teacher  2  class modern device pc lot school many german trying much money possible need number show wellbeing money alone make human happy reason like  60  vote towards left right 
ez7uua,1580900013.0,man convicted pushing woman balcony rejected advance,CRI0ST0IR,129,15,ali placed hand thigh rip jean aggressively placed arm around neck saying bedroom also grabbed pulled hair get attention made clear interest reciprocated became angry aggressive creep female victim managed leave flat attempting call lift ali approached ran balcony called help ali ran towards pushed ledge fucking psycho caged forever like animal landed hard floor suffered significant injury including fracture neck lower back victim spent several week hospital though making good recovery unable go back work college thank god survived really serious injury change life forever feel really sorry hope recovers fully quickly possible fine human specimen guy dude never let prison asshole deleted best tl dr could make original reduced  81  bot man convicted pushing woman balcony rejected advance stabbing two people party hosting victim met ali arrived friend soon began making inappropriate advance towards quot detective constable tom waller said quot ali violently pushed innocent woman fourth floor internal balcony fit rage already seen stab two men extended summary faq version tl drs far feedback  23 autotldr pm comment monitored constructive feedback welcome top keywords ali  1  stab  2  pushed  3  victim  4  balcony  5  fucking aggressively touched woman rejected got argument brandished knife stabbed  2  guy running leave found woman later ran balcony scream help chased pushed guilty attempted murder uk fucking embarrassment pinnacle humanity display see later another group boy arrived fight broke ali armed knife kitchen wild party happens come culture woman treated like object fuckwit guilty attempted murder despair court system uk probably walk free  18  month victim lifelong consequence tantrum remember woman say direct right start shut men simply leave alone stop advance respectfully however obvious teasing leading would honest direct give roadman reason england gone shit sentencing assault u often imo light hope uk take grievous bodily harm seriously deleted tragic really news 
f1b2qc,1581266313.0,israel bar palestinian exporting produce via jordan,CDAATX,331,13,creating ensuring dependancy israel remains key part controlling palestinian life trade freedom movement control land resource freedom expression hallmark occupation lol want american politician make illegal american boycott israeli product also want stop palestine exporting anyone except israel fucking disgusting best tl dr could make original reduced  83  bot israel banned sunday export palestinian produce via jordan coordinator government activity territory kamil said marking escalation trade dispute israel palestinian began october according palestinian israel sent back west bank nine  25  truck loaded good worth  50  million shekel headed turkey via jordan response israel slapped sanction pa revoked palestinian businesspeople  039  passage trade license halted passage donation strip  039  allow palestinian bring cattle imported independently gaza extended summary faq version tl drs far feedback  23 autotldr pm comment monitored constructive feedback welcome top keywords palestinian  1  israel  2  israeli  3  west  4  bank  5  disgusting behavior invader israel turned villain within generation bastard fascism christian anymore horrible sad see israel trying emulate nazi move follows defense minister bennett instruction stop agricultural import palestinian authority ramallah limited import calf israel classic tit tat let stressed soon palestinian authority revers decision harm cattle trade israel free market actor crisis way commentator removed imagine canada buying tequila america except america manufacture resell mexico take cut canadian go hey buy direct mexico retaliation america blockaded canada ca trade country ridiculous situation make sense keep attacking israel suffer restriction fuck jewish people ok 
