id,time,title,author,score,num_comments,text
fsryv0,1585712620.0,taiwan donate  10  million mask country,whateverworks325,8075,101,thank taiwan taiwan no 1  european lived taiwan experience taiwanese pro assistance come country foreigner taiwan donate  10  million mask country update taipei april  1  cna taiwan donate  10  million face mask country seriously affected new coronavirus disease president tsai said wednesday speech delivered presidential office tsai said taiwan increased production face mask giving country ability provide mask country experiencing major escalation contagion tuesday taiwan ministry economic affair announced taiwan daily surgical mask output hit  13  million current daily output four time amount taiwan capable producing early february produced average million surgical mask per day foreign minister joseph wu indicated diplomatic ally united state european country would among would get mask say mask would donated speech aimed raise awareness spread ahead upcoming long weekend observe tomb sweeping festival tsai said taiwan made considerable effort bring contagion control achievement recognized globally due effort boost face mask production tsai said taiwan transformed importer mask second largest surgical mask producer world able provide enough domestic use adding government aim increase daily production still  15  million unit tsai said taiwan work global community providing face mask also drug related medical technology future tsai said taiwan provide mask country seriously affected based progress production asked press whether taiwan donate face mask provide medical assistance china contagion began end december tsai said taiwan provide aid country need help long taiwan able help indispensable part global effort tsai said taiwan willing work country get difficult time ahead addition face mask tsai said taiwan also devoted developing rapid diagnostic test vaccine drug fight contagion area many country expressed willingness work taiwan according tsai taiwan working european union czech republic map strategy combat disease taiwan currently conducting material swap australia example moea announced monday australia agreed provide  1  million liter edible alcohol turned million  300  milliliter bottle  75  hand sanitizer return taiwan provide australia  3  metric ton fabric key raw material used surgical mask production capacity stabilized moea said addition taipei washington said march  18  two side form partnership research development rapid test well research production vaccine medicine tsai said clinical trial country point possible cure quinine patient mild symptom taiwan government told local pharmaceutical firm raise quinine production bid provide medical support needy country wang eyh hsieh france huang enditem hsieh france huang thank taiwan long live freedom another reason celebrate taiwan thank taiwan love taiwan thank taiwan glad see taiwan succeed without need thank taiwan wife lived taiwan several year proud country long live taiwan thank taiwan deleted queen taiwan wow country actually understands want problem country support country world leader thanks taiwan taiwan trying join un etc even declare independence china world leader bye taiwan hope changed time name taiwanese poet gave taiwan made song orphan asia taiwan betrayed almost everyone long time work company taiwan canada project coordinator taiwanese company offered team member n 95  mask shipped directly home thank taiwanese people indeed number one crazy flooded reddit become ccp shill time taiwan number  1  thanks taiwanese people shame recognize please china u europe together declare taiwan country thing china autistic screeching state medium good hope piss china  2  million mask u  7  million mask italy spain france germany belgium czechia poland luxembourg uk switzerland  1  million mask aia viva taiwan removed taiwan bite biatch god bless taiwan thank taiwan hope get recognition deserve everything blow proud country taiwan taiwanese nicest country sometimes loving love thread thread american enjoying watching badminton hope april  1 st thing taiwan best ccp worst taiwan china case clear china lol issued statement thanking china donation  10  million mask china tho love taiwan free taiwan time u open embassy taipei officially recognize sovereign country lmao see wumao running stuff say pathetically calling china like anyone care desperate attempt lol feel everyone use fresh mask daily advised go billion mask day make week one  4  use one still around  280  million mask day number scary friend family taiwan terribly worried u u right weird world right news u donated million mask communist china turned around said corona virus made u sigh fuck yeah taiwan rock one work properly unlike ccps   yeah thank taiwan shall forget taiwan best country taiwan china compare ccp selling test kit stockpiling mask china probably  100  time much mask never donate half much anyone reason thank taiwan taiwan number wan joke aside praise thank also fuck ccp free tibet tiananmen square protest  1989  tiananmen square massacre struggle great leap forward great proletarian cultural revolution human right democratization freedom independence system taiwan formosa republic china tibet dalai lama falun dafa xinjiang uyghur autonomous region nobel peace prize liu xiaobo winnie pooh really really really hope meet standard  1  shitty neighbor cool please print big bold letter front made taiwan sweet greeting china un thank taiwan fuck china horrible manner tawaian remembered one true hero helping much doesnt surprise visited taiwan  2018  people nice canadian reminded fellow countryman great western country run already government asking company donate protective equipment even used one china stepping send world mask well done taiwan whole  1 st world need manufacture donate  2 nd  3 rd world fast million dead wonder china list lol china even ball come claim donated mask policy lol wonder many country turn taiwan exist mark going health care provider anyone country great country never proud born roc  1  prc  4  taiwan taiwan asking friend guy west taiwan gon na pissed see comment  walis tool glad see china helping honest one actually care taiwan except taiwanese wonder people commended taiwanese maybe rest world actually start acknowledging existence nice china taiwan better china know taiwan best china taiwan numba wan taiwan truly best china great country taiwan donate china hope wont bother thank real china corrupt ccp played virus transmitted praised china everything wuhan want see real truth wuhan multiple video liveleak showing citizen wuhan captured shoved vehicle citizen committing suicide jumping window hanging virus way worse telling public resulted thousand death country prepared china case death even come close true number stopped testing tested controlled amount mean china thailand next question please deleted today announced donation  10  million pair mask foreign country people waiting line buy mask upset think  10  million tablet carefully one day production taiwan japan  311  many people donate one day chance mainland come invitation receiving mask taiwan x 200 b design dialogue x 200 b geng shuang chinese uphold spirit hungry hungry drowning taiwan province china donated  10  million crisis mask country want thank greater china x 200 b curious funny china donate something became headline reddit one cared taiwan donated  10  million mask kind double standard apparently chinese propaganda nice propaganda ddp lol wait china donating mask dont recognize taiwan accept supply mean real china even country lmao seems stupid taiwanese really good making mask trump probably refuse would get way letting virus spread get business usual virus run course hundred thousand die going gold herd immunity immunization problem spread virus continued ongoing inadequate testing inadequately providing ppe ventilator shipped  17  ton mask ppe ventilator claiming obama left stockpile empty would ship  17  ton equipment china knew going need restock stockpile recently said knew along pandemic done crime humanity literally killing ppl  5 th avenue main st republican supporter cool edit nice region china fun fact china prevent doctor getting infected use respirator mask surgical mask actually none skin exposed would like send sincere thanks err err mean one part china right refuse recognize status false april fool prank good true removed well leader refuse sell mask sale place west strait back jan come  1  country donates stuff late found company taiwan selling used mask deleted kind story getting tiresome pointless country x donates x million mask yawn 
fwukas,1586299827.0,trump say hold world health organization funding backtracking,bhola64,195,14,president donald trump said would put hold funding world health organization backtracking claiming saying going like clown juggling bag shit know next pandemic coming prepare tap head blather blather blather idiot thinking aloud treated like old grandfather figure mean he racist would surprise hate anyone brain would dare disagree especially science community anywhere else could eventually file charge land jail deflecting blame trump plague shit phoning presidency wholly unqualified office america vote oaf back seen think start treating country way treat south korea mild curiosity otherwise mockery ignore always wonder people actually know thing take care idiot idiotic thing like everyone trump cultist knew three year ago trump hater see actually controlled china blind let trust president time xenophobia gee time poor joirnalism could achieved level suckitude via tweet terribly written article lead upto comment nothing substance 
fxxn1b,1586456527.0,sex toy sale triple new zealand coronavirus lockdown,,153,5,ball gag replacement n 95  mask word kiwi think right business time good job new zealand keep continuing make proud keep fact coming hard fact related news rival aussie going much greener option buying phallus shaped vegetable 
g1ucd2,1586965210.0,five patient died indian city bhopal survivor  1984  bhopal gas tragedy suffering respiratory illness made vulnerable disease,shadilal_gharjode,7667,28,know disaster people exposed methyl isocyanate mic gas highly toxic substance made way around small town located near plant union carbide never apologized always hated people call bhopal gas tragedy union carbide gas disaster somebody lived happened would like offer insight obviously observation opinion try best unbiased  1  around  2   2 nd dec  1984  family member heard commotion neighbor driveway father asked going observed removing fuel vehicle another car motorcycle scooter etc filling one jeep getaway vehicle entire big family heard huge gas leak old part bhopal near train station people dying like fly decide flee like many disaster everybody decide turn radio decided stay put side city  2  entire staff station train station time dead people living slum around uc plant dropping dead along cattle irony many old disabled people left behind covered mattress survived kept low ground one ran away ingested gas many perished  3  chief minister arjun singh known extremely corrupt time ran away huge palatial mansion built near lake far incident site issued decree evacuate little late  4  cause combination operator error faulty valve identified replaced replaced time came know many year later briefly worked engineering conglomerate right college owned company manufacturing valve allegation corruption etc bogus one clearly maintenance operator failure corruption part came later money disbursed  5  ucil union carbide india limited india company practical purpose foreign company invested india time india even allow foreign country hold majority share would come back bite govt tried assign blame u parent company sought compensation punitive damage  6  expediency reason payoff reason know indian govt agreed settle  450 m despite asking  2 b initially money never made people politician delhi bhopal took huge bite whatever made people mostly form small monetary compensation hospital clinic built  7  interesting fact tank capacity  80  ton mic methyl isocynate  15  ton leaked caused havoc rest formed gel due rapid cooling escaping expanding gas one imagine result happend  8  conclusion plenty blame go around uc ucil india govts etc photo little girl buried parent haunt day two photographer arrived disaster time took similar photo child pablo bartholomew took colour picture raghu rai took black white colour image went win  1984  world press photo year deleted born bhopal place factory still found toxic high level flouride water union carbide never apologized accident paid reparation still see damage health descendant affected three generation death counted bhopal  1984  parent lived within  50  km proximity union carbide company felt eye affected due whole family wear thick glass whole life parent asthma genetically sister pay  500  glass checkup appointment every year govt compensation  500  per person joke year  1984  sikh parent survived  1984  anti sikh riot almost killed cousin family death though parent living legend u never held accountable another note remember watching mockumentary yes men made union gas chemical leak lead mass casualty indian govt mute af damn project union carbide age ago expect see pop relation covid fuck uc style may everyone taste behind bastard decent job covering bhopal disaster always wondered many american familiar bhopal happened much suffering death miscarriage environmental toxicity still around accident deleted infamous massacre authoritarian government lower death count bhopal disaster similarly justice never delivered write research paper handled terribly blame back forth saying employee checking procedure company government held accountable lot finger pointing actually called bhopal law tragedy imagine something scale happening state wikipedia june  2010  seven indian national ucil employee  1984  including former ucil chairman convicted bhopal causing death negligence sentenced two year imprisonment fine maximum punishment allowed indian law released bail shortly verdict eighth former employee also convicted died judgement passed remember accident happened  1984  man studied event detail chem eng elective heartbreaking highly recommend anyone interested bhopal disaster read novel animal people indra sinha telling  5  people died covid bhopal sad santiago chile saw union carbide plant outskirt town make wonder moved nasty stuff well people died vulnerable one reason another reason quarantined largely keep vulnerable people alive  kill make vulnerable madre theresa would say forgive culprit twice dont say im willing bet  99  covid death respiratory issue removed  1984  man made disaster survive  2020  virus nature die takeaway nature always win 
g2m5pu,1587066507.0,alarm ring greenland ice loss cause  40   2019  sea level rise,kantidugar,2859,37,month  2020  flood place bet high school science class  1974  teacher told u fifty year warming going cause greenland ice cap melt start melting going fall piece causing massive sea level rise relatively short time matter year decade sad part majority human still understood profoundly terrible lifestyle habitat supposed information good thing staying home degree impactful proposed program combat climate change best tl dr could make original reduced  88  bot  1990 s greenland ice sheet roughly state balance annual mass loss risen since greenland shed four trillion tonne ice  1992   2018  causing mean sea level rise  11  millimetre according study december  2019  study nature ipcc forecast global sea level rise could top metre  2100  due mostly discharge icesheets greenland west antarctica extended summary faq version tl drs far feedback  23 autotldr pm comment monitored constructive feedback welcome top keywords greenland  1  icesheet  2  ice  3  warm  4  global  5  almost alarming however icesheet accelerating disintegration force driving author reported week cryosphere journal published european geosciences union half dramatic loss  2019  due air temperature rather unusual weather system linked global warming anticyclone condition blocked formation cloud southern greenland causing unfiltered sunlight melt icesheet surface fewer cloud also meant le snow  100  billion ton average addition lack snowfall left exposed darkened ice absorbs heat rather reflecting pristine white snow condition different better northern western part greenland due warm moist air pulled lower latitude study showed factor led accelerated melting runoff creating torrential river cutting ice toward sea atmospheric condition becoming frequent past decade said lead author marco tedesco scientist columbia university earth observatory likely due jet stream powerful ribbon wind moving west east polar region said twice global average disruption jet stream normal pattern linked disappearance sea ice faster rate atmospheric warming arctic disappearing snow cover siberia consequence global warming average temperature arctic region risen two degree celsius since century twice global average climate change word may make destructive atmospheric condition common greenland tedesco said impact system factored climate model used un intergovernmental panel climate change ipcc project impact global warming greenland icesheet study warns likely underestimating future melting factor two xavier fettweis research associate climatology laboratory university liege belgium told afp new study attribute nearly  70  percent meltwater runoff iceberg discharge last year high pressure system rest direct warming atmosphere climate change jet stream deleted bye bye florida hey hey hey one disaster time please unlock virus disaster future get used coronavirus big deal bigger surprise day later hope educate people coming invisible crisis unlike coronavirus u participate averting voting living lifestyle le waste le meat change must come bottom top corrupt refuse change unless make like grab surf board alarm know alarm ringing one listening one thing time please obviously good volume nice knowing florida man one bad news time please might get attack titan shit nyc least name relevant  2020  like im looking forward  2021  beach getting closer people freaking corona bitch better wait vaccine gon na save u climate change shit going hit real hard corona child play compared global warming make greenland green greenland finally living name air become much cleaner world almost completely shut pollution probably lower industrial revolution melting second question due glacier melting found trail greenland viking used travel reason lack ice cover lastly greenland called greenland iceland assume reason next west antarctica read comment look like everyone dumb except find flaw thinking hmm ok sea level rising  7  meter foot wow dad house charleston sc  9  foot sea level life way west ashley prediction scary god damnit greenland keep shit together climate change crowd glad virus stealing attention haha damn archimedes principle thooo xd deleted another b climate warning going since  1970  mm meter le  16 th inch sealeavel rise better start running hill going drown 
g7sojh,1587817525.0,chinese embassy canada investigate claim made ottawa  1  million kn 95  face mask bought china failed meet federal standard use frontline health professional appealed incident become politicised,,437,19,sure thing non political sense china shown reliably provide critical good canadian need totally non politicized way divest much manufacturing possible non politicized way avoid dealing much possible sensitive insecure country ever cause pandemic hide critical pandemic information lie pandemic number distribute faulty pandemic equipment around world cry backlash yeah fuck chinese government authoritarian eat shit good time bring medium lot camera show ambassador poorly made mask sure ambassador slip good one keep close eye know operate every little thing politicized chinese find nothing wrong mask canadian testing methodology flawed appealed incident become politicized unfortunately nowadays everything politicized especially government resort medium rather political channel resolve issue happened country pass supply chain third world hopefully canada start manufacturing least vital important supply surely deal worked failing legislated chinese people give fuck professional standard contract requirement adhering country quality expectation want succeed best way succeed china exploit cut corner fuck ordered china first place china capable anything right except fucking people people foreigner government expert scum deleted canadian order  5  million mask disappeared chinese airport also political issue bad canada make china sad chinese communist propaganda lie listen chinese communist said look chinese communist propaganda repeat lie wear okay give u back citizen least let released accessible house arrest time bring manufacturing back home elsewhere give benefit doubt assume someone skipped certification process back china pay dearly good investigate starting immediately chinese custom take great care examine every shipment medical supply canada conduct rigorous sampling testing make sure meet standard let border whole process take  3  month least  3  month later canadian get trickle medical supply better quality actually believe china already starting better yet ban selling supply canadian protect healthcare worker find much better source problem everyone happy chinese alternative standard put something packaging mislead foreign market thinking people buying mask investigated buying something even labeled adhering standard set bought crate rolax watch complaining keep time course disgusting chinese produce thing standard course deceptive buying safety equipment duty know fuck 
g978s6,1588014794.0,one country one system week china shredded promise hong kong,,147,7,china consolidation coming along nicely next taiwan troublesome neighbor sorry say right seeing decision coming beginning wish ben wrong clear message country making deal treaty china take thousand year vicious imperial rule still surprised china able join modern world stop threat people free think rather serving imperial regime dressed marxist flair chinese political culture belongs bronze age modern world people see clearly despite effort hide truth crappy little god like xi people deserve free boot pretend emperor channelling chinese enforcer look like halo soldier hi eurotrashcardoc submission behind metered paywall metered paywall allows user view specific number article requiring paid subscription article posted accessible everyone submission removed flaired user discouraged upvoting commenting information see wiki page paywalls please try find another source news site reporting story contact moderator bot action performed automatically please contact moderator subreddit question concern american propaganda machine perpetual lie china broke promise hk probably autonomous city world hk pay tax central govt 
giifnl,1589311692.0,macau ban annual tiananmen massacre photo exhibition,polymute,150,2,think june  4  project publicly big city world tweet picture respective chinese embassy nobody forgot people stand peasant run china world fall war china think war guaranteed drive u greed want cheap thing made china slave 
gjkzfy,1589457600.0,india sends fighter jet chinese border tension mount,jplevene,1303,35,anyone familiar source never heard london love business seen story anywhere else india deployed fighter jet chinese border tension soaring military helicopter flying inside india airspace contested border mile long known line actual control lac attention conflict since  1962  lac run disputed kashmir region disputed region according indian ani news outlet chinese military helicopter flying close line actual never good start war right even worst ww 3  would restart economic activity let  1  never start land war asia  2  never get battle wit sicilian death line thing china bullshit intimidation shit time indian border share huge border china hate india gut since tibet issue happened nothing new india used random bullshit china every fortnight posturing time lol china preppin bent india staets absorbing manufacturing china beta xi jinping new incarnation hitler ccp new nazi party every nation planet nothing stop deserve everything happens know need right dick measuring contest two major nuclear power believe many idiot thread want world war china china feel existence threatened way hesitate use nuclear weapon bring mutually assured destruction multistage total warfare china release pandemic attack every country third reich n roll happen would happen much stake nuclear power war china india would devastating planet think either country would shy away using nuke tbh china world take delay killing coronavirus blow please say enough fuck ccp let take ccp china making friend world new cold war well news correct buddha communist seriously fuck china giant veiny cock hoping meet end soon maybe headline week ago saying thousand company planning move manufacturing china india asking whether jet scrambled asking sukhois flying may  5   6  would say regular training flight taking place including today iaf said see evidence sort tension mounting sensible side oh hope people fine  2  billion life danger hope make alive morbid curiosity fight fight fight china know done expansionary phase ended could develop force projection value kashmir guessing trade route mineral resource seems like weird place risk much guess time day oh yeh spam random chinese article world news time day removed let hope dont fuck get another pilot captured lol lol xi dining ruin new delhi noon get good morning rajiiit help wat ariplane sorry sir follow sir pas president sorry sir follow turn try india nothing like nothing pakistan threatened removed trump republican choose india china 
