id,time,title,author,score,num_comments,text
abpv8b,1546403490.0,russian billionaire demolishes trump former  95 m palm beach mansion,pervertedarchitect,366,16,ruble launder damn even imagine demolishing mansion realize land probably worth majority value damn deleted wonder russian simply trying score point billionaire club lot grass mow give noise cancelling headphone paradise probably way get stench much story trump doubled money property sold  2008  property market freefall oligarch bought even concerned recovering rent one occupied since torn lot speculation quid pro quo money laundering transaction one way hide evidence never understand people want live big house mansion even rich see would want space would rather smaller house nature ground could almost live forest privacy ground size regular house yikes layout place awful see outdoors area look totally wonder getting demo look like built  100  year ago probably made trump free mansion donald sell damaged good russia scoop money laundering going say donald would thing ugly fuck rybolovlev purchased acre estate  2008  record breaking remind trump sold yet another home yet another russian oligarch really sure supposed take away belive whole russia debacle brought court evidence presented found factual russian conspiracy reminds  911  inside job people sort sound plausible paper nothing done everyone would field day concrete evidence instead going oompa loompa unrelated stuff conspiracy theory might well vaccine denying sandy hook believing mk ultra paranoid schizophrenic believe russian interference 
adbgju,1546818278.0,israeli teenager suspected deadly stoning palestinian woman,spartan2600,3204,46,israeli seminary student religion taught something morality something good something wow really stoning people best tl dr could make original reduced  82  bot morning friday night attack shin bet said activist set car settlement yitzhar rehelim briefed student prepare deal shin bet interrogation quot client underwent trying day suffered extremely inappropriate conduct shin bet interrogator quot said three lawyer adi keidar nati rom legal aid group honenu itamar ben said two minor detention connection case allowed speak lawyer shin bet employed extraordinary method jewish terrorism suspect including administrative detention delaying access lawyer measure previously reserved palestinian accused terrorism extended summary faq version tl drs far feedback  23 autotldr pm comment monitored constructive feedback welcome top keywords shin  1  bet  2  palestinian  3  settler  4  west  5  compare  5  american teen throw rock overpass killing driver call stoning stoning inaccurate inflammatory term use article title since stoning evokes idea group people surrounding woman repeatedly throwing rock dead religious purity reason happened threw rock car single rock even even le dead one including would want minimize language precision matter people using evocative language imprecisely probably agenda case author agenda paint horrific religiously motivated premeditated crime instead allowing possibility afforded american teen stupid reckless action perhaps part malice without genuine intent kill thus manslaughter teenage boy throw rock car lot different jewish teen stone palestinian woman bias glaring comment section become always argument legitimacy history new nothing someone kill someone everyone blame everyone tired wonder ben shapiro think removed glad already arrested place people hate like israel curious people reportedly antizionist ultraorthodox radical sect comment section sadly spun circlejerk sad people know teenager also edit downvotes article support agenda european jew take land original inhabitant proceed murder original inhabitant land world live deleted hi spartan 2600  submission behind metered paywall metered paywall allows user view specific number article requiring paid subscription article posted accessible everyone submission removed flaired user discouraged upvoting commenting information see wiki page paywalls please try find another source news site reporting story contact moderator bot action performed automatically please contact moderator subreddit question concern worth noting arrested versus celebrated grab popcorn deleted deleted find lack equal outrage coverage news towards stoning racist muslim sheer hatred one must feel thing like zionist nazi two side coin really need leader faction get locked room difference sorted linger conflict go senseless becomes right wrong going stone people death shoot bomb gas dose lsd let see happens may rot jail forever almost certainly comment suggesting israeli government endorses petty lie make doubt validity account posting boy boy fuck reddit remember lump whole group people together tolerance usually go stone age belief acting stone age eye eye headline part world changed  4000  year post alert jdf literally everything said hotly disputed trying pas opinion fact based one reference make seem either care one side argument unaware dont think advocacy bad thing upfront bias shocking another day israel kill palestinian tuesday october  18   2011  gilad free home bosom family country celebrate israel joyous gratitude fill heart along round captor slaughtering savage dip hand blood use strapping bomb devil spawn sending meet virgin taking life child already pimped mother murder shield hiding behind burka cradle like unmanned animal throw prison bide traded thousand another child israel sea float food shark stargazer whatever oceanic carnivore god put purpose go blog elliot abrahms wife bush cabinet look top right corner contributor joe fucking biden guess propaganda working well teenager decent background would hesitant murder cold blood b shot throwing stone israel handle child throwing stone thought israeli people could commit crime palestinian without severe repercussion meaning suffer absolutely consequence note deleted difference jew israel arrest palestinian happens much often pay thousand dollar stone back like religious freak old testament tell deleted deleted  2000  year really wonder humanity travelling star exploring galaxy colonizing solar system mining asteroid building vast rich culrure creative endeavor like ca even comprehend still asshole throwing rock patch land happened israel several jewish teenager arrested grave terrorism offence happened gaza mother heroic martyr appears national television reiterate importance ridding middle east zionist usurper asks child lay life must lone wolf fuck religion deleted israel right defend stone thrower upset theyre land taken away reacting lethal force innocent kid forcefully settling occupied land brainwashed breed hate 
as9k1q,1550576898.0,new universe map unearths galaxy,StronglyWeihrauch,137,10,deleted map new zealand many galaxy already discovered prior used hearing large number come astronomy know whether large increase know galaxy another drop bucket astronomer fancy weighing fact galaxy star milky way evidence need know life somewhere hot take universe big nice see new dlc finally dropped took long enough best tl dr could make original reduced  79  bot new map night sky published tuesday chart hundred thousand previously unknown galaxy discovered using telescope detect light source optical instrument see international team behind unprecedented space survey said discovery literally shed new light universe  039  deepest secret including physic black hole cluster galaxy evolve  200  astronomer  18  country involved study used radio astronomy look segment sky northern hemisphere found previously unseen light source thought distant galaxy extended summary faq version tl drs far feedback  23 autotldr pm comment monitored constructive feedback welcome top keywords galaxy  1  light  2  see  3  new  4  source  5  something something elite dangerous definitely life unearths 
asl2ct,1550644732.0,conspiracy theorist david icke banned entering australia ahead speaking tour politics,beelzebubby,318,19,know australia real lizard overlord confirmed four hour change life world famous alternative researcher put together presentation blow even open mind tour website said lol open mind much brain fall seems likely happened guy best tl dr could make original reduced  81  bot controversial british conspiracy theorist david icke banned entering australia home affair department cancelling visa mr icke due travel australia next month taking latest speaking tour melbourne adelaide brisbane hobart sydney late last year government cancelled visa provocateur founder proud boy group gavin mcinnes ahead planned speaking tour country extended summary faq version tl drs far feedback  23 autotldr pm comment monitored constructive feedback welcome top keywords icke  1  visa  2  australia  3  government  4   5  probably going popular opinion mixed feeling freedom speech apply agree law place australia prevent speech feel awful lot like allowing becaue something might say holocaust denier stated many time holocaust happened nazi tried commit genocide jew also said repeatedly source claim people assume lizard creature code jew david icke clear saying code euphemism mean literal alien lizard creature secretly run world david icke nazi nut law batshit crazy long hurt anyone may crazy preaching crazier religion replace reptile satan force evil got clone faith already simply need found religion good deleted australia already full complement nutter running government need competition well good news today actually uncovered shit mostly regard elite pedo ring undercut interesting insight might nwo social control insisting literal lizard people pulling string get worse people misunderstand lizard people code word jew least icke specifically talk alien lizard coming earth seems genuinely dumbfounded people keep insisting really mean jew sow dangerous seed disunity theorise mate australian spokesperson australia letting anyone anymore hail nimrod lol people believe kind dangerous preacher nut funny guy actually pretty insane conspiracy theorist something warrant freedom taken david icke fuck anyone got info many activist banned australia keep hearing news medium people say right left statistic comparing link article appreciated stand pretty one sided 
atl3k6,1550860523.0,kelly charged cook county aggravated criminal sexual abuse,Wets10,143,6,lock melt key surgically implant foot step take reminds disgusting probably pissed well fucked omg break first rule worldnewsclub end rape kink first time everything guess removed 
axvkza,1551852748.0,u reduces visa duration pakistani citizen  3  month,,142,6,indian pakistani redditors please read article commenting irrelevant subject removed false information affect specific type visa mainly journalist visa please see u embassy official press release removed pakistan innocent wonder usa article nothing indian allegation see modibots indian nationalist trying spin anyway last day india made pakistan look like amateur india  1  dropped bomb tree  2  dropped airplane inside pakistan help pakistan air force  3  dropped pilot inside pakistan enjoy awesome pakistani tea  4  taken pilot back pakistan show force  5  fired pilot isi agent  6  sulked pakistani prime minister offering olive branch  7  let pakistan test submarine hunter open sea kidding aside modi going lose big time miscalculated fake sir ji kal strike modibots roll 
azfrh2,1552225431.0,rowan williams say pupil right protest climate williams whose stark comment come amid growing wave protest scale ecological crisis said civil disobedience wide deep support public,LongDickMick,174,8,work hard school future future compromised believe wide deep support public needed bring matter fully attention political leader show actually achieve democratic change good everybody civil disobedience wide deep support public never happens way though student money power need adult walk pick date month two spread internet bring entire world stop  24  hour everybody take street demand action child using excuse skip school would started long time ago former archbishop canterbury rowan williams oh well respected something position head church england know much state religion anyone help anyone else read robin williams think oh wait dead correctly think adult sitting around solar around everywhere slow steady ev road electric bus city jeez get seriously trying make new trillion dollar energy system everyday take time 
b5ot8b,1553601601.0,eu parliament pass controversial copyright reform,PM_ME_SOME_DINERO,134,21,happens politician using contact representative favour article  13  surprise surprise majority supporter common old likely failed understand even hope every scumbag voted abomination get voted office sure every single one walk shiny new job one copyright cartel voted bag free money laugh vpn old touch people making decision thing young people care politician still think internet new mysterious people protested bot edit spelling pry rare pepes dead cold hand happens average age eu parliament around  50  year old might smart people know nothing modern world fuck democracy gg website shut europe goodbye meme actually interested see real consequence end user much drama artificial driven order protect position make laugh youtube similar platform rising alarm defense user freedom give shit well anything asked medium giant short impact giant company yes forced change way operate yes change badly needed yes change way use internet know probably yes know extend anyone know vpn would work case oh hell guess get lifetime vpn subscription thankfully switzerland close shit show going make bad exactly content nothing new site like google yahoo host news people write host sometimes rebrand story add editorial front story x 200 b get paid work issue content generator content provider maybe google facebook instagram twitter tube could make unavailable england people england tried access feature would get error message saying fucked thank might see change next election eu awful idea start take country back european 
bcje2m,1555106243.0,trump told cbp head pardon sent jail violating immigration law,,196,17,encouraging violate law crime think greater implication law broken pardon pardon irreversible questioned court give would break law get jail free card would consequence corruption ford pardoned nixon crime charged uncharged relating watergate made untouchable willingness use pardon remove consequence breaking law scary hope republican party enjoying hope think worth notably ca speak anyone staggeringly self serving utterly corrupt antic ensured never vote r life level state federal ca say good got r n n g h e w p relax guy lot republican libertarian congress stand given single shit anything besides tax cut mybads legal allowed fucking hell america life hearing great check balance last  3  year criminal blindfolded follower wo even hear word action fascism really maximum president subvert constitution act dictator  1  executes full scale purge make clear say fire  2  pressured nielsen statutory replacement claire grady resign could appoint loyalist mcaleenan without congressional oversight  3  directly tell loyalist break law pardon  4  installed ag demonstrably proven belief dangling pardon blow disobedient official  1  install loyalist  2  enforce protection  3  validated  4  court nothing department justice nothing check balance impeachment another impeachable offense people surprised guy offered pay people bail beating protester rally nothing new watching collapse america feel like planning ahead pardon skirt breaking law would fall something like conspiracy commit crime wonder part led fire nielsen bad stuff wanted go even extreme hit limit deleted would happen guy leaf office technically actually ok tell folk break law promise shield consequence lol butthurt remember lest forget spying justice 
cl3ger,1564748914.0,record heatwave much likely human impact climate scientist say july rewritten climate history wildfire raged around world,ManiaforBeatles,216,4,aerosol masking effect landed situation harrowing irony emission risen co 2  bought u time process dirty coal produce sulfate cloud atmosphere act sunscreen reflecting incoming heat back atmosphere sunscreen prevented level warming seen avoided kinda keep reading good example smaller scale effect shipping industry carrying unintentional experiment climate engineering century global mean temperature could much lower would otherwise based mean forcing effect much done way researching extent effect currently understood anthropogenic aerosol already brought decrease k experiment based representative concentration pathway rcp given ipcc ar 5  show dramatic decrease three anthropogenic aerosol  2100  lead increase k say truly avoided warming simply kick road emission warming still waiting moment longer emit sulfate  35  reduction industrial output emission would lead  1 c temperature rise depending scientist ask could little week could  6  week paper nature analyzed change temperature due absence sulfate cloud cover airline  3  day immediately following plane u grounded accessed temperature change north america  1 c recorded  1 c temperature rise  3  day absence air travel warming occur shipping industry transition clean coal economic disruption much greater regardless though abruptly occurs warming still horizon worse though recently discovered effect actually potent previously estimated twice much life earth adapt abrupt warming like additionally warming like serf amplify rate loss sea ice methane emission described number system arctic earth refrigerator ice arctic heart stability planet control circulation weather planet ward rapid warming reflecting incoming heat like sulfate described consequence ice go life earth go anomalous weather experienced notably recent year direct effect warming arctic loss ice occurring arctic ice aerosol masking effect two key sunscreen protecting u warming loss ice likely occur next year due lack strong sea ice result warming top current warming top rise longer keep aerosol sunscreen seen flawed figure reported news somewhere based adjusted figure true  1750  baseline originally used mark beginning industrial revolution baseline shifted rather significant point omission behalf ipcc report also ignore nonlinear methane emission estimate warming loss sea ice neglect factor significance aerosol masking model  2 c temperature exponentially increase likelihood ice free summer head polar ocean physic group cambridge say ipcc grossly underestimate blue ocean event methane feedback problem methane ch 4  naturally occurring greenhouse gas organic matter decay ch 4  byproduct capture heat period trap  84  time heat per mass unit co 2  noted normally time process decay something come along eats natural cycle none created amount could enter atmosphere net impact problem lie permafrost ocean floor beneath arctic sea ice million lifeforms killed snap die frozen time cold place never available exposed eaten problematic area insulate remain frozen annually emission occur slow rate organism could feed gas escape instead area warming fast massive amount gas venting atmosphere positive feedback loop arctic warms microbe sediment beneath ice terrestrial permafrost become excited knocking ch 4  free arctic warms repeat alarming issue le ice permafrost open door immense amount methane released atmosphere roughly  4  gigatonnes gt methane eastern siberian arctic shelf alone gt referee journal literature noted year ago  50  burst gt predicted amount hydrate storage highly possible abrupt release time would cause increase modern atmospheric methane burden consequent catastrophic greenhouse warming limit adaptation mechanism bring warming source may hard conceptualize would mean web life quite literally interwoven specie dependent another survive life adapt far point specie longer adapt temperature greatest hurdle noted paper annihilate planetary life extreme environmental change giovanni strona corey j bradshaw despite remarkable resistance environmental change slowing decline specie still could survive fact transition state complete tardigrade persistence complete extinction scenario abrupt happened far tolerance limit close global diversity collapse around  5  heating cooling fig  1  suggests environmental change could promote simultaneous collapse trophic guild reach critical threshold environmental change critical environmental condition breached even resilient organism still susceptible rapid extinction depend part presence interaction among many specie specie resilient lesser specie relies upon unrealistic expect life earth able keep seen paper result striking matching projected change  2100  would require rate niche evolution time faster rate typically observed among specie variable clade despite many caveat result suggest adaptation projected change next  100  year would require rate largely unprecedented based observed rate among vertebrate specie going forward culminates clear disconnect understood literature described timeline various source feedback established decade ignored ipcc among others timeline model also growing social issue science dismissed alarmist aspect climate change others explained people discussed tremendous motivation shut effort scientist relaying information doomsdayer talk projection one bias harmful tribalist u mentality delay progress discourages transmission concept foundation understanding must established inspire urgency ultimately together emotionally easy prime directive need spreading awareness crowd sourcing research geoengineering method one assume continue path could possibly need act human global ecosystem alike suffer best tl dr could make original reduced  86  bot heatwave roasted europe last month event made  100  time likely climate change scientist calculated found extreme heat france netherlands temperature peaked  40 c made least  10  time possibly  100  time likely climate change uk set new record  25  july human impact climate made high temperature least two three time probable extended summary faq version tl drs far feedback  23 autotldr pm comment monitored constructive feedback welcome top keywords climate  1  record  2   3  heatwave  4  heat  5  nah really founder accuweather something insightful say record heatwaves 
cz9mqu,1567539206.0,people waiting bus hong kong told stop assembly rthk,jefferyto,629,8,cop losing shit lost authority act police force view entire public enemy hong kong police need see psychiatrist best tl dr could make original reduced  58  bot police searched passenger  039  belonging checked identification two hour bus unable use stop kwun tong road queue passenger resident swelled surrounding police chanting angry slogan quot another man said quot live near would like take bus visit friend got saw lot police quot  039  tell u happening ordered u find bus somewhere else clear instruction u take bus supply bus come extended summary faq version tl drs far feedback  23 autotldr pm comment monitored constructive feedback welcome top keywords  1  police  2  bus  3  bus  4  take  5  cop friend something similar happened toronto g 20  meeting lol happend washington metro lol got police beating way work freedom come freedom go wether protest china got 
