id,time,title,author,score,num_comments,text
fubf1k,1585931149.0,piracy german official say u swooped mask airport highly ffp 2  mask destined use berlin police confiscated bangkok diverted u,fruitspunch-samurai,224,14,would download mask op posting history heavily kong trump trying order  3 m stop sending mask canada latin america dipshit something stop parallel trading china january maybe would le shortage article reference claim u diverted shipment mask destined france canada claim apparently debunked may best take claim grain salt certain evidence edit clear saying specific claim debunked saying similar claim apparently debunked may best view one measure skepticism real sound like movie something holy fuck number ccp paid shill thread trying show discord virus change face world hope action like forgotten read several article none say confiscating happen president donald trump late start procuring urgently needed protective gear recent day invoked defense production act get u firm divert resource battle pandemic sent ppe china still calling virus hoax really unexpected clown like next bolsonaro guess lol baddie america also stole valuable medical supply italy early day pandemic assuming authority confiscate stuff landed air port case trump actually using military steal rest world soft way mean u generation war coup proxy war manufacture consent paved way worst possible human reaction world wide problem easily count hardest trial world population time amazon cut china endless war middle east elsewhere journalist environmental activist shot car bombed apathy million gear old evil prepared super power actually fucking rumbling arctic melt sea rising cusp extinction event see final death specie even honour discover yet loss system rely live going raise little girl siting watching vamperina fucking farmer would cry thought could without someone seeing asking wrong explain day angry left express well voted trump wanted america first unfortunate expense everyone else capitalism zero sum game 
fv5z7i,1586052424.0,rajasthan doctor refuse admit pregnant woman muslim child dy delivery,Plzbekindurimportant,190,13,removed first take part hippocratic oath islamophobia time high right india muslim congregation sparked new wave case list name address mobile phone number people attended tablighi jamaat event leaked police circulating social medium given current communal narrative spread make extremely vulnerable community backlash hate crime state health minister ruling political party bjp revealed name age locality nizamuddin returnees tested positive state official press conference asked jamaat attendee also come forward face treatment part india far administration made effort preserve patient anonymity guess bending rule special circumstance also started charging draconian national security act allows detention without charge trial year allegedly assaulting health worker even though could easily booked existing assault battery law allegation true ordinary muslim already deeply distrustful modi government even le forthcoming symptom health worker fundamentalism kill shame india led utter piece dog shit removed muslim see number comment extremist thread blaming religion specifically hinduism arguing solution simply get rid religion comment uninformed either unwilling unable engage critical thinking problem religion problem hinduism problem bad politics good hindu bad hindu good muslim bad muslim evil see story product doctor extremist politics hindu religion extremist blaming everything religion please use critical thinking part solution condemning bad politics extremism ilk contributing problem ignorantly blaming secular ethnic division religion clue getting bad even doctor starting turn away patient religion flaired appropriate sub rajasthan part world news religion need die asshole ever wondered extent mainstream medium go create narrative india one need look despite knowing muslim woman delivering  7 th child  7 th month pregnancy doctor bharatpur assessed condition referred jaipur indiatoday group chose turn blind eye attempt get sensational headline lady relative husband included accepted treated case forwarded yet see malicious impulse medium house spread fake news attempt malign indic civilization clearly headline read couple loses child due complication pregnancy way jaipur ambulance le eyecatching muslim woman denied treatment muslim shame please share get truth matter since debunked article either lie premature truth end faith 
fyfx4o,1586525646.0,coronavirus restriction empty street around world wildlife roam city,atlantacharlie,250,17,street neighborhood filled giraffe live seattle suburb bald eagle land backyard tree suburb last week hung hour wild animal becoming lot daring people indoors day amazing week confinement affecting environment much deleted retaking home turf one welcome new goat overlord shame animal relying human food whether tourist feeding dropped scrap destroy natural habit make reliant u survive city even think disappear legend little asshole get back wood dead yet preview apocalypse wild deer trincomalee teincomalee famous deer everywhere wild pig rajistan wild dog india monkey new delhi poor example animal always place must nice live people taking seriously essential business told close many non essential business remain open would piano repair shop considered essential people still packing park going jog getting really close people pas wearing mask riding bicycle picnic walk work healthcare see ton people like summer vacation counter medium reporting city saying great job social distancing staying home drive work hit traffic every day severe outbreak imminent unfortunately life find way russia past summer pack dog roaming southern moscow wonder like street empty wild life changed seen ferret weasel window prague cz day ago wild rabbit yeah ecological misconception always city 
gdg9j7,1588614319.0,amazon vp resigns call company chickenshit firing protesting worker,mrkevrd,893,18,finally higher ups speaking great bezos walking penis guy really became victim greed amazon hooli know jeff bezos gavin belson mask deleted good although envy process return company computer phone microchip installed deeply beneath skin damn badass good rich enough able conviction warehouse worker backbreaking labor risking health jeffrey b getting profit bezos find plyable moldable replacement value shareholder  1  go putting money mouth much respect man corporate america thing ethic good business break law like long consequence smaller profit made anyone ethic systematically removed speaking voluntarily otherwise system simply allow put people profit situation time machine profit profit alone vp pull prevent kind thing happening feel would helpful use position power something instead quitting anything hurt amazon great mew amazon completely responsible sucking fkng soul city live seattle made hell live financially bezos piece shit well commented last night post later removed posting tim definitely cut different cloth run mill aws l 10  vp aside fact lot street cred outside world de like burdened managing large team majority peer make wonder happen one dismayed also make wonder even one must enough money care ndas good working aws like completely separate division amazon know seeing also protesting canadian pipeline make even le credible sure amazon never going financially recover 
gmfvuk,1589855411.0,chinese embassy ridicule australia claiming vindication global coronavirus inquiry abc news,runneri,1047,37,chinese government spend day obsessively reading news make public statement talking shit complaining like every  60  minute piss ccp best tl dr could make original reduced  45  bot china  039  embassy canberra say joke australia claim vindicated international support coronavirus inquiry beijing  039  embassy canberra issued statement saying inquiry considered wha quot totally different quot one australia proposed saying claim vindication quot nothing joke quot quot know consultation process led resolution understand quot claim wha  039  resolution vindication australia  039  call nothing joke extended summary faq version tl drs far feedback  23 autotldr pm comment monitored constructive feedback welcome top keywords australia  1  wha  2  inquiry  3  claim  4  joke  5  china tantrum good thing must happening everyone sent ccp embassy packing yet lol anyone actually believe country soo sensitive censor winnie pooh transparent january fuckfest china stfu chinese embassy australia  5  rating facebook imagine ridiculed village idiot china need work diplomacy one billion people choose ca find small team competent people lady doth protest much ccp world need answer china massive fucking dick huh ccp petulant child reading foreign news day people northern wave two corona china showing world china surprisingly incompetent lately kick china big sparta moment prodded diplomatic usually unbearably condescending starting dislike chinese food type behavior guilty people lash china afford say co australia titan industry politician university back pocket example andrew forrest mark mcgowan peter someone pls stand bully laugh stop buying chinese made crap west stop buying cheap fake contaminated defective toxic chinese good evidence far meritocracy china fact run bunch incompetent petulant maniac eric cartman world community strike honestly rather poetic nation desperately sought control people thought control information ravaged reputation economy affected something ca blackmail forcibly remove execute gon na lot skepticism distrust among people china ridicule whoever want outset thought inquiry bullshit seeing china reacting sure anymore seems country nothing hide would inquiry clear air vindicate yes guilty used think send chinese ambassador home think balance way hasty appropriate diplomatic response point would arrange someone go chinese embassy punch chinese ambassador dick send home enter global exclusive story rupert murdoch australian daily telegraph last weekend headlined china batty science bombshell dossier lay case people republic paper claim leaked research dossier prepared unnamed western government chinese government culpability outbreak clear inference telegraph report document prepared five eye intelligence community linking u uk australian canadian new zealand intelligence service murdoch journalist story expressly stated five eye document article shy away stating explicitly document authorship newspaper go detail number investigatory action undertaken five eye nail chinese state responsibility u presidential politics three issue campaign trump handling virus dig u economic hole hardline china donald beijing biden republican seek tag democratic opponent little else table therefore using intelligence leak pushing chinese culpability laundered foreign country turbocharged credibility factor alleged five eye product help partisan political cause let clear murdoch campaigning trump murdoch medium china coronavirus conspiracy one aim get trump chinese locust summary generated china embassy canberra said joke australia claim vindicated international support coronavirus inquiry claim wha resolution vindication australia call nothing joke embassy said australia second country u call independent inquiry global pandemic sparked diplomatic row china bother dont buy cheap stuff pay higher price get stuff well inquiry longer china global major win china major loss government trying scapegoat china failure response australia wanted look wuhan china alone global inquiry look measure key player already know finding inquiry america failed royally find ironic australia trying hold china accountable seems working well everyone forgot australian government allowed cruise ship people covid like symptom dock sydney people proceeded whatever want supervision incident said lead  30  australia coronavirus death australian government pushed responsibility cruise company wiped hand clean right pushing responsibility mishandling crisis china scotty please shush 
gnk25o,1590010866.0,senate pass bill could delist chinese company stock exchange,paone22,113,9,suck feeling brought driving also way overdue company want listed nyse playing rule every company exception best tl dr could make original reduced  70  bot senate approved sweeping new legislation wednesday could ultimately bar many chinese company listing share exchange otherwise raising money american investor steve dickinson harris bricken wrote china law blog american company seeking raise money publicly must audited accredited firm audit monitored pcaob china refused allow company follow security law arguing chinese law bar auditor  039  work transferred country dickinson wrote quot stated directly unlike company europe everywhere else world chinese company list stock exchange exempt meaningful financial oversight quot lawyer said extended summary faq version tl drs far feedback  23 autotldr pm comment monitored constructive feedback welcome top keywords company  1  u  2  chinese  3  list  4  china  5  imo company listed nyse audited quarterly earnings semblance reality otherwise whats stopping people making shit senate focus helping american billionaire buddy happens existing share delisted short good need brought line made play rule company chinese company state owned mean get special privilege world stage especially nyse baba nooooo big deal plenty stock exchange choose sinophobia enough people acknowledging pandemic edit ca believe getting downvoted suggesting senate republican racist chinese lol 
gu5asd,1590953546.0,new coronavirus losing potency top italian doctor say,geoxol,212,14,got get back normal country said someone take responsibility terrorizing well guy certainly balanced nuanced perspective agenda got ta say really hope right wait science verify wait virus clinically longer exists italy best sound like shady attempt misrepresent listening sound like communist china level b suggest even thing virus alive spreading italy since middle january still waiting go back home eu border saying middle june reopen like poorly interpreted translation turned sensationalist headline poor reporting covid still deadly january reddit covid misinformation policy sort sht best tl dr could make original reduced  79  bot rome new coronavirus losing potency become much le lethal senior italian doctor said sunday quot reality virus clinically longer exists italy quot said alberto zangrillo head san raffaele hospital milan northern region lombardy borne brunt italy  039  coronavirus contagion second doctor northern italy told national ansa news agency also seeing coronavirus weaken extended summary faq version tl drs far feedback  23 autotldr pm comment monitored constructive feedback welcome top keywords new  1  italy  2  italian  3  virus  4  country  5  make sense would become le potent yet contagious selection pressure advantage virus make host sick advantage infect host replicate everyone susceptible already recovered sick dead yep make sense seasonal flu persists kill people dawkins wrote dna want reproduce virus dna best way stay alive find successful mean operating virus le lethal hence stopped distancing etc live many year weakened form host human get back normal life far understand also occurred spanish flu note historical interest spanish flu actually started u evolutionary successful disease one mildly inconvenience host highly contagious maximize history host transmission avoid killing coronavirus family virus common cold afterall  italy went forefront western civilization corrupt third world nation ever since charged geologist murder pedicting earthquake listen italy science advice funny nobody complaining protester ignoring social distancing guess people realized got bamboozled rona nothingburger 
gyozdb,1591578612.0,bts fandom army matched south korean boy group donation  1 m usd blm day aiming  2 mforblm,comealongwidme,178,4,kpop weaponized fight racism section history textbook going fascinating note army reached  1 m mark june  7   9 pm est edit army come different country south korea amazing done army great thing debut sadly doesnt get highlighted nearly donated  600  charity probably million donated various different charity since debuted check account oneinanarmy twitter done hope people move thinking kpop stans getting redemption arc many people always chosen see negative thing tiny minority done get lot shit kid posting fancams realistically many fandom much worse get free pas sport fan killing team losing rap fan encourage garbage behaviour many rapper star war fan exist threat actor fandom honestly fandom people time people put away label reserved solely kpop weird double standard spread everywhere stop demonizing million young woman spreading good message removed 
hd78f1,1592747396.0,unusually large saharan dust cloud moving across atlantic reach carribeans southern united state end week,mobile_website_25323,198,15,read saharan dust provided nutrient amazon rainforest good thing positive consequence slowing hurricane formation well ought wreak havoc sinus july looking june accomplishment hold beer weird another mega habu u people sensitive lung avoid outside currently bad antigua giant dust cloud apocalypse bingo dust bowl coming everyone stock gatorade truly idiocracy hahaha  2020  presumably contains lot angry ghost islamic world travelling u fuck mind boggles screwy weather phenomenon gotten lately think used call weather completely archived redefine word weather mean u almost like transition another epoch akin astrology enthusiast used say going except ai age aquarius nope mean aww shit wow scary 
hzlr94,1595966313.0,germany new virus case fell  500  day week topped  800 ,pascal_prv,382,12,opening economy mean case staying home mean le case simple difficult part find balance two maximize utility economy minimizing liability corona american living germany would say feel pretty lucky country  800  case day call crazy opened quickly basically everything open including school people seem impression health official plead please take seriously pretty sure go form lockdown week man rookie number got ta pump em wan na number one honestly hardly news  2  day increased amount infection already fallen back number also testing holland confirmed case test preformed percentage wise number confirmed case  1  every  1000  remember correctly new case mean nothing hospitalization death concerned reason reported low removed german government handled crisis poorly unfortunately people pay price given lethality virus lot people dead man walking better lockdown next  4   5  year germany changed allowed case also defining case context fucking republican de santis huh 
i8w2zc,1597306848.0,instagram facing  500  billion fine facial recognition lawsuit,Gromchy,222,7,best tl dr could make original reduced  63  bot lawsuit whalen facebook claim instagram tool us facial recognition identify people create quot face template quot stored database quot facebook capture instagram user  039  protected biometrics us bolster facial recognition ability across product including facebook application share information among various entity facebook without providing required notice disclosure required illinois law quot plaintiff wrote complaint statement business insider facebook spokesperson stephanie otway said instagram use facial recognition way facebook app extended summary faq version tl drs far feedback  23 autotldr pm comment monitored constructive feedback welcome top keywords facebook  1  instagram  2  lawsuit  3  recognition  4  without  5  glad live country data privacy still defended somehow even far perfect using facial recognition security seems pretty stupid lol facebook stock run high like day market cap creepy even though know willingly post picture still feel like posted picture sharing effort bolster facial recognition infrastructure effort fined amount money qui bono way every user receive anything lol american fine 
j1pavj,1601342025.0,gallup world grows le accepting migrant,Mighty_L_LORT,193,20,feel like failed government elite offloading failing onto country via outdated asylum treaty incentive fix underlying issue given said migrant inevitably send back remittance enrich corrupt elite institution surprising pandemic migrant solve news migrant starting fire people barely getting really good time ask local take unknown stranger removed mass migration cause culture forced meld many time one culture compatible another certain aspect hence turmoil mass migration always cause problem real question debate whether problem worth accepting given benefit happens government brings hundred thousand give free housing medical dental vision care mention thousand dollar allowance natural borne citizen living extreme poverty prime minister tell asking give big difference legal illegal migration best tl dr could make original reduced  93  bot washington european union debut new migration pact gallup find world growing le accepting migrant number eu country topping list country world overall world slightly le accepting migrant today three year ago according gallup  039  latest update migrant acceptance index nearly country accepting migrant  2019  also among accepting migrant extended summary faq version tl drs far feedback  23 autotldr pm comment monitored constructive feedback welcome top keywords migrant  1  country  2  score  3  world  4  acceptance  5  deleted deleted migration nothing compared incoming next hundred year carving habitable part planet nation geographic border drawn defense expedite extraction resource really best humane arrangement manage resent migrant make sure live somewhere inland temperate fertile diverse vast portfolio capital mouthing  50  year lucky problematic given inevitable displacement people due climate change would wager design world going get worse climate change yet stupid fucking president believe climate change real definitely interesting pandemic starting reveal grow crack society around world friend turning friend neighbor turning neighbor citizen attacking street corner neighboring nation throwing bomb middle pandemic mean sort distrust malice seen spanish flu bode well world considering happened flu give two decade significant track world le hospitable human habitation see like immigrant stop making world better get used since gon na seeing lot climate refugee elite get working people support policy interest answer divert real cause privatization economic deregulation disinvestment policy supported instead play anger immigrant islam billionaire behind far right ironic considering current future world given climate crisis happens folk migrant become migrant let see joy people face realize somehow get migrant job done problem year finland strawberry farm could find people wanted work shitty condition welp say 
jdu0l5,1603076815.0,china conduct test massive suicide drone swarm launched box truck,,195,24,carrier arrived well suck pretty sure seen episode yep definition every bomb suicide bomb destroys fancier missile bet u one emp pulse history slaughterbots anyone remember video wait til see come z box z truck fuck cod advanced warfare people thinking china plan defeat u conventionally delusional change meaning guerrilla warfare plug podcast series popular front episode drone warfare last week associated genuinely interesting podcast series covering current event regarding war spotify link pair china insane facial recognition system targeted attack china everything u try however work  50  time best similar weapon extremely effective combat last week assume israeli drone advanced prc drone used mass swarm tactic azerbaijan know suicide drone loitering munition think flying smart mine deploy area fly around scanning target conducting recon like unarmed drone target available attack fly back recovery reuse cheap hard detect probably still cost effective even shot modern aa weapon oh look ripoff raytheon model iran able intercept u predator drone cheap chinese knockoff got ta admit little disappointed video reason looking picture reading word swarm thinking mythbusters hwacha launching signing lesson version large orb robotic arm efficient reminds documentary saw u going use bat device attached japan never used nuclear weapon made used instead reminds documentary saw concerning wing commander dick dastardly notorious vulture squadron tasked stopping pigeon recall innovative aero engineer called devised solution involved flying two aircraft parallel giant net first lieutenant get medal many many deadly drone viral video firework drone far threatening sound abnormally similar swarm drone attacked u base afghanistan last year 
