id,time,title,author,score,num_comments,text
hxt856,1595707480.0,poland leave treaty violence woman,Murasame-dono,521,26,sad move country seems constantly moving backward current leadership zbigniew ziobro said document known istanbul convention harmful required school teach child gender need teach child exist ashamed people zbigniew ziobro said document known istanbul convention harmful required school teach child gender learn gender forbearers forbearers learned gender watching farm animal funny uncle  2020  remembered year fool stay classy millionth time handmaid tale meant fucking guidebook fascist fuck polish woman fucking know say decision surprise even hatred stupidity fucking lack concern anybody side andrzej duda stated president polish people fucking forgets polish people fuck wrong world eu please stand back cut poland toss baltic going poland day way go trying prevent young people running western europe support move nonetheless title misleading even manipulative x 200 b convention rejected violence woman point also contains obligation regarding gender construct non biological reason convention rejected mean local law ca protect woman without convention x 200 b might disagree might disgusted misleading lying closing door disucssion part bigger problem leave eu deleted x 200 b provision convention source dissenting state politician objection shoot messenger gender defined socially constructed role behaviour activity attribute given society considers appropriate woman men crimilisation large range behaviour including psychological abuse stalking sexual behaviour requires state include teaching material gender role formal curriculum empower girl boy pursue role consideration gender based violence refugee application definition specific legal category called violence woman creation oversight committee suspected potentially becoming overly rigorous oversight gosh would happen let woman legal protection ca look like rammed german russian left indelible mental handicap polish must right wing view tie church child diddlers catholic church mini russia got putin move going poland sad really sharp slope seems going time boot folk eu actually explains would perceive weird polish  50  shade grey rip immenesely popular netflix acceptable normal movie defending decision also many country signed treaty without actual ratification eg armenia bulgaria czech republic hungary latvia lithuania slovak republic united kingdom unbridled smugness everyone displaying sucking liberal view better demonstration needed happen could ever ask definition gender entirely socially constructed slight critical alteration tapestry document  100  ideologically motivated jew want circumcise child say part culture judge country right leaning belief biological determination gender suddenly opinion opinion anymore common sense ca get ignorant suggesting ramblings older generation need die rising liberal utopia maybe right wrong suggest entire country absolutely idea uncompleted bachelor creative writing beyond blind always assume person talking know something thank john paul ii led full backwardness full francoism poland glad see poland abandoning socialism 
i1ohpz,1596268075.0,philippine police arrested people breaching lockdown duterte wage war like war drug,GOR098,357,9,packing jail cell tight people taking covid precaution seriously could possibly go wrong arresting shooting softer touch drug war mind someone push hard anti mask karen might get nasty shock country deleted best tl dr could make original reduced  82  bot man seen wearing mask name president duterte election campaign slogan april  5   2020  quezon city metro manila philippine philippine president rodrigo duterte using tactic controversial quot war drug quot including mass arrest threatening civilian violence take coronavirus pandemic far arrest made march  17  july  25  philippine police made arrest recorded curfew lockdown violation according washington post extended summary faq version tl drs far feedback  23 autotldr pm comment monitored constructive feedback welcome top keywords philippine  1  police  2  duterte  3  arrest  4  pandemic  5  broken record new daily case  3  day straight government eased lockdown restriction despite fucking insane culling people economy given game plan wait vaccine letting people die left right fucking nightmare like war drug uhhhhhh sure article writer realize implication said statement police killing people corona crime like drug criminal sprinkling corona people philippine give fuck hundred year people actually followed law philippine full corrupt people one president changed corruption get wrong people may still changed country changing better good job keeping people check philippine needed man discipline people voted people like way rule stupid put also importantly want change bad way accustomed even though know denial true nothing else got ta admire consistency people left country 
i3o9hs,1596564103.0,canada continues make major cut environmental monitoring oilsands despite plan new project,,405,10,considering government spent hundred billion dollar investing oil sand pretty fucking huge waste money heavily subsidize oil industry fuck capitalism arent profitable die paying support something supposed generate profit canada provincial ucp government alberta gave billion dollar moving cost oil gas company first got elected doubled given billion dollar prevent diversification oil well cleanup doubling giving even oil gas business ucp also prevented diversification cancelling sr ed innovation credit fund innovation oil gas think focus since everyone pulling dinosaur go canada article stupid yes plan new project thing still shutting higher rate opened news bank account continues decline time despite still getting paycheck petro dolla dolla bill fuck liberal party better refuse deleted make sense considering many oilsands project hold winding oil sand profitable never become profitable oil losing business canada lost money bag industry since usa energy independent time canada diversify economy instead depending cash cow oil sale also depending much immigration canada literally easiest country world immigrate mean canadian falling living standard since country depression wage rise added pressure much immigration 
ibypas,1597747615.0,puppy whose perfectly preserved body found russia munched woolly rhino last meal,,174,4,phillip fry would like word ice age doggos must great partner man little wolf told stay watching waiting vacant prey proud leave slipped away unburdened forever free play deleted 
ijmim7,1598828144.0,french magazine prompted outrage saturday portrayed black female lawmaker slave chain earning condemnation nationwide well french president emmanuel macron,DoremusJessup,6643,51,writing fictional story involving lawmaker thing france alone seems weird enough shit even fn denounced go far even popular far right party france give shit well case conservative mean extreme right racist ok say truth french stance racism different racial dynamic north america france strict hate speech law fair game play within boundary racist shit stiff exist met stiffly people know racist shit public outrage french universalists splitting people race illegal even allowed use race statistic since one human race racist attack taken attack unity republic whole instead racialized event hope help make sense love titled ultra conservative ultra orthodox macron seen political centrist raised eyebrow last year gave interview valeurs actuelles praised good magazine heh make anyone think would good idea dear french magazine please stop appropriating culture thanks concerned american best tl dr could make original reduced  78  bot french president emmanuel macron led nationwide outrage saturday magazine portrayed black lawmaker slave french presidency said macron called danielle obono party france unbowed quot expressed clear condemnation form racism quot france witnessed several protest june july racial injustice well colonial police brutality inspired black life matter movement george floyd  039  death knee police united state extended summary faq version tl drs far feedback  23 autotldr pm comment monitored constructive feedback welcome top keywords obono  1  france  2  magazine  3  black  4  hate  5  cmm damn person read original article also likely read explanation valeurs actuelles one roommate college huge francophile loved everything french watched french movie listened french music drank absinthe exclusively read biography famous french figure artist immigrated france found app used host french tourist catching recently surprised find moved greece france like always said going asked basically said france like people south carolina could garden apparently spent month found magnification trait american could stand fuck wrong conservative cunt seriously red head back look like took biggest bong rip life remember conservatism used financial dealing country haha kidding always racist institution charlie hebdo portrayed muslim young woman university student union leader big lipped monkey dared wear hijab france racist asshats right across medium political spectrum proof conservative hate filled batch removed capitalize black title tbh look ridiculous going church sunday best respect court dressing appropriately well bit late macron condemn magazine especially praising giving large interview journalist month ago another macronesquerie saying one thing publicly complete opposite shadow desperate french girlfriend suggest try vichy removed conservative time time come anyone actually read piece question could well racist trash important read source material rather opinion others making definitive passionate response deleted portrayed really hmmm freedom speech french charlie hebdo even controversial sure comforted fact place world also fighting far right extremist view kinda hoping american thing think word looking fascist grey hair look  30  guess right time heretofore shy franco trumpistas forcibly ripped mask despicable thing print heartening read people denounced article though stay classy france deleted trump one french woman dangerous racist communist wanting destroy nation spreading white privilege bullshit totally racist praise muslim terrorist people wanting kill white hang baby deserved piece work honestly got deserved reaped sowed us racist rhetoric white people time love political islam leftist one racist making everything skin color marine gon na win  2022  anyway ignore tiny minority soceity seems stuff get attention make seem much larger thing huge double standard france moment lawmaker raise voice french singer called white genocide killing baby rape woman called culture yeah understand article outraged people truth said people even read saw picture african slavery black slave black master  18 th century part history today society refuse admit white supremacist blabla history far bigger actual slavery today white master course serve medium politics agenda  2020  liberty expression hypocritical one end limit nationwide outrage drawing imagine people defend magazine insult china removed idk okay make fun muslim jew supposed draw line either allow stupid shit frobid everyone ultraconservative way neonazi headquarters stormfront valeurs actuelles defacto magazine local fn nazi party maybe medias stop trying normalize nazism ultraconservatism much overlap conservative gestapo officer wannabe slaver extreme right nutcase totally deserve blowback got deleted hilarious anyone presume imagery appropriate read real  2020  polite expression mofo outrage bullshit humanity blow live replace woman president see france macron lmao france even slavery 
ipcwze,1599644779.0,lawyer denied access  12  hong kong people detained mainland china,Acrzyguy,479,6,exactly hong kong people never trust legal system china lawyer china show anyone really believe thing rule law independent judiciary china deluding china ccp government absolute never fails image convey population thus judiciary also never fail security force arrest never fail practice absurd instance mean brought justice guild something arrested always right justice system exist expose humiliate force sign guilt confession chinanhas legal system copy bunch legal system world say law come enforcing law used ccp purpose rather society wellbeing citizen china accept unjust legal system long without anything basically rule law endless torture happened load mainland chinese hongkong counterpart china imitating america bad habit america allow lawyer access prisoner guantanamo 
j262zs,1601406898.0,u china australia brazil refuse sign pledge reverse damage natural world,altbekannt,179,14,fucking get harm planet ever done imbecile charge country anyone take even quick look world want use every method protect lot people already raising environmental awareness lot people aware please people wiser tell really solution fuck australian government regard australian nobody even skimmed article  64  around  190  plus nation already pledged china declined yet already pledged carbon neutral  2060  already planted insane amount tree combat desertification australia flat said nope paris agreement u speaking seems  4  asshole world stage set environmental war side far shithole axis country usa china australia brazil noble conservationist ally everyone else ah usual suspect user often report submission site ask u ban sensationalized article oppose blanket banning news source reader responsibility skeptical check source comment flaw help improve thread linking medium verifies question article claim link could help reader better understand issue find evidence article title false misleading contact moderator review bot action performed automatically please contact moderator subreddit question concern usual suspect surprise current state affair brazil pretty much expected bolsonaro government dismantling environmental protection spreading fake news amazon well honest easy sign pledge country isnt abundant natural resource country wont halt development free actually global cooperation save planet financially subsidising country reduce usage resource mean brazil literally biggest forrest world want stop cutting wood reduce agriculture space well ok first slow demand substance secondly support process saying would actually work nutjobs governing world  61  brazilian land still natural forest grassland swamp world expect u turn city back atlantic forest one cleanest big economy world  82  energy come renewables capitalism collapse soon going destroy world anything done liberty justice believe good reverse damage already done save planet point better invest resource right advance techonology find new planet escape one day 
jkoaj0,1604024238.0,record traffic paris second french lockdown begin,Diapertorium,389,6,going spread case france like happened india back first lockdown migrant worker major city essentially walk way back rural village spreading virus far wide remember opposite technique chinese used january locked wuhan soon entire hubei province preventing people leaving place point lockdown let everyone leave right happens gon na try wack mole fresh outbreak going pop france couple week best tl dr could make original reduced  77  bot epa traffic around paris hit record level hour new national lockdown came force across france quot  039  asking people stay home parisian stay paris well understand people paris invade infected without knowing obviously risk spreading rapidly quot wrote one commentator local sud ouest newspaper first covid wave certain region france paris particular badly hit lockdown imposed area comparatively case extended summary faq version tl drs far feedback  23 autotldr pm comment monitored constructive feedback welcome top keywords paris  1  lockdown  2  people  3  france  4  first  5  deleted awful time civilized french people  1  death due lockdown  2  grotesque murder due religious indoctrination  3  cusp war muslim inside outside country pic paris mumbai like zombie movie hahaha people running away spreading 
jo8bwa,1604535390.0,google admits censoring world socialist web site,TheSuspiciousKoala,4708,55,deleted orwell reckon big brother outsourced corporation google need fuck corporate censorship better state censorship best tl dr could make original reduced  89  bot data showed quot world socialist web site heavily affected traffic google search fallen two third january  20   2020  wsw published article titled quot google suppressing world socialist web site content search result new york time  039   1619  quot article independent data authoritative widely read material published wsw historical falsification called quot  1619  project quot suppressed google search result david north asked quot world socialist web site never informed claim suppression discussed within management investigation conducted complaint quot neither pichai anyone else management google ever responded question open letter extended summary faq version tl drs far feedback  23 autotldr pm comment monitored constructive feedback welcome top keywords google  1  wsw  2  socialist  3  pichai  4  world  5  since people seem want read article apply skepticism news censorship wsw published wsw go google admit censoring wsw least colloquial sense word use hearing u senate admitted compliance issue wsw regard moderation policy claim apply equally response senator lee asking example left wing organisation censored caveat censor used mean fact check block label demonetize colloquially censoring something implies blocking form speech attempt prevent expression speech fact checking form censoring since stop speech expressed point innacuracies labeling ca censoring either since stop speech happening demonetization argued since impact ability speaker express message blocking looking however library say ca speak anything censoring speech rule place order proper censorship targeted specific kind speech case legitimately applying policy equally censorship wsw breaking term service context hearing prove google censor site people apparently believe word spoken fact apply policy anyone break term service tl dr censorship people pissed ca break term service name free speech surprised see reddit liberal base lauding google heroic action socialist subversion people advocate tech company censor hate speech realize everyone saying slippery slope right people still realizing company give f hate speech using justification get foot door set precedent widespread company influence thought kid growing smartphones time  2  parent teacher determine people think anyone else meeting came funny bunch republican senator saying claim block misinformation block right wing left wing site article really biased opinion piece banned rule  4  subredit skip hide important point pichai compliance issue world socialist review compliance issue google take search engine algorithm seriously keep working secret actively work prevent anyone figuring game system seriously fact  5  occasion google accidentally punished compliance issue fact somebody found one left leaning website entirely unremarkable would expect shiteload website done across political ideology google banned china censoring sensitive content google shall never yield tyranny censorship murica google google censorship continues deal use duckduckgo nothing new part u surveillance machine year guess u gov going put google entity list national security reason violation american value fuck google use removed bigger news cringe highest level american political institution buying censor right narrative til jeff goldblum socialist even socialist think  1619  project bunk google long since useless search engine intention good riddance google long l ive duckduckgo okay tangible evidence actual impact bullet driving propaganda go option ecosia search engine plant tree every search thanks google would never checked without free pr campaign group propaganda tool google slowly loosing respect socialist fucked thug revel day come make social medium google public utility strip asset drop executive freshly dug hole google censor much moved bing hey private company whatever want service remember government censor private orgs editorial control content wait think get republican upset business running business go use different business capitalism free market want regulate business something fact google search world socialist review actually yield wsw top two result totally available honestly stopped using google privately funded closed sourced search engine lead result favor company suit fancy use chrome jailbroke phone get rid chrome google crap app need generally search apk dl use duckduckgo search stuff wish people would take effort use resource rely something personal interest time question beacause news like iwould like avoid google future android smartphone need account germany way use smartphone without account takeaway article republican senator think fact checking form censorship censorship bad deep irony enthusiastic socialist censor people encourage tech censorship used censoring plenty individual expressing factual based genuine moderate opinion misinfo libel harassment conspiracy fit within category main entity censored vast majority online platform including platform owned tech giant reddit seems wake one outlier source censored result tolerating censorship dissident internet society rarely agree trump imagine reason different seem like big social medium platform really hide behind law protect held accountable posted abundantly clear curate people see bring back google evil x 200 b done evil major take hearing question asked propaganda given equal air time google facebook twitter senate also dorsey zuckerberg refused give would provide list later lee got pichai google executive responded moderation policy apply equally compliance issue world socialist review sic although pichai used name world socialist review print newsletter ceased publication  2011  clear referring world socialist web site fact google search world socialist review actually yield wsw top two result say something else trying make seem like fact cite fact disproves claim able search google showed result dumb believe article guess headline make good circlejerk google though linking site censorship site still fully available article sensationalist critical support trot google bullshit piece shit company know bound reported world socialist website good place assange style propaganda meant help far right deleted well duh weird sex web site course good wsw run sep rape cult hole lee fuck libertarian fucking delusional think private sphere tyranny better corporate one exactly get reddit people complaining facebook censoring stuff like month ago almost government entity work people regulate corporation act public good looking google amazon exxonmobil monsanto etc fucking gop regulation trump drain swamp as removed much regulation possible use bing say google amazon looking forward upcoming antitrust investigation dave rubin unavailable comment least right leaning site like right wing pundit keep pushing 
kf0t3u,1608223099.0,estonian erect statue give home beloved stray dog,phoenixonstandby,155,5,best tl dr could make original reduced  84  bot society divide ethnic estonian ethnic russian acutely felt zorik managed bridge divide winning old woman fed well estonian hipster including group opening cafe named quot zorik quot zorik dog able disappear dog everyone kalamaja knew touched everyone young old estonian russian quot valner said viktoria ger given zorik new home enclosure doghouse behind family home describes quot peculiar dog extended summary faq version tl drs far feedback  23 autotldr pm comment monitored constructive feedback welcome top keywords zorik  1  dog  2  people  3  valner  4  estonian  5  nice read thanks sharing awesome fry dog ended cute 
