id,time,title,author,score,num_comments,text
c7rplx,1561982513.0,uk home office official provoked outrage stating trafficked woman nigeria return country wealthy prostitution held high regard,ManiaforBeatles,111,9,fuck governing around world lack empathy basic intelligence scary best tl dr could make original reduced  74  bot home office official provoked outrage stating trafficked woman nigeria return country quot wealthy prostitution quot quot held high regard quot quot dr charlotte proudman human right barrister represents woman girl case violence particularly female genital mutilation said quot home office  039  deplorable policy trafficking woman nigeria show hostility woman victim face claiming asylum uk suggesting trafficked woman wealthy enjoy high socioeconomic status fundamentally wrong home office assessment state woman trafficked sexual exploitation return nigeria unlikely risk reprisal original trafficker acknowledges may risk abuse depending particular vulnerability extended summary faq version tl drs far feedback  23 autotldr pm comment monitored constructive feedback welcome top keywords trafficked  1  home  2  woman  3  office  4  nigeria  5  man home office really killing pr game recently oh well thats ok job opportunity kid home office people unbelievable think social financial status relevant human right abuse think could lot abuse addressed victimized appearance kind statement make expelling refugee boris charge guardian research journalism home office think people rich much money eu australia say thing earning le year poor returnees interviewed nigeria even anecdotal story would useful conflicting claim come lawyer taking legal aid money tax payer represent woman probably paid per hour prostitute case could take hundred chargeable hour resolve 
cbfjlg,1562758182.0,david attenborough say sorry australia climate change denier power hope electorate respond,,111,9,australian pm religious extremest brought lump coal parliament prop belief prosperity gospel lost cause scumo charge next  3  ish year urge rest earthling move try catch denier paid handsomely deliver line conviction sorry trying  2018  little promising vote russian patsy might get back respectable behalf australia really fucking sorry bunch cunt u sorry really brazil craziest mother fucker president guy believe science welp uk get one assume hope top corrupt country planet geared hold money donor quickest quid pro quo even press  10  family press part paid fucking donor system people get actual truth spun suit donor forget beautiful thing weather bill board flashing neon light spanking red state america like blue state dawn someone day bu time come dark time best tl dr could make original reduced  78  bot renowned british broadcaster naturalist david attenborough said concerning climate change denier position power country like united state australia quot sorry people power internationally notably course united state also extraordinary australia already facing deal extreme manifestation climate change quot said despite attenborough say criticism climate change science quot stamped quot despite almost unanimous consensus among researcher human activity driving global warming extended summary faq version tl drs far feedback  23 autotldr pm comment monitored constructive feedback welcome top keywords change  1  attenborough  2  climate  3   4  deal  5  
cefkxv,1563382814.0,tory leadership british voter nearly  20  time likely describe boris johnson buffoon statesman,casualphilosopher1,103,8,user often report submission site ask u ban sensationalized article oppose blanket banning news source reader responsibility skeptical check source comment flaw help improve thread linking medium verifies question article claim link could help reader better understand issue find evidence article title false misleading contact moderator review bot action performed automatically please contact moderator subreddit question concern even real buffoon image fake fucking chancer make higher ambition loot country pal well guarantee selected next pm always fail upwards well year baffoon yet poised elect consider keeping moron around another term something stink thereby cementing position pm american also  20  time likely describe donald trump moron presidential user often report submission site ask u ban sensationalized article oppose blanket banning news source reader responsibility skeptical check source comment flaw help improve thread linking medium verifies question article claim link could help reader better understand issue find evidence article title false misleading contact moderator review bot action performed automatically please contact moderator subreddit question concern 
cs4fbs,1566150399.0,gibraltar reject u pressure say iranian oil tanker free go,tristan_isolde,103,6,removed gibraltar proving backbone funny boris wow best tl dr could make original reduced  81  bot government gibraltar sunday rejected request continue holding iranian supertanker detained month ago suspicion attempting breach global sanction syria friday justice department issued warrant seize tanker forfeiture claiming iranian illegally used banking system finance shipment oil syria issue warrant seize iran oil tanker  039  grace  1   039  gibraltar judge order release extended summary faq version tl drs far feedback  23 autotldr pm comment monitored constructive feedback welcome top keywords u  1  gibraltar  2  tanker  3  sanction  4  iran  5  angry walrus noise john good gibraltar standing tactic uncle sam gibraltar uk mean 
cv1474,1566691167.0,denver based supertanker arrives brazil put fire,hgfggt,625,16,know bolivia brazil right fucking confused farmer deleted colorado spring mother fucker finally good news shit storm day bolivia brazil bolsonnaro really gon na like bolivia president believe ordered tanker socialist thing refill tell fly scoop water like smaller plane late another thread someone said tanker wo much hired upcoming election  2  month president burning amazon brazil even brazil shamed action smaller surrounding country already ordered action brazilian nothing spread across country boundary got ta say denverpost web site one best ever seen live vancouver canada alot content irrelevant still going subscribe cheap really enjoyed content first good thing coming u long time sailed supertanker denver exactly plane shoot humanity clearly proven deserve saved hurray usa usa usa gon na save soul yeah murica rah rah rah 
cwcfmp,1566948416.0,russia came winner year g 7  summit despite kicked trump looked like puppet,viva_la_vinyl,263,13,looked like  40  trump foreign policy team turned spy far trump putin puppet trump puppet imagine day read trump trump great day ca wait trump putin puppet sooner kumquat kolored kriminal take dirt nap better entire world putin pimp game serious trump putin puppet republican politician voter love embraced traitor burn u ground rather admit fucked country intervened drunktard yeltsin  1996  russian election well  100  sovereign karma today eye eye tooth tooth well lying say others find russian ukrainian english speaking civilian criminalizing putin really know people still buy trump russia b completely debunked discredited mueller report usa russia new arm race friend russia insofar putin absence proved pointlessness whole meeting unable reconcile difference member point ejecting point un exists un ca randomly drop member meeting even like russia russia powerful country requires seat sort major international meeting able influence world sometimes influence horrible see crimea time necessary prevent even horrible thing right major conflict afghanistan pakistan hong kong russia influence way benefit west shunned u close ending involvement afghanistan involvement began  50  year ago counter russia leave power vacuum created necessitate russian action total mission failure refusal accept failure ensure region spiral control even faster instead talking russia tried boycott like olympics stop invading country russia operates 
d5gsu3,1568726027.0,explosion russian lab known housing smallpox virus,josefmyth,178,17,accident good week reread stand hbo spin scary shit russia going cover man first nuclear missile biological warfare stuff bad time russia unless mi 6  agent running around russia ca keep shit together sooo go get smallpox vaccine deleted russian shitting eat must tuesday fire broke gas cylinder exploded fifth floor laboratory building city koltsovo blast caused window smash structural damage building ta reported god damn russia stopping blowing god damn facility house globe changing radiation potential pandemic one fucking second think still vaccinate smallpox rural area exploding virus factory vaccinated area still better large population misinformed housespouses deciding risk kid neighbor kid life vaccinating new twist roentigen least month radioactive okay take away adult thing russia please handle remindme  28  day later russia failing first part scientific question 
de0m55,1570351012.0,brexit majority briton believe boris johnson secure eu deal  31  october pm approval rating fall growing surge dissatisfaction pm leadership according new research,ManiaforBeatles,102,10,boris isnt trying secure deal anyone realizing hello welcome back sanity know happened lot clean going take give u hand elected neither predecessor people think irrelevant uk politics personality pizzazz surely enough get deal leadership leadership english trump reprehensible hit toupee however core support leadership hovered around mark  35  per cent month  39  per cent september  35  per cent august surge dissatisfaction another click bait title independent user often report submission site ask u ban sensationalized article oppose blanket banning news source reader responsibility skeptical check source comment flaw help improve thread linking medium verifies question article claim link could help reader better understand issue find evidence article title false misleading contact moderator review bot action performed automatically please contact moderator subreddit question concern 
didxpa,1571171481.0,hong kong youth fight free democratic future despite mass arrest child activist vow,maxwellhill,179,2,fuck west taiwan best tl dr could make original reduced  85  bot samuel chu managing director hong kong democracy council told newsweek child young  12  arrested hong kong  039  police force accused widespread brutality activist ho described strategy arresting child quot quot explained hong kong community would quot stand quot faced oppression quot lam government done precisely free democratic future hong kong needed mass relentless popular education campaign mean free cost securing maintaining freedom quot told newsweek extended summary faq version tl drs far feedback  23 autotldr pm comment monitored constructive feedback welcome top keywords hong  1  kong  2  arrest  3  protest  4  young  5  
djddsv,1571349205.0,mulvaney acknowledges ukraine aid withheld boost political probe news everybody get going political influence foreign policy acting white house chief staff told reporter,EssoEssex,288,21,let eat cake moment waiting egregious moment time start arresting people sure mick get guy overthinking course ok people commit crime long open admit repeatedly public straight face acting exasperated anyone hassling trump hey mick need check something bus foreign policy somehow equal trying pressure foreign government fabricating dirt domestic political opponent purely personal power office open mouth insert foot trumpers qui gon jinni qui gon jinni check mate libs best tl dr could make original reduced  81  bot pressed briefing whether describing quid pro quo ukraine mulvaney responded quot time foreign policy quot cited holding back financial assistance northern triangle country affect immigration policy although mulvaney insisted quot money held absolutely nothing biden quot trump raised allegation call zelensky final condition mulvaney listed appears refer attorney general william barr  039  investigation foreign interference  2016  election detractor criticized white bid discredit work former special counsel robert mueller extended summary faq version tl drs far feedback  23 autotldr pm comment monitored constructive feedback welcome top keywords mulvaney  1  policy  2  foreign  3  trump  4  ukraine  5  love hear reaction supreme count justice use argument front aand walk back powerful whatever fuck want want get deleted wtf say wan na try ever threatened arrest oh come officer get bold move cotton let see pay dug history find message really life choice lying fuck stealing everything fucking poor mean extortion politics everyone involved everyone support irredeemably evil sure yes go fake news read complete fully accounted transcript man office releaed guy fucking illumanati libzard removed 
dl42m7,1571679826.0,fast food chain close first uk branch boycott call lgbt campaigner demanding cluck outlet opened shopping mall reading christian owner donated organisation opposed relationship marriage equality,Molire,282,22,furthermore brit could give flying cluck new fancy chicken shop considering hundred centre none gon na beat nando ever heard lease commercial property especially restaurant think great far fast food go honestly like food moral eat somewhere else sound like protest boycott sure mall waited lease find profitable probably want business disrupted protest also donated organization promoting death penalty homosexual africa something major brand kind comment section holy shit lol also calling really truly closed due large saturation chicken joint area lgbt boogiemen support government want kill gay people gay consume food best tl dr could make original reduced  82  bot faced demand quot cluck quot fried chicken outlet opened shopping mall reading month chain also faced controversy u last year rider university new jersey declined offer outlet campus despite demand student company quot widely perceived opposition community quot last month lawsuit filed san antonio international airport refusal allow open outlet extended summary faq version tl drs far feedback  23 autotldr pm comment monitored constructive feedback welcome top keywords  1  chain  2  outlet  3  reading  4  family  5  fucking love society reject richwhite hatechristians deleted christian owner extremist since almost one north western europe give damn christianity company religious fanatic opened food even good missing taste bud shot war anyway pearl clutching whingers missing serf right liberal fascism action deleted love chic filet stand screw uk kind pathetic majority bend insignificant minority grow pair brit stop bending people deleted nice heterosexual agenda place uk damn liberal california slacking considering two new one passed opening soon even virginia getting shit cali allows interesting yeah still blow mind people eat shitty establishment removed 
dnferd,1572104221.0,australian water rat cut cane toad open precision feast heart say native rodent western australia discovered kill eat part poisonous pest,ManiaforBeatles,6643,124,possible native animal solution cane toad best news one could hope smart little rodent best tl dr could make original reduced  85  bot australian water rat learned kill cane toad eat heart carve organ quot surgical precision quot quot anecdotal report water rat killing cane toad across queensland northern territory many hundred million cane toad area could get swamped  039  major issue native predator quot parent quite long period care offspring baby rat stay mother learn parent would make good sense parent teaching child kill cane toad avoid poisonous area extended summary faq version tl drs far feedback  23 autotldr pm comment monitored constructive feedback welcome top keywords toad  1  rat  2   3  native  4  area  5  desperately need find way kill something take australia based aussie rat adapting imported pest glad natural predator could emerge deleted cane toad western australia hilarious tale people fucking wikipedia worth read basically added cane toad solve problem took kept adding invasive specie like killing toad caused problem similar cat wall story edit north eastern au fucking wild evidence bite head body partially consumed toad rather rat appeared hold toad back incise thoracic cavity consume organ toad still yikes austrian water rat like edit meant australian  keeping track invasive specie came australia survived spider snake shark everything else started spreading westward australia responded rat hold cut heart still alive message brought canadian tourism board oh australia even rat savage fuck  skaven start something similar india frog mainland got island chain basically fucking people even eat baby people grow poultry worry rat robot toad detecting ai fucking chance turn fuck planet rat next root specie environment recovers disaster future glorious pretty metal fair play rat let hope take liking human heart next pretty metal finally think crow flipping eating underside edit found article metal af nature find way life find way australia one step closer death world every day nature find way quick introduce rat queensland forsee future problem one welcome new rat overlord great rat gain special strength x 200 b fucked life find way kill great aussie got enough deal shark man eating reptile poisonous insect fucking mammal turning killing machine africa sound safer jesus australia fatality kind unfair call ex girlfriend water rat rat edible arby know maybe crow taught sound like opening scene episode pinky brain going tomorrow brain thing every night pinky try take world eat yer heart metal thing read today ivan milat rat life uh find way actual quote almost surgical precision interesting story kinda pissed lol fuck australia startling news koala australian figured surgically remove person skin wear often impersonating victim taking life creating havoc resident therefore asked watch loved one intake eucalyptus leaf excessive consumption report anomaly local authority removed must super rat news channel talking joker jeremy wade brought cane toad attention need video video thought australia elected rat government latest lot leader abysmal must genetically modified escaped lab rat highly evolved intelligence secret nihm splinter take inferior eastern state water rat west coast best coast nature metal rather icky good news long wind plague venomous amphibious rat huh realised got name cop show australia water rat nature uh find way goldblum nature find way eat fucking heart great news eats water rat australia like video would like watch crow worked flip year ago water rat must paid lot info evolution wild thing brutal life uh find way reckon one really smart rat lick body part tell poisonous could figured part edible damn nature scary magpie already started year ago best news day think next quote ian malcolm life ah find way casually snack heart forget eat heart courage rich tasty courage mmmmm yes professor another day australia somebody show peta toad thing metal fuck rat appeared hold toad back incise thoracic cavity consume organ toad still alive australia prof critter top tier call harbor police water rat thought cop eating frog second standard dont ever want operating room got ta start spreading one around learn quickly within generation water rat spread around country nature awesome hrm human one invasive damaging living creature earth never mind climate change drug resistant bacteria virus predicting attack titan lol seriously humanity fucked stupidity greed well uh thought post life uhh find way straya fuck yea wa get got real hunter killer snake surprised anything still alive fuck oh hell remind never go australia bruh yay used pest destroy pest bring qld absolutely fine get many rat bring snake australian water rat cut eat heart never prouder australian life find way one reason know world fine kill evolving life find way holy shit terrifyingly effective solution cane road problem typical australia yeah boi imagine lab rat escaped wild one dna generically make smart would frighting smart one teach pack soooo earlier week learned drive open heart surgery could go wrong mean sure australian rat  life uhhh find way surgical precision say say train rat become next top surgeon time teaching wild insane sort thing happened huge rat problem year poison working introduced owl back area back day owl construction chased since tree roost cut anyway year rat population dwindled control poison rat control think nature figure eventually toad even though poison control toad everywhere pretty low food chain poison question happens much damage corrected life uh find way aussie tv cop show called water rat thought cop cutting toad first lol learned taught maybe happening cattle mutilation killer whale australia great white shark killing taking liver evolution baby huge problem cane toad qld huge water rat terrifying dude metal wtf australia deadly spider snake blue ring octopus salt water crocs huge great white shark fucking drop bear rat steal eat heart fuck place story cane toad one shocking incompetence everyone every level long period time see competence actually shocking human displaying said competence maybe trick know mass murder caused water rat would high rate death cane toad continued contribute increasing average toxicity cane toad natural selection selection kind occurs could toxin begin appear higher proportion part cane toad body impossible due anatomical purpose report cane toad killing water rat intelligent enough form gang survive yet another reason avoid australia cost shit like cane toad stringent law come declaring pet remember depp decided try sneak dog made sarcastic apology yes ridiculous got instead lawful punishment sarcasm fucking ignorant shit u want keep way imagine aussie animal fucking rabies frog thats odd name would called chazz wazza 
eibsap,1577840619.0,trump try avoid benghazi defense secretary mark esper announced sending additional force support personnel embassy baghdad force created wake benghazi,,226,13,best tl dr could make original reduced  82  bot series twitter post tuesday afternoon president donald trump alluded force also threatening iran dismissing comparison benghazi marine deployment accident former senior administration official told politico secretary state mike pompeo heavy critic obama administration  039  handling benghazi especially predecessor clinton concerned similar attack could bring trump administration version scandal lindsey graham made connection benghazi baghdad tweet meeting president donald trump tuesday extended summary faq version tl drs far feedback  23 autotldr pm comment monitored constructive feedback welcome top keywords benghazi  1  trump  2  force  3  command  4  president  5  see trump bad aspect tweet president send unit designed respond event incident closely mirror benghazi isi reforming soon join  2020  starting lit doubt republican congress persistent investigating benghazi sure soon learn fox really democrat fault somehow least sending people instead emailing sidney blumenthal waiting instruction people die still amazed happen iraq liberated supported u iraqi leadership still control least capital literally land marine fireteam anywhere world within  12  hour  80  imagine time frame significantly le president need congressional approval commit troop battle however specific regulation limit power drastically  70  applied marine applies branch armed service see war power act  50  code chapter power resolution happened bhenghazi system place since cold war prevent thing like worse happening trump nigeria year ago count medium hold standard actual benghazi event removed still ca believe left people die overnight benghazi guess point want another battle mogadishu black hawk wo stick trump marketing perspective word benghazi ring make want say iraq sound flat ring able get ben ghazi safely 
ej1qv3,1577988541.0,top google exec pushed company commit human right google pushed say,,329,8,removed paywall source consideration human right mean smaller profit getting rid original motto consequential come money bad business said pretty normal china fight voice say truth whether chinese citizen jesus citizen fast way reeducation camp simply disappearing hi sddgfdbdfbdbgfbfgb submission behind metered paywall metered paywall allows user view specific number article requiring paid subscription article posted accessible everyone submission removed flaired user discouraged upvoting commenting information see wiki page paywalls please try find another source news site reporting story contact moderator bot action performed automatically please contact moderator subreddit question concern seems google truly lost founding way company first started hopeful would different seems marketing lie 
