id,time,title,author,score,num_comments,text
gec2df,1588734260.0,new genetic analysis virus cause taken patient around world show virus circulating people since late last year must spread extremely quickly first infection,maxwellhill,1580,34,lend little credence idea many u felt like much late december january  2020  normal seasonal flu bad first week january  2020  fucking killed everyone say oh flu na around time either wuhan direct contact someone wuhan starting think plain true french discovering early case much likely december virus circulating people since late last year must spread extremely quickly first infection feel like nothing statement new info work close contact several people traveled china came back early december got brutally sick fairly soon got back seriously wonder bos like worst fucking bronchitis life december relentless bad lasted almost  3  week think never go hospital anyways assumed bronchitis get twice year actually talked enter people anecdotal story confirm bias already best tl dr could make original reduced  67  bot new genetic analysis virus cause taken patient around world show virus circulating people since late last year must spread extremely quickly first infection researcher britain looked mutation virus found evidence quick spread evidence virus becoming easily transmitted likely cause serious disease quot virus changing mean  039  getting worse quot genetics researcher francois balloux university college london genetics institute told colleague pulled viral sequence giant global database scientist around world using share data extended summary faq version tl drs far feedback  23 autotldr pm comment monitored constructive feedback welcome top keywords virus  1  genetic  2   3  balloux  4  published  5  british researcher named balloux simulation getting weird deleted father teacher often brings back bug work last november bought home something horrible much worse regular bug sister ill isolated much possible immunocompromised since intermittent cold last  10  minute day going go doctor january coronavirus started making news felt would best bother gp minor issue incase new thing became bigger thailand late november early december stopped abu dhabi visit dad day back london stay mum sister terrible dry cough flu mum ashma went inhaler lost sense smell notice dog rolled fox shit sister never get flu bedbound symptom dad went cough flu day left pretty sure thats traveller cough key worker hoping free anti body test soon find obvious story spreading april spreading leaving china attempt misinformation awful everlasting cough around last week december new year lasted like month super sick cough long time literally knew existed late october warning november december people blind fact early warning ignored outbreak result instead news corporation playing fact one listened medical professional  2  month failed properly inform public november indeed late last year worldwide january fast spread already known fact america reporting may really news terrible journalism tell u virus recent line estimate also could usa europe month january meaning even identified december need lot clarification actual timeline vague partially contradictory statement doubt mom got phenomenon march  2019  live seattle first case popping could hardly breathe super sick forever cough pretty sure corona known idaho business tie folk go china regularly flu december real bad real bad lasted brutally two week went away week came back month family sick weird flu may bad strain influenza surprised also surprised coronavirus also reason believe conspiracy theory people getting weirdly sick late last year could also covid 19  read time gf really fucked odd sickness back december january described feeling like common cold steroid perhaps maybe since apparently symptom pretty mild regular healthy people hmmmmm earl december took train western canada visit husband washington state train started feel throat pain dryness thought maybe cold something big deal quickly next morning started feel like get enough air long bedridden whenever breathed made noise kinda like rattle fever spent two worst day unable stand day take deep breath order get air sleeping little feel like got enough air like hyper conscious lung felt never ill life started frightened real trouble go doctor assumed really bad flu also type avoids going doctor even point considered found much drs appointment usa cost decided wait starting go away tried going short walk fully stand straight chest pain frightens think might could maybe died actually gone doctor huh horrible case bronchitis took like month half shake back february new genetic analysis confirms obvious err unless people dying italy nonstop since last year antisocial missed sooo sound like bat eating theory quite hold missing something always remember need confirmation medically scientifically particularly something like pandemic new info known deleted evidence mean shut pointless never started fart rarely ill year last year got ill twice november december think covid 19  though breathing main symptom still suspicious mean fake news china virus fake chinese communist socialist fake news foreigner edit guy jesus christ could seeing evolution virus antibody ca tell difference original le harmful version notice much versus one today may mistaken original version virus became lethal version seemingly infectious lethal one theory several month virus evolved go bad virus today much bad virus repeatedly infected human became transferable among human traveled outside china covet  19  outbreak combined another animal virus point became lethal version today case confident antibody test could tell difference original version potentially le lethal version also claim made recently le lethal strain complex version virus evolved gained little bit traction contacted hong kong airport early december worst flu ever early january scientific american visual indicates spread disease similar flu except virus lethal close living area ship perfect breeding ground coupled international travel nationalist argument country requires one consider research virus quickly identified shared around globe idiot leader u blaming another country sharing selective ignorance 
h0nx5c,1591834320.0,nascar ban confederate flag future race,,1392,38,smart move taking hit spectator really want last man standing issue oh man facebook comment southern u must blowing right nascar going get many tweet stating lost fan lol nascar started group bootlegger trying stick man banned  60  viewership lol everyday reality becoming le believable fiction like hot topic banning dark colored clothes literally nothing flying damned confederate nascar obviously racism well race get around ban using mississippi state flag canadian thing already confederate flag racist equivalent che guevara angsty uninformed teen racist redneck tear delicious time stop honoring csa traitor lost fucking war still think right fly flag beyond flag fly white one long cheeto man tweet dumb fuck supporter give shit nascar rather jumping latest culture war topic giving  3  hour good confederate flag pretty much like swastika well duke boy f ked sure skeeter zeke livid like banning sand beach best tl dr could make original reduced  74  bot announcement sure controversial number nascar fan display confederate flag symbol racing event even five year nascar asked fan quot presence confederate flag nascar event run contrary commitment providing welcoming inclusive environment fan competitor industry quot nascar said prepared statement issued race wednesday night martinsville speedway virginia quot bringing people together around love racing community creates make fan sport special display confederate flag prohibited nascar event property extended summary faq version tl drs far feedback  23 autotldr pm comment monitored constructive feedback welcome top keywords nascar  1  race  2  confederate  3  flag  4  fan  5  move new york knicks lol next god danged hybrid khaki ever going time get popcorn one wait see trump handle base going shit brick incredible eating sock moment posted yesterday would never happen glad wrong good job bubba made sport even inclusive look like way trying reach northern audience shed southern redneck image guess though also heard people gone race apparently pretty fun basically vibe race pretty interesting guess brother uncle going mighty upset treading country know nascar nascar shit like wwe banning cut well go fan base kid hardcore fan watch know couple people surprised fan nascar willing remove fan display shirt body wade grandstand surrounded people threatening tell car stop racing ca see tried fan would go nut consider patriot fly flag enemy state u probably one place stay one care problem watching racing always watching spot track boring hell point watching race see point time ranking rather watch tv show coolest part uh oh going lot angry white people redneck f 1   1867   2020   153  year  153  year traitor contry supported failed group wanted see slavery main stay traitor traitor hung fuck anyone support failed confederate state fuck reading comment see lot confederate flag equal racism people go nascar race confederate flag sport basically started premise american people chose ignore government prohibition taxation control alcohol understand rebellion towards government allowed american people right alcohol even though uncle sam still get tax bootlegger doubt delivering product people trying keep illegal think modern day drug runner marijuana becoming legalized many people chose accept authority man bootlegger inadvertently started sport still around today told edit spelling grammar deleted ban past race feel better even though know nascar really racing right word racing sound racist need change name national association stock car auto racing changed national association stock car auto fun jesus confederate deleted flag mean different thing different people support flag burning protest understand people putting meaning flag 
hencdq,1592947375.0,investor managing trillion dollar asset warned brazil escalating deforestation dismantling policy protect environment indigenous community creating widespread uncertainty condition investing,lbwcricket,217,8,world money money save money harsh tongue lashing get folk somebody update wikipedia definition word salad please start behaving bit responsibly within year may consider serious way expressing disapproval ethical group withdraw investment people want wood beef increase investment ethical group get marginalized squeezed decision circle want amazon responsibility produce oxygen breathe chopped forest build housing estate answer feel people pretend saint sinning much pressure right blm best tl dr could make original reduced  83  bot investor managing trillion dollar asset warned brazil escalating deforestation quot dismantling quot policy protect environment indigenous community quot creating widespread uncertainty condition investing quot quot strict guideline investment term unacceptable risk contributing serious environmental degradation human right violation need consider divestment currently happening brazil alarming pose high risk environmental degradation human right violation quot bergan said quot trend  039  seen brazil concerning quot daniela da brazil portfolio manager asset manager robeco told reuters extended summary faq version tl drs far feedback  23 autotldr pm comment monitored constructive feedback welcome top keywords brazil  1  government  2  deforestation  3  year  4  manages  5  lol save tree hurting bottom line funny clear mystery amazon rain forest fucking history matter time 
hj7qam,1593599484.0,hong kong protester defy police ban despite security law man independence flag arrested,sandsou,142,4,hey china stop dick edit seriously people hong kong quiet stand stupid risk take likely die prison rest life protester sold body part best tl dr could make original reduced  70  bot man hong kong independence flag causeway bay become first arrested national security law according police police displayed blue flag warning illegal assembly yellow flag cautioning crossing cordon line called earlier arrest man possessing hong kong independence flag ridiculous quot government attempting control people  039  action also people  039  mind china fragile hurt flag china need reflect fragile extended summary faq version tl drs far feedback  23 autotldr pm comment monitored constructive feedback welcome top keywords flag  1  kong  2  hong  3  people  4  arrest  5  
hkfvyu,1593767674.0,uk confirms u banned travel destination high coronavirus infection rate,vaish7848,64739,88,ok say banned undergo quarantine like country passenger arriving england united state exempted quarantine rule britain transport minister grant shapps said asked friday whether united state would country quarantine period apply mr shapps said afraid wait title really misleading early morning article say u placed list requires people quarantine  14  day upon entering country thing travel ban donald trump interesting guy consumed base forgot love money stock market people sold entire economy please base group people honestly make sick imagine took path imagine came hard virus whipped nationalism china used stimulus build american factory subsidize company manufacture china could used excuse completely close border sold bunch maga mask crushed virus psycho would getting second term economy stimulus would roof guy biggest idiot time interesting u sweden seen plague colony due taking seriously ca even go denmark norway finland well deserved guess change till least january trump somehow loses even guarantee many american think freedom mean freedom want fuck everyone else trump would probably think uk taking piss put america orange list decide red green agent orange et tu boris contra surprising twist event said one remember trump said obama ruined international reputation going make nation start respecting u thank goodness worried special relationship going make boris keep thing open hope get deal trump uk think fucked covid really must fucked justice world donald trump would get would great people america stop covid party come full circle country travel banning u shit even news worst infected country league safe list suck u wearing mask social distancing likely one passport likely visit europe edit since misconstruing point people think life usa matter world one refusing wear mask selfishness make rest u feel u want experience culture people world look bad preventing u traveling former restaurant worker currently employed due corona nothing class money desire travel give crap world think american change name covid trump virus might started china grew control american never offended something  100  agree saw someone post picture trump walking back white house tulsa rally tie undone picture post read  74  year old man long day work people age retired sitting home man work day  2  unbelievable blind ignorant shit done feel need commemorate getting home  2  holding rally people administration got corona supreme behavior doubt shrine built home frightening usa every country certain american give fuck whereas country give fuck remember much trump flipped obama  2  people died ebola u clearly better equipped handle pandemic people respond yes know covid ebola completely different machine demanding accountability giving name game funny rest eu least netherlands far know uk listed orange country requires people coming country quarantine  14  day still prop uk taking precaution ai somethin happens treat pandemic crisis like joke response cost economy much loss american job close back business work thru hoop open lost money time suffer devastating loss fail strong leadership mandatory complete shutdown quarantine could solution citizen shown absolutely thought come safety fellow remember friend neighbor could prevented thought others government always resource ease pain simply refuse give america horribly misleading headline u banned travel uk given exemption quarantine independent trash banned fake news curious graph show uk daily case graph show u user often report submission site ask u ban sensationalized article oppose blanket banning news source reader responsibility skeptical check source comment flaw help improve thread linking medium verifies question article claim link could help reader better understand issue find evidence article title false misleading contact moderator review bot action performed automatically please contact moderator subreddit question concern happy  4 th july everyone embarrassment trump really think whole fuck world idea outright ban travel live u lot people right thing flip side also even people grow fuck wear mask stay clean away people hate say lose privleges covid go away try teach people something good sorry inability follow simple instruction caused signed dumb texan would want u either deleted deleted american good stay safe get shit together burning ground covid infecting major city quickly many hospital reaching max capacity houston san antonio getting hit hard mask required small town im duh dont worry still ca figure wear mask taken publicly shaming stupid people walking around ruining country literally humiliated country behavior perpetuating dsease fuck uk withdraw post bunch showed someone wrote costa rica possibly allowing people u visit border open august  1  yeah lot discussion whether headline misleading least owned libtards holding hope dude trump say go away like magic disappear like credibility trump imago whole thing strike nerve want limit travel country u number fine get like eu letting u wo let part feel like middle school playground bullshit rubber glue politics come play something political well clear comment nobody read article im u absolutely hilarious everyone world indicating ca get shit together local news comment section missouri full people thinking virus hoax said day ago fauci sad little man looking  15  minute fame scary wilfully stupid people make place feel quite worth deleted canada need keep border closed foreseeable future also fuck alaska american want get lower  48  go alaska direct ferry many using loophole vacation bc disgusted see become used pretty awesome neighbor almost like growing guy really looked see spiral grip crack addiction get clean america welcome america citizen believe science government nothing contain deadly outbreak police officer murder white health care system bankrupt need stitch enjoy stay yeah come train wreck right ban  2  week quarantine upon entry ban american dumb look fact honestly make sense united state need locked travel outside border really expecting people refuse wear face mask public quarantine  2  week foreign country give shit anyone else home sure hell going give shit would nice american would stop illligally jumping border canada sorry welcome moment figure shit decide come country canadian weird see travel ban popping america may held accountable stupidity first time global scale way impact american aka care guess took weaponize misinform entire population threaten send way people still traveling mean even travel uk need quarantine two week would let people enter leave country soon allow travel see increase case matter many measure take upon entry prevent spread title really misleading someone confirm mean ban u citizen come uk stopped come long quarantine  2  week misunderstanding make sense breaking news honestly world use excuse quarantine u let sort shit welcome back regained competency know fucking smug  8 th world coronavirus case yet  21 st size population kid usa become along kid president punished way discipline shoul banned every country planet earth fix issue usa following swedish model forgetting part protecting vulnerable make sense world confirms dumb country embarrassing uk listening poppa trump poppa trump say virus isnt problem poppa trump always right u citizen applaud decision american say good call fucked badly european protect u  2  spidermans pointing tbf u red list since could read awful shit totally legally occurs u every red list banned travel destination fucking deserve canadian heard people say going border gun shoot american try cross got ta fuck really bad canadian take arm last guy osama bin laden hitler travel permitted abroad vaccine found vaccinated leave way malaria controlled really blame right wing psycho social medium influencers keep saying hoax get trump office globally coordinated hoax getting control woooooo america waiting trump spin yeh britain got bad hombre stop u resident going knifed man whole world sure going hoax make trump look bad british airway virgin atlantic  2  spidermen point finger meme keep lying enter going alaska proceeds stop banff whistler vancouver basically western canadian province way alaska dear southern cousin give head shake stop trump claim voted want sickness month covid measure sincerely canadian jesus christ fucking headline day great yet 
hmrwex,1594116938.0,uk sanction russian saudi money magnitsky act uk slapped sanction dozen individual organization russia saudi arabia myanmar north korea human right abuse london also threatened seize gain,ManiaforBeatles,731,18,best tl dr could make original reduced  79  bot original law adopted u  2012  memory russian lawyer tax advisor sergey magnitsky died russian jail suspicious circumstance monday uk foreign secretary dominic raab said sanction aimed stopping laundering quot blood quot uk use law bar entry individual believed responsible human right abuse well stop money flowing bank cut violator profit first time uk imposed sanction leaving eu u  039  top diplomat mike pompeo praised london ushering quot new era uk sanction policy extended summary faq version tl drs far feedback  23 autotldr pm comment monitored constructive feedback welcome top keywords russian  1  magnitsky  2  sanction  3  official  4  law  5  boy comment thread bizarrely controversial good news omg well done uk hope country follow love headline three four rung one uk selling arm saudi despite warcrimes yemen funny since whole magnistsky story bill browder getting hole swiss cheese uk large hand profiting blood money sometimes even make money bloody like u wow irony uk talking blood money edit wow truth hurt orange dotard wont like rally behind new ally putin mb kim jong defend pal aggression exactly london seized asset yet uk resume arm sale saudi arabia despite war crime yemen government say talk saying one thing another unlikely london real estate market would collapse started seizing property dictator oligarch foreign criminal fuck britain boris blood hand corona fucking russian invaded iraq  2003  left shamble sanction evil ass frozen asset handled going red cross uk government latter sound like daylight robbery even though victim criminal particularly appalled designation top official prosecutor general office investigative committee russian federation well judge diplomat said russia investigation prosecution judiciary operate basis independence executive guided exclusively law living simulation code china ignore 
hrc1q1,1594767573.0,brazil recorded new case coronavirus past  24  hour additional death,linusdropstech,1343,17,weird two worst hit country seem complete asshole human being leader correlation equal causation wonder bolsonaro spent valuable time trying convince country virus communist hoax state governor went implemented quarantine bolsonaro attempted prohibit quarantine supreme court declared federal government right interfere led massive communication campaign governor supreme court mobilized fake news network link virus communist plot encouraged people ignore safety recommendation expert world health organization local authority people started dying popularity plummeted say supreme court said could ban governor imposing quarantine covid crisis longer federal issue right trying convince country hydroxichloroquine  100  effective virus used early death caused previous condition maniac hate fuelled management country challenging time since long time seen two minister health fired corruption scandal involving family tie rio police mafia plenty threat medium keep bashing forced take drastic measure popularity falling minority still relevant  30  vocal vicious follower eat whatever vomit facing dire time honestly scared family countryman really represent wrong world bolsonaro skate asymptomatic least ostrich bit quarantine something deleted bolsonaro still sick please say yes holy shit fucked president care life u least governor u trying stop closest read brazil street gang implementing curfew gang run lot thing though know lot place basically part infrastructure hope wrong people charge make difference western continent bet thank god brazil president trump point like game case usa brazil ofc usa winning leader free world brazil  7  day mean basically flat couple week state got hit later growing like mina gerais others got hit early decreasing like rio de janeiro huh imagine country two insane president seeing spike pandemic likely number higher considering bolsonaro probably manipulating statistic america hold shotgun wow almost like test made begin go positive like nigerian president issue goat testing positive throw number nobody question statistic age propaganda lol reddit bro whatever state say oh wow brazil trying hard take america title biggest bunch idiot wear mask social distancing fucking hard let virus burn stop spreading call rookie number let make  50 k guy 
