id,time,title,author,score,num_comments,text
abey1s,1546317089.0,car crash new year crowd tokyo suspected terror attack eight injured,,364,7,deleted could one aum shinrikyo type retaliation lawful hanging carried  2018  deleted takeshita dori quite surprised got  8  person guess much le busier night people got lucky enough quite narrow street time jam packed people whole length street meji shrinei nye pretty shocking everyone call new year peaceful way possible actually heard siren exited around  1 am think much crazy got ta kill innocent people go bang though asshole removed 
ap3tu0,1549804881.0,israel approves compassionate use mdma treat ptsd treatment deemed compassionate use allows drug still development made available patient outside clinical trial due lack effective alternative,mvea,2996,45,hopefully mdma turn helpful ptsd deleted decade ago remember israeli veteran telling somewhat tradition soldier completed conscription service conflict zone go mdma beach party explicit understanding beneficial dealing ptsd article something reddit generally support heavily comment absolutely ridiculous ca stand israel inb 4  israel palestine quickly merge loveraelstine abbas netanyahu hugging street uncomfortably long period time let honest also clicked article read hilarious dumb comment got downvoted rightfully deleted mdma still development discovered  1912  used million daily basis logic completely wrong stupid victor victor even retarded best tl dr could make original reduced  92  bot emerging research shown promising result using quot party drug quot treat patient suffering stress disorder israel  039  health ministry approved use mdma treat dozen patient mdma classified israel quot dangerous drug quot recreational use illegal therapeutic use mdma yet formally approved still clinical trial part israeli health ministry expressed belief result upcoming compassionate use treatment next clinic trial israel decisive giving physician therapist  039  confidence mdma result positive said address need ptsd sufferer also generate hope could mean treating broader range mental disorder extended summary faq version tl drs far feedback  23 autotldr pm comment monitored constructive feedback welcome top keywords mdma  1  treatment  2  patient  3  trial  4  ptsd  5  anyone know company manufacturing listed public company well done well fucking done actual science based emotion u drug scheduling baseless research cannabis scheduled worst worst million prisoned good israel looking deeper way help people thinking outside box support move interesting using science religion fear dicate done medically revolutionary concept cannabis used immediately traumatic experience thing cause ptsd reduce severity even prevent ptsd entirely something brain form memory influence certain compound emdr eye movement desensitisation reprocessing therapy available israel currently undergoing emdr treat ptsd supposed  80  success rate strike odd claim effective alternative treatment trauma form therapy shown good result meanwhile  3 rd world america state still charge felony possession quantity mdma camp bucca dealing agree mdma beneficial pharmaceutical mdma question manage horrible comedown terrible tuesday came shit mdma cut purify avoid dosage awesomeness cashmere sweater shag rug sale going go roof hi mvea submission behind metered paywall metered paywall allows user view specific number article requiring paid subscription article posted accessible everyone submission removed flaired user discouraged upvoting commenting information see wiki page paywalls please try find another source news site reporting story contact moderator bot action performed automatically please contact moderator subreddit question concern want live within un sanctioned border israel logical answer go somewhere within border could kill  30  palestinian child take drug feel remorse effect deed cool could mdma help treat sociopath call world leader maybe give idf rock thrower middle east crisis fixed israel compassionate one title burning hole u yeah really need israeli soldier must upset blasting child brain sniper round legalizing human testing table seems legit start something want keep trail roll molly forget teenager sniped would wan na b female unit better treat symptom cause otherwise would require israeli government populace actually investigate position burning olive grove defending pricetagging settler edit yeeesh idf like comment maybe compassionate palestinian next hmmm administration israel need use mdma find compassion dont idf soldier get killed drunk driving combat sound like wan na keep party rolling removed israel compassionate hardly could show compassion palestine mdma treatment work country like israel u commit war crime knowing soldier easily treated much would dose israel compassion cost could stop committing war crime something dunno committing genocide ironic plan spray stuff bantu stand palestine instead dangerous drug maybe israeli government stop using young soldier illegal occupation ethnic cleansing palestine chemical make violence disappear chemical shitty life 
