id,time,title,author,score,num_comments,text
i40nz1,1596611216.0,global witness record highest number land environmental activist murdered one year,jakeisarake,102,3,best tl dr could make original reduced  84  bot ngo  039  annual report also shed light urgent role land environmental defender play fighting climate breakdown opposing carbon intensive unsustainable industry accelerating global warming environmental damage quot many world  039  worst environmental human right abuse driven exploitation natural resource corruption global political economic system land environmental defender people take stand two third killing took place latin america consistently ranked worst affected continent since global witness began publish data consistently one worst region attack related agribusiness driver attack defender extended summary faq version tl drs far feedback  23 autotldr pm comment monitored constructive feedback welcome top keywords killed  1  defender  2  attack  3  community  4  threat  5  fuck website bolsonaro worse people forget colombian almost every activist gone 
i9joe8,1597401710.0,queensland first state australia criminalise gay conversion therapy state politician voted make highly destructive unethical practice illegal lgbtiq affliction disease requires medical treatment state health minister steven mile,madazzahatter,9342,72,interesting queensland first seeing  3  year since removed gay panic defence justification murder law wait legal everywhere else pretty sure legal victoria year edit first ban appears criminalise hopefully follow suit soon qld leading nation situation really must fucked rest country good news seems like vote pretty close mr mile deemed practice highly destructive unethical bill passed support queensland green queensland labor lnp bob katter australia party one nation voted ban lnp claiming law would turn doctor criminal wait stand many people defending conversion therapy lol funny people thread nothing positive say qldrs homophobic etc typical state always point finger yet covid running rampant due lack foresight surprised hateful red headed bitch pauline hanson voted ban make proud queenslander could bob katter indeed spent time despite fact every three month person torn piece crocodile north queensland queensland one conservative state mean lot gay queenslander edit oh wait noticed apply religious institution wtf queensland fuckin rest think left wing right wing agree stand curious think gay disease one need medical treatment could agree stop acronym come better way describe pretty clever specie come something le unwieldy whoopsie trans require medical treatment imo broken love tim tam proud inhumane since first time ever practiced good let get rest world highly destructive unethical good description pokie machine holding breathe made illegal best tl dr could make original reduced  86  bot queensland become first state australia criminalise gay conversion therapy state politician voted make quot highly destructive unethical quot practice illegal  2018  landmark report la trobe university human right law centre found conversion therapy quot pervasive quot australian faith community least  10  organisation offering practice australia new zealand australian capital territory victoria also committed banning harmful practice act introducing bill outlaw conversion therapy minor thursday extended summary faq version tl drs far feedback  23 autotldr pm comment monitored constructive feedback welcome top keywords conversion  1  practice  2  therapy  3  survivor  4  health  5  thanks australia one piece really good news read today struggling find democracy voting right taken away congress go month break without covid relief american people thank australia letting see good humanity today sure hard find day great news still even thing news still allowed still medieval society like florida first u state something progressive little surprising say least queensland also made illegal journalist report allegation political corruption face  6  month jail well least someone government head straight stand get memo deleted mean lgbtiq hmm individual want transition sexual orientation possibly small irdk group would good take away ability stop something believe wrong saying probably case plus asexual plus bigotry never end fuckedup country fortunatelly far away enough put young boy female hormone feel like girl fuck queensland hey guy journalist university technology sydney currently working story gay conversion therapy want hear perspective people sydney someone know experience gay conversion therapy feel free reply comment perhaps could meet chat feel comfortable commenting feel free message privately either way love hear perspective topic matter experience think new law queensland tight enough think nsw follow suit insight people would pressured conversion therapy basically anything feel relevant love start discussion thanks guy thought trans legitimate disease gender dysphoria affliction disease health insurance cover imo ca way never guessed qld would first queensland particular brisbane become progressive late great see running joke like stepping time machine back  1950  regard conservatism head rural fnq area seem remain way look like much longer user often report submission site ask u ban sensationalized article oppose blanket banning news source reader responsibility skeptical check source comment flaw help improve thread linking medium verifies question article claim link could help reader better understand issue find evidence article title false misleading contact moderator review bot action performed automatically please contact moderator subreddit question concern jesus wtf state force religious group stop teaching homosexual relationship wrong done deleted ia kid also consenting adult lot therapy mental torture take perspective something wrong person circumstance experienced treatment lgbtq also autism told developmentally fucked never normal result parent therapist refuse raise leading theory indicate actual issue delayed maturation borderline pd told manipulative never normal research indicates actual issue going immense amount stress disorder research fucked design objective start mostly consist questionnaire kid parrot back thing therapist told personally participated research disorder diagnosed month interested call back tell already published went forced therapy kid recently diagnosed ptsd ironic still seeing therapist come idea biological explanation behavior considered abnormal result economy pushing ton barely tested psychoactive medication brain still formed u  2014  prescription heavy antipsychotic risperdal seroquel kid age  2  earliest documented case psychosis around age even extremely rare know number year collected reported know long term effect tested personally experience army doctor tell fucked way lead behave accordance diagnosis especially kid strong template behave people young going great stress mental fortitude step outside consider lucky diagnosis associated medication treatment kept changing point could believe anymore actually make diagnosis based observation second hand reportage clumsily crammed broken diagnostic model extremely low success rate therapy two cent kind feel like somehow victoria queensland switched place victoria acting liberal conservative anyone au queensland labour policy passed expected victoria first saying pro lgbtq agree forcing right approach like watching alabama progressive lgbtqi right fucking embarrassing rest country federal government see make federal law astounds someone want conversion therapy someone feel comfortable gay bi etc wtf stand keep adding stuff keep track conversion therapy far know voluntary gay religious objection homosexuality able seek counseling attempt correct sexuality granted think people dubious result someone want able seek doctor help removed voluntarily sign gay conversion therapy removed removed deleted think people every right want genitalia really want agree people allowing child take hormone blocker getting sex change removed joke opening new clinic curing insert random fetish fetishism experimental participant sign waiver legally call patient seems fair would lgbtiqjkwsa need special treatment normal lgbtiqjkswa removed going use persecute jesus coming soon satan taking disease want cured illegal try change sexuality people love try change gender bad thing change sexual orientation gay want straight able try conversion therapy  christian see law infringement freedom religion christian recognise homosexuality sin bible say homosexual go hell also many sin listed bible tell u christian homosexual well know unrighteous inherit kingdom god deceived neither sexually immoral idolater adulterer men practice homosexuality thief greedy drunkard revilers swindler inherit kingdom god washed sanctified justified name lord jesus christ spirit god esv  1  corinthian christian see sinner homosexual also adulters thief greedy people etc u mean going hell forgiven christ go homosexual sinner talk god love chance save eternity lake fire removed disease requires medical treatment kind disease chromosome wrong meant reproduce naturally perhaps ultimate denial science still justification cause harm edit ex name tatted foot lesbian fixed self image issue people hate told need fix giving enjoy hard understanding basic truth make stupid rome fall sodom gommorah fall remember peace gay person ca enroll conversion therapy even know bullshit many thing highly destructive unethical legal 
ikkkio,1598968113.0,pope urge respect paris climate accord say groaning,MacMommy111,124,6,problem religious thinking belief god save u god real go extinct collective history nothing compared age universe would missed next time collection plate go around proportion money get given environmental action individual priest dedicate minimum amount time next sunday mass issue best tl dr could make original reduced  57  bot vatican city pope francis tuesday urged nation fight global warming according  2015  paris climate accord weighing issue figure presidential race quot need everything capacity limit global average temperature rise threshold deg c enshrined paris climate agreement going beyond prove catastrophic especially poor community around world quot said challenger presidency democratic candidate joe biden said return united state leadership role climate change assertively nation future climate negotiation advance goal paris climate agreement extended summary faq version tl drs far feedback  23 autotldr pm comment monitored constructive feedback welcome top keywords climate  1  world  2  global  3  agreement  4  paris  5  ask god fix climate catholic church force good world position condom use downright criminal sure pope better ratzinger still pretty despicable human mind deal sexual abuse child popiness ever commit abuse 
iuqk9x,1600371016.0,entire apparel industry gap h adidas profiting forced uighur labor activist say,Pheonix-_,1767,30,activist named  38  company say based credible news investigation news report product connected forced uighur turkic muslim labor let shame company full list abercrombie fitch adidas amazon badger sport founder sport group c cofra holding ag calvin klein pvh carter cerruti  1881  trinity limited costco cotton dangerfield factory x pty ltd esprit esprit holding filum filum korea ltd gap h hart schaffner marx authentic brand group ikea inter ikea system jack jones bestseller jeanswest harbour guidance pty ltd lacoste maus freres mark spencer mayor muji ryohin keikaku nike patagonia polo ralph lauren ralph lauren corporation puma skechers summit resource international caterpillar target australia wesfarmers tommy hilfiger pvh uniqlo fast retailing victoria secret l brand woolworth woolworth corporation llc zara inditex zegna isnt goal make much profit possible people top least amount expense bottom know make labor real cheap dont pay force people else everybody shopping time start going nude also use american prison labor sometimes put tag unfinished shirt say made america look like time start making clothes say anyone know find people help preferably free sad thing awful cycle poorer people west facilitate involuntarily  1  desperately need certain piece clothing  2  afford good quality ethically sourced clothes buy budget cheaper high street chain  3  said piece clothing change shape tear crotch seam looking  90  jean ever buy fade wear otherwise become somehow unwearable within month worst case week  4  poor person buy new piece clothing replace recently spent money probably budget buy cheap item  5  rinse repeat saying good saying acceptable saying ethical however saying demand remain high sadly unavoidable majority people luxury boycotting brand price ethic course want facilitating another affordable option even charity shop actually full clothes seen primark clothes local british heart foundation much could primark u outlawed underpaid prison labor cent per hour prisoner disproportionately people color may improve credibility criticizing others disproportionately imprison minority pay labor activist putting fash fashion deleted article last modified  2  month ago may contain date information original publication date july  23 rd  2020  last updated july  27 th  2020  per submission article published within last week nbsp nbsp bot find outdated article impossible  100  accurate every site difference time zone date format may little send message notice error would like bot added subreddit send feedback github bot github chrome extension deleted best tl dr could make original reduced  85  bot dozen major global brand accused complicity mass repression china  039  uighur muslim minority sourcing supply cotton product factory exploiting people  039  forced labor activist named  38  company say based credible news investigation news report product connected forced uighur turkic muslim labor earlier week new york time reported china using forced uighur labor make personal protective equipment exported u country extended summary faq version tl drs far feedback  23 autotldr pm comment monitored constructive feedback welcome top keywords uighur  1  xinjiang  2  cotton  3  supply  4  forced  5  full shit wait people realize much labor u performed prison oh wait even woke people give shit concentration camp soil nudity justice welcome capitalism difference forced labor slavery start calling slavery help eminem hope yea fast fashion labor issue long time really new followed closely source chinese company using utilize force labour chinese company wo open xinjiang incredibly difficult get good data due tight censorship denying asking need pitchfork mob heyyyy article july buying new pair sneaker made labour going suck look like new balance option would cost product go corporation rely unethical labor maybe  5   10  yr ago clothing company using american prison labor people boycotted switched american prison foreign concentration camp prison labor slavery never solve problem move around way pinpoint next exploitative move also maybe need get rid capitalism pay seriously pretending known apparel industry running slave labor decade get wrong support scrutiny ca help wonder people suddenly object slave labor china perfectly fine slave labor bangladesh decade problem according republican democratic economic theorist slavery legitimate form comparative advantage company outsource labor avoid environmental protection law pollution slavery happen u soil matter embargo china end west commits 
jjmn3q,1603887415.0,armenia attack civilian azerbaijan,faridall,218,25,amount pro armenian shithead reddit insane find hard explain action instead get post removed canadian armenian point view embarrassing strategic value bombing civilian anyone tell side avoid targeting civilian settlement wish war soon possible go back peaceful negotiation although might difficult pashinyan clown head state azerbaijan spineless dictator truly act barbarism child deserve war crime good job guy make look natural upvote exact second making post go  45  upvoted  70  immediately crazy week armenian bombing new city azerbaijan imagine general sitting discussing new city bomb next innocent people dying military object least nothing active people answering thing happened stepanakert guy sane gon na justify action government killing civilian okay war crime world really hate turk people deceived azerbaijan kill innocent really opposite armenia commiting war crime week broke ceasefire agreement least twice maybe people still blaming azerbaijan stupid world lol vote brigading manipulation going right thread incredible andalou agency turkish propagand site anadolu agencypoorly source typically source heavily quoting without linking actual story azerbaijan attacking church cafe school month straight azerbaijan also one worst press freedom world jail journalist thousand straight propaganda state run news agency andalou agency turkish propagand site good dont u site  90  time said fake turkbots taking straight top bois azerbaijan used cluster bomb capital karabagh interesting town mind close line contact shelled hysteric brigaders reddit got heated biggest armenian hospital region targeted azerbaijan totally trying cover anything deleted propaganda turkish newspaper armenia defending people stopping another genocide look side story drawing conclusion fuck turkey removed deleted party used cluster munition city center total b fake news probably azeri got together mass upvoted desperate attention victimisation bomb hospital church nk point finger deny armenia continuously shell ganja start confict azerbaijan bomb shit stepankert capital artsakh difference seems lie fact azerbaijan reluctant attack armenia proper due defensive alliance russia possible azerbaijan pretty deep armenian controlled territory already news site tr turkey domain run anadolu agency news agency reporting armenian nop see kind conflict interest might cause anything le fully impartial news reporting guy 
jscf0c,1605115684.0,first cruise ship resume sailing caribbean covid scare captain said passenger tested felt ill test passenger required two negative covid test boarding,mepper,2875,65,maybe take cruise pandemic world thought good idea go cruise right passenger felt ill got ship anyway may go way industry amazing could guessed might happen small vessel show behemoth know big cruise ship still huge happy see cruise industry die floating petri dish environmental catastrophe serve purpose humanity giving old people chance post something facebook terrible person every day read people behavior face global pandemic make tiny violin little smaller kind fucking clown would purposely get floating petri dish middle global pandemic social darwinism efficient fucking  9  month pandemic learned operating cruise ship time horrible idea lol idiot still lining live petri dish bacteria pandemic acting surprised tempted go carnival one since give free suite actual cash  3 k australian sailing  1 k domestic want risk held sea week like last round ship come back port quarantine read thing enjoy cruise shut folk environmental destruction cruise industry cause unconscionable hope go business someone life island barbados feel bit context order visitor coming required negative pcr  72  hour le arrival island depending country origin transit required quarantine approved facility le  3  day  14  day required pas minimum one usually two rare exception pcr test set free roam cruise passenger taken via secure transport directly airport cruise terminal everyone came contact extensively monitored safety precaution rigoursly observed local transmission island quite time recent case contact trace fully within  48  hour party quarantined tested met safe criterion precaution taken board vessel pale comparison enforce island finally free roam island taking sanitizing mask wearing extremely seriously like get physically thrown somewhere wear mask refuse wear right assuming even make door anywhere type visit require log kept name contact information temperature time visit facilitate contact tracing necessary ofcourse place restriction relaxed bit local bar rum shop etc even better walk mask cough temperature told uncertain term leave hell getting cruise ship right absolute utter moron passenger hold vote eject sus glad bought ccl put day stop trying make cruise happen gretchen seems like really maybe even smart take f ing cruise pandemic quarantine idiot sea let crew first planning cruise early symptom covid cruise ship industry die fucking stop shit industry anyway fuck sake even great like fast food vacation go somewhere experience another culture people selfishly lied testing result thing fun encouraged president unexpected hm almost like stuck boat thousand people week bad idea pandemic knew way fucking idiot going defer bill burr bit cruise ship people said bit get cruise middle global pandemic hang let break world tiniest violin edit word enough fucking cruise already industry need disappear indefinitely thing worse cruise industry people go cruise wait heard oh wait start fucking thing ffs specie fucking stupid stop entire cruise industry massive waste money ressources anyway plus health environment hazard reminds zombie movie people selfish enough ruin planet going cruise trusted altruistic enough honest disease could possibly ruin people holiday hope passenger affair order utility bill direct debit garden taken care will written might board long time coming home coffin serf industry right find something le polluting maybe huge hygienic half million case day people wan na shit human stupid could predicted never understood appeal cruise ship stuck sea  100  people basically shopping centre  0  appeal least dear anyone read go fucking cruise even covid thing floating daycare bring covid polluting environmentally destructive carnival consumption love sorry much empathy expected anybody take cruise right end getting covid fuck thought good idea people die every year illness thrown overboard straight fucking murdered thing wanted get back onto boat ca dock anywhere pandemic good riddance ok gon na okay deleted unbelievable obvious news article obvious dumbest freaking idea let take cruise pandemic omg felt sick came anyway jfc clusterfuck idiot would think people would enough common sense join together  100  unknown people pandemic confined space disease could spread people simply zero fucking patience geez want fkn cruise care die give nowadays cruise like mega orgy everyone stranger possibly time stop cruise like ticketmaster near future imagine show card vaccinated attend concert wild time man get people understand virus ca stopped period fuckin cruise line passenger fucking stupid think received due reward operator cruise line though need face consequence amount willful endangerment passenger say oh tested oh plan take genius foresee likely outcome  10  buck say someone uk get appeal cruise mean stop trying people wtf refund close sail date travel arrangement course people going lie hell wrong worse ever one trump admin overruled cdc cruise ship decided allow trump totally defeated virus going cruise ship automatic darwin award 
