id,time,title,author,score,num_comments,text
c3peof,1561208321.0,nigel farage accused faking letter brexiteer whose brainwashes,michapman2,4903,75,got ta imagine someone trolling nigel stupid catch way anyone holding political office would intentionally try fool people something stupid right feeling trepidation thought existence farage tweeted picture letter friday afternoon youngster claimed school u leaver mate buying dear nigel write sad queen overthrown replaced benevolent fuhrer merkel hail merkel glorious eu regime sincerely little boy cursive f  10  year old  35  live u cursive mandatory elementary school  5 th grade age  10  everyone use time glad shit fell style used tell u write check cursive adult people use cursive know anyone  70  writes check plus write print regrettably make whit difference supporter nigel farrage  school brainwashing get idea guessing parent one could even say parent brainwash kid political idea think fake yeah think fuhrage faked way stupid need  45 yo  19  stone bit gammon attention yeah probably deleted regardless subject matter whether fake thing got people think  10  year old write cursive school started using fountain pen drilled write cursive year  4  age handwriting arguably best ever age said child age give toss politics unless something like school project something parent forcing farage drop bucket crap he done agenda boggles mind people support piece shit like lot narrative right relies white fear ie gon na put u fema camp indoctinating kid love gay etc etc nice see side political spectrum stupid morally decrepit side pond well conservative faking letter child trump admin kid named pickle tactic left blatant lie think trump admin lying poll number inauguration attendence thing blatant lie know supporter dumb research anything l buy imagine child lame write nigel farage new low even  10  year old complete utter wazzock nigel every always act bad faith lie always forever exception democracy function many bad faith actor boy name pickle would thought people want leave eu unelected bureaucrat listening unelected non mp party say really kind  10  year old writes like ten year old boy writing express gratitude party without leave voter would nobody represent opinion majority mp parliament want ignore democracy turn referendum result deleted would even care legit brexit utter insanity need brainwashed need corrupt shit brexiteer even believable first glance let alone inspection making plan nigel although might go lot people believe farage actually stupid highly doubt would risk negative fallback crafting fake letter post social medium may case someone sent joke written child parent whatever think likely sent  10  year old campaign run article reek anti brexit bias evidence seem bunch shitlords twitter kind journalism perpetuates fake news cycle sick honest news anyone accuse anybody anything oh nigel nigel farage personality wet sock putting veracity letter one side view ten year old relevant ten year old ever consulted policy utterly ridiculous start finish fairly common people write political opinion attribute child like shitty facebook meme farage face true prick come many people see barely enough adult grasp eu let alone  10 yo feeling disillusioned could see real letter really different  10  year old school used kid whose parent allow television house let alone video game poshest accent heard even though inner london primary school actually really nice got bullied badly leave school  10  time could totally imagine writing letter like guidance parent really brainwashing kinda obviously correct choice know twat surprised cursive taught primary school age  5  uk fucking italic tipped fountain pen though headmaster boner italic handwriting even letter legitimate would anyone care think something complicated membership european union membership involve movement trade good information people people hard time fully appreciating let alone elementary school kid absolute best summarize parrot parent tell propaganda gone crazy gon na agree bullshit honest start letter dear insert first name age would farage something conservative divisive scourge earth could old even recognize brainwashing regardless care think brexit adult barely understand implication even le child kid going understand brainwashing young age much likely heard someone say parroting even kid say think eu awesome good everyone school telling otherwise really give opinion weight adult us kid letter basis political opinion eye roll right skull wish could filter worldnews post contain word acused allegedly milkshaking nigel tsk tsk tsk news edit pro farage presumptuous goon old care enough shit care next cartoon get video game time letter sent a 4  envelope letter look like crease folding fucking loser massive bellend wow could least picked realistic age  10  writing political letter  10  year old brainwashed hardly matter side hope someone trolling make shit uk friend making huge mistake brexit ever actually happens til sheldon cooper  10  year old life ca wait blow lead absolutely nothing happening exactly want think garbage tweet news used like independent keep printing shit like add list medium ca trust could real could time tell ya think hi useless web site full void  10  year old today writes physical letter rather electronic message pen well suppose presenting objective fact also form indoctrination sense could one parent penned explained  12  year old live uk eu explained brexit responded make sense explain eu child try explain brexit met confusion allow tabloid shit worldnews posted china harvesting organ detainee year ago turned true said news removed post dumb come idea whoever pushing brexit shadow culprit bet totallynotaconspiracynutcase cursive hard taught write way since standard probably pretty much way wrote almost school write like still joined letter trying go back good handwriting great thing subscribe accused somebody made course since accusation reddit completely buy shit absolute fact absurd left clutch straw find whatever smear farage id bet alot money wasnt faked absurd kid spew whatever hear parent talk brexit large event probably explained cursive need learnt purpose curriculum automatic lazy note taking damned useless accusing counterfeit due person decent handwriting unusual age  10  least everybody every medium corporation running along story wow person sending letter may potentially pretending younger justify calling farage aside possibly falling trick would surprised letter real though sceptical  10  year old secret majority school curriculum liberal leaning 
cgp4jh,1563864466.0,google facebook secretly track activity porn site microsoft report,,563,55,google facebook track activity every site possibly still got search right porn wack get shit together google delete facebook use far private browser vpn show eu citizen private get free actual study result come interested reading full thiss paper explores tracking privacy risk pornography website analysis pornography website indicated  93  leak user data third party tracking site highly concentrated handful major company identify successfully extracted privacy policy site  17  policy written one might need college education understand content analysis sample domain indicated expose suggest identity interest likely linked user google already know frequent porn use google porn pretty sure midget amputee pregnant incest scat porn wo interest pretty rich coming microsoft feel terrible amount pity poor bastard actually sludge atrocious porn habit data bro earned fucking wanker google facebook track activity porn site microsoft anyone automatically assume tracked naive shocked shocked say point anyone really shocked google fb amazon track everything well google facebook searching hot clip found last week x 200 b give man bone please facebook creepy fuck fake account use dating apps let say match guy named travis know travis however search travis first travis appear travis matched fucking creepy facebook track rather website visit ad tracking ad following thats keep sending job opening pizza delivery guy worst kept secret world would illegal due gdpr curioisity effective blocker like noscript preventing type tracking facebook domain google analytics mixpnl  3 rd party tracker blocked browser way track would sever side pornhub domain right website track clientside would work watch best video understand wan na follow great collection glad make sure type legal teen since wgen microsoft become good guy noticed day google doubleclick used ad mindgeek pornhub others website trafficjunky though google allowed ad serving platform adult gambling content ha hahahaha sorry whoever came across mine facebook probably work porn site category like sharing course dopamine every click guess learn pornosites far le regulated ppl meh would able use info private citizen definitely humiliate result tech company destroyed lawsuit outrage gathering data point obvious info user website surely huge deal overall tell something new turn webcam watch jerk interesting glad jerk anime girl fuckin duh one scroll meme app quickly swipe add away people know weird porn taste point tracking porn people watch mean ok get tracking everything reason track porn specifically use google go site facebook open even locked facebook account long time aaah sheeeet thats use xbox porn hub like genius website logged visited thanks daddy microsoft  come microsoft know well end targeted advertising well long give information wife give shit wonder often show yeah nsfw btw okay cool know like lesbian video info porn seriously consuming human brain power making u lethargic stifling drive thing may fully realize impact much later right track everything clear way ad displaying suggested friend option etc secret honestly thought secret hand probably elaborate form looking research purpose excuse come across keep suggesting incest title told alexa want shit maybe make sweet recommendation something vpn protect installed ublock origin auto cookie delete addon year half ago ublocks almost million request blocked time stop looking porn perverted pervert decency beat porn ploy try get people use bing stupid microsoft yeah bet people google like big booty redheaded milf pov anal good wow guy really like milena velba secret mode tho oh no pr 0 nz habit compromised surprised literally care lmao watch vanilla stuff ever 
cvqb4g,1566836622.0,macron surprise trump skipped g 7  workshop ocean climate biodiversity,mepper,1730,30,trump mental capacity even sit meeting like meanwhile trump supporter verified gullible idiot planet fair cheeto golem avoids anything word work seriously trying think meeting trump would asset ca picture situation say something everyone else think oh good idea let imagine crazy difference would either sander warren win next election going rest world leader trying drag trump meeting kicking screaming lazy anything new american president drag everyone else away overdone overpriced lunch order get work sander would probably take two bite meal say delicious pie chart move move work tea party people global whiplash would astounding lol anyone still support trump worthless piece dog shit president answer financial guidance accusing scientist answering financial guidance execute global conspiracy people still deny reality science continues show u either stupid lying heard biodiversity thought minority noped best tl dr could make original reduced  80  bot biarritz president donald trump show workshop environmental issue g 7  summit today french president emmanuel macron said came surprise macron hope enlist leader g 7  industrial country several invited country sign metz charter biodiversity agreement recognize value biodiversity protect biodiversity work reverse collapse quot country working including member g 7  country including chile australia india south africa signing biodiversity charter quot macron said extended summary faq version tl drs far feedback  23 autotldr pm comment monitored constructive feedback welcome top keywords macron  1  country  2  biodiversity  3  carbon  4  climate  5  imagine everyone else relieved skipped deleted serve hamberders assume tried read word biodiversity quite make end got distracted tray waffle skipped want read honesty possibly talking meeting like high level could trump contribute except snoring big mac cold mcchickens well know trump politician particular g 7  fined arriving something look one work company fails arriving specific meeting get called upon higher power reprimanded ca politician vetted fine trump like every american president continue complete disregard enviroment planet big multi corporation oil cartel dissolved thrown jail make sense know gon na get anything much like kid adult table course trump missed time nap trump exactly smart capable person would point make distracting bullshit sound bite absolutely useless progress lost doesnt colouring book donny stay focused table lol hey reddit watch get downvoted quoting article macron suggested trump absence interpreted rejection workshop president trump several bilateral meeting including chancellor merkel prime minister modi morning meant room team rest great mean know plan already right tax fuck everyone trump wife macron wife nothing like skipping school good trump skip want help macron annex huge part brazil deleted meeting economy country fear macron grow stop behaving like child trump father mother need parent go 
cwwoui,1567057541.0,beginning massive protest uk thousand flood street stopthecoup,JLBesq1981,111,2,government give shit people serf cinic bet despite outrage go course best tl dr could make original reduced  78  bot many thousand people took street across united kingdom wednesday crowd central london surrounded palace end effort suspend parliament launched earlier day prime minister boris johnson paul journalist book author political also demonstration london said calling people across join street put body line orchestrated overthrow british government johnson elite many left uk warned johnson might take drastic measure push deal brexit regardless consequence mandate womack said quot  039  think would make brutal move showed disregard parliamentary procedure extended summary faq version tl drs far feedback  23 autotldr pm comment monitored constructive feedback welcome top keywords johnson  1  democracy  2  people  3  parliament  4   5  
d16nnn,1567918003.0,hong kong govt denies protester death,leeta0028,289,5,online speculation spread accused police concealing death multiple demonstrator yeah anyone want cite credible source ear hong kong government made lot mistake inclined add failing debunk online rumor one died  8 n tienanmen square back  1989  online speculation spread accused police concealing death multiple demonstrator speculation closely monitored rectified prevent false notion spreading without fact backing deny death like work well removed 
d9c9tg,1569458924.0,donald trump claim mike penny also conversation ukraine president want penny transcript released donald trump made surprise claim united nation press conference wednesday apparently implicating vice president mike penny ukraine scandal,,64991,53,lol arrested development shit president vice president arrested best lawyer plot twist penny whistleblower guess gop reluctant take trump x 200 b going bring gop classic holding tiger tail wheel bus go thump thump thump even nixon turn agnew insanity holy shit trump consistently brings feeling completely shocked yet surprised weird mind state stupidgate intensifies good politics really get natural lol throwing bus guy going power pardon future hilarious trump spent large portion united nation press conference condemning allegation attempted zelensky hoax witch complained congressional investigation phone call investigation tuesday become official impeachment inquiry trump trump appeared call investigation penny think ask vp penny conversation couple conversation also trump said press conference quoted news site raw story trump continued saying expected congressional democrat also ask transcript first phone call raw story reported appearing reveal july  25  conversation zelensky first time spoken ukraine president elected april year also mike penny conversation think one two perfect perfect trump continued nothing wrong definitely also look penny wrongdoing read transcript first ukraine talk oh wait shit rat sinking ship beautiful deleted literally ratting vp classic trump fucker taking taking everybody donald baby doin rumor also called pelosi make deal whole ukraine issue get releasing whistleblower report lol desperate right well say would drain swamp right two turd one flush hurt confusion man child next thing know admitting hired someone jeffrey epstein fox news website absolutely losing mind right using every trick book hand deck spin muddy water wonder hardcore republican camp say beginning fall apart u ootl eat fucking asshole hilarious trying throw penny bus deleted deleted probably giving way much credit seems like strategic move gop may willing replace trump penny pelosi whistleblower mike penny damn really dry snitched vp deleted holy shit gon na throw vp bus try weasel guy unreal mean fuck penny trump even bigger coward thought lmao everyone knew trump would drag everyone going trump going going penny surprised pikachu face fucking hilarious maybe think throw mud people becomes le dirty  like eating trump biden penny drop one scandal definitely move country left fucking imagine obama asked foreign power look kushner dirty deal saudi conservative would going mad set bar low holding water would dictator think ever able respect someone vote time around sixty million american voted dense motherfucker wrong u snitch trump might likeable variation man fuck even going going try burn place way sloppy donny trump penny go get president pelosi lol trust senate republican right thing deleted jesus shit show guy trump idiot producer apprentice rescued crumbling shitty  70  building lived hamburger sale guy commercial fast food joint went bankrupt  6  time obviously smart every time come reddit excited think could end trump regime dissappointed every time year worried non story week like every thing else done thats move straight giulianis handbook amazing trump  6 ix 9 ine wow going alone huh 
dctf8m,1570120736.0,blocked  5  country import product believed made forced labor,speakhyroglyphically,162,11,iphones violate chinese labour law fine think apple admitted violsted chinese labour law also dont forget report child young  7  mine rare eath mineral colbolt used smart phone cared would address cuba nation dont like making human suffer mean slavery say country whose outlawing slavery specifically excluded prison labour prisoner routinely rented cheap corporation iphones best tl dr could make original reduced  82  bot product  5  different country seized custom border protection acting information good made using overseas slave labor section  307  tariff act  1930  quot prohibits importation merchandise mined produced manufactured wholly part foreign country forced indentured child forced child labor  400  billion good probably made using forced labor enter market yearly extended summary faq version tl drs far feedback  23 autotldr pm comment monitored constructive feedback welcome top keywords labor  1  forced  2  product  3  million  4  child  5  hello kitty called happy kitty logo walt disney handwriting yep china considering relies entirely chinese manufacturing funny  soo diamond except maga hat course 
df82z7,1570576207.0,turkey attack fighter syria forcing american troop move,Jozoman,683,25,u troop move safety damn sure backing anyone yet u turn back ally trump one recent great unmatched wisdom trump action given erdogan ability attack place troop without fear physical retaliation time b fear actual response aggression white house think nato ally attacked essentially u position bailed trump fucking pussy soldier back coward donald trump occupies white house betrays ally time ally suffer lethal consequence trump done yet damage america national security whoa whoa whoa forcing american troop move article title fuck knowingly abandoned attack came guess killing u ally helped defeat isi limit probably kurd funnel money trump personally using trump tower like turkey smell like mujahideen fighter oddly way saying kurdish people look like russia got another ally mid kurd prophet trump foretold isi moving plus  12  thousand isi prisoner probabaly get free one could almost say planned really suck tossing aside even though fought isi ally u would weary let hope something best tl dr could make original reduced  88  bot pentagon confirmed troop repositioned northern syria turkey chose conduct operation kurdish fighter backed washington quot syrian democratic force criticized white house decision step aside could lead turkey allied syrian rebel group expanding across northern syria without quot safe zone quot agreement syrian opposition lost ground government backed russia iran turkey remained embattled faction  039  last major foreign supporter extended summary faq version tl drs far feedback  23 autotldr pm comment monitored constructive feedback welcome top keywords syrian  1  syria  2  force  3  turkey  4  northern  5  always u bad guy every single death conflict republican hand fucking coincidence coward honestly understand turkey would take civil war opportunity carve kurdistan syrian territory maybe make minor territorial concession alleviating kurdish insurgency even coldest calculated logic would create kurdish fighter go defend newly established homeland inevitable syrian attempt retake much like syria jihadies forcing american troop move word retreat viet nam deja vu time get hell despised defeated u government finally forced stop aggressing hegemony dying fast thankfully hopefully government next super power retarded probably putin want isi return making sure putin keep raising gas price move way back u let sort deleted thought arming people political reason act terrorism terrorism defined 
do4jyb,1572240433.0,basic human right taiwan revel first pride since legalising gay marriage,vannybros,1832,17,hey good job real china lighter side group lgbt called pride meanwhile china hell yeah japanese uni student presentation today lgbt visibility best one far girl spent past week researching development event outstanding presentation seen  30  student country issue still poorly understood awesome stuff around taiwan basic human right america would like word would like state recognize taiwan independent country president winnie pooh wo like china use pride parade picture propaganda show country turn start adopting western cultural value missing word  dont understand british english going use letter z letter gayyyyyyyy taiwan numba waaaaan pretty gay lmao revel homosexuality actually say one human right rather basic bet citizen like damn let avoid traffic fuck want marriage basic human right merely artificial act officially long relationship like saying buried basic human right 
dx454j,1573891710.0,prince andrew state recollection meeting underage virgina robert although multiple photograph pair together,,189,18,defense fuck lot random underage girl deleted recollection sex perhaps refresh memory like cardinal george pell recollection royal commission child abuse hard believe vile predator ca recall epstein kill pope say satan responsible priest rape child funny ordained power god earth actually offer protection money sexual relation woman listened awesome podcast exploring connection appear run deep apple spotify air mile andy would better taking train sexual relation teeny bopper way andrew rest family well advisor staff would least known way facilitated fair photo girl look underaged young yes would guessed around  20  maybe  19  victoria robert claim andrew introduced queen official record proven queen accessory underage sex trafficking long prince charming ah old trump gambit removed pedo real question andrew epstein group effort think bill wanted give  24  hour hang self andrew wanted someone rape eye socket time lol underaged regardless fucked age consent paid something would known detail anyway chasing big name ignoring many disturbing question case decided automatically guilty without trial guilty buried prison comfortable pitchfork coming without due process 
