id,time,title,author,score,num_comments,text
ab36ix,1546226769.0,korea ban use disposable shopping bag supermarket,edwinksl,8930,81,cafe illegal serve drink paper plastic cup drinking inside unless taking drink go drink come mug deleted gon na see banns like china gave big push since stopped taking garbage rest world  2018  barely change business usual korea store etc bag would sell special garbage bag time would actually get plastic bag store cu israel introduced something similar last year complete ban forced big supermarket put  10  price tag bag sell big bag everyone want everyone included thought drop ocean ministry environment care reported  80  reduction plastic bag le year supermarket biggest user plastic bag fashion shop small grocery shop still use plastic bag stuff way fewer customer offer reusable bag personally basket bunch reusable bag simply take go supermarket convenient saving world still help deleted plastic bag banned town made lot difference amount obvious litter live austin thought dumbest idea world first implemented turn month thought awesome benefit shitty shopping bag littered everywhere made remember bag grocery shopping feel strange city go convenience store buy one soda clerk put bag say unfortunately texas state legislature infinite wisdom decided could tolerate liberal city bullshit overrode city ordinance thankfully grocery store seem continuing behave bag ban still place probably would piss lot people started passing litter reason potentially make little extra selling bag yet still courage ban one thing result litter anything else cigarette best tl dr could make original reduced  56  bot south korea ban supermarket retailer nationwide using disposable plastic bag attempt conserve natural resource reduce recyclable waste government official said monday subject ban outlet major discount chain supermarket sale floor space  165  square meter handing free plastic bag currently prohibited revised law bakery nationwide barred handing free disposable plastic bag extended summary faq version tl drs far feedback  23 autotldr pm comment monitored constructive feedback welcome top keywords bag  1  ban  2  plastic  3  shop  4  recyclable  5  uk research show people buy life dispose instead perhaps go paper know guy reused garbage bag home gon na buy garbage bag happens turkey ban free plastic bag set minimum price starting next year deleted iirc charged extra plastic bag last year australian shopping centre already decision really great see wonder much energy go making plastic bag v paper textile bag everyone switched bag would get rid plastic waste cost climate change maybe difference minimal anybody know still plastic bag get charged every shopping bag disposable wish could buy thick disposable plastic bag used supermarket roll use month lot durable reasonably sized disposable bag handle weight get hole easily especially useful carrying can bottle taking recycled heavier load trash net positive personally miss bag get banned around packaging waste though wish would get looked replicated every major country world citizen easily bring bag pay bag using proceeds sale combat pollution india completely banned added extra charge  10  year ago far good pretty successful introduce ban every country amount wastage saw saudi arabia made depressed global catastrophe avoided thanks murican come think great idea worldwide ca wait till u ban single use plastic put disposable shopping bag entire indian state maharashtra india mumbai banned disposable plastic period everyone switched paper straw wooden spoon biodegradable produce bag vegetable market everyone carry bag carry thing bring one store charge bag give one made polyester canvas generally street food people serving paper plate glass cup using wooden utensil good step korea would better change food packaging practice well since moving ireland one thing immediately noticed awful lot unnecessary packaging along nearly everything sold especially food good decision yes great good step forward take canvas bag take canvas bag small trash bag suddenly demand thats great something similar israel get plastic bag pay certain amount became thing free supposed pickup dog poo korea designated trash bag sold regional government control amount trash disposed nowadays plastic bag printed trash bag people regular trash bag bit expensive always get special trash bag grocery store rather paper bag hell getting soup home gon na happen bag used point wonder bad korea disposable shopping bag supermarket live annoying paper bag dont handle like strong arming buying canvas bag saving money korea box chocochip cooky individually packaged cooky wasteful good kim already place france see bad minor inconvenience lazy people germany done like  2  year ago ban usually come expense plastic bag cause taxpayer clog storm drain expensive repaired expensive repaired flood korea south korea best korea try japan old lady put little clear bag around individual item riot feel climate change need take drastic measure use plastic shopping bag need way save planet great boxed cooky still sold pair really want carbon emission reduction ought ban supermarket market general heard practical lot merchant mean already charged lot bag deleted hooray korean seem biggest plastic bag waster ever source korean banned supermarket australia actually big deal aparent benefit planet sure way worth ocassional small annoyance shit left bag home canada next pay disposable bag use reusables whenever remember still many disposable bag find way house also store use disposable bag biodegradable maybe way go south korea banning use disposable shopping bag supermarket whereas forward thinking glorious north korean already ensured supermarket never easily carried item shelf negating need shopping bag unfortunately ban elder living poverty car  300  pound plastic recycled practical separate get burned go landfill nobody problem know would inconvenient allow plastic car gunna lie first read korea ban use reuseable shopping bag deeply confused good  2  second north south deleted define disposable get time cunt even australia bogan backwater carry grocery stupid paper grocery bag fucking suck ca use bag clean litterbox plastic bag perfect california implement something like year ago surprised korea behind curve one also thing korea assuming south korea north know propaganda piece  1  come medium  2  country referred north korea south korea korea south deleted deleted korea mean south korea way nation called korea bad everyone delivery bubble wrap like half stuff bag people buy ton reusable bag dozen accumulate home huge waste resource money fire hazard worst stupidest law hope stop eating dog next dumb wow america save communism bullshit communism prevailed capitalism south korea future democrat want mustve voted kate brown office sweet garbage bag back 
aq03gp,1550015709.0,u commander north korea slowed nuclear program,,322,19,longer nuclear threat north korea trump go figure art deal kim may crazy fool look happened ghadaffi gave program really tough went back forth fell love ok really wrote beautiful letter great letter fell president united state donald trump reference discussion north korean leader kim jong un  2018  trump said nk longer threat mean isi defeated get wall paid mexico dear god thankfully repeal replace success russia investigation tell something know please would north korea good evidence show nuclear disarmament would nk interest look happened ukraine soviet union collapsed ukraine agreed disarm soviet nuke territory exchange guarantee protection nato case russia attacked putin annexed crimea west come ukraine aid north korean government may incompetent administrating economy smart fucker come remember time got massively downvoted saying extreme optimism trump meeting unwarranted since nothing productive actually happened yet excellent nuke day keep yankee imperialism away libya iraq nuke would suffered immensely yank intervention hundred thousand dead sanction alone open slave market horror unleashed well nooooooooooo shit donald trump relationship kim fell love alpha male telling like right red cap maybe reach something like shame one trust u anymore well yeah actually think nk would course giving nuclear arsenal would mean kim get deposed obviously want since atomic weapon cruicial grip ca give away expecting america destroy country hopefully world answer likely  90  world want cower appease wow shock thought trump good ol kimmy really hit shit reaching peace maintaining nuclear arsenal best option country planet see america russia israel pakistan india country nuclear weapon working towards one mismanaged already heavily allied nuclear power deleted 
arlv79,1550419598.0,translator japanese marathon fire calling african athlete cute chimpanzee,,189,14,felt like communicating caveman shy chimpanzee first little little opened also captioned video athlete cute sure funny sad messed oh god felt like communicating caveman shy chimpanzee first little little opened also captioned video athlete cute feel like maybe might slightly racist think best tl dr could make original reduced  77  bot woman worked several athlete africa including morocco ethiopia kenya south africa marathon ended february  10  wrote experience blog quot felt like communicating caveman quot quot shy chimpanzee first little little opened quot also captioned video athlete quot cute chimpanzee vast majority netizens side athlete woman though many expressed concern similar would judged country action one person extended summary faq version tl drs far feedback  23 autotldr pm comment monitored constructive feedback welcome top keywords athlete  1  woman  2  blog  3  country  4  marathon  5  mean cute chimpanzee kind good definition human read remark context especially communicating caveman bit yikes japanese map central africa  1930 s mom first time saw black guy airport step aside start praying something like told stop started follow eye embarrassing whoa japan lot gear day welcome asian country asian money dont like deleted chimpanzee hear japanese love shit flinging fetish white person fucking crucified japanese woman hoping beppu come appropriate apology athlete learn mistake move better marathon next year even international invitee deleted deleted removed 
bgcjp1,1555997135.0,microsoft worker decry grueling  6  day week working standard chinese tech firm letter github demanded company comply labor law limiting worker  40  hour week versus day standard,EnoughPM2020,3986,64,going worker tech company country used platform complain harsh working condition  996  standard industry philosophy endorsed tech billionaire jack name based idea working  9 am  9 pm six day week microsoft worker called chinese tech company comply local labor law limit worker  40  hour week maximum  36  hour per month overtime issue permeate across full time contingent job microsoft industry whole worker said history tell u multinational company pit worker race bottom outsource job take advantage weak labor standard pursuit profit microsoft letter said come together across national boundary ensure working condition everyone around letter initially  30  signature worker behind called fellow employee contact add name move latest internal tech protest february microsoft worker released petition opposing  480 m contract provide u army augmented reality headset letter signed  50  employee github repository repository hosting material called reference comment one poster said schedule could land worker intensive care unit user created list  150  company said inhumane working condition including huawei bytedance maker app tiktok ant financial associated alibaba quickly became one github repository service history starred time repository gained traction tencent alibaba mentioned list restricted access material browser letter microsoft worker called microsoft github keep forum uncensored available everyone repository contain list containing chinese company practice  5  day week work schedule list anonymously voting  996   955  company guide worker file complaint company via labor law rule usually court law according description used last resort list introduce encourage working tech firm outside china internet memorial page dedicated remember life ruined lost result unofficial  996  practice big tech company china list contains template petition complaint tech company dubious labor practice various labor department union call action company page information disclosure local human resource social security bureau requires disclosure work report plan action completely legal low cost litigated make complaint lose job chrome extension mark company listed named natasha romanoff black widow avenger english translation github page english translation repository origin  996  work schedule directly violates chinese labor law regulation miscellaneous info november  2018  google employee walked job report former executive ousted sexual harassment received  90 m severance package worker involved organizing protest reported internal backlash demotion action anecdotally people know worked culture people tend work lot slower total productivity per week probably lower  40  hour week tired worker pretty bad worker  12  hour day  6  day week yeah pretty much exactly hour pulled chef career person forced live like inhuman worked video game company rhyme actually rhyme anything activision  666  minimum  6 am  6 pm  6  day week compliance submission crunch wed often work upwards hour shift  7  day week usually day submission hour heard right straight shift also made  9  hour aaa franchise billion since contractor recourse quit health insurance paid time sick day benefit edit wrote billion another commenter pointed true meant billion total sale one major title worked broke many record several hundred million digital presales within month worldwide revenue exceeded  1  billion sale sale  90  worked tech company still well known microsoft three location staff project everyone knew word mouth manager location ranked term expense location u expensive canada next another country cheap worker subsidized government generally skilled wanted keep job job people around destroy number coming location cheap worker subsidized government number posted updated almost real time called lash shocking finally hear company complaining rather using weapon worker reason union exist fucking crazy people collective bargaining company give shit powerless peon utterly replaceable like cog machine collective bargaining negotiate equal amount power government regulation reason worker right without would literally slave rather metaphorically unless company reason work  40 hrs week wow even  40  feel like life stolen fucking ceo demand put prison realize born work rest life rich fuck billionares asking afraid new incetives  6 h work day  4  day work week people need giving health moneygrabbing company give slightest shit even die shift corporation want make u slave feel proud arbeit macht frei  996  slavery  12  hour day tech worker stupid tech worker good  4  hour intense creative work use mindless zombie  8  hour meeting tire make family life miserable burnt  30  year old start useful spending time plotting office politics make others miserable let real creative work four hour four hour learning new stuff find interesting find interesting kick work place work hour take vacation lol sure jack give ton fuck microsoft employee think problem free trade globalism suppose compete country type thing norm argue counter technology remember buy use exact tech others silly notion better chest beating come get educated go back teach others simply work economy endless race lower cost higher profit reason economy exist first place make sad m use real bad reputation come workplace horrid stack ranking system contractor exploitation excessive unpaid ot year took m redmond actually seen pretty nice place work misery china deleted hate seeing american medium circle jerk around jack work ethic incredible bring u success china level dystopian dictatorship capitalism anything anyone aspire aside low cost literally benefit either society productive output best tl dr could make original reduced  75  bot worker tech company country used platform complain grueling working condition quot  996  quot standard industry philosophy endorsed tech billionaire jack name based idea working  9 am  9 pm six day week microsoft worker called chinese tech company comply local labor law limit worker  40  hour week maximum  36  hour per month overtime letter microsoft worker called microsoft github keep forum quot uncensored available everyone quot extended summary faq version tl drs far feedback  23 autotldr pm comment monitored constructive feedback welcome top keywords worker  1  microsoft  2  letter  3  tech  4  company  5  james bond  007  never sleep sure one see slashed support na india moving fucking costa rica place almost like  4  time many people population value human  4  time le got stuck  12  hour shift  7  day week military couple month short learned give zero time alive barely enough shower shit shave plus sleep harsh seems taking communism replacing communism capitalism instead maybe replacing authoritarian democratic pretty shitty people agree participate  996  one stand human right encouraging supporting viable way worked six flag summer  07   08  think worked every day making minimum wage time overtime seasonal job despite fact apply next year current year park worked stayed open past christmas factory work hot af looking back though kinda fun almost summer camp feel go park like totally seperated rest world anyways suck factory worker though unionize already like billy boy know scumbag like rest nice philanthropist work oh aerospace industry u constantly  12  hour day workweek order rush software go know commercial aircraft life inside incredibly stupid deadline rushed work time source work industry unfortunately wait change career warms heart hope becomes standard across world ummm work norm yet msft employee frequently work dreaded  996  sound sort like work u global worker movement begun change anything le amazed resilience found hour nap take lunch day client although none work alibaba phd end would make sense doubt phd end working  72  hour week sound nice economist mean term competitiveness competitive economist wonder nobody like working hard still trying come iphone killer lol see repo link article include microsoft outsoucing software testing china india tech worker protest abusive  996  work schedule wisening true reality rich extremely greedy selfish boss ceo seek abuse worker like disposable slave dirty hard work take credit money company rich boss robs poor care worker burn die earlier overwork karoshi long get spoiled boss touch reality worker face classic say ordering worker earlier death much hour work course think problem limited china well problem already showcased country world many wallstreet entertainment firm nowadays still impose similar abuse term unpaid overtime weekend worker offshoring cheaper wage country le labor law india southeast asia africa east europe etc rich demonic boss must stopped think labor union justifiably organized first place industrialized era europe america  40  hour work week humane limit le simply put working harder equate better society matter many extra hour effort worker put boss gon na deny promotion bonus worker extreme selfish heartless greed know firsthand real experience one wall street got laid along many fellow unpaid overtime weekend work hour theft greedy manager ceo frequently using budget cut excuse rich idiot greedy swine ceo boss must taught lesson real life chinese government actually working hour highly unusual chinese worker apparently hour usually  40 hour week conformity socialist gain twentieth century billionaire want change government policy line profiteering might sound harsh tech field  996  seems normal hour restaurant business even united state american company outsourcing development circumvent u labor law absolutely shocked outraged game theory say eventually job coalesce locale labor law people worked death basically slavery kind working condition surprising microsoft product buggy piece shit ca force creativity people jack dick jack jesus wonder suicide bad american factory worker unfair complete china human right violation white collar america lol learn new skill leaf u white collar america wait think thing would happen u interesting peak capitalism come communist country deleted worst thing done day guy asia call still working almost ruin evening weekend shill scrambling cough feelgood gate awesome human published reddit soon hurr regulation always hurt business capitalism ya anyone else find weird article tagged mention brand every single paragraph smell like native advertising na removed theguardian seem confused labor law china whole point x z comply labor law complete nonstory thats japan win work crazy hour work hard since paid enough survive might always case seems way person know nothing reading thing watching ton anime japan little china much since often shit lol deleted removed 
bi87bx,1556430807.0,indian police uncovered islamic state bombing plot killed  250  people easter sunday sri lankan authority act,maxwellhill,3277,23,alternative source india quite successfully indian intelligence infiltrated islamic state ring track arrest afghan suicide bomber sent hit delhi india right sharing realtime intel terrorist sri lanka hourly basis thing seems serious still sri lanka india today issued travel advisory citizen concerning sri lanka u uk australia etc already issued small blast happened two day ago lankan police recovered weapon mosque slave island vigilance required edit india put national security guard nsg counter terrorism unit mobilized unit southern tip india sri lanka offered service sri lanka sri lanka said far need thing seems serious cnn journalist reported today three sri lankan mp tell cnn personal security officer received police warning could attack coming day planned perpetrator thought behind easter sunday bombing  5 egoogle  7 ctwcamp  5 enews  7 ctwgr  5 etweet edit 2  sri lanka issue decree banning form face covering tomorrow move come day parliamentarian submitted private member motion ban burqa security ground indian police warned sri lankan counterpart impending attack easter bombing rocked case fix later real full quote article time writing thought local islamic extremist responsible son wealthy people indian police warned sri lankan counterpart impending attack easter bombing rocked jesus christ business insider ai write bullet point poor communication kill damn guess indian government another country job country deleted weird many idiot reddit said uhhhh akschully sri lanka  0  problums mooslim terrorism dozen people need imprisoned criminal negligence anyone involved automatically lose job hundred died failed act disgusting best tl dr could make original reduced  87  bot colombo sri lanka monitoring usual channel indian police stumbled upon something extraordinary detailed plot would become bloodiest islamic state attack south asia police investigating suspected sympathizer withered caliphate southern india name record surfaced national towheed jamaat sri lankan militant organization authority say conducted coordinated easter sunday attack church hotel sri lanka killed  250  people nation  039  minority tamil part descendant million tea rubber plantation worker brought sri lanka southern india british colonial ruler  18 th  19 th century extended summary faq version tl drs far feedback  23 autotldr pm comment monitored constructive feedback welcome top keywords sri  1  india  2  lanka  3  intelligence  4  war  5  feel like successful terrorist attack one slip security police sure scary fact slip knowing many removed authority know deal situation must use ally india example  250  people easter sunday wrong world reminds binladen determined attack israeli set camp took photo  911  happening even knew happened weird shit always happens always warning someone dropped ball didnt act well whoever didnt act held responcible could fucking prevented maybe maybe fucked kid would charged lesser crime could got help needed completely totally fucked life life others like way go show exactly happens fail stand fucking something something chance deleted known onset need rub face sri lanka making right move aggressive investigation raid terror cell deleted due cival war ended  2009  basically majority think get two minority fight majority say responsible death seriously said deleted deleted 
