id,time,title,author,score,num_comments,text
ddb78y,1570213153.0,trump demand full house vote impeachment complying lawmaker,,1775,80,spoiler wo comply afterward either removed president authority give order congress deleted usual mr trump work even pass goal post moved vote start inquiry eat dick stop stonewalling innocent easy breezy deleted call someone dictate term tip tongue vote know anymore damaging shit like text message come wonder trump saw article  538  span week polling suggest people support impeachment propaganda video like hilarious watch back replace obama trump sure anyone tell start consequence level toddler operate lied cooperating believe time dear america behalf rest world would like thank highly entertaining show putting last year seriously though really going country anything exciting happening real world politics real president day transparent president history best tl dr could make original reduced  93  bot trump demand full house vote impeachment complying lawmaker president told reporter friday  039  treated quot unfairly quot house speaker nancy pelosi call impeachment  039  real full chamber cast vote updated et president trump demanded friday full house must vote democrat  039  impeachment inquiry arguing  039  comply congress  039  request house need vote lawmaker conduct impeachment investigation vote could give republican power inquiry extended summary faq version tl drs far feedback  23 autotldr pm comment monitored constructive feedback welcome top keywords house  1  impeachment  2  trump  3  democrat  4  vote  5  get care demand man child work executive branch dictate legislature work know senate put directly trash want go senate quickly possibly house stop investigating crime send senate exonerated cooperate investigation pretty sure subpoena work someone need tell orange assclown demand jack shit congress swear get stupid hour watch resign mean get beloved show politics fuck lying sack shit like think charge charming merry melody kind way nothing wrong therefore refuse talk police convicted trying force rush vote tax return go public going lot dirty russian money flowing last shred pretence die finally write definitive trump biography titled kicking screaming nothing constitution law house rule requires full house vote opening impeachment inquiry something wh trump lawyer thought explicitly president prerogative tell congress conduct affair pelosi house committee exactly book yes phd political science ucsd  2002  pony like want donald please stop finding evidence long try say impeachment unconstitutional something along line would shock suggested extending term removing term limit either even get choice dictating term cooperation think want house vote mcconnell try schedule immediate senate hearing lol ai gon na happen donny obstruction want one guess dictate impeachment president almost three year going almost three year almost become like part day cool dumbass dont say matter everything act like dictator sorry chump criminal position make demand bring shrubbery donnyboy get house vote soon enough overwhelming majority voting impeachment bother already know go back word second suit breaker law creator new one guess big mac clogging brain demand want donnie wo make true comply release tax return work lawmarkers ca demand thing work thought dictator told legislator oh well guess since mitch mcconnel wo take step without trump direction house next complying legitimate congressional oversight optional guess want accelerate impeachment timeline le evidence gathered stay farther away election day  13  month want bluff force democrat proceed without knowing information make riskier proposition democrat proceed likely large ramification  2020  republican right impeachment inquiry legal standing essentially made term legal power discovery right formal impeachment make sense republican would also try stonewall document witness request force vote official impeachment someone told better vote instead continue throwing data dems slowly erode support snowball rolling snow covered mountain let grow fuckhead fuckhead sure controversial smart move trump team err well lawyer may even right impeachment inquiry nixon officially endorsed vote house vote time around impeachment inquiry clinton use power house investigate special counsel investigated house voted based investigation hell see argument laid say would idiotic lawyer taken route possible house fail endorse impeachment inquiry vote interesting edit house democrat response showed pretty clearly would able counter argument make court compelling part argument opinion could use normal oversight power subpoena whatever document need trump team probably point democrat argument nixon part impeachment began house vote endorsing inquiry say subpoena conversation foreign leader require vote know constitution barely outline entire thing one sentence look supreme court done interpretation commerce clause thing work donnie boy sure republican senator obama supreme court nomination time choosing pay back bitch dems whine much loser crybaby point republican give guy trump best shot  2020  careful wish first two reply pretty much nailed going cripple united state legal system decade persecuting crony farce stop breaking law asshole think reason rush judgement american people deserve fair hearing fact happen impeachment committee interviewed respective witness opportunity review material produced via subpoena white house want vote impeachment stop obstructing investigation allow fact come trying get investigation news work fat donnie adorable think charge impeachment proceeding trump position make demand constitution clear unless think senate going let read article  30  republican senator would consider voting impeach seems impeachment real possibility step  1  tell people comply step  2  comply step  3  democrat congress order comply step  4  say white house told though step  5  congress collectively shrug check balance thing anymore apparently genius move trump literally making case could vote next week probably pas based trump statement alone trap time let supremes crown king kinda sound like know republican wo vote might well go hard demand let oblige good luck president trump enough political theater let go real deal deleted actor netflix show original let vote get already reason wo call vote make inquiry legit perfect response trump want impeachment need go process matter trump goal post move time quit playing dems game would accept going jail jury come back deliberation yet jesus judge neither 
dfqeh3,1570668721.0,blizzard hong kong become international incident,Frocharocha,1972,28,earlier different thread said something along line blow week long blizzard say anything stupid well played blizzard showed soo yeah win live stupidest possible reality told last week blizzard would take ea crown shittiest game company piss game around world would laugh yet stand looking blizzard company sits throne poo gg blizzard deleted man imagine precedent set sporting world punished voicing political thought would olympics even like anymore people know already canceled world warcraft subscription told blizzard exactly selected reason canceling going bend grab ankle dictatorship getting money may make much dent long run conscience clean anybody link something show playerbase dropping blizzard game want see actual stats big fuckup wonder going handle blizzcon next month bet cancel q blizzard final straw cancelled wow subscription let remaining friend wow know happening looking another mmo deleted eu citizen obstruction put place deleting account breach gdpr article  17  right forgotten play nice play fair blizzcon going hoot year fyi atvi stock price  1  past week like remind everyone company actively helped nazi found made sure buy product support oh wait ahem ibm ford volkswagen hugo bos kodak bayer edit seems bunch people think defending blizzard something point still boycott company profited atrocity like assume meaning quite ferociously next month blizzcon gon na something alright democrat republican agreeing something guess nothing brings people together like common enemy soft power great way win war thing obviously suck country either spends money soft power bullet good job china know who charge lighter note least know run country donald trump sad lost much hey sport corporation video gaming evrything america support right right capitalism like blizzard reject conservatism buying matter yet think blizzard gon na give week see much steam left tank many actual subscription get canceled who stronger wait see outrage impact bottom line western market otherwise genuine deleted reddit china hater moral outrage hypocritical hate china consumer every company youve done currently business also business china problem keeping moufs shut political issue gon na boycott starbucks nike walmart costoco gm apple ge many list computer led screen reading also assembled china gon na boycott company gon na boycott reddit sucka win china win china inevitable forget blizzard essentially owned tencent chinese investment firm deleted removed something called respect wan na profit china go insulting china imagine foreigner coming u profiting u consumer going saying shit u let california hawaii alaska texas secede said foreigner support secessionist movement support undermining unified united state think state department gon na nobody forcing u company business china kowtowing nfl owner boycott kapernick speaking mind criticism nfl old white owner young redditors dont know history young people day willfully ignorant 
dorza3,1572365381.0,white house official heard trump ukraine call offer testimony house impeachment investigator think proper demand foreign government investigate citizen alexander vindman,maxwellhill,29123,55,damn whistleblower anonymous source lt alexander vindman army officer nsc top ukraine expert oh wonder try downplay testimony laura hate everything anti trump ingraham already started campaign discredit foreign born fox news ran away shit yesterday hasnt even testified yet gop stoop new low attacking serviceman first trump say call perfect fine trump busted redacted transcript proof quid pro quo hearsay accusation quid pro quo bad eyewitness trump cult still support crook give america back attention span required read understand something clear cut nonpartisan vindman testimony read vindman opening statement posted politico deleted patriot sacred duty honor advance defend country irrespective party politics vindman goddamn right sir served country honorably upheld oath defend constitution enemy foreign domestic hope see supportive message message crazy right thank done country get back soon hooah like second phone someone ca claim executive privilege shit bed right wing medium nut trashing reputation without shred evidence alexander vindman embarrassment america donald trump straight murdered child live national television still find way try flip trump fan still defending bad people nuance true american patriot get fucked trump supporter anyone still supporting trump plan vote publicly humiliated gullibility idiocy man patriot every sense word republican still wont take objectively speaking improper foreign government investigate action u citizen soil background could even investigate nothing country intelligence service time x 200 b problem trump requesting dirt political opponent holding back funding forcing quid pro quo situation thwarting congress abusing power office get trump wanted side fund bunch independent investigator journalist chase biden son around even bad idea follow committee would shady maybe illegal republican support respect veteran yea support vet affect political agenda partisan main story republican committee member even attending listen gop claim tgat testimony countering trump come therefore must disregarded activity investigated like spree killer alton coleman cry couldnt get fair trial evidence white house fox news already trying smear patriot double agent right cue reminder seeming get enough attention trump making move make sure impeachment election using vague term promising militarized police going raid city go deems crook course trumpflakes already trying tear war hero earned purple heart cadet bonespurs avoided vietnam dancing manhattan disco heard crowd chanting lock made believer country right thing let enablers hook ever shame traitor make sure name stained history book trump gone enablers try use let unite heal country plea fuck bullshit time pay attack democracy number people heard phone call seems extraordinary many damn people room sitting u president making supposed impeachable offense seems must made call air super bowl  2016  republican dare current republican take step back fox news week take alternate news source consider alternate point view think president corrupt believe single minute commercial uninterrupted hannity segment fox shit still belief fuck abortion fuck portland removing urinal fuck illegal immigration piss could republican obama deleted imagine supporting bribery extortion witness tampering lying oath obstruction justice emolument violation dozen accusation sexual assault call people never trumpers never traitor never piece shit make much sense fair republican want bidens investigated want bullshit made whole cloth republican never interested truth add pile much perfect phone call hatchet job trying bring great leader thank serving country lt colonel thing seems reported fact trump requesting u citizen without court order church committee trying stop sort activity television reality show star obvious con man republican party one else even come close destroying inside matter presidency turn republican ever able make serious claim much care country even come close claiming moral high ground issue ever despair good people trump done u huge favor exposed party truly spineless immoral coward really never able wash stink matter hard try billionaire almost everything anyone want run president usually power trip billionaire government power would try help anyone else wanted help people would billionaire long story short one surprised he trying abuse power people finally think get rid coming forward jumping joy rid idiot get better news source article site cross liberal fox news highschool kid diary glad phrased way thing bothered trying force foreign country investigate u citizen really matter political rival business rival like guy ordering foreign nation investigate one citizen bad president ever require foreign government target u citizen regardless reason dude risk life foreign government could investigate citizen american hero worthy commendation next president patriot trump irony bonus one immigrant country putin irony bonus evil kgb putin served created instrument undermine putin greatest triumph room normal someone listen presidential conversation deleted really know keep focusing phone call rather cover went hide full transcript phone call feel substance need get potential impeachment really lie whistleblower reported correct amount effort went scrubbing full transcript alarming par nixon level covering track abuse power far conversation concerned feel wiped going get nothing deadends hearsay keep pursuing end pursue whistleblower claim might actually get concrete evidence understand desperate get substantial evidence extortion regard ukraine alarming say least feel like story keep going circle point trying find news trump tend wait  48  hour circle back see summarize insanity post  1  transcript memo  2  illegal ask foreign government get dirt campaign opponent whataboutism power trump felt biden shady plenty people american soil could asked investigate  3  vindman called action trump improper well illegal trump need follow law like would expect citizen impeach fuck guy sweating pressing two button meme support troop support president think possible political opponent worse never american terrorist never investigated say uk investigator proper attempt extortion done personal lawyer government channel know name many witness expecting next defensive tactic see told deep state legal guess never occurs republican anything believed republican mouth especially potus administration boot lickers 
dqlpno,1572708611.0,smuggler cutting trump border wall power tool,protekt0r,20107,98,worst part power tool made china one could foreseen tunnel fun start ukrainian remember tunnel found authority border local news smuggling tunnel length seven soccer pitch complete train found running beneath border slovakia ukraine along million contraband cigarette slovak government said thursday tunnel equipped small train capable transporting various kind good suspect also people interior minister robert kalinak told reporter ladder latest technological advance seems  16 th century solution solve  21 st century problem well whoda thunk anyone know power tool article referencing retail le  100  cut steel concrete market bustling town resided lively inquisitive boy known zest curiosity unique gift knitting townsfolk single tapestry shared story laughter lively resembling squirrel gifted boy enigmatic stranger creature named whisker brimming life embodiment spirit townsfolk tale wisdom shared laughter however unexpected encounter flamboyantly blue hound named azure plaything cunning opulent merchant set unanticipated path hound spectacle behold product mysterious alchemical process design merchant profit amusement returning encounter boy noticed transformation whisker fur like azure startling indigo vivacious energy seemed misdirected drawn putting show detached intrinsic playful spirit unknowingly boy found playing role puppeteer string tugged unseen hand whisker become spectacle townsfolk essence town shared story collective wisdom began wither recognizing grim change townsfolk watched unity shared knowledge got overshadowed spectacle transformed whisker boy symbol unity unknowingly becoming merchant trading whisker spirit hollow spectacle transformation took toll whisker leading point deep disillusionment playful spirit dulled energy drained essence reflection town tarnished act desolation silent protest whisker chose leave departure echoed town like mournful wind indictment allowed become boy left alone began play merchant seduced cunning word shiny trinket drawn world game slowly losing vibrancy sense self time boy symbolized unity shared knowledge reduced mere puppet plaything hand merchant eventually merchant extracted could discarded boy leaving hollow husk ghost former self boy left mere shadow reminder symbol unity camaraderie shared wisdom laughter withered lost thing  20  foot high wall lead  21  foot high ladder tool bought mexico mean mexico getting sale tax mexico paying wall profiting trump get owned wait thought new wall wait sec construction already well motto maga mexican always get across yes safe robber still using tool get perhaps different approach needed gop link arm along border form impenetrable human shield border wall required electronic surveillance required ice patrol required deleted course probably contract build one friend us sub par material charging ten time much big beautiful wall wait mean tell wall nation working asked germany mongol wall worked spoiler alert well could start scrapping metal wall make easy money show ignorance actually curious call trump border wall thought funding construction trump wall new fence installed border get much attention literally started building said wall glad investment paid wow almost like traditional wall next useless situation sisyphean wall stupid  10  foot wall create market  11  foot ladder thing called drone kind euphemism presidency hey guy let cross border fast wall turn around darn foiled stupid wall thought didnt get wall section built yet calling fence current blockade wall lmao expert surely cutting wall mean freely smuggling good border isnt good thing vote incoming couple billion invested wall foiled hundred dollar power tool sound par administration fucking joke haha joke used mechanic torch tell bolt asking wanted removed sure power tool good people going start chanting patch wall rally billion dollar crossing border anyone thought wall would impede traffic fool deleted fence jumped im going take whole thing x 200 b nobody deleted meth head started stealing copper electrified section yet ca walk around side well let see try cut way alligator moat worry make taller sad read many comment one mexican joker reference something put place bureaucracy designed poor engineering cost public tax dollar working way ok colorado safe homeland security knew weak fence really since beginning waste time money power tool require electricity make fucking shitload noise almost like border patrol wall solution anyone catch last sentence completely undermines headline rest article trump denied validity photo saying wall designed previous administration though one question made administration entire article author still unable confirm incident happening updated wall design could foreseen mexican good power tool carpenter battery tool le  100  cut thru concrete steel rebar article filled bullshit likely misinformation say happened almost  2  year ago one knew building wall could complicated deleted wall simply vanity project despicable cunt man admitting smuggling problem thanks reddit wish trump building real wall proving need stronger wall trump side going help cause could least use made america tool oh big beautiful wall would say wall better wall would fibbing shitty wall work damn mongorians like add thing unsupervised long enough someone break highest security prison world physically broken nobody guarding shocking news gone gator moat snake shark according custom border protection statistic  90  percent heroin seized along border  88  percent cocaine  87  percent methamphetamine  80  percent fentanyl first  11  month  2018  fiscal year caught trying smuggled legal crossing point wall stop coming smuggler good authority asylum claim counselor fuck trump trump wall story trump built wall others guess fuck care asshole gee thought wall absolute answer border issue mean anything almost like reddit want open border smh power tool made china made wall power tool serious fellow patriot time come need construct plasma barrier boarder obvious somehow trump brings alligator next day news smuggler eating alligator making boot skin think build wall provided wall constructed recycled plastic mean probably effective may never finished least would done something plastic wall people expect make explodium people dare mess great wall china could cut saw going build wall least right lol shit ca believe supporter lack imagination wall could crossed deleted pic clearly bollard need filled nuclear waste right jet fuel ca meme steel beam knew instead wondering drug coming wonder drug coming reason people there demand drug trade die instantly crack use legalize use ah holey wall old saying show  15  ft wall show  16  ft well let build wall hell build  18  yeah see point right whose point people build ladder way stop raid tower crow mk  19  every  2 k dead space covered ground sensor cellphone jamming system rule dog bee mouth bark shoot bee issue border even need smuggler cut border wall see wall work pic happen aw c mon guy even finished yet decency walk  2  mile waste fucking fund could gone infrastructure le mile completed literally flex wait actually started building wall request  5  billion allocated wall wait mexico supposed pay wall fucking waste tax dollar deleted colorado border wall mexico pay power tool 
e9oik0,1576162266.0,report trump ukraine extortion scheme financed russia,,311,14,rudy worked trump lawyer free parnas paid half million dollar work parnas paid russian source mean russian essentially subsidizing trump paying work lay dime money article point basically look like russian paid parnas paid guiliani working directly trump negotiating withholding aid ukraine would used fight russian ukraine announced investigating bidens trump political rival upcoming  2020  election removed treason sold country trump name eternally tied word trump traitor traitor trump deleted cheeto jesus christ mean trump never pay bill get money papa putin get already need president people conman make quick buck rudy arrest yet meanwhile federal prosecutor charged yesterday evening lev parnas associate president trump represented ukraine wired  1  million russian bank account week arrest say trump ukraine plot appears financed russia see lev testify senate trial ok ukraine thing seemed like really messed scheme get trump trump committing impeachable offense trying get foreign government influence u election order kremlin wait scratch kremlin actually paying trump commit impeachable offense wow take whole new dimension another case major corruption dare say act treason huge think putin get arm trump as wow huge bombshell wall closing president trump beginning end conspiracy trump liberal wo gobble edit deflecting conspiracy dipshits change conspiracy dipshit ignorant ha care either party america first money send fuel war machine giving ukraine  400  million first place look first money need say commercial voice 
