id,time,title,author,score,num_comments,text
fjczid,1584323577.0,new warning issued whatsapp imessage user major threat encryption,,1716,29,signal last hiding place guess dumb government backdoor mean easier hacker backdoor open backdoor nsa compiled later sold hacker take one corrupt individual million people vulnerable cool cool cool like anything else worried future suck hmm life modern west world becoming communist china want u like country cover information lead global pandemic fucking serious well shit fucking republican using global pandemic try slip make america even authoritarian feel powerless exhausted best tl dr could make original reduced  88  bot last year ceo messaging platform wickr acknowledged real need law enforcement telling quot completely legitimate understandable even predictable concern coming law enforcement elsewhere quot also warning quot deciding get access key mean  039  business determining  039  good  039  quot also warned open content platform quot go snooping user data use messaging apps nowadays increasingly shifting sm platform run network quot top quot platform like facebook whatsapp imessage whatsapp push encryption anyone else albeit security scrutiny secure alternative proposed extended summary faq version tl drs far feedback  23 autotldr pm comment monitored constructive feedback welcome top keywords platform  1  security  2  encryption  3  message  4  law  5  messaging service built like tor legalizing part behind scene privacy illusion american big brother always watching ya one concerned privacy pgp open source available everyone apps like pgp everywhere others edward snowden used pgp communicate encryption genie bottle would happen everyone started ending every single message sent collection red flag word president weapon bomb etc could make message scanning redundant hey least someone reading text mean apple facebook people expecting time dust ol enigma eli 5  whole world become china stupid question go would affect u based encryption wo drive traffic away international service vpn good use device connect internet hide ip mac address tracker see information location choose location app voyeuristic tendency criminologist always mystery many twelve year old girl talking using potty language versus many adult talking said girl kind like camera uk china allow criminologist study eccentric behaviour varies according culture think told mental illness prevalent previously thought public policy question whether american parent want criminologist perform kind study reason privacy conscious time start violent uprising across western world yet sure starting feel like internet death old company around almost century fight destroying within honest question would happen facebook google bought advertisement telling people tell lawmaker want law passed shared list public phone number email people charge passing law implication past message transaction whatsapp history going available affect new messaging pretty sure happening behind closed door since patriot act anyway care use telegram well u control really surprise anyone safer never understand user apps standard sm 
fpageg,1585224691.0,deleted user,,189,7,glad arrested sick fuck ahh love country intentionally coughing someone assault also battery classy turn actually would charge starting article risky hope put one spit guard charge attempted murder 
fwx5c8,1586309460.0,blackberry uncovers china backed hacking campaign,station13,15441,68,know blackberry company awhile china need sit nothing anyone link report article short detail surprising absolutely nobody paid slightest bit attention china last  30  year state sponsored hacking decade shocked fact long time hey keep buying cheap shit walmart sold u rope hang many time til blackberry still around still making phone ton tech deleted blackberry seems chinese contractor compromising platform including linux server give big tech carte blanche collect personal data dont shocked third party get hold sure misunderstanding sweat need detail seriously china c mon deleted seeing surprising lack shill guess still asleep common sense lacking west news old let use huawei good cheap right china say shocking let punish giving even product make u little information article tell anything information compromised much personal information need give read actual report blackberry come long way bbm tight encryption something true still love blackberry hope go far deleted sub phone construction third party blackberry key 2  love pound email quick computer text message send usually end person receiving calling ca keep love great phone good battery power run android bad watching blackberry completely drop ball smartphones world dominance short period time arrogance executive suite led ignoring iphone debut getting time little late blackberry  10  great o app devs wanted make apps good history lesson happens take competition seriously nevertheless ill key 2  forseeable future ca touch screen thing irritates call old fashioned care edit update youngins background info blackberry brainchild research motion small tech company based waterloo ontario hour toronto early blackberry look almost like palm pilot first phone able send receive email also light web browser worked data friendly using hardly website pretty like mobile text dominated liked  1  gig data would last forever waterloo time became mini silicone valley rim tech stock darling iphone came predicted noone would want calling toy stuck time clear wrong put together competitor took long hung security measure bb 10  released little fanfare android apple already cemented smartphone leader point changed stock name blackberry never recovered tonne patent pertaining security ended focusing still wanted make phone outsourced manufacturing incoming china apologist trying downplay article pretty well known china engages cyberwarfare admit publicly target west target country well hell patriot proud far reaching insidious country cyberwarfare capability edit better link fuck china everything cut tie rest world people realize deep china hand country trying bring  5 g canada spy everyone shady real estate market attempt propaganda country shady business practice etc canadian company broke news china state sponsored hacking method u data intelligence kind make trade war protectionism seem like petty behaviour think trying promote chinese govt hate think toned whole cyber warfare thing since pandemic would like remind many ppl working home unsecured network device food thought take action china redditors typed phone manufactured china wore clothes held mug imprint stating made china want stop china yell brick wall start outrage tncs corporation outsourced production product chinese owned factory protest government relation trade china easy yelling country likely responsible china growth power fuck china time sanction china back third world ethnically chinese racist china led corrupted power hungry fascist dictator winniethepooh yea every intelligence organization world actually shocked lol people think world  2 nd biggest economy military hacking next people gon na say u spy hack ally russia impossible deleted shitting u protecting innocent little china rage right way make past  10 k upvotes anyone surprised abandon china stop bowing dictator seems completely character china certain logical explanation mix minute blackberry still thing thought went away like telephone operator remember people believing china report rona fuck china fuck china fuck chinese government blackberry flexing still relevant dammit power play respect china back dooring tech made hacking decade hell chinese hacker used money maker red alert game early  2000 s like know got addicted cheaper product tech company got slave labor huge margin simply rely blackberry still exists appear like advertising software pose security risk nice admit trying tell people year advertising security risk especially implemented today every day nearly every website directing browswers load third party content background every single one potential vector browsing website like breaking covid quarantine go diner party every day seeiously fuck china til blackberry still exists hey china world feeling bit sore right maybe take hiatus cunt china fast becoming rogue state always need whistleblower expose recognize taiwan country hack talk shit ccp hack support protest hong kong hack believe tiananmen square massacre real hack believe ccp run concentration camp harvest human organ hack believe coronavirus came china engineered u military hack allow huawei  5 g country hack probably thousand reason ccp hack fuck china weird read nation opposite darkhotel hacker used lin shit quel grand surprise people need take notice china playing around world burn russia see opportunity running government sponsored program undermine destabilize west covid 19  want win cost see cheap place make good massive place sell knock knock ccp watching back day bb absolutely dominant business iphones viewed little toy company must quite mismanaged fuck thing badly early canadian tech company thought going china great opportunity tech stolen effectively destroyed double edge sword china remember nortel china gutted like fish thank world news complicit suppressive communist chinese regime come surprise since since day slick willie winnit pooh shit chinese found sudo stock exchange use linux technique talk disguising malware adware hardly new novel technique also mention android lead believe mostly o linux server generally ever adware call rhetoric cato used back roman senate carthage time fuck dem hoe spyin business conversation ever gon na anything piece shit country 
g7ud3y,1587824846.0,australian army veteran call access legal cannabis help treat stress disorder,,796,14,deleted stop also call mdma actually cure ptsd rather bandaid like cannabis maybe could get job canadian ski resort usually full pot smoking australian find low thc high cbd blend effective anxiety startle response father support marijuana usage affect son previously admittedly qualm busting condemning people using son need even breaking law previously upheld order obtain hide weed health benefit long get legalized survive nasty virus raise thiocyanate level like smoking tobacco also prophylactic guy happen believe legal every corner turned australia someone last much longer follow medical study say substance help given condition benefit outweighing harm robust clinical trial back allow regardless sydney brisbane canberra sunshine e coast allegedly even came across south park lsd decent ecstasy emu give 
gf62za,1588856403.0,chinese paddlefish one world largest fish gone extinct,,235,12,chinese paddlefish close relative around least  200  million year specie reaching seven metre length survived unimaginable change upheaval mass extinction killed dinosaur marine reptile like plesiosaur swam alongside time flowering plant evolved came populate shore ancestral home yangtze river china specie gradually declined last century thanks overfishing  1970 s tonne paddlefish harvested per year average aquatic food source worldwide continues regretfully example cod north atlantic shark shark fin soup depleted alarmingly low level soviet union almost drove several specie whale extinction communist beauracratic system demanded quota met even whale drug far offshore would unusable rotten soviet demanded sheer number order please central planner killed sake satisfying theoretical need nothing deleted chinese paddlefish extinct least  20  year already known extinct specie  2000 s textbook human activity pollution primary reason caused extinction article originally published  4  month ago may contain date information original publication date january  8 th  2020  per submission article published within last week nbsp nbsp bot find outdated article impossible  100  accurate every site difference time zone date format may little send message notice error would like bot added subreddit send feedback github bot github chrome extension let make easy animal chinese name wo around much longer best tl dr could make original reduced  93  bot study team looked chinese paddlefish hundred location along yangtze part ongoing biological survey entire river basin chinese paddlefish one two paddlefish specie existence remaining relative american paddlefish vulnerable specie found mississippi river basin united state lead image last chinese paddlefish seen alive  2003   039  declared extinct extended summary faq version tl drs far feedback  23 autotldr pm comment monitored constructive feedback welcome top keywords paddlefish  1  specie  2  fish  3  chinese  4  yangtze  5  assume went extinct due fact powder grind genitals give people boner must wakeup call sad happened used make sort chinese virility medicine humanity really pride perpetually fucking everything 
ghh1si,1589172619.0,coronavirus update china infection rise new virus cluster emerges,zerreback,132,6,attention protection team freeze isolate sterilize say mortal kombat round  2  fight china busy fighting democracy human right time fighting te virus well probably good relentless virus dumb question amnesty virus everyone medium referring disease 
hbmhgw,1592512640.0,indian mp demand government take revenge china photograph emerge spiked club used clash,,127,7,go trouble making instead using efficient sword spear revenge way economic sanction hitting china pocketbook absolutely totally agree strong language said signal best tl dr could make original reduced  81  bot indian mp thursday demanded government take revenge china amid wave public fury chinese troop  039  use rod lethal border clash earlier week monday night chinese troop ambushed unarmed indian patrol galwan valley ladakh piece contested territory china allegedly agreed withdraw force photograph apparently used clash shared across india indian army source provided journalist defence expert ajai shukla extended summary faq version tl drs far feedback  23 autotldr pm comment monitored constructive feedback welcome top keywords chinese  1  indian  2  india  3  china  4  ladakh  5  china asshole  2020   1320  mean really plague riot article spiked club killing wont end well india try 
he7jjn,1592884817.0,wa police officer escaped sanction shocking force indigenous boy,huisi,430,9,police agent state state always look henchman unless public outcry deafening deem cop much liability public relation throw wolf thing ever change country zero respect law enforcement fear son mixed parentage happened would destroy would ultimately end mental health issue fear authority possibly charge physically injured aboriginal men woman treated like law protect u call  1  cop loses temper slam kid ground  5  cop look way  6  bad cop best tl dr could make original reduced  90  bot western australian police officer dragged handcuffed indigenous boy ground causing head hit pavement escaped sanction incident internal investigation found level force used quot necessary excessive quot case highlight critic say lack transparency accountability way police australia investigate alleged excessive force officer reveals concerning detail way police treat bystander speak see unnecessary force footage submitted evidence wa police dropped charge de agreed open internal investigation use force boy extended summary faq version tl drs far feedback  23 autotldr pm comment monitored constructive feedback welcome top keywords police  1  officer  2  boy  3  investigation  4  force  5  though evident footage wa police said officer reacted belief male juvenile spat preparing spit someone tell police  2018  spitting dangerous told police take officer involved incidence investigation subject treatment boy teenager sitting hand cuffed behind back incident appears say something officer one grab boy pull ground two motion causing head hit pavement footage show officer using forearm press boy face pavement minute second officer pull boy leg behind body also lean boy remains pinned ground handcuffed five minute stopped cry indignity treated way tell level force used necessary excessive actual fuck wrong people like empathy even tiny shred humanity instant disqualification hiring process australia shade brown soon enough u witnessing white supremacy old colonial country thing different soon matter time government judiciary police army reflect hue actual population thing turn around quickly reason identarians neonazis brazen swan song deleted shit kid equal wa 
hgmqrx,1593230592.0, 2   3  doctor rural india formal medical degree study,,771,25,big problem due fact actual doctor want go rural area problem south asia x 200 b doctor family want get rural posting want urban education kid education rural area shoddy best general south asia pretty much anybody worthwhile degree want posted near city self get sick rural india parent used tell little township electricity local dentist would take patient small room next barn kept pig would strerilize equipment boiling water rubbing alcohol prior use also  0  schooling dentistry area wasnt india though southern brazil think formal doctor year training would take shit pay area toilet somewhat experienced formally qualified medical practitioner may still better none  1   1  potus qualification either still rather rural indian doctor handle life india urbanisation rate  34  actually majority population affected interesting pakistan report  1   0 f  3  pilot license report india doctor coincidence best tl dr could make original reduced  82  bot updated jun  27   2020  ist least two every three quot doctor quot rural india informal provider care qualification modern system medicine according india  039  first comprehensive assessment public private health care availability quality measured medical knowledge although  75  village least one health care provider village average three primary health provider  86  private quot doctor quot  68  formal medical training found survey village across  19  state  2009  researcher centre policy research new delhi cpr study found formal qualification predictor quality medical knowledge informal provider tamil nadu karnataka higher trained doctor bihar uttar pradesh study found extended summary faq version tl drs far feedback  23 autotldr pm comment monitored constructive feedback welcome top keywords provide  1  health  2  care  3  informal  4  state  5  even work like parent rural india persistent making doctor kid convince child technically get degree totally joking btw call doctor reality medicine men peddling cow piss kind hindu witch doctor treatment might little misleading india become legit doctor aka md become ayurvedic doctor essentially doctor alternative medicine considered valid career saying ayurveda bullshit thing homeopathy couldnt possibly work past placebo saying one go ayurvedic doctor impression md believe think help still called doctor though dumb opinion different culture idk like trying solidify stereotype point andy totally fix pc phone haz virus youre telling doctor india india seems fake china real pilot real doctor whats next heard ayurvedic medicine common rural india line doctor see  5  second hand twig leaf cure man could pilot pakistan doctor india degree history doctor china surprised india big problem corruption visiting new dehli traffic something else asked taxi driver people india take driving license different part world exception really fail get driving license final test done either money table table said people really good respecting speed limit even traffic low see traffic accident two week time traffic really loud though people india love car horn like pilot pakistan people wonder taxi driver say doctor pas certification people realize country cheat western immigration system claiming high education fact fake let hard working immigrant let rich corrupt one  1   3  people doctorate india md impressive actually way go indian mom pressure worked hiiii everybody indian man successfully translant goat testicle gall bladder order cure male pattern baldness correctly diagnosed result masturbating repeatedly neighbor shaved pomeranian spitz mix eleven man need go medical school else could possibly teach accomplished goat vasectomist tell huh 
hkfxrx,1593767953.0,history proof expansionists perished pm modi strong message china ladakh,_thestarkboy,183,7,israel laugh u dollar comment section like two car train wreck killed  6  passenger best tl dr could make original reduced  74  bot strong message china delivered height ladakh prime minister narendra modi friday said age expansion expansionists must learn mend way perish quot age expansion age progress progress future age expansion humanity suffered quot pm said address nimu leh district ladakh modi reached ladakh around earlier interacted soldier military hospital leh also briefed situation line actual control extended summary faq version tl drs far feedback  23 autotldr pm comment monitored constructive feedback welcome top keywords ladakh  1  soldier  2  indian  3  modi  4  age  5  expansionists like imperial russia usa might point end relevancy expansionism also bitterly ironic considering india shutting kashmir jammu let pretend kashmir jammu exist deleted 
hxsv1w,1595706195.0,spain drive fear european wave,Redromah,111,4,uk govt announced returning spain uk isolate  14  day pic wonder much protection mask offer trying make em suck country end community transmission second wave relax safety hope small short would case count covid death rate pretty much nil currently 
ivvof3,1600532823.0,brazilian wetland fire started human worsened drought,altbekannt,113,4,concerned looking solution list  5  thing  1  join relevant subreddits  2  plant tree browsing web make ecosia default search engine install app android iphone  3  change hurt shopping conscious probably biggest impact reduce use palm oil beef dairy main driver deforestation buy meat buy locally possibility try using bike public transportation often  4  share thought share related article social medium reddit stay connected  5  vote seriously brazil fire since last year clear solution nothing anyone chinese biggest export beef happily munching brazilian beef matter mad reddit get best tl dr could make original reduced  86  bot fire devastated brazilian tropical wetland region famed wildlife started human exacerbated worst drought nearly  50  year according brazilian authority firefighter environmentalist group analysis satellite image life centre institute local environmental group found  17  august  67  fire destroyed hectare started nine place five private property satellite image showed fire impacted  83  percent pantanal  039  bai aacute guat oacute indigenous reserve started outside border extended summary faq version tl drs far feedback  23 autotldr pm comment monitored constructive feedback welcome top keywords fire  1  pantanal  2  farm  3  started  4  region  5  land formerly known wet ftfy 
