id,time,title,author,score,num_comments,text
f0szsf,1581175646.0,british isi bride initial bid regain uk citizenship rejected court,hsm4ever10,633,29,honestly feel sorry woman mean willfully left country join guy fucking war zone really fucked interview couple month ago special immigration appeal commission hears national security case issued friday ruling said could instead turn bangladesh citizenship haha isi torturer well isi bride tasked hunting non sufficiently islamic unsurprising would woman ever pro isi good made choice live take backsies sorry sympathy death sentence deal consequence action best tl dr could make original reduced  63  bot british isi bride shamima begum  039  bid regain british citizenship rejected friday initial stage according report british isi bride shamima begum try use baby get back uk claiming  039  sick begum want go back therapy death three young child syria sky news reported british isi bride admits  039  brainwashed  039  believing isi hope second chance  039  lawful strip person citizenship person entitled citizenship another country sky news reported extended summary faq version tl drs far feedback  23 autotldr pm comment monitored constructive feedback welcome top keywords citizenship  1  begum  2  british  3  bride  4  isi  5  good fuck cactus good fuck even said remorse done would even reason want come back side lost western world smart except come letting piece shit country frankly surprised let allow play world smallest violin fuck given sympathy stay rot rest never made battlefield collateral damage sympathy nerve even ask second chance citizen treason never let fuck xd tried syrian court well guess getting new citizen canada trudeau feel sorry people history giving convicted terrorist citizenship instead uk choosing make kurd problem group limited resource house feed provide medical care idiot day take last breath british citizen problem deal kurd repeatedly called called first world country come take citizen enough shit deal instead stone walled uk cake eat claiming best human right record yet see problem making people stateless international crime subjecting citizen unfair trail choice either life prison death minute enough debate whether accept child rightful citizen repeat child even open discussion hate idiot want claim justice due process brit mean crime others fucking work enough shit deal take fucking citizen let country spend limited resource people house terrorist canadian would allowed back like canada take passing responsibility along western terrorist tried western court yeah tough situation  15  year old plenty young impressionable brainwashing thing simple know murder bad youre  15  good luck explaining one holding viewpoint world grey grey really stupid young kid till least  25  year age society capitalism truly skewed perception adult truly believe people change ive dark corner mind growing much older really see wrong thing thought charge making decision im sure would dont think writing die desert kid nation something would must road restitution allowed attempt cant turn back wheel time fix action must way forward story absolutely ridiculous designed make white british people hate muslim brexit result type propaganda fox news source guess anyone idea british girl like terrorist offer something 
fka9js,1584469539.0,deleted user,,8612,87,ugly rich deleted deleted know poor tell christina pazsitzky im surprised slightest happens everywhere never see ugly poor disabled person high end designer brand advert tik tok society cancer duh money fabulous perfect like finding ugly young female news anchor reddit thing except user one upvote attractive girl front page proof tiktoks true garbage nature hope burn tiktok spokesperson said goal prevent bullying platform tying document report december showed company suppressing vulnerable user video misguided effort prevent becoming centre attention could turn sour hilarious bunch user openly stated like certain content bullied content creator turn tik tok removed content altogether social medium company driven money social demand fine brigade person oppress unpopular opinion way company based public data signifying people want want okay human fucking weird probably people generally enjoy video prettier people subconsciously coincidence internet celebrity especially tiktok one average attractiveness like tv movie actor deleted funny friend sometimes reposts dozen time know find opposite tiktok supposed look like old creeper pedos super uggos developmentally wild ride vine never none shit ai never even ever never replacing tiktok cunt e fixed double negative cunt enjoy people like looking undesirable reddit pretend shocked regular viewer mom house podcast clearly failed must lot filter way fucked also representation social medium platform culture heavily swayed theme superficial influence representation society value tiktok spokesperson said goal prevent bullying platform ca bullied nobody see tap removed imagine coming home partner ask work today explain job find way suppress worse society ca get bullied nobody see video logic least understand watch mom house know successful business none u like average average looking people pretend like look morally superior nice novelty nobility unattractive people market secure care look fully accept something like unattractive people sell positivity exchange validation mass insecure low social credit score welcome exported china look like redditor could post video surprised tiktok trash thing critical chinese government let forget care crap social medium function nobody force anyone join go ahead tell one company filter ugly people thank god christina p well ya good looking rich scum society telling u entire existence see ugly people time disabled poor social medium platform like others good looking luxurious get ugly poor also fucking care thing run want something feature ugly poor people go make dont shocked one want give ad revenue though licking toilet seat ground classified disabled shit china forget little girl singing beijing olympics lip synching another little girl ccp standard appearance wise one actually singing absolutely cancerous app literally posted tiktok shit censorship lgbtq past well got bunch reply bunch privileged brat screaming filthy liar feel vindicated idiot use anyway think anyone using tiktok least tiny bit disabled filtered group became reddit userbase know shit stain app give af remember china owns tiktok fucking chinese running app fuck people expect deleted wrong sweetie mom bullied social medium awful one mean girl school social medium platform tell christina removed reddit care ugly people marvel movie reddit love ugly disabled people star war reddit love child made product vision tell tiktok business filter promote content however like maximize profit like reddit would violation right mandate internal policy business model must people cry free speech idea term actually mean applies tik toxic tiktok garbage chinese government garbage coincidence think wtf everyone mad acting like want see attractive people get high horse anyone using communist china shit begging trouble stop using liking shit tik tok fuck tik tok deleted weird every tiktok video see ugly poor disabled person seem recall basically need model airline steward singapore airline true chinese app expect censorship performed chinese app course surprised given tiktok chinese owned tbh tend discount people video due typically vapid nonsense someone attractively downtrodden population often make effort due perceived necessity try harder social network vapid shallow people us vapid shallow criterion selection video promote one shocked well awkward way realize ugly want see people app still creep porn plan plan c absolutely surprise true pretty old news swear saw month ago like  80  tiktok user mean skip mostly ugly disabled look poor thanks suppose vine would never people wonder body image issue fuck tiktok trash sorry mate got ta looking extra fine th platform ooo lost limb well bad see got skin disorder well get weirdo tik tok mod like people enjoyed watching seemed happy old news like sending everything phone china big deal tiktok embodiment stupidity user app try best make others drool excitement performing circus routine camera peoplw commenting use tiktok ive dabbled myswlf havebt noticed lot poor ugly ppl board decision china else expect everyone us retarded app never crap hopefully dy disgrace company true funny see entire human race like monkey savant syndrome trying curate wonder find weird one time lovely company really would expect anything ccp lapdog 
fww1bp,1586305136.0,jack dorsey founder twitter payment app square said donate  1 bn towards effort tackle coronavirus pandemic according mr dorsey donation represented approximately  28  wealth,liverpooltarheels,3110,87,psssh spend quarter fortune like twice week mentioning percentage wealth nice touch emphasize generous gesture thats much fucking money good gon na drag anyone contributing damn make everyone else look meager calling jeff bezos square employee met jack say extremely humble person earth square already done fair bit help small business time subscription fee giving away free marketing campaign pushing people help local business cherry cake honored work donation good human ca imagine donating  25  net work dollar holy shit pandemic disarmed fund go toward girl health education research universal basic income fucking man holy hell great least two great thing come money go finding vaccine buying much needed medical equipment saving many life  28  closer dorsey net worth donate dollar panda express word express gratitide good guy jack would like formally announce also donating  1 bn towards effort tackle coronavirus pandemic wow quite something well done stepping trying help pay attention bezos philanthropy meanwhile world richest man bezos please donate charity forever respect people like hat reddit hate billionaire billionaire find thats great tech billionaire especially one trying get mar bde give hope respectable wait flat donating starting new business called start small either way mad prop jack using wealth help others notice mentioned covid defeated switch focus girl health education ubi done like percentage added headline really generous donation humble thoughtful person totally nonplussed sort ego celebrity shit good fortune talk many year ago bit conference earth come good money something like good measure deleting twitter account person responsible exacerbating situation misinformation trump good guy jack fuck bezos x 200 b fun fact leave review amazon say good thing product bought end fuck bezos get deleted lmfao money good money point wow good one jack dorsey big percent anyone think jack look like little guy got would real donation quite bit going tech industry great contributing dorset ever shown remorse twitter role rise continued grip trump hating man awesome generosity either trying failing miserably funny b genuine arsehole stfu probably donated anything help fellow man probably keep opinion billionaire bezos good guy jack remembered holy shit insane exactly thing supposed work ca expect rich people waste money u american voting public people donate like know money actually used intended kind oversight seems easy money disappear people pocket honestly see billionaire u regular folk give praise deserves step bezos poggers billionaire getting serious covid 19  virus hope contribute world wide issue like  50  buck giving billion crisis actually increase value money would otherwise worthless existence vault could easily invested vanity project like space exploration earth taken care ca take care home cause neglect universe small price pay letting twitler run amok platform good gesture though quarter wealth billion people know get back  4  time smart person condescending comment way make sense decent sized philanthropy cried normal citizen wonder much super rich make selling vaccine wuhanvirus must lot holy shit also giving money via cash app twitter cash app square thing donation good wo eat one donating said pledge like peanut anyways better nothing dorsey look like good guy maybe trump give worth maybe debt due poor choice know nice hope follow dorsey lead although  1  r donating upwards mean wealth hey got headline minute selfie dying people rich people bad much trump personally donated since successful billionaire care much feel like people look number say shit never donated good cause better something nothing chill god hell yes hope make  3  remaining billion keep thought maybe like stop allowing known liar  76 m follower keep lying virus people went spring break thinking flu brave much dollar still billionaire look god next shut twitter half joke aside admirable donating claim tax deductible donation tax return mean good could hell lot good towards saving life banning politician spread disinformation virus daily basis even trump deleted pay due tax meanwhile donald trump pocketing stimulus like job done fucking talking thankful rich people fundraiser know could donate way giving u chump change take ryan reynolds great donated mil afik barely  2   75 mil net worth prolly closer  5  still lot could much good banning select people twitter hooray billionaire saving u sad thanks satan clearly good dude instance deserves prop let pretend sacrifice deleted bruh drop  28  wealth bill want cookie give lol worth  4  billion amateur need donate  72  longer consider disgustingly evil worker built twitter rightfully owned money jack gave away fine worker money go north  50  percent impressed 
fyf0hm,1586521687.0, 91  recovered virus patient test positive korean central disease agency,jay7646,124,6,one patient taiwan hospitalised nearly  60  day asymptomatic still test positive edit actually  78  day today test test viral rna virion still  80  day long as time free viral rna floating around health authority said virus highly likely reactivated instead people reinfected tested positive relatively short time released quarantine hopefully reinfection even reactivation bad current protocol around quarantine release may releasing people still potentially infectious well le stellar happened antibody treatment people recovered false negative let stop lockdown pointless 
g15mnl,1586871320.0,lego producing face visor day healthcare worker amid coronavirus pandemic,glennjersey,35981,214,really hope put lego peg stand mini fig nurse run ppe hospital lego city start new facemask hey build facemask help infected prepare ventilator treat patient help recover new collection lego city thanks frontline worker btw issue collector boxed set deleted boris johnson going buy mega blok version nh everything awesome making mask part team yeah tiny man contracted lego build face mask deleted lucky ever got playmobil goggles u gon na buy mask spend next  2  hour building fucking thing let pray u piece one want holy mask prototype unfortunately veryyy tiny would appreciate would assemble wear rather explore many different way put together making surgical cap old bed sheet house one hand real war supposed like civilian mobilise well hand go show shamefully unprepared inevitability known year coming caveat step one barefoot painful af snap circle top head everything canceled everything canceled cause covid 19  everything canceled stuck quarantine everything awesome right lego working healthcare industry perfect price already actually slightly baffled company something similar looking pessimistic pragmatic term pr perspective nothing good news shout rooftop definitely sweep away business practice recent past financial perspective ppe hot item right take bank regardless eventual vaccine situation hospital stocking never municipality around world lay see major weakness preparedness private company probably order hand future sick employee importantly guaranteed face mask going worn many many many people day day worldwide year come seems like sound investment tool start producing ppe regular mask mean friend mine costume designer making killing selling mask friend group thing going sooooo uncomfortable owning lego face visor would ultimate collector item want one literally thought reading  3 d printer guy making one visor per half hour internship factory molded test tube stuff machine could spew couple dozen every  30 sec granted need metal form custom made like  5 k make form one machine printing visor would replace hundred thousand  3 d printer massive injection molding machinery difficult retool machine make visor part good job lego fan clear making healthcare worker denmark still great thing tho ofc bet go together snap playmobil producing mask bad need knob head attach sorry first thought many piece kit lol pandemic use building block corona victim memorial face visor ant bad fit pinkie finger assembly required need one weird head attach onto always impress quickly place retool production line make something completely different probably worth pretty penny assembly required late party welcome everything awesome label brand name interesting artifact come decade one manages survive lego logo definitely would great museum piece show pandemic affect love spirit little small year landfill going overflowing face shield lol minifigure sold separately tfw lego doctor better ppe nh staff lego delivered pile lego outside everyone door outbreak would eliminated week time consuming thing gluing brick together puzzling instruction brick glue next make mask honestly find surprising given geared like nobody else injection moulding look like see solid wakeup call world least ikea assembly required wan na hear excuse visor least three time bigger however make big enough fit little lego head eyeing creator stuff news made place order good stuff lego building great way spend time period feel kinda relaxed zen removed well one way make something coronavirus regret stepping thanks lego bit uncomfortable take  20  minute assemble wonder many piece take assemble get build fun part great news desperately want big smiley face front recommended age range many piece anyone got set number yet lego lego also tried making protective footwear result le optimal happens ppe used get disinfected reused recycled step mask wo small though unfortunately  8  year old understand instruction use want one bad really proud company focusing production power ppe protective item honest question face visor sanitized reused seen hundred people making hundred visor take  4  hour assemble one though oh good least hurt step assembly required yeah got ta deformed head make em fit face shield ant least charging price god damn lego take easy  28  year old want build lego bugatti want giant lego hospital set fully enclosed well thought like modular maybe enough million dollar awful situation going company collaborate somehow imagine size mask separator create one wearing one go grocery shopping eye opening vorus hopefully mask rigid designed fit cylindrical head  60 mm across fuck pirate barracuda bay set backorder assembly required wear circular peg top head attach though wait stand one bet hurt like hell accidentally step crazy would think lego injection molding science kudos keeping visor unbranded lol thought title meant lego visor first lego ever fail double decker face visor thought going say lego producing fave visor far legomen normalize safety practice kid wow knew lego master builder talented really build anything disrespect lego look little short  feel like many thing going become collectible lego face visor louis vuitton face mask ford ventilator new name essential worker suicide squad anyone else worried single near single use plastic product end seems like everyone rushing make much possible trusting market happens mountain single use product used cranked known bunch people worked plastic industry know method using mould cost lot money make something flip switch whim guy definitely pothead safe crumble apart eventually awesome news although karma pain stepping lego barefooted many brick one take good especially lego producing bioplastic sustainable hopefully face visit also made sustainable plastic material especially since going much ppe contributing landfill ocean garbage patch man fallen river wait megablocks version could used much better picture actually legit seems like huge production per day guess multiple factory world way lego everything awesome part team amazing face sheild provider ton practice  100 k day look like safety google last july basically lost mind first time  25  year starting buying lego set unhealthy amount lego set feel better lol lego face shield would lose fucking shit coolest kid block asshole worker photo making mask isnt wearing hse isnt wearing glove horrendous would carrier every mask make carry huge risk lego building instruction deceptively tricky doctor dumb corona everywhere source doctor legally incorporate one lego build unfortunately tiny visor ant visor need atleast  3 x size step going buying lego stuff grown as man like supporting company give damn assembly required lego probably best company ever fine worker size lego figure step one barefoot could get touch city fort worth see working deal fort worth want  15 k specification public bet hurt badly step stan kingdom denmark lego continues favorite company miss opportunity include stud mask disappointed match system facemasks disposed cleaned reused mean stick mud number seems really low far manufacturing go hard retool assembly line automation retool something like imagining like clear face shield made clear lego brick unfortunately none fit due fact human head stud wo bit small capitalism finest hope one step one ouch unfortunately small use yea totally getting lego face visor sound uncomfortable wear personally assembly required papa told mama laura told nick build mountain brick brick fun game tread one end e lego well least better prepared real pandemic elaborate global preparedness exercise known event  201  hope crack like space man helmet contest obviously great lego reddit mocking pillow guy announced redoing  75  factory making  30 k day wo see headline anywhere deleted mine please lego logo k thanks making new lego whatever step hope look like mini fig helmet visor lol use mask prevent infection hey build mask prevent infection step covid company good precise mold creation quality control plastic formation process imagine advance notice could produce quite lot lego size look like made lego connect hinge piece  2 x 6  lego brick followed covering  2 x 2  brick question failure result mask breaking apart feel like lot people making face shield used need n 95  mask reuse supposed single use sorry woke thought tiny erk back sleep made smile heart warming see help many place people please tell spot add brick would soooo cool til lego even awesome previously thought got lego stamp stud collectible would hilarious still put block together create visor honest question anyone heard bad press lego like ever truthfully say never seen bad news article come need many  13 k day seems like small amount biggest toy manufactor world use illegal building technique honestly tho expect anything le happens step still u available unfortunately fingernail sized call lego swear step one mask gon na hear good job lego thanks part pull face smile serenely nobody particular friend made huzzah corporation quality like picture building lego thought love lego anymore need assemble first drop one step include one made lego going little small think wait lawsuit start rolling people stepped facemasks bad never going fit real people little face mask ant incredible see stuff like happening america day last time american industry shifted manufacture favor single cause world war  2  american car manufacturer began making tank shipyard began producing warship textile began making parachute amazing see happening america except different kind war threatens america industry thank  3  mean plastic injection machine get mold ready easily crank new part every  20  second faster multiply quantity equipment lego got serious contribution also good way use world highest profit margin toy company gon na something man river would like know lego location selling visor come augmented reality see virus real time floating air cost  100  everything awesome also hope title mean producing actual life size visor visor lego character lol vw mexico supposedly make respirator day effort big company fight virus warms heart even though know depressing cold true answer business move e clean uncle scba mask fireteam anything read first half thought making little visor lego figure tribute healthcare worker something reality make lot sense actual lego visor would adorable another high valued collector item big enough would small face mask fit friend minifigs  1072  piece  50  piece man contracted corona virus lego city god forbid accidentally step lego mask made denmark hungary mexico u clear lego something know needed man caught lego city hey build lego city face visor save day face visor ant lego hero child hero adult get feeling company mainly publicity get wrong think great providing many face visor seems like know news x 200 b also brings question keep hearing healthcare worker across country needing protective equipment ventilator time hearing company like providing significant amount equipment contribution making dent healthcare worker still need equipment trust facemask made plastic brick step night 
