id,time,title,author,score,num_comments,text
ab3esx,1546228495.0,footage show saudi hit team carrying bag believed contain body part murdered journalist turkish report say,AWACS-Thunderhead,2022,24,anyone know turkey managed get audio recording murder mean consulate bugged someone working inside deleted best tl dr could make original reduced  85  bot video footage leaked turkish medium show saudi hit team istanbul carrying bag said contain remains murdered saudi journalist jamal khashoggi whose killing sparked international outcry jeopardised kingdom  039  relation western ally video show arrival member team saudi  039  residence istanbul day khashoggi killed inside saudi consulate several hundred metre residence last week saudi king salman replaced ibrahim former finance minister first cabinet reshuffle since killing khashoggi extended summary faq version tl drs far feedback  23 autotldr pm comment monitored constructive feedback welcome top keywords saudi  1  killed  2  khashoggi  3  turkish  4  murder  5  report using acid dissolve body dispose drain false rumour would love u stop business regime like saudi arabia china remember quote james bond movie refused business villians almost one trade stop fucking around release tape people expected keep story like without actively sniffing every report piecing together like larping  1950 s noir detective first story shocking interesting many new finding murder getting hard tell story actually reporting significant development trying make minute detail every news outlet may well publish scheduled report every  2  month say khashoggi story saudi arabia still bad call day x 200 b discounting gravity khashoggi murder want news reported without repetitive desensitizing drivel anyone site piecing together every piece new information case coherent story mean fail divulge information america truly back bone ally saudi totalitarian regime full stop end engagement selling blue jean rock n roll like everyone else demand better right citizen remembered tiny hand president ugh apparently erdogan still pound flesh managed coerce trump leave kurd slaughtered want ksa like regime change story really help fill huge gap know khashoggi murder hopefully another story let u know material bag made part bag much weighed etc sour relation west far know seem gotten away president toupee even back read headline footage show saudi team hit carrying bag believed contain body part murdered journalist turkish report say wondered could get anymore cartoony evil realised original phrasing cartoony evil misreading quick trump announced reconsidering pulling syria come let give break already know seriously already know know nothing become shit take time  24  hour news station deleted perps used bag empty wish would resign using fossil fuel nation sink darkest well poverty complete monster gradual reveal going continue heading holiday season wait usa invades country said publicly fight trustworthy saudi trump good friend trump belief cia patriotism real question check ah yes let detail come saudi hasnt punished yet dafuq even care ppl die time million starved active war zone idiot think journalist toxic behavior towards saudi government got deserved meddling affair kingdom fuxking democracy voice matter entire land ksa inherent property saud family speaking ppl issue first place think voice could change anything need u oil counter iran stfu snowflake 
abe300,1546309712.0,venice charge enter city,glasier,181,14,replace tourist tax pay hotel bill anybody stay hotel legal airbnb pay targeted cruise ship whose passenger come great number spend little money venice making current model unsustainable smart move economics  101  would suggest put tax reduce consumption case visiting tourist socially optimum level bhutan charge  250  usd daily tourist would gladly pay obviously tourist infrastructure damage brought sale tax people spend many spend next nothing best tl dr could make original reduced  82  bot venice charged euro  10  enter famous lagoon city authority continue grapple ten million tourist visit every year report italian press suggest could added cost arriving city either train bus cruise ship respective transport company passing proceeds venice authority venice visitor already pay tourist tax spend least one night city extended summary faq version tl drs far feedback  23 autotldr pm comment monitored constructive feedback welcome top keywords venice  1  year  2  authority  3  island  4   10   5  venice officially museum sad since really lovely city must awful experience visit crowded tourist attractons deleted spending million yacht fuel get spend  10  enter city think made money absurd take boat somewhere else venice charge enter city doubt extra charge deter visitor since people see venice romantic city reality nothing overcrowded sewer system think many people even realise ha thought meant people eating lsd day walking around wowee concidering pay  200  parking spot  10  much amount money also get half cup coffee venice remember come summer smell canal paying  20  cappuccino imagine outrage american city great way ensure wo go europe anyways suck well people 
akrsin,1548708121.0,activist calling mariah carey cancel upcoming performance saudi arabia kingdom alleged human right abuse jailing woman right advocate,ahm713,46956,112,sure get right hibernation time year christmas season another  10  month heard may abused human right surprised even let show wwe contract one fierce stipulation female wrestler shit saudi got butthurt one show one female caster fuck fly checked one republic enrique iglesias jason derulo preformed john legend mariah carey next edit also dj gon na preform edit  2  awkward apology everyone read comment thought saw somewhere john legend really preforming find actual link meantime try find thank sorry like mariah carey give shit anyone mariah carey would stop rest world alleged hilarious love satire post major artist middle east sometimes cancel found long go back oil tycoon birthday party uae publicity dy alleged yeah cause get em change way see guy coulda mariah cancel u stop business saudi yall think drunk old bitch care anything money ha mariah bill mariah sings hmmm cancel show request bunch noise maker buy music whether show take payday gee wonder going alleged human right abuse fact saudi arabia let woman perform surprising mariah carey care normal people performing mean support human right violation logic perform anywhere else either country violate human right boycott usa europe human right abuse state sponsored terrorism war mongering sings wherever fuck want pocket cool million maybe tell saudi fan cool trash keyboard activist ever achieve well one could argue presence western artist especially notable female artist like mariah carey others contribute changing perspective around woman right generally encourage liberal thinking among citizen government person grew middle east stop whining let people enjoy shred westerner get year round people benefiting saudi arabian citizen mariah carey fucking care probably going voted oblivion successful woman however got matter fan go show woman country become stand said country safer group plenty u company job saudi arabia also cancel business thread full blatant sexism absolutely littered uninformed baseless attack mariah saying sing anymore stupid say least absolutely need convinced literally mariah carey sing check performance singapore  2018  furthermore lawsuit sexual harassment orchestrated vengeful stella bulochnikov really want tear mariah woman literally black mailed mariah mariah bipolar disorder anything woman claim trusted go burka stage male chaperone singing lady need eat wo isolating reclusive kingdom western culture make next generation culturally conservative jesus til reddit hate mariah seeing kind rumor flying around backup cancel willing bet find b say lmao matter cancel guy gig gig sing get paid mariah cancel concert need dress way regularly usual choice garment would sort form protest sa question going perform abaya mariah carey dj tiesto sean paul agreed perform saudi arabia choosing money respecting basic human right leave black mark career choose go ahead arab live oppression like american artist american ideal like freedom fun somehow government allows american artist perform denied freedom fun american explain would better mariah carey western singer go saudi arabia perform try poison mind youth western value something like like saudi arabia going say oh mimi coming guess better stop killing people seems like would productive actually try integrate citizen country western society rather feed u world mentality make people likely accept western value well maybe might something saudi arabia actually got full embargoed going happen happen prefer many american european performer possible go perform activits twitter troll think outrage let dictate behavior sick term alleged fact anymore like saudi terrible human right record fact nothing allegedly tbf got free ticket see christmas performance human right violation bad maybe punishment saudi arabia need help get track seen perform last ten year know number one mariah care wo cancel love much mariah law pretty sure know public execution point among many thing entertainer political activist want sing make money li ten ha many rea ons  1000  zero knowledge story bit silly boycott israel genocide war crime massive human right violation terrible person bd people need burn hell also terrible person boycott saudi arabia equally despicable human right violation sense entertainer paid entertain nothing money money taking dollar west take dollar middle east difference world power evil responsible death suffering around world activist shut fuck focus cleaning house complaining others want end human right abuse start government get house order moral police back duty guy going quit driving car running suadi oil bullshit position take would surprised many activist work corporation contribute way human right abuse climate change social injustice number societal ill also pressured take moral stand stop working forego income alleged alleged funny sa highlight human right issue unless willing boycott chinese made product saudi oil etc b platitude maybe boycott saudi number  1  weapon supplier wait u quit taking money many company business saudi pick singer carry flag need comprehensive sanction sa denying concert let girl get bread shutting wont change anything culture influence think canceling performance bad idea performance country open communication help exchange idea performer beacon hope oppressed embolden powerful embrace modern ideal deleted get mariah downvote mariah different standard u gov hell even land gig kingdom pretty much epitome wahabists long selling billion dollar weapon l think make everyone get pissed entertainer want put show instead fully focused  100  government look like stupid ignorant cattle giving weapon kill people let start end discussion right instead getting distracted meaningless nonsense matter like whether someone sings yeah play concert young saudi arabia need exposed western culture much possible granted best example still may give young people inspiration achieve wouod ilamic theocracy everyone insist punishing people country fucked leader private performance terrible people one thing stupid take away event people terrible mariah carey stop giving performance country condemn saudi alleged human right abuse cared would agreed gig first place yeah get right worry alleged know help woman ksa people exposure world know help telling people go ban deeply getting queen since bohemian rhapsody movie came played south africa apartheid heavily criticized response people south africa punished act regime much eloquently course since reading sure feel mariah playing saudi arabia decade mariah care anyone mariah saudi woman really excited see mariah get woman totally different country said mariah shameful use term activist everyone tell everyone live feel think day like something believe something fine keep let people make decision vegan great lecture eating meat cruel think show agree super buy ticket need people tell show ok show cancel promise give fuckkkk ah yes human right abuse allegedly moon sky right might know maybe meteor blew sure considered maybe mariah carey would cancelled anyway sure drunk perform alleged pretty sure proof saudi oil rich charged anything mean everyone still filling car gas publicity stunt never life performed saudi arabia suppose medium shining light leader publicity stunt come brave woman said saudi arabia insert political issue oh yeah boycot saudi arabia genocide yemen etc come fuck fucking care bourgeoisie singer go saudi arabia sing going give shit war crime crime humanity shes way self centered give even remote shit mariah carey like honey badger care give shit care money highly doubt cancel seems like board sa never heard anything remotely positive character fact ever heard horrible selfish narcissist also quite irrelevant day way cancelling paid work especially christmas jailing like killing woman really expect mariah money bitch feel like even need tell saudi arabia pay good money real good money also gon na perform going burqa ok government still selling arm priority guy world took stand south africa apartheid end  1980  hard world take stand saudi arabia  2019  guess money outweighs moral conviction rich bitch dont give fuck would scheduled fucking first place piece shit american icon guess saudi get fuckin nasty people money would wear hijab performing let go maybe get taken hear another god awful performance news mariah carey calling activist accept next paycheck alleged human right abuse shes prolly heading pick new maid killing dismembering khashoggi time magazine put one guardian truth kidding performer go money lead would probably performance woman beaten right amount money let woman make money everything political statement mean one perform usa due human right violation commit time anyone honestly think mariah carey give flying fuck human right violation care pay check xanax wine probably order lol arrested dude dabbing yeah going wear full burqa refrain moving performs would worrying risk liberty seen support illiberal regime sympathy aid help saudi way deleted maybe go provide example woman capable achieving mean perfect role model mariah carey rich woman life much like rich saudi princess without patriarchal shit power woman starting get little like see someone go let woman know world paying attention care sometimes take musician bridge divide dave brubeck russia long time ago truly broke ice led cooperation country present difficulty notwithstanding complex issue hate see sanction boycott deprive innocent access life warmth spirit contact vital geopolitics imho else supposed perform 
aq0dyw,1550017506.0,senate proposal would block saudi path atomic weapon nuclear deal,howabouttits,719,15,please country nuclear tech weapon sa never given blatant killing reporter etc oh brilliant idea let saudi get nuclear technology nothing could possibly go wrong trust north korea icbm trust saudi arabia nuke kind yet stood trump sabotaged destroyed nuclear deal blocked iranian path nuclear weapon agree saudi arabia currently much militant warmongering iran closely allied funding terrorist group seems retaining block nation make lot sense would stupidest dangerous thing america could right trump hold burger giving home wahhabism islamic extremism nuclear weapon program terrible idea guarantee saudi arabia acquires nuclear weapon going start giving terrorist group like daesh make dirty bomb give functioning dirty bomb best tl dr could make original reduced  79  bot washington senator party introduced resolution tuesday requiring deal share nuclear power technology saudi arabia block kingdom making nuclear weapon measure civilian nuclear cooperation agreement  123  agreement saudi arabia would prevent enrichment uranium reprocessing plutonium made reactor two route making nuclear weapon reactor builder westinghouse owned brookfield asset management inc would likely sell nuclear technology saudi arabia deal extended summary faq version tl drs far feedback  23 autotldr pm comment monitored constructive feedback welcome top keywords nuclear  1  saudi  2   3  arabia  4  technology  5  ok use commercial airplane u next time obvious isil legalized would love nuke use give terrorist friend call saudi arabia call isil legalized given unstable middle east tends anemic saudi military last thing need getting nuke trump kush probably lot exaggerated winking lately eyelid muscle getting good workout least good give fucking lunatic bomb smoking gun something something mushroom cloud real call dumb thought one wealthiest state world already nuclear weapon iran others fuck right jesus christ politician refuse acknowledge safe make nuke plant want make ksa wtf dumb want pretend china security risk telecomm infrastructure country ever get hand weapon middle east screwed u favor uke mecca pls k thnx bye 
az2pkr,1552131993.0,united state citizen need visa visit europe starting  2021 ,epique,3383,70,also apply u new global policy everyone take chill pill  5  euro take  10  minute complete misleading headline etias european travel information authorisation system etias visa u esta electronic system travel authorization imagined system similar esta system united state eta system canada electronic system travel authorization esta automated system determines eligibility visitor travel united state visa waiver program vwp however cheaper  5   7  euro v  14  usd valid three year two u system imagine eu wanting make u exact thing u want nerve itt stupid tax u american outrage u done year european one u cheaper valid longer time pay outrage saved trouble u citizen actually butthurt  3  year take  10  minute smooth relatively quick entry entering eu eu citizen traveling u  14  valid  2  year enter u need endure least  90  minute inefficient immigration hell fair eu citizen paying u visa tax year balanced last edit grammar deleted european version esta hardly visa deleted get visa go canada u seems fair u citizen require visa visit country within european union  2021  absolutely false statement incredibly misleading headline implementing electronic travel similar already existing scheme u canada australia many country already eta visa eta cost buck done minute website visa much lengthy process typically get something stapled inserted passport  5  euro need charge  12 eur like esta surprised earlier funny part esta supposed promote tourism payable department homeland security almost like found way fund dhs independant state  77 m visitor u year bring shade  1 b cash dhs etias esta eta unnecessary tool tell traveler welcome day age absolutely possible check departure scanning passport using biometrics country align agreed upon passport biometrics standard mean extra check like etias everybody else must easy carrying valid passport watch trend general concern instead making world le restrictive least within realm country similar value arrange simpler mean traveling opposite good stupid u requires eu state stupid eu going require u said thousand time pleasant enter eu u citizen return u u citizen cattle pen wait photograph take fucking dehumanizing also fuck premium service allow take priority screening line like already pay enough shit tax understanding everyone saying getting visa take  10  minute process acquiring general visa uk definitely case get appointment homeland get biometrics taken location exactly numerous process waiting three week pay  70  buck shipping along vfs accepts express courier service visa living n stuff literally esta system usa us title clickbaity applies country currently visa exemption much ado nothing require citizen eu going require u everyone else nation right control border sorta fundamental sovereign nation official added etias authorization visa source read article note article updated clarify visa high time shit returned back going u nightmare form visa security check wait get invasive body ton intrusive question f ing tourist planning spend money guess give push getting portugal american need visa go europe work joke wo able afford travel till dead u millennial right american going get arm approximately  36  u citizen hold valid passport people left america lived another country  6  month would see shit country education health care public transportation totally ok basically visa small fee got one went australia trouble suck hate applying visa  3  month visitor visa  1 st world country perfect including visitor coming america thank european bros sister explaining big deal since waiver last  3  year fill travel old time knowing traveling point next  3  year new european visa apply eu country schengen like romania bulgaria need one already global though u lol major news affect  5  yank passport visa travel approval vast majority case done online approved within minute negligible fee le  10  good  3  year planning schengen country  90  consecutive day yes go usual visa approval process includes contacting consulate additionally u includes canada country well article break pretty well come boat north africa still skip finally usa requires visa even layover paid much money passing country  deleted dual eu u got ta keep considering way u heading soon steady stream refugee illegally immigrating american wanting move europe whats difference visa passport  80  american dont even passport point agreement travel visa free create tax like til already thing article need reported removed misleading electronic travel authorization nothing like visa apply eta even arrive port entry whereas must apply visa even travel visa need added passport issuing country love dual nationality world traumatizes usarians passport plus brown skin american german gf always bragging point passport came travel travel country show fuck whenever want ohh well ill argue passport look better wait need one fuck meh seems alright going see le man june good know affect ability criminal history travel abroad paying dollar make line end go faster getting custom amsterdam took bit time visa passport need europe australia yeah apply etias u citizen need valid passport email account credit debit card eu said need email account people really tech savvy typical visa source make sound like go embassy spend  100   5  euro like esta program glad getting italian therefore eu citizenship next year show rubber dinghy claim refugee etias website european union said recently decided improve security level avoid problem illegal migration terrorism know funny usa would perceived negative move curb legal immigration administration u loos dominance rest world rip apart decade bullying meanwhile african free relocate permanently documentation approval process world insane good really big deal american least likely travel abroad anyway united state dispute eu european parliament european commission visa bulgaria croatia poland romania cyprus traveler five country eu nation u requires apply visa require tougher check texas florida visit eu come ukz definitely part europe wo need one really stupid 
b1405d,1552588773.0,stop justifying italy pm tell judge,snicker33,110,3,italian justice renewed scrutiny recent year prosecution amanda knox conduct mignini holding particularly well regarded slow biased unprofessional latest fiasco particular sentiment ugly raped going help fight prevailing opinion judiciary italy europe india never heard term sound buzzwordish 
