id,time,title,author,score,num_comments,text
emcdm9,1578588913.0,report iranian missile system shot ukrainian plane tehran mistake iraqi source say,,102,11,pretty big mistake leave government would benefit hurting ukraine adding chaos u iran also shot mh 17  russia mean retaliation regardless mistake everybody knew best tl dr could make original reduced  67  bot ukrainian airplane crashed outside tehran tuesday mistakenly struck iranian missile system weekly newsweek reported thursday citing pentagon official senior american intelligence official initial iranian investigative report said thursday crew plane never made radio call help trying turn back airport burning plane went iranian report suggests sudden emergency struck boeing  737  operated ukrainian international airline early wednesday morning crashed minute taking imam khomeini international airport tehran extended summary faq version tl drs far feedback  23 autotldr pm comment monitored constructive feedback welcome top keywords iranian  1   2  official  3  ukrainian  4  crash  5  knew report guy mistake mean rocket headed way mistake hit airplane plane completely turn ball fire unless something go bang hit something hit knew suck suck civilian pay ultimate price heard around  60  canadian board trudeau mad majority iranian assuming say leave fuck give u clarity levelness dear great spirit sky baby jesus preferred hero choice go whatever option make happier ooh get list unites state accidental attack could fun start hospital bombing afghanistan obama paid damn shame life let hear democrat iran calibrated response trump reckless attack 
emqsrm,1578662282.0,iraqi prime minister tell pompeo mechanism troop withdrawal,JLBesq1981,2335,58,deleted u leave iraq one way nobody want sure everyone interest done peaceful civilized way deleted best tl dr could make original reduced  66  bot iraqi prime minister adel friday called secretary state send delegation iraq quot prepare mechanism quot troop withdrawal country according friday statement associated press reported advertisement iraqi leader asked pompeo quot send delegate iraq prepare mechanism carry parliament  039  resolution regarding withdrawal foreign troop iraq quot according statement ap reported quot prime minister said american force entered iraq drone flying airspace without permission iraqi authority violation bilateral agreement quot statement said extended summary faq version tl drs far feedback  23 autotldr pm comment monitored constructive feedback welcome top keywords iraq  1  u  2  iraqi  3  country  4  troop  5  alan greenspan served chairman u federal reserve almost two decade stated saddened politically inconvenient acknowledge everyone know iraq war largely oil de facto annexed eastern syria entire iraq part afghanistan look like much progress made last  20  year front situation actually deteriorating rate troop still  2040  let sink way succeed fully integrate disenfranchised community area world economy educating giving proper job livable wage emphasized since people proper job engage conflict one another go limb say one item going happen state going leave strategic location long enmity iran edit note support stance see unfortunate reality edit oh look right cue title read acting iraqi prime minister resigned last year massive protest government nothing slow stop corruption basically one step away proxy government iran also noted whole vote entirely partisan shiite member voting passed slim margin sunni kurdish representative mostly boycotted vote despite iranian funded backed kataib hezbollah straight threatening would equivalent mob chicago calling city council vote threatening member pocket violence show plenty iraqi absolutely want u international force leave country regardless actual law cabinet would make formal designation rejecting invitation u troop country parliament vote matter disgraced former prime minister acting u leave laughable trying save face american dream one day industrial military complex go away good neighbor world want friend partner sovereign prosperous stable iraq gon na whatever fuck want country gon na totally ignore democratically passed resolution even though bitchin importance democracy yeah seems like partner sovereign iraq iraqi pm talking like one charge couple thing firstly vote kick foreign troop still unofficial non binding could change though secondly officially vote remove u troop lengthy process possibly year longer lot asset theatre need retrograded remember barely day ago trump said iraq actually want u leave would open terrorist occupation bullshit yeah something good may come american troop forced leave iraq nobody fight wwiii starting shock awe end whimper ah gon na occupy hostile country like big deal awesome statement signaled sending delegation iraq discus withdrawing troop well going iraqi troop show gate say time leave opening fire would look really bad mechanism troop withdrawal mean like catapult suggest trebuchet iraqi regime think equal american regime u army occupy place long want iraqi govt indeed say whether america stay iraqi land operation iraqi freedom as time go good luck iraq agree people iraq imagine isi would look like american way queue resurgence isi  3   2   1  hey want let go isi return tell shove base r belong u hope everyone aware iraqi parliament accepted pm resignation december prolonged protest due tie iran still office replacement named outgoing iraqi pm resign bc iranian influence administration one calling support idea seems relevant shockingly included article would cause harm power vacuum free reign jihadist reason kurdish people want trump move troop syria pricesily power vacuum someone confirm deny whether iraqi prime minister actually said soleimani iraq talk saudi arabia please use original source preferally video arabic article one lying pompeo stated soleimani diplomatic mission breaking sound leaving note fridge roommate fucking dish awesome iraq probably want afghanistan want troop leave money keep flowing disappointed sadly withdrawl back syria kuwait iraqi pm watch drone unless planning illegal coup wo even power much longer basically stripped power waiting upcoming election usher party office get michael isi capturing territory iraq end year mark word russia say hello pm forced resign currently serving interim basis due outcry public nothing mouthpiece iran government real authority make demand good right finally leaving iraq  17  year even embarasses trump see problem got white helmet coach lying idle somewhere isi get going pretty funny trump biggest part middle east getting kicked know spin know truth trump take credit getting american soldier iraq iran saying seen report u preparing leave iraq want make seem like u told iran equivalent telling someone leave got done telling room going head brigade criminal clown washington understand care going request like gon na happen ya idiot reddit paying attention past year obama idiocy pulled troop isi unless would like another group like anyone feel like constant terror attack provide stability reddit understand iraqi prime minister tell pompeo mechanism troop withdrawal let door hit butt way easily done use army occupation iraqi government function u military governor easy pompeo make pretty awesome get dick slap iran maybe kinda dick slapped get pull iraq pretty fucking awesome let get go back ever isis 2  enjoy iraq hey america bad guy suck everyone iraqi want insist trump idiot due self serving short sighted action make early exit trump played right russia china iran hand iran iraq invest nuke happen plane perhaps form trebuchet iraq failed duty protect immunity embassy violated right back personally bit killed notorious terrorist get bring troop home bit course iraq soon known western iran problem anymore deleted bomb door mechanism failed b 52  accidentally carpet bombed house sorry happen u leaving iraq remember happened last time military leader said leaving potential disaster soleimani death blow next crisis sadly another crisis one constant today 
etkrfo,1579919068.0,china virus death toll rise  41  infected worldwide,DoremusJessup,148,15,probably lot worse trust statistic released chinese government alright virus messed time officially name kung flu whoever playing plague inc stop really actually big number far number people infected go feel like death infection ratio pretty high though anyone confirm ai bad finger crossed start throwing exponent end number  deleted number sticking pretty close exponential growth rate little scary hold remains infection rate week crossing  100 k infection within month reach billion way shit accurate medium controlled china like u number way higher multiply number  100   1000  bet nearer truth matter thats plannned use people biological weapon excuse mess knew virus since late december last year wuhan still waited last minute chinese new year knew people china travel world blocked city day chinese new year knowing people travel abroad everywhere day timing wrong virus spread faster planned think canada fault goddam glacier melting releasing ancient virus onto planet none would happening single person telling get shit together keep ice frozen sheer apathy astounding best tl dr could make original reduced  77  bot china said  41  people died new coronavirus infected people globally health authority around world scramble prevent global pandemic latest death occurred wuhan epicentre outbreak virtual quarantine china scramble contain virus spread vast majority case confirmed death date china virus also detected thailand vietnam singapore japan south korea taiwan nepal france united state hubei  039  health authority said saturday  658  patient affected virus medical care  57  critically extended summary faq version tl drs far feedback  23 autotldr pm comment monitored constructive feedback welcome top keywords health  1  wuhan  2  virus  3  china  4  authority  5   bullshit friend wuhan reporting live weibo real uncensored estimate death right let ccp xitler squad fool free hk revolution time 
euuk31,1580159744.0, 45  million chinese quarantine official try halt coronavirus spread,I_Mispelled_Mispell,605,12,thought  56  million put context roughly population size spain paper modified coronavirus produced unc north carolina usa university attempted engineer virus surface protein shc 014  coronavirus found horseshoe bat china backbone one cause severe acute respiratory syndrome sars mouse hybrid virus could infect human airway cell caused disease mouse according team result published nature medicine national institute health report well report biroxiv give evidence coronavirus associated recent pneumonia outbreak human potential bat origin interaction bat coronavirus spillover potential among rural resident southern china  2005  team led shi zhengli cui jie found sars virus originated bat result published science  2005  journal general virology  2006  key laboratory special pathogen biosafety shi zhengli currently wuhan institute virology chinese academy science wuhan china mentioned paper may one best people area help imagine sudden rise birth october november china really want buy conspiracy stuff find hard believe total confirmed infected  2700  hundred thousand population density damn high low number area stay home dont try get risk making thing much worse knew would come back bite could effective way thin herd damn trump done messed usually one perpetuate fear mongering chinese serious think need pull one north korea play book meh another flu like sickness china business really appears great government practice running drill laying siege major population center people population  45  million coronavirus kill  3   3   45  million million people would make  1  total population would killed update  106  dead something infected  2  death rate china 
f9km99,1582678060.0,coronavirus man receives medical bill test returning u china,PartTimeSassyPants,12801,111,lol joke someone might virus guess great way spread virus around expect normal citizen contribute eliminating potential risk spread hospital waiting charge u simple blood test nasal swab mr azcue told newspaper never thought would u combat pandemic without universal healthcare assume without medical insurance would seek medical attention currently living korea going back state even start calling evacuation actually health insurance corona test free u proving yet shortbus medical world oh potential global pandemic level virus better charge thousand dollar way general population avoid going doctor help spread like wildfire welcome home maybe thing finally get u health care instead diabetes patient rationing insulin however many absurditis system anyone working service job without insurance sick day becomes super spreader never get tested infects million thanks universal healthcare fun literally save civilization something also help spread virus people want pay test day seems getting worse worse think stock canned food water stay home insanity cdc already said today spread u look like gon na spam canned fruit right virus outbreak particularly bad u healthcare unbelievably hilariously fucked going countless citizen showing symptom choosing stay home hope best deadly disease rather seek medical attention face financial ruin top guy getting billed  3500  actually owned  1400  insurance covered rest cherry top government expect citizen pay thousand dollar get tested aid containing novel virus mind boggling criminal irresponsible hope damage done really hit home u citizen absolutely broken healthcare topic fixing front center next election yea probably would get tested story already hospital charge  100  quoted cost physical therapy visit american health care system broken deleted american confirm absorbent medical cost especially coded medically necessary removed jackson memorial hospital mr azcue received test told miami herald bill way man give shit hell enjoying corona get loose general u population going get good demonstration significant downside style capitalism happens country allows healthcare monetized fucking profit matter human life basically u least equipped deal considering worst healthcare system earth well great way make sure virus spread many people possible gg america criminal one reason chose stay china health insurance cover china even chinese government paying bill foreigner relating covid  19  fear caught way back resulting bill would ruin went uc davis two month ago severe lower back pain saw intern told exercise one month later received bill  450  covered insurance fuck shit pay dime canada saying american wan na pay stupid shit like know vote would happen medicare sayin maybe finally show american need sort universal healthcare current medicare none policy u health care system privileged enough insurance pay nose premium nothing covered greatest country world least know sure back home america starting sound like one shithole country trump talking massive healthcare bill crippling student debt huge wealth distribution disparity mass shooting climate change denial rolling back environmental legislation list go hospital cartel time bring lawsuit hell virus test ever cost much yet another reason medicare could help everyone like half greek yearly minimum wage u think drummed actual threat global health safety insurance company salivating great way discourage people getting test symptom joke lol heard usa ridiculous medical cost taking piss price like coronavirus gon na spread like crazy usa noone going bother getting checked lol oh america misuse capitalism m 4 a deleted disgraceful people country fall one  3  category abject poverty working poor paper middle class anything massive debt combination credit card medical bill student loan fucking classic late stage capitalism well go strap seatbelt hey guy america great right wow nothing like discouraging people testing highly dangerous virus highlight ridiculous medical system hey least using form socialism someone somewhere getting super rich u healthcare joke supporter traitor work medical device company provide health benefit ironic chest pain went emergency urgent care open  11 am  6 am  6  hour testing mostly waiting doctor released cost  6500  insurance pay half spent  80  time waiting test result going go third world try negotiate philippine father hospital bill talk way appropriate health care citizen developed country insurance company going go bankrupt enough people get infected many people wo able afford pay going ask bail crash entire economy way medicare notmeus u strategy suppress infected figure since counted afford get tested america complete shit people actually say one best country world blow mind shit wack ca even fart canada without ambulance showing asking diarrhea want taken treated thank god live state backward as hill billy place another opportunity big pharma profit many people go ahead knowing price shit scared ignorant lmao greatest country world fkn joke poland insurance group risk travel abroad recently etc cost test coronavirus  500  pln  126  usd insurance really risk test free rest  3374  usd go u u concerned people avoid hospital thereby spreading virus australia current concern excessive strain pandemic would place hospital system people afraid every show free testing unethicallifeprotip get free go hospital ask cost test look shocked refuse test start coughing around look sickly usa land free sikeeeee america actively pushing people get tested welcome  2020  vote bernie america yep m 4 a tell good thing fuck sake human stupid lol got ta fucking love american medical care yeah fyi china testing treatment corona virus completely free charge u healthcare gon na u healthcare guess sooo ehh build wall instead health system virus stay fuck united state united state yalls need sort fucking government ridiculous socialist society pay medical expanse population usa wo pay coronavirus expansion poor choose get tested healed gon na profitable epidemic ever everyday ask even worth living usa anymore someone please direct explains health insurance situation got way right u specially medical bill price got astronomically inflated insurance company allowed refuse paying treatment even though valid policy holder love explanation take timeline event available trying explain situation u friend familiar probably realize existence lol murica pay die potentially take others nothing like punishing disease prevention murica worry free market sort put simply healthcare monetised period every fucking thing respective distopia australia mine monetised beginning right end bit death merely slave make daily excuse justify slavery lead horrible understanding actually free bitter pill swallow go doctor cost money spread virus far wide possible worth money medical industry deleted ah yes u retarded would thought shithead support public healthcare need smacked back head getting test done best interest rest society people get smacked ridiculous medical bill le likely get tested allows disease spread insurance case wondering like breakdown cost er test bet test pretty general new yes still stupid also presented er thought might sound like correct move u best bet u call county health district bet freak test free health district actually tracked gave tb test hospital waiting room someone tested tb test free healthcare received adult news like people wary going hospital even symptom proponent uhc least get enjoy perk think pay uhc like long wait time get infected also get choice public place pickup virus may know healthcare system u expensive get country get medical checkup public hospital le  5  gl need almost like health care company want people get sick public interest test free obvious repatriated china would subject insane medical cost likely u insurance expat u joke fuck medicare solves bullshit also wtf cost watched tv debate czech eu director major hospital explained buying test kit czk  430  kit used  50  test basic cost one test  9  rest medical work insurance company profit italy test free come home test avoid potential spreading case turn infected tested  9000  people insofar  323  found infected  11  died none strictly virus old weak already ill case people wonder italy many coronavirus infected people test thousand people found many also come italy china blocked quarantined happens move inside italy infected region non infected one read country around world really weak protection protocol even europe country test come china say mom went urgent care breaking pinky toe confirm broken buddy tape toe put special shoe bill came  4000  uninsured fortunately qualified discount got  400  welcome america worry sander going win november pull america kicking screaming  21 st century virus hit america going hit hard one going willing pay get tested flu corona virus glad american little extra pay tax mean hospital care covered deleted healthcare crisis healthcare system clearly work well situation however couple contributor problem front line charge unaffordable approx  100  time caused treatment centre run private enterprise rather public service little price regulation enabled private insurance industry essential get care accessible highest earner need least poverty brings health risk little regulation industry fundamental cause ideological primary objective healthcare system making money providing care design become tainted ideology demand sometching people pay shall provided well people pay thing happened university access credit reporting management ton background social mobility access problem america visiting u  4   5  time year work number people living bridge outside gas station stagger plus mention work colleague visited emergency room  4  hour diagnosis shingle received total bill almost astonishing make job company provide health insurance plan america thing get stupid hope never get bit unknown animal like bat turn rabies bad coronavirus disease either pay die deleted course usa think free murica going suck canada american come spread sound right feel bern murica murica murica country health price tag american heh day ago american absolutely surprised dismissing people telling virus apperance italy le devastating usa healthcare work better great affection america culture good people living fucked vote get rid slavery public healthcare seen normal everywhere western world point paying tax private company going fuck as painfully every scratch 
fgkn7y,1583872805.0,u apparently providing support taliban isi,DavidCarraway,310,32,also fund russian leave enter get cia train charismatic tall slender man wealthy saudi family beautiful natural beard leader code name nedal nib amaso spent trillion fighting taliban end power territory started war giving weapon america fucking joke lol like  80  much next guy fucking part visible confusion let sgep 1  pay people attack country step  2  act like war step  3  step  4  profit step  5  become friend mean said time point said imagine conservative reaction obama done thing awkward going end well wonder trun future u helping one terrorist group another look happened last time helped terrorist group afghanistan take long go negotiate terrorist negotiate aid terrorist promise play nice u hard nose republican party work warhawks ca win war fiscal conservative consistently cause economic recession christian hate neighbor patriot freely offer freedom seriously worked well first time never ending cycle enemy enemy friend bin laden left behind fortune much taliban pay trump make happen surprising forget cia raising fund selling opium american good falling hole dug history repeat often rhyme hear leave piece shit god forsaken land forever come full circle jfc pathetic read like satire wtf wrong timeline would scandal impeachment proportion obama isnt aiding enemy treason war terror best thing u ever helping terrorist maybe trump invite taliban come hang trump tower like bush invited hang governor texas one read article however military official told task purpose limited support taliban mean two thing suspension air strike taliban force engaged fighting isi something discussed directly taliban use air strike known location fighting strike coordinated taliban official said course article never specifies limited support airstrikes isi position taliban attack arm logistics enemy enemy friend imagine obama u likely want prepare another future attack launch yet another war billionaire arm manufacturer mercenary company got ta leech dollar seventh yacht somehow seems like shitty source fanatically insistent calling taliban terror group afghan government removed forcibly u invasion course u funded trained fight soviet  80  would different 
fhwejh,1584088020.0,coronavirus make namaste greeting trend,,166,13,namaste home trump seems love trend well considering germaphobe spend week namaste country think way better need shake fat sweaty stranger hand want sell something like drive racist crazy alabama currently shamble best tl dr could make original reduced  87  bot last saturday prime minister narendra modi asked people panic said quot world due coronavirus outbreak shifting towards greeting someone handshake namaste mean forgotten use namaste right time prince charles started trending spotted greeting people namaste london palladium march  11  recent instagram post bharat actor asked fan stick namaste salaam coronavirus outbreak control extended summary faq version tl drs far feedback  23 autotldr pm comment monitored constructive feedback welcome top keywords namaste  1  people  2  coronavirus  3  hand  4  greet  5  wave going live long prosper accompanied vulcan salute go wrong sound like last day decided going use vulcan hand sign star trek live long prosper good fucking hate shaking people hand even fist bump would better  outgrown namaste prefer break ball instead 
