id,time,title,author,score,num_comments,text
fah8ng,1582831090.0,coronavirus update japan closing school month,,594,20,wonder would happen school system rely class number funding would people hourly job salary job could possibly make could hourly worker survive living check check must really gotten control decisive action wonder country follow lead countless misleading headline official policy request pm abe school required adhere point time many likely exactly parent situation like imagine similar scenario u would wreak havoc parent ability afford month extra daycare babysitting ultimate snow day go spring vacation  2  week anyway basically cancelling school  2  week mean serious measure quite drastic seems headline kid thinking get pas asian mother homework every night deeply disappointed best tl dr could make original reduced  69  bot coronavirus fear prompt japan close school month goat soda prime minister shinzo abe said quot putting health safety child first quot asked employer help worker cope temporary shutdown japan asking elementary junior high senior high school close week reopen spring break end april bid protect child japan fight contain coronavirus quot next one two week critical importance quot abe said laying plan japan  039  novel coronavirus response headquarters thursday extended summary faq version tl drs far feedback  23 autotldr pm comment monitored constructive feedback welcome top keywords japan  1  school  2  coronavirus  3  close  4  abe  5  article say woman contracted virus recovered thought got sick virus developed immunity united state would take measure like one except school identified active infection site student already getting sick trump administration united state may ever take measure like due negative impact would workforce therefore stock market would hurt upper class trump establishment negative impact would trump  2020  presidential race shools japan hell froze coronoavirus conspiracy created daycare boost revenue netflix watching surge worldwide right whole month npr making seem worse two week left school anyhow two week vacation yes equal month closed school little sensational order make conscientious effort contain spread virus suspending school activity school already tuxedo mask anime industry stock skyrocketed beneficial child hope hiatus brainwashing result adult longer accept slavish working condition student yay school parent study doctor study even school  8  hour day 
fizbkw,1584267735.0,chinese community offer u  28  reward killing stray dog appeal responsible dog ownership wanjiang community dongguan take sinister turn resident encouraged kill animal found lead,johnruby,105,19,stop people killing people dog disposing mean already declared dog cat transmit bloody point awfully barbaric whichever way look get every country share value come pet dark gon na breed buncha little serial killer jesus least eating  28  also include gutting skinning cutting bite sized piece know popular say first world feral dog terrifying seen child ripped apart pack wild dog like pet forty fifty generation living street turn wild predator flea louse covered mange worm sort sickness shit everywhere kill pet farm animal killing pretty good thing word fail regardless stray problem lead people breeding dog country put bounty unwanted pest people start make pest get money proven history work come dog farm followed release remaining dog back street government end reward scheme find dog farm make original dog problem even worse outlaw eating dog anticipated creating problem duh oh oh remember snake people started breeding snake cash cash ran snake live leak get ton new dog murder video idiot wind chinese version butcher shop fucking savage fuck china wan na eat china asshole free food admire china reaching country pandemic read barbarism damn fuck china 
fojppx,1585108598.0,jeff bezos top executive offloaded share time pandemic slashed company value saving billion,ikilledtupac,243,22,deleted entirely within right member congress sold stock day got private briefing senate health committee coronavirus would issue surely nobody would stupid something like though warning daily mail known lie sensationalize news please take everything say mountain salt beep boop im bot amazon currently trading roughly january anything going miss sweet run announce corona aid package fact majority family get around government know portion spent amazon get bump tomorrow bump next couple week sure selling share saved billion unless anything insider trading smart investing one going lose money purpose avoid hell even point article yeah rebalanced portfolio end february saved shit ton story lesson pay attention shit jeff stock trade disclosed advance founder ceo company hearing virus wuhan since january take genius know matter time hit tightened automatic stop loss mid january going china citizen feeling research belief stock could loose value supposed suck oh look daily mail article sure fair balanced although fuck bezos right fucking something ya twat mean warning signal early year want guy money entire world money power mean finger every government anybody think know shit hit fan anyone else crazy nothing wrong saw coming lie like certain politician dumped share well least good news like billionaire pay team financial advisor manage thing really news worthy large scale event like virus generally significant impact market given time high arguably overinflated come surprise virus acted catalyst bring market back pandemic started late last year  2019  wuhan even point contemplating selling lot stock waited til hit u given fast hit china obvious u got  100  case time worry could sheer coincidence x 200 b said none individual need billion dollar separate issue save money people sell thing back lower price deleted lucky daily mail user often report submission site ask u ban sensationalized article oppose blanket banning news source reader responsibility skeptical check source comment flaw help improve thread linking medium verifies question article claim link could help reader better understand issue find evidence article title false misleading contact moderator review bot action performed automatically please contact moderator subreddit question concern funny insider trading illegal average investor 
fscyba,1585661498.0,world leader post deleted false virus info,OldBoots,103,7,twitter delete medical misinformation venezuelan president allow american president continue lie false accusation personal attack like sheep herder virus good destroying political spin care guess least learning competent price high voted world leader please please take advise setup kissing booth darwinism best well comfort know one saddled dipshit trump fyi world leader lol 
fvwrbc,1586170778.0,coronavirus ban wildlife market prevent future pandemic say un biodiversity chief message getting take care nature take care u elizabeth maruma mrema say,ManiaforBeatles,60598,122,nature always win chinese government gon na ban actively go enforce guaranteed wildlife remember swine flu bird flu factory farming also source pandemic removed china give fuck report  2009  bunch ivy league guy said wet market china ticking time bomb cause global pandemic bush laid foundation pandemic preparation mentioned importance speech  2005  surprise anyone paying attention china problem every civilized government world become dependent upon cheap labor material provided china nobody ball stand every developed nation issued complete travel ban china wet market totally eradicated would shut within  30  day deleted tell humanity need reconsider relationship natural world entirely doubt yeah keep thinking pissed vegan must last major epidemic related eating meat lol china best prepare like mad next pandemic well china going continue likely try replace un chief one people banning asian wildlife market banning western abuse antibiotic factory farming epidemiologist rising loudest alarm year quite hypocritical ban much worse future picture fucking terrible poor creature ca even move fuck wildlife market anyone shop good luck enforcing china anything doubt ever happening start china much shit put world need sit china like germany ww 1  edit meant ww 2  sorry lack sleep yeah kinda banned international trade pangolin decade ago china give bat undercooked as case notice like take care china take care u deleted world willing sanction country based human right abuse desire acquire weapon mass destruction etc also willing sanction country likely cause pandemic without removing base china economic strength manufacturing way stop activity yeah let ban like banned whaling stop outlier country already banned something never understood people illegal animal trade poacher uncaring damage cause ecosystem entire specie know obvious consequence hell going straight die thread went need ban wildlife market one ever eat animal really quickly sars learn thing ban matter time next outbreak undoubtedly originate another wet market china time take action xi please send uniformed guard house later thought crossed mind smarter system talking anyone particular definitely talking someone particular people say racist blame china saw consequence market sars epidemic banned long lifted ban today something make think wo long lift ban huge consequence complete sanction isolation china dont stop backward barbaric practice want join globe need adapt hate hot touch lately get called racist xenophobic calling market expert agree market problem continue giving u virus saying someone usually go well factory farming bad america china able want completely irresponsible first defend factory farming since forcing say many pandemic stemmed factory farming u like ask many pandemic causing virus come china point stop replying think refuse answer last question fear becoming victim logic answer question truthfully admitting china explaining try hard sensitive culture forget hold accountable stop deleted removed vegetarian still really like see ban farmed meat totality clown pretending precisely zero difference eating pasture raised sheep inspected closely vet disease eating random as wild animal stacked cage thing came cow something really need pandemic know treating animal way bad mean skinning animal alive fear make meat taste good china biggest shit hole country deleted agree already illegal sure people follow suit find way feed pay equal value took government offering buy refined sewage oil poor people would earn using make food could finally get issue control nothing voodoo nature cult philosophy simply china negligence malfeasance directly responsible destruction livelihood death occurring world wide china know  100  certainty wet market causing endemic pandemic level event continues allow set shop operate freely ban wet market real fast company start pulling china en masse bet happens supply chain risk concern deleted china kill u next time wo milder virus like mild symptom majority people many asymptomatic people instead could like ebola something much much higher mortality rate even world condemns eating wild animal known pathogen carrier wo close wet market already reopening people eating bat animal known harbor disease jump human sars exact thing learn lesson clearly learned lesson current pandemic next  10  year fighting yet another global pandemic chinese origin kind pandemic  100  happen china never make sure ban put eating random wildlife go ever enforce say banned walk away care happens next time lot u survive one wo make happen line think sanitation hygiene problem rather animal problem much misconception come wildlife people believe civilized country consume wildlife china false wildlife trading global problem see report done traffic org extremely insightful list country wildlife exported consumption think u eu consume wildlife statistic terrestrial fauna trade revealing example historical trade data reported legal trade give insight magnitude transaction including  180  million  1  billion asian frog exported annually indonesia europe usa decade european union usa world largest importer frog leg gourmet food industry carpenter et  2007  altherr  2011  rest world need group say fuck china china fucking entire planet way handled coronavirus amazing shit always come southern china hundred thousand year refused change eating live frog fucking floor frying dog alive right next pen issue one people comparing wet market u factory farming u perfect eon ahead unregulated chinese market fda incredibly strict milk utter trace bacteria blood thousand gallon milk farm produced thrown away pig farm regulation testing pig riddled trichinosis parasite lay egg muscle unheard walk supermarket get pork trichinosis done good job eliminating trichinosis fda actually lowered recommended cooking temp pork swine flu started mexico pig tested slaughter also talk chicken bird flu even tho version bird flu think originated asia tested flu one bird coop whole lot get foamy death talk beef cattle antibiotic plugged antibiotic day everyday fda restricted antibiotic veterinarian administer antibiotic cattle fda also test cattle unsafe level antibiotic disease people referencing bird flu asia swine flu mexico mad cow disease europe mrsa canada come american farm ethically treatment animal effect environment something debate american standard health safety consumption animal far superior anywhere world remove china un unless accept harsh penalty transparent foreign check in bull shit fuck ccp keep downvoted wumoa pussy like eat meat example consider disease jump plant human hope every country remembers china next pandemic make mistake next global pandemic thanks china world quickly shuts travel trade prevent spread month year whatever take banned sars virus deleted sure china would totally veto sarcasm btw remember reading wasnt bat directly eaten cause pandemic bat infected chicken chicken cosumed people chinese market know true seems much plausible eating bat lot market china yeah going shut like set loose another deadly virus yeah good luck getting chinese wow un saying something useful let see far get china vote ban p 4  lab matter regulation bad crowd sure get quiet fuck china good luck enforcing china nature uh find way learned basic concept specie yet lmao take carol baskin good luck banning china lol banning force underground investigate contamination happened educate regulate food standard turning ethical debate farming going anywhere government scared china must come u un yeah kind late stopping covid 19  need prevent future outbreak since ccp spreading lie u military spread disease guess china need shut dirty wet maker also put china charge anything literally stated pandemic tried cover late government trying spread false properganda origin virus shift blame west general apparently chinese government evil incompetent literally warning nature let see world specifically china receive message maybe throw doctor trying fight infectious disease jail whatcha think un good luck wet market part chinese culture people defend culture last breath especially asia look japanese whaling amount b 12  deficient people underdeveloped brain thread fascinating china one eat kind wild life including dog cat bat taking care animal fucking factory farm banning something make go away regulate like singapore thailand really like statement really truth like every time find way around continue trashing environment living like normal bastard strung deserve another plague yulin dog eating festival meat industry yulin dog eater go way torture animal think make taste better fun fact stress hormone adrenaline actually make taste worse tortured literally reason real solution fix poverty area wet market exist people get food talk want long best option going away blow open next pandemic start thanks china send memo print pdf china use simple language ccp fucking understand unfortunately china give shit people feel like ban canabalism interfamiliar sexual intercourse situation harvard would employ traitor u fine china dollar uk think tank china number one causing global pandemic mass killing right violation dirty people listen yeah would nice market beyond awful disease point view going happen though chinese live animal trade continue traditional medicine also china rich aggressive one dare tell anything instead happen every government west virtue signal banning pet shop adding hurdle zoological researcher need start imposing sanction china vile still place locking animal small cage like planet desperately need leader capable handling birth control  8  billion u without screamed eugenics religious right armchair historian addition getting hell away non sustainable food farming around  30  year happen without literal  3 rd world war people like trump bolsonaro would rather nuke planet lose profit even quality life go yeah maybe go take care dont listen bang bang primitive fuck hope someone make task force hunt people like animal abuse drop tomahawk cruise missile place please dont listen need purged publicly privately dont care really dont get domestic meat delicious plentiful eat exotic animal food guest china nasty lot case see lot flu pandemic general drop finally get rid horrible market humane dispatch animal without sick fuck like live chinese animal market wildlife trade shred virtue someone worked multiple facet factory farming industry buy pack chicken beef local grocery store practically bad someone eats wild animal could keep chicken farm vegan stupid eat egg carnivore want steak often possible favor ordering country ban first world way looking people need protein diet unless also major discounted meat etc export area world poor people hunt food necessity way done fo billion year happen donald trump jr import head illegal trophy hunt unfortunately see government continue deregulate someone dad office maybe country stand stop china really need doubt read something effect operating outside law nature mean still eventually enforced think may daniel quinn anyone help find source wish could remember think often cool swine flu bird flu mad cow joke un cute sure xi take advisement much u chinese culture ok people eat random wild animal cultural quirk feel like dont take care nature care u deleted photo break heart cute people think tell china good luck lol ban never work see united state war drug ban create black market would make much harder track next pandemic place need stay legal highly regulated steep fine noncompliance message getting take care nature take care u lay theatrics ca agree wildlife market viable option anymore abolished adding hocus pocus hootenanny nature powerful send diesese plague u oblige im destroying already illegal wet market pandemic still occur sars h 1 n 2  avian flu heck even bubonic plague started well outside illegal market hold people republic china accountable prevent future pandemic actually govenments failed proactively protect citizen need held accountable strongly agree joke apart cruel inhuman ticking time bomb virus mutates highly infectious high fatality wet market banned fine humane market kind thing problem much unregulated black market trade exotic animal rule like need sweeping change globally effective good idea also perfect solution either far important issue allocating resource currently example recently united state leadership incompetent close nothing possible effort abysmal thanks mike penny voluntarily put charge pandemic response despite similar attempt combatting hiv epidemic governor indiana several year previously made situation worse far hospital running supply sick space deceased doctor working costume mask homemade mask bandana due mass shortage safety mask hospital running low bed patient treated alternate location space allocated top ventilator mass shortage leading people neglected immediate care people higher risk need treatment supply elderly patient giving life younger people use ventilator brave respectable could prevented infection death number soaring due disobedience social distancing recommendation health official cause high death count short time morgue overflowing refrigeration truck substituted give space also systemic issue ignored people losing job house due lack payed leave job security others face tough going work putting life line feed family well aware get sick receive care need government assistance single payment given certain citizen sadly despite sorry state united state country either worse similar situation anything despite desperate need want italy smaller area started experiencing mass spread death rate roof astoundingly high rate infection overwhelming hospital leading people die without chance receive help entire community experiencing mass loss despite italy effort help citizen iran india massively statistic extreme mistrust government citizen india living leader preparing genocide despite obvious problem disease consistently reported zero death iran citizen skeptical even going receive aid believe health minister never even planning downplay fine day later huge problem china uncountable number human right violation reported police officer physically harming citizen quarantine enforced physical violence people climbing aparentemente get food afraid starve death china also periodically censoring horror story chinese citizen telling even going far arresting poet poem people china people experience hardship daily base source hope taken developing county africa lack sufficient government power economic strength able enact quarantine sanitation effort lifeless body lay street depressing reminder freedom feel like boarder designed fail due economic hardship caused nothing done globally lack supervision regulation led mass shortage essential good like mask hand sanitizer soap toilet paper canned food among thing lack sufficient education leading conspiracy theory racism general resentment population well supporting poor safety practice turn lead preventable endangerment people greatest danger retirement home effected dwindling staff number unable efficiently provide medicine periodically check resident mention also infecting resident people retirement home found undisturbed day died alone accountability blatant neglect endangerment le economically privileged citizen either world place every little problem world leader ignored coming back becoming exponentially worse finally experienced economically ethically damaging wealth hoarding monetary privalage world seeing effect racist totalitarian immature inept outright malicious leader defining hour seeing blatant ignorance greatest danger seeing rampant racism toxicity hate classism healthy world function stand watching crumble beneath foot time action encourage everybody age read vote public election politically active regularly educate global event time wait end time become politically active part change hopefully transition healthy future even choice given bad nothing ever get better worse candidate elected every time want live functioning healthy world airplane spiraling towards ground tl dr everything fucked subreddit saying racist shut wet market last month trump said care anything want feel right shit sherlock solution ever reason china place addicted disgusting tradition look realize guest rip deer duck moose hunting unless enforcement take place shutting wet wildlife meat consumption think ever really get handle honestly know china country ever really stamp practise many people watch go underground speak really pray un health organization destroy type market otherwise battle everyone fighting right nothing please safe everyone dammit stay home put life others stake thinking invincible think child parent grandkids everyone else stay home people die except person know shit ton disease come western agriculture guess would cost people hamburger ca happening action consequence sooner later pay inevitable many reason well later generation reminding fucking greedy ass since yet called u dumb stupid lazy socialist unamerican etc making fucking stuff essential use fucking entitled boomer like nursing home would deathbead cause better thing take care jackass die anyway plus le old people mean le burden social security right fact animal wild horrific condition animal kept treated cow pig bat pangolin whatever animal virus always start poor treatment terrible condition stop fucking animal period 
