id,time,title,author,score,num_comments,text
dmnmy2,1571954607.0,high school athlete disqualified country race ohio wearing hijab,Mario_lib,210,10,wearing hijab affect racing punish kid site explains quiet well wearing nike hijab one picture ran race found never problem last  3  year etc participated oshaa athlete coach  30  year play uniform rule girl disqualified tights state meet winning fourth straight state title  10  year ago one qualified ran team expect know rule follow exception sound like gave much warning felt necessary coach dropped ball strict official color size logo hat glove tights get busted lot following rule seen measure reject logo designated size also seen boy jewlery necklace earring etc watched several team get warned last weekend district meet running music playing bt speaker warming also warned team throwing football sop oshaa understand asking change matching short understand asked remove hijab fault fault though per article team  3  year got competition know ohsaa staff check athlete uniform decided disqualified told coach coach dirty even telling disqualified see name board rest team mate think intentionally targetted hijab staff failed known rule sure would gotten going user often report submission site ask u ban sensationalized article oppose blanket banning news source reader responsibility skeptical check source comment flaw help improve thread linking medium verifies question article claim link could help reader better understand issue find evidence article title false misleading contact moderator review bot action performed automatically please contact moderator subreddit question concern story expecting least insight decision disqualify usually racist supposed justification usually pathetic wrong justification nonetheless appears pretty blatant unapologetic according recalled incident via cousin facebook team uniform checked ohio high school athletic association ohsaa official ahead race teammate asked change short match rest runner singled want religious exemption barbaric uncivilized could argued want perpetuate sexist idea american culture 
e5wupr,1575452318.0, 629  pakistani girl sold bride china,newnemo,36959,58,ap investigation earlier year revealed pakistan christian minority become new target broker pay impoverished parent marry daughter teenager chinese husband return homeland many bride isolated abused forced prostitution china often contacting home pleading brought back investigation trafficking slowed investigator frustrated pakistani medium pushed curb reporting trafficking china get sex slave pakistan get fuck christian minority probably close state sanctioned human trafficking get messed entirely surprising back  2008  took  2  week tour china one bus ride guide question group one fact came surprised hell one pitfall child policy paired fact lot family went length make sure one child boy created situation generation men outnumber woman  20  million  20  million dude literally chance hell getting married relationship unless come outside creates market monstrosity like decade killing baby girl due policy finally caught buy girl country messed many level best tl dr could make original reduced  89  bot lahore pakistan page page name stack  629  girl woman across pakistan sold bride chinese men taken china today pakistan receiving massive aid china  039  belt road initiative global endeavor aimed reconstituting silk road linking china corner asia quot one thing striking issue fast list growing country known source country bride trafficking business quot heather barr hrw report  039  author told warriach amnesty international  039  campaign director south asia said pakistan quot must let close relationship china become reason turn blind eye human right abuse citizen quot either abuse woman sold bride separation pakistani woman husband china  039  muslim uighur population sent quot camp quot turn away islam extended summary faq version tl drs far feedback  23 autotldr pm comment monitored constructive feedback welcome top keywords pakistan  1  china  2  trafficked  3  official  4  woman  5  deleted handmaid tale irl removed reminder pakistan one country praised china human right record power debt see would think way china treated muslim minority western china islamic world would bit pissed china anything buck seems know story particular coming especially number human trafficking tremendous china matter domestic international country lao vietnam kidnapping woman vietnam gender imbalance issue wicked already wait population ageing severe enough china around corner hell problem need clarified parent willingly selling daughter like pakistan forcibly taking away still ridiculous though defending pakistan weird relationship china basically lapdog world fucked man one child policy kill baby girl attempt get boy country end excess boy solution state sponsored human trafficking apparently china joke everyone seems look way pakistan government official fearful hurting pakistan lucrative tie beijing removed pakistan minority already diminished significantly owing relentless religious conversion gun point human trafficking title mean say trafficked china sold men china made think sold government something would say woman sold canada even though trafficking canada deleted headline make sound like china nation involved sold chinese men removed given two country mentioned anyone really surprised mean denigrate disgusting trafficking human being country neither pakistan china known valuing human life highly basically also happens mail order russian bride always thought thing people actually looking love ca find one good looking rich enough buy love eventually two people fall love least tolerate actually huge problem one child policy china created glut men never get married attention turned poorer area asia woman bought trafficked china either bride sex worker fun note chinese men fell victim scheme well scammed get pakistani bride pay money go pakistan get nothing except money robbed criminal town used believe x 200 b btw problem people mindset please least make logic reasonable intellectually sound ppl saying happens chinese government evil wonder logic applies country whether u uk somewhere know horrible unjustifiable  629  little low probably thousand kidnapped kid philippine vietnam india africa sold parent kidnapped one know cant get reported police corrupt lazy dont care fucked shit old pakistan also country neighboring china like vietnam myanmar even north korea behind scene think majority redditors currently anti china hate train even article know really hard control trafficking want fix need fixing root generally border country china mountainous area population majority minority ethnic poor really lack education awareness human trafficker usually triad member kidnapping literal sense rare local know people map random chinese thug kidnap young girl neighbor country probably get caught beaten death local arrested local officer long reaching border instead connect local collaborator sometimes collaborator worker used work china triad would request find young girl convince go china successful time collaborator get percentage money fate young girl however decided triad young virgin sought wife chinese male unable get marriage china otherwise sought prostitutors worker restaurant spa hair nail salon important everyone case case girl collaborator friend get kidnapped case girl get tricked believe better job side get dream crushed arrived unable comeback sometimes girl know trap still follow trafficker get better life real girl even family abandon husband child go even refused come back police come rescue worse got sought parent wedding money really hard police  2  country investigate case especially happened long time ago hard case girl sought become wife ca comeback home child current husband solve however need big plan national level first invest developing mountain border area usually poorest part country due unfavorable terrain poor people get desperate cling every chance change life secondly education abandoning backward tradition like seeing daughter like property sell wedding gift raise awareness general population especially young people usually dream fantasy life easy high paying job even though easy talk thing hard achieve reality developing mountainous area invest money fall tree country poor developing country government priority develop city coastal first provision officer country limited due lack resource man power heck even developed country like uk germany still hard stop illegal migrant go country like human trafficking case recently death  39  people said still found uneasy commenters even original poster lack knowledge matter trying shift blame government especially chinese government like one directly control get benefit human trafficking chain funny every time bad thing happened related china china single identity separate government people company china whole like big bad wolf meanwhile come usa always google facebook insert particular individual usa whole case double standard one wonder hell even started dude china need wife pakistan enters room deleted communist buying slave islamist odd number sure anyone equate human trafficking selling people china fault china government seems like illegal activity unique china malaysia country bright young bangladeshi pakistani immigrated country promise furthering education leased construction site work partly earn back independence passport done syndicate working malaysia country feel like lot thing going wrong china felt redditors lately general separate problem systematic state supported organ concentration camp problem immoral people immoral stuff broadly feel like sentiment chinese bad china human right nightmare new thing sea country one suffering problem get much attention many girl return even manage get back home much better community usually poor backwards people understand gone plus also mean abandoning child since way get back situation kinda suck around trafficked forced prostitution ftfy evangelical christian next horror woman sold concern second trafficking ring made chinese pakistani middleman include christian minister mostly small evangelical church get bribe urge flock sell daughter hit way close home make doubt choice headline suck woman trafficked chinese men chinese government country much moral corruption western news always refer china one big monolithic thing child trafficked america uk never girl sold bride america girl sold bride uk country like mine norway enjoy many freedom need grow fucking backbone punish country like china shit sanction ass somehow happily live leaner life mean contributed helping people held prisoner slave part world pm erna solberg conservative stated verbally aim please president xi pooh chinese government every turn refused meet even receive dalai lama visited allow government official refused discus human right week prior visit china disgraceful fuck ashamed country lack backbone one child policy bad buy bride pakistan learn mistake make two child policy surely work time fact victim human traffic voluntary china huge ratio unbalance old tradition prefer boy  40  million bachelor ca find significant ai slavery know else never surprise inhumanity humanity capable let hope next specie inherit earth worthy friendship one many reason india relaxing immigration law minority neighboring country reason govt also started kicking legitimate muslim resident country pakistan hell lot debt china let say government change stupid mind wanted minority never never instead exploited government could stop indebted china irony policy forcing chinese family ethnic pakistani christian child try genocide border say lot kind parent sell child hate people million could use instead chopping part seems inefficient killed infant coming woman china demographically speaking fuuuuuucked far many men never find bride china deleted deleted mean surprised one country abusing human right indulging sex trafficking another country abusing human right worse known weather ally without china money pakistan would failed state long back navy seal crashed chopper guess pakistan send chinese reverse engineer china repeatedly vetoed un sanction pakistan seriously fucked country prostitute bride 
e6is82,1575560068.0,netanyahu personal lawyer charged netanyahu first sitting prime minister israel indicted,chelsea707,1397,27,good fan netanyahu policy committed crime face repercussion israel likely convicted going go like trump whatever want without consequence yes know impeached also know gop senate never convict sound familiar ca place maybe rudy giuliani take case since bibi attorney busy trying save skin next year may shape pretty well somehow remove trump netanyahu political scene sound awfully similar another similarly indicted world leader huh like another degenerate familiar crook motive trump friend po criminal functioning justice system rule law look like happening trump rudy donny listening tap tap tap like america except attempt accountability trump next trump next please trump next user often report submission site ask u ban sensationalized article oppose blanket banning news source reader responsibility skeptical check source comment flaw help improve thread linking medium verifies question article claim link could help reader better understand issue find evidence article title false misleading contact moderator review bot action performed automatically please contact moderator subreddit question concern byebibi damn politics nowadays prove everyone overextended power turn leader criminal pm snatched right office given treatment overstayed license picture guy voting holding dog priceless meh maybe trump adjoining cell using personal lawyer way trump used lawyer commit crime well kinda think trump personal lawyer might indicted similar charge next year among others make sense trump netanyahu close removed netanyahu locked lot thing let forget persistent crime humanity true piece shit fucker downfall long overdue deleted benjamin baby rudy jewliani 
e9nkw3,1576157463.0,deleted user,,1081,44,deleted read title assumed meant ransacked hospital lawsuit litigation meant literally mob lawyer attacked hospital employee armed club educated people act animal act doctor made fun u sue fucking lawyer biker gang wrong lawyer little thug pakistan may educated majority case extremely misogynistic right wing piece shit video went viral month ago lawyer kicking shit woman right outside courtroom biggest supporter blasphemy law islamist politician also lawyer educated matter law mean civilized even humane bunch shit head lawerys lost fist fight doctor got feeling hurt people mean poor country decided best course action destroy hospital thus taking away valuable equipment risk people need fucking die oh  3  die straight away asshole probably patting back really sticking mean doctor poor schmuck fighting life cardiac hospital ca remember last time read something positive pakistan really living bizarro timeline wow first guess upon reading headline hospital must debt monstrous lawyer bringing bailiff unhook patient life support gear take compensation guess completley wrong idea whether reality better worse nut got argument hospital staff doctor duty leading fierce fist fight lawyer outnumbered hospital staff anyone know good lawyer think going need one today episode lawyer doctor  200  lawyer wielding stick stormed lahore punjab institute cardiology midday wednesday pride pride lawyer fucking lawyer shit timeline next month accountant v dental assistant  20  arrest police filed complaint another  250  check security footage start pulling bar license people even involved died petty bullshit let get straight lawyer riot fucking lawyer seriously go trouble law school learning complex method deal dispute plan deal punch thing saw story posted earlier thought hoax like completely lawless country need shit like happen basically anything get away smh best tl dr could make original reduced  85  bot afp three patient died hundred lawyer attacked hospital lahore furious dispute doctor simmering anger among young lawyer since  20  november half dozen accompanied colleague hospital treatment sick mother say bbc  039  ilyas khan islamabad got argument hospital staff doctor duty leading fierce fist fight lawyer outnumbered hospital staff forced provincial authority intervene agreement reached tuesday hospital staff agreed apologise lawyer lawyer agreed withdraw complaint extended summary faq version tl drs far feedback  23 autotldr pm comment monitored constructive feedback welcome top keywords lawyer  1  hospital  2  police  3  staff  4  doctor  5  pakistan defend lawyer retard licence practice law fight scene anchorman  3  call  200  lawyer bottom ocean good start ca insurance company like civilized people bunch dummy like one hurt doctor wo see lol wild read bizarre story read like news article  4 chan would make one biggest problem inthe world fact people century behind desire advance insist regress ask trumper tell great back day phrase used convict discussing day criminal egotistical asshole define gong show hundred next stop top hat axe heard ambulance chaser take level absurdity pack feral lawyer trash hospital submission end killing three people icu prevented doctor caring live strangest timeline guess passing bar pakistan includes martial test fight snap slim jim free market work never seen riot full men suit fuck pakistan started cheif justice iftikhar chaudhary started lawyer movement  2007   2009  dictator pervez musharraf lawyer became goon since inbred population country world guy x 200 b west racist thinking civilised remember fault deleted reading story objectively clear happened aside almost passing remark hold judgment read detailed source quick update source seems state started video going viral one lawyer tried cut line waiting medical treatment assaulted two doctor due seems history lawyer field political power since  2007  due protest occurred back embolden certain member profession bbc reporting woefully poor lawyer fact going strike today due police handling matter new york time better article give context monkey suit going amock attacking monkey doctor coat imagine india pakistan one country chaos 
ee3mvs,1577011591.0,australia pm return face hawaii holiday critic,drunkles,112,9,fuckwit best tl dr could make original reduced  86  bot many australian accused scott morrison  039  government inaction global warming criticism growing heatwave broke record across country worsened fire combination temperature  40 c low humidity strong wind worsened struggle emergency personnel mobilised deal bushfires nsw quot period unbelievable drought area  039  seen rain  12  month quot nsw rural fire service inspector ben shepherd told bbc quot fire likely continue spread well past christmas quot added fire nsw generating thunderstorm rural fire service said extended summary faq version tl drs far feedback  23 autotldr pm comment monitored constructive feedback welcome top keywords fire  1  saturday  2  state  3  australia  4  emergency  5  get hose scott guy want lose airbnb deposit understand pm class wanker imagine going hawaii tired hot weather stayed hawaii good coming back early surprising people even realized gone useless even left naive arrogant 
ekv5ze,1578322614.0,australian climate change study  12  year ago warned intense fire season,benzene88,1232,21,deleted scientist know making money tony abbott ex prime minister australia praised fighting fire right responsible fire fighting way like mentally deranged arsonist join volunteer fire fighter go lighting fire join fighting fairfax medium report part deep job cut announced later today many  110  position csiro ocean atmosphere division go similar number affected land water division believed leave  30  staff organisation ocean atmosphere unit working climate issue climate gone basically one senior scientist told fairfax announcement understand prime minister malcolm turnbull science minister christopher pyne signed prime minister speech paris tackling global warming innovation empty rhetoric keeping abbott climate policy letting coalition climate dinosaur rule australian conservation foundation campaigner tony mohr said axing  435  million arena starve research development clean energy australia moving u back global race clean former prime minister tony abbott department discussed setting investigation bureau meteorology amid medium claim exaggerating estimate global warming freedom information document revealed forty year ago teenager clearly remember learning called global warming worsening effect would lead fire beginning fuck capitalism scomo meanwhile wildfire victim stop acting apocalyptical well sure imagine would happened stock market government taken action whatsoever everyone brain australia new going happen country believe climate change believe coal pretty much chinese hoax sad thing time really bad thing start happen late anything australia halted extraction consumption fossil fuel tomorrow would make difference least decade rest world made similar impossible change fucked australia new normal  5  year old could predict deleted warn arsonist warn almost  200  people arrested setting bush fire last  2  month curious  1900   1940  drier climate change happen make australia wetter fire primarily due arson deleted perhaps god exists since australia responsible  32  world coal export punished sin sure older study prove correct anticipating future risk produce limitless amount study nowadays sponsored full capitalist propaganda shit gotten point trust study anymore could genuine sponsored corporate interest warn  200  people would lighting fire draw attention climate change errmmm australian bush fire existed ever since australian started recording history see many people jumping bandwagon without providing shred evidence sorry buying infer causal relationship event one need provide evidence simple guess pretty much scientific study claiming something without providing evidence another study make opposite claim also without providing evidence whatsoever science think much unreasonable believe even australian abolished use diesel jet engine even stop burning coal century ago bush fire would still happen know unlikely make scientific claim one would need something ideologically charged position enough 
elboi1,1578404417.0,teenage jailed six year planning terror venue worth attacking home city,CaptainWales69,553,19,judging writing clearly grammar nazi best tl dr could make original reduced  70  bot teenage listed venue home city quot worth attacking quot jailed six year preparing commit terrorist act trial ending last november jury found guilty preparation terrorist act october  2017  march last year youth also unanimously found guilty disseminating terrorist publication possessing article purpose connected terrorism three count possessing document record containing information likely useful terrorist extended summary faq version tl drs far feedback  23 autotldr pm comment monitored constructive feedback welcome top keywords year  1  found  2  terrorist  3  attack  4  last  5  defense joking really alt never excused used right winger caught totally credible pretty sure politically correct term people like nowadays call get lot screaming bad still disgusting ideology header second page really show piss poor planning hope jail time getting access sort mental health professional care teenager subject alot shit internet day extremely impressionable falling way wagon like hope time think sentence receive actual help get sure going changed much way  reddit white nazi mental health counseling probation brown radical throw away key least consistent  6  year jail enough time totally radicalized ready kill  2026  deleted shoulda lwp life without parole quite terrible thing confused possibly mentally disturbed teenager thrown jail main part twenty kid going way radicalized come prison  6  year edit vote want reality face locking aggressive hateful people wow little loser fun dropping soap kid deleted nazi stupid child like uniform want club mandatory counselling education plan going amount anything mean notebook look super childish thread reek chapo chuds jailed someone thought crime world news meanwhile black teenager chicago actually murdering people 
er6wvq,1579489052.0,state school college england order free period product student part government scheme tackle period poverty scheme aim help prevent child missing school access product home,ManiaforBeatles,120,4,ca everyone accept something good happening quit critiquing life hard sound like fair scheme shame necessary perhaps alternative would speak guardian girl access sanitary product find hunch missing tampon also missing lot stuff scheme make sound nefarious word commonly used england talking government program given current state england surprised solution simply make show school red pant teach personal responsibility providing making sure say loud much shame make feel bad 
f8ktzr,1582513824.0,thousand protester armed stone stick molotov cocktail clashed police sunday latin america biggest music festival opened latest spurt old wave grassroots anger economic inequality woe,DoremusJessup,233,6,lol paragraph long headline even identify country deleted wealthstock one article otherwise uninformed going admit ignorance protester bring molotov cocktail resort indiscriminately attacking local business burning car reaction immediately sympathize cause edit apparently nuance honesty appreciated reddit fair enough sound like want destroy thing deleted 
