id,time,title,author,score,num_comments,text
clumq9,1564911978.0,hong kong brace largest citywide strike decade people  20  sector vow join protest government,UnstatesmanlikeChi,15239,67,sincerely hope pla mobilised late hour night different related topic want help people hong kong u eu uk citizen hong kong human right democracy act  2019   3289   1838  use website send letter representative joint motion resolution situation hong kong letter mp uphold  1984  joint declaration letter spread word situation hong kong already helpful example involvement helped people hong kong u passed senate bill sanction chinese hong kong official violating fundamental human right freedom sec  6209  forever grateful edit update uk petition link good luck hk hope work admirable seeing guy back keep fighting hong kong million first night number still high taiwan support hong kong quest remain autonomous seriously fuck china keep fight going removed uhm last protest number around  2  million  14 k seem miniscule compare extent city hong kong shut nobody get work market effectively closed type situation ton company individual losing billion dollar every day protest go long people think government afford give people demand chance scary military mobilization totalitarian crackdown read happening know area nearly well enough know answer question like gon na tiananmen square  2  going hk next week everything fine fuck china nice feel hong kong people fighting well want freedom china powerful without protection another world super power fucked funny history evolved hong kong british asshole taking thing turned really better colony forced back fighting tooth nail admire think fucked right way though going strike smart interested see thing develop thought previous strike million see many fuck china comment nothing help going make people think hate maybe helping situation anything make thing worse see comment tell friend already hear chinese people outside force trying destroy wonder happen mainland china deploys troop tank roll famous tank man time hong kong u guy going amazing u guy brave compare scale ongoing yellow vest strike throughout europe deleted keep fighting freedom communist party horrible thing people china google forced organ harvesting living falun dafa practitioner currently hk point clarify  1  far general strike city still operational work  2  protester actively preventing people going work sabotaging public transportation pressing every subway emergency alarm train blocking train door creating road block stealing road sign metal fence  3  e 4  b 8   89  e 7  bd e 4  b 9   98  e 5  ae a 2  e 4  b 8   8 d e 6  bb bf e 7  a 4  ba e 5  a 8   81  e 8   80   85  e 6   93   8 b e 9   96   80  e 5  a 4   9 a e 7  ab  99  e 6   8 e  80  e 7  bd b 5  e 6   88  e 6   9 c  89  e 5  ad  95  e 5  a 9  a 6  e 4  b 8   8 d e 9   81  e 4  b 8   89  e 7  bd e 4  b 9   98  e 5  ae a 2  e 4  b 8   8 d e 6  bb bf e 7  a 4  ba e 5  a 8   81  e 8   80   85  e 6   93   8 b e 9   96   80  e 5  a 4   9 a e 7  ab  99  e 6   8 e  80  e 7  bd b 5  e 6   88  e 6   9 c  89  e 5  ad  95  e 5  a 9  a 6  e 4  b 8   8 d e 9   81  e 4  b 8   83  e 5   8 d  80  e 9   9 b  86  e 6   9 c e 6   97  ba e 8  a 7   92  e 7  a 4  ba e 5  a 8   81  e 8   80   85  e 8  a 8  ad e 8  b 7  af e 9   9 a  9 c e 5  a 0  b 5  e 9  a 6  ac e 8  b 7  e 8   88   87  e 5  b 8   82  e 6  b 0   91  e 7   99  bc e 7   94   9 f e 7   88  ad e 5   9 f e 4  b 8   83  e 5   8 d  80  e 9   9 b  86  e 6   9 c e 6   97  ba e 8  a 7   92  e 7  a 4  ba e 5  a 8   81  e 8   80   85  e 8  a 8  ad e 8  b 7  af e 9   9 a  9 c e 5  a 0  b 5  e 9  a 6  ac e 8  b 7  e 8   88   87  e 5  b 8   82  e 6  b 0   91  e 7   99  bc e 7   94   9 f e 7   88  ad e 5   9 f  4  least one case protester got physical conflict driver tried drive road block e 4  bf ae e 4   8 b e 9  a 2  a 8  e 6  b 3  a 2  e 5   8 f b 8  e 6  a 9   9 f e 6   93  ac e 8  a 1   9 d e 6  b 0  b 4  e 9  a 6  ac e 8  a 2  ab e 7  b 6   81  e 6   94  e 8  a 1   8 c e 5   8 c e 9   96   8 b e 8  bb  8 a e 6   92   9 e e 4  bd  8 e e 7  a 4  ba e 5  a 8   81  e 8   80  e 4  bf ae e 4   8 b e 9  a 2  a 8  e 6  b 3  a 2  e 5   8 f b 8  e 6  a 9   9 f e 6   93  ac e 8  a 1   9 d e 6  b 0  b 4  e 9  a 6  ac e 8  a 2  ab e 7  b 6   81  e 6   94  e 8  a 1   8 c e 5   8 c e 9   96   8 b e 8  bb  8 a e 6   92   9 e e 4  bd  8 e e 7  a 4  ba e 5  a 8   81  e 8   80  live news across multiple channel shown numerous angry confrontation civilian protester bent forcing people strike call strike misleading definitely minority people refused come work notable movement actively trying force unwilling civilian go work deleted government fighting hard literally everyone country bill keep going deleted might effective form protest show work let  1  suddenly feel repercussion wage slave producing look good paper anyway seems trying get people involved strike involved destroying electric supply traffic light hong kong island far democracy low people power economy grind halt beautiful thing hey seen one allegedly communist chinese army massing border waiting go order red chinese allow challenge state authority take bet hong kong exist end month spokesperson strike organizing committee gave name chan sneak  100  go year sporadically every time come idiot get  10 k upvotes gold saying something something tianamen massacre imminent second reality situation propaganda gold beijing hardens mainland nationalism already existing hatred hk people make easier paint democracy chaos work foreign operative literally one modern propaganda initiative actually work people given free lol really wish america would mass protest government get many people walk fuck job something sensible done mass shooting job industry take street picket canvas everywhere taiwan government china fled losing communist revolution people republic china never got around conquering forced everyone un recognize independent country kept name republic china actually control china fact independent country army internal politics foreign affair albeit compromised prc influence bribery prc falsely claim independent country province china well actually basically problem simple commie get china basically brain wash whole generation great mother importantly make know mother land china make proud loyal chinese asshole beating hong kong pro democratic protester basically even government collapse people still crazy state mind basically started cultural revolution happened saying back revolution horrible time basically shit happened man people hong kong fucking around end well already seen end cant stop cant abandoned china china greedy claw dug hong kong kill many protester possibly world protect people take  2  district  12  mockingjay exactly hk want actually bill already withdrawn tiananmen square massacre  2  note chinese people longer see thread fuck ccp reserve loathing extend others edit read car rammed barricade narrowly missing protestors charlottesville moment hk hongkong like trade door china outside world happens get screwed  14000  people need america american suck protesting like ppl last time anything compared let burn corrupt government rolling money nothing resisting mean take longer establish stranglehold mean becomes normalized let take rein quickly let bring water boil fast mass apathetic citizen fear hate change finally need done drown street gushing river blood pour like waterfall neck stump oppressor let burn new growth take root use corps corrupt fertilizer better world fuck commie long live capitalism r 0 dditors favorite propaganda medium encouraging yellow west wonder bunch hypocritical devoid clown get replaced mainlanders fraction cost free market told  1  million people possibly  2  showed last time  14 k largest strike go honk kong totalitarian china good fuck yeah hk stop viva la push dictator keep democracy holy shit sceptical first go hong kong power baby protestors deliberately jammed subway line roundabout force hong kong go strike defacing public property setting trash can fire shooting cop homemade slingshot pulling brick pavement throw police funny thing even talk demand government everyday guerilla warfare cop peaceful protest think devolved crossed line long time ago source actual hong kong citizen living shit everyday past month almost could make work traffic condition china finished cant contain hong kong  china fucked boy china smoke let go god speed good soul standing dying freedom honor world get sitting far away hong kong shouting protestors back bit push made point stay home getting bad feel situation see tiananmen squared thats good people hk fed ccp barely knowledge subject think hk tired oppression come ccp censorship true im glad standing right think happen cuba aswell correct im wrong china big problem worry 
cnpwmx,1565289288.0,instagram ad partner secretly sucked tracked million user location story,myrisingstocks,115,4,point never surprised see facebook product hoovering user data think anyone surprised instagram constantly recording location people always assume tracked whenever use online application safer way secret transaction agreed never assume data safe online facebook tweeter instagram matter someona storage data somewhere someone else gain access 
cv1m9e,1566693947.0,mulan star skip d 23  press amid boycottmulan controversy hong kong protest,Frocharocha,1948,40,plan defeat hun ca face tough question press disney would asked stay away press guessing case unlikely would shy sudden career west something like life privileged life west filled freedom denied people china decides people china want democracy shameful absolutely disgusting shang said mysterious dark side moon mean hide like coward shadow bet disney regretting casting scarlett johansson im sure around asia part press tour deleted disney never ever employ nationalist star film especially promote nationalistic fake news campaign disinformation protect regime honestly hold none value disney supposed represent head lot prc shill account comment read comment sounded fake clearly checked account  6  month age movie come march  2020  really would like see boycott pickup steam year ccp threatened destroyed career asian star going party line talking public apology like isi execution video many taiwanese star spoke felt pressured intimidated read script ccp make thing right continue career mainland much sway bootlicker almost always coward unwilling face genuine criticism challenge mainland chinese brainwashed way beyond anything ever imaginable world gon na watch mulan theatre support chinese ccp bootlicking bitch complete opposite everything disney stood though seems like disney bending backwards chinese money pathetic gon na use mean instead lol ball watching shit flick fuck china guess time boycott film wo america got ta give cash mouse money principle let get business defeat hong kong edit guess really needed tag ironic star movie hero stopping country taken tyrant fighting country want tyrannically take another group people currently enjoy significantly freedom would otherwise coward chance disney saying anything strong chinese movie market want film boycott even shown father business government also come powerful family background suck fantasygirl censured people restive hear sing reflection trailer tease see controversy let say coming actress getting role lifetime country film industry expects complete loyalty chinese celebrity repeat party line likely indoctrinated since birth b publicly support hong kong mean stay china likely kidnapped reeducated possibly ruined career best case scenario c support hong kong defect forever america safe also never seeing talking family friend ever never working china never future movie star shown china another career ender rule china still wo assasinate later date america harm friend family back china fault country shit western culture bad treating young female star like shit speaking dixie chick anyone supported dealt compassion fight china stand government people trapped system fighter evil name hypocrite bought paid china leader ought redo movie dub someone else mulan boycott movie right good fuck removed smart woulda gotten as beat like asked showed face never seen someone become unpopular fast pretty fucking stupid though im still gon na see still gon na listen michael jackson worthless piece shit anybody pro chinese government deserves rot deleted removed deleted still watching movie give shit celeb comment movie bad though shes done lol deleted deleted sub really gone downhill honk kong bandwagon shitfest deeper reason people boycotting mulan right seriously ca based around chinese culture closest thing successor culture taiwan edit apology assuming reason expressing unfamiliar story used logical process discredit reasoning surface hoping somebody familiar would able provide quick explanation people like unfamiliar traitorous dog west careful response convinced chinese actress job instead hollydeadwood always poorly attention detail bigger thing sjw people 
d65q8c,1568850474.0,attenborough documentary actively mislead audience thinking wildlife fine scientist warn scientist looked script  4  recent david bbc netflix nature series said show extent nature threatened,Rvolutionary_Details,138,21,planet earth  2  basically attenborough screaming camera fucked everything human definitely get impression planet click wan na ruin day netflix one talked climate change decline lot like almost episode fucking b one single person front line continuously warning u endangered natural environment caring wild life beloved sir david attenborough stopped watching nature doc year ago especially attenborough always end dead soon dunno accusation unwarranted optimism based message got beautiful nature life important preserve edit misunderstand message scientist said incredibly meaningless statement hate overused mean scientist experiment showed even expert field claim mean jim political scientist made blog post second time youve posted scientist university oxford newcastle kent bangor found netflix series planet dedicated  15  per cent script environmental threat conservation far exceeded bbc series planet earth ii dynasty however said still failed visually show threatened natural world complaint documentary talk best tl dr could make original reduced  88  bot nature documentary could quot actively misleading audience quot showing nature something pristine damaged human researcher warn scientist looked script four recent david bbc netflix nature series said show extent nature threatened human activity scientist divided much nature documentary could increase support conservation extended summary faq version tl drs far feedback  23 autotldr pm comment monitored constructive feedback welcome top keywords nature  1  people  2  research  3  natural  4  world  5  seems legit probably show people would horrified rating would tank human race part actually care simply want insulated harsh truth face u luckily god willing mind set seems changing ever slowly  blue planet  2  depressing hell last ep course intent make documentary devastated nature nobody fucking watch want watch something pretty entertained nature doc fox news documentary showing human complexity beauty nature people connect respect nature want preserve nature many scientist smartest documentary critic saying apparently actually watch screen started watching documentary last year got depressed show deeply fucked planet clearly watch documentary oh fuck incessant guilt tripping narcissist know reddit post create carbon emission aircraft carrier densely packed bullshit news video game cause school shooting bank blame economic crisis false flag news  11  
dixhhi,1571267139.0,u troop bombed headquarters fighter closed trump hasty retreat,viva_la_vinyl,3993,55,removed fighter moved closer u troop attempted repel using apache helicopter show force warn away u troop still x 200 b turkey u nato ally foreign policy involves running ally battlefield bombing base lol u military run draft dodger fighter moved closer u troop attempted repel using apache helicopter show force warn away u troop still according wall street journal airpower failed dissuade force sdf fighter fled set fire part base u troop left u asset destroyed base misunderstanding scuttled sure land equivalent destroyed really show context base ran away worried ally would come take surely force tried enter say turk assaulted would act war like retreating viet cong without fight thanks donald dont kno whole scenario tragedy comedy tired america winning much like arma  3  multiplayer operation gone wrong compilation irl trump coward weird built wall instead told keep bad hombre gon na let turkey destroy base built base one destroy wait mean turkish force attacking u force best tl dr could make original reduced  78  bot according wsj troop advanced facility used equip train sdf fighter isi tuesday leading u official quickly withdraw u troop destroy base wednesday fighter moved closer u troop attempted repel using apache helicopter show force warn away u troop still according wall street journal airpower failed dissuade force sdf fighter fled set fire part base u troop left u asset destroyed base extended summary faq version tl drs far feedback  23 autotldr pm comment monitored constructive feedback welcome top keywords force  1  base  2  troop  3  syria  4  fighter  5  f cking mess context hope read story like  50  u nuke trapped air base turkey withdrawal region collapse relationship turkey many terrible implication edit complete picture demonstrating russian force may quickly sweep region also russian force seemingly occupy abandoned u base northern syria amp brave brave sir donald bravely ran away ca attack already attacked tap surprised could move fast considering bone spur still waiting one single redeeming quality trump presidency far like badly written comic book villain winning tax dollar work think american realize ordinary destroy asset like controlled detonation usual dropping  500  lb bomb old position fucked one nato member v another long time ally abandoned mortal enemy freed troop put dangerous physical horrible moral situation stopping trump truly beyond party politics bunch incompetent idiot guess hard gain respect twitter diplomacy creates demand bomb base building material huge win military industry complex reminds nam tax dollar work make america great almost trump also asked isi investigate bidens quid pro quo wait ca turkish force dig wreckage gain information bombing headquarters accidental trying hide something would say like catch  22  bomb airstrip german give better term debt much costing u keep turkish trump tower business turkish troop shooting u held position u bomb position sends suit ankara agree u one carrying nation step return fire fired upon sound like acceptable idea man great use taxpayer dollar build base abandon bomb else orderly retreat would mean complete proper dismantling base hasty retreat destroy one use u care occupies base pulling anyway purpose scorched earth move thought turkey ally attacking u base trump stupidity affecting military wonder support war criminal say lot reddit internet general requires purpose tag like seems pretty well implied even one chooses read story course people wo footnote needed ignored sop leave nothing behind aid enemy instructed put willy pete top vehicle engine block bug burn way sweet sorrow united state retreat syria blowing million dollar supply fear incoming rebel winning yet trump supporter america change ally like underwear evacuating troop making every country hate maga nothing say strongest military world like running away blowing base fall hand rival force much equipment intelligence think destroyed fled isi getting stronger every reported event music ear america nearly last person blow latrine imagine directing blame turkey bombing kurd trump turkey entire planet knee thanking kurd heroic fight isi instead get repaid genocide nato ally hell wrong trump guy used like wtf love war look armchair analyst somehow know situation syria potus saying good move everyone u involvement syria long ago erdogan explicitly stated multiple time want depose assad good thing pkk kurdish resistance fighter considered terrorist organization united state going people opinion changed drastically short time edit sure  2020  dems take besides probably pretty disgusting looking patas problem foot foot fucking sick anti trump propaganda headline hasty work since campaigned 
djdvfr,1571351361.0,trump thursday praised erdogan agreeing deal u characterized syria turkey promptly disputed said,maxwellhill,949,19,want thank congratulate president erdogan friend mine glad problem frankly hell leader trump praising despotic leader despotic leader made look like fool day ago deleted trump gun start shooting tend thing jesus fucking christ five year old eloquent guy least two year erdogan shut trump tower see melt trump lie thing think guy wo disagree president mexico wall trump simpleton best tl dr could make original reduced  76  bot president donald trump thursday praised turkish president recep tayyip erdogan agreeing quot amazing quot syria turkey  039  foreign minister explicitly said quot quot gun start shooting tend thing tell behalf u want thank turkey want thank people gotten together made happen quot trump said quot want thank everybody thing want thank group want thank kurd incredibly happy solution solution really well saved life frankly saved life extended summary faq version tl drs far feedback  23 autotldr pm comment monitored constructive feedback welcome top keywords  1  trump  2  want  3  thank  4  turkey  5  tell lying lip moving turkey living bubble know trump hears want hear well guy must mistaken trump donts lie leader big ego collide one strongman room narcissistic leader deleted get turkey say pause turkey firing x 200 b spongebob longer attacking area firing cease yes agree mike penny representation u fact negotiated syria pause word trump lair read tweet post truth deleted technically good illustration trump derangement syndrome know believing genocidal well alternative expel kurd zone force wipe allowing leave en masse without bombing shooting probably best outcome everyone involved definitely ceasefire simply stopping fighting period nope ceasefire win fight often wise interfere loser erdogan want say great special like 
e2k312,1574878426.0,prince charles acting shadow king queen nears retirement,,186,17,shadow king sound like something fantasy book retirement death btw bet outlive sun set british empire shadow king rise distract u horror randy andy nation wince go back drinking tea dandelion burdock monarchy  21 st century circumstance see absurdity used period transition institution get scrutiny even ardent royalist heart heart say look forward charles king best tl dr could make original reduced  83  bot royal source told sun wednesday planning prince charles  039  accession throne going quot time quot highlighted prince andrew saga quot charles recognised acted decisively like king may well soon moment charles stepped prince regent shadow quot prince andrew left guest list meantime majesty continuing keep calm carry job prince andrew face first major event forced watch wing extended summary faq version tl drs far feedback  23 autotldr pm comment monitored constructive feedback welcome top keywords prince  1  andrew  2  royal  3  charles  4  queen  5  acting like crown prince hold press user often report submission site ask u ban sensationalized article oppose blanket banning news source reader responsibility skeptical check source comment flaw help improve thread linking medium verifies question article claim link could help reader better understand issue find evidence article title false misleading contact moderator review bot action performed automatically please contact moderator subreddit question concern shadow queen nice way talk queen coming death time abolish monarchy imagine entering work force first time age  71  going shock bet could pas duty king philip atleast month dude deserves chance real king atleast month thought charles abicated claim decade ago god save prince tampon 
e5yohk,1575463402.0,trump nato summit like homer simpson trying screw according uk feared journalist,chelsea707,162,11,think fair compare trump homer simpson trump like burn would intelligent ralph wiggum educated cletus spuckler first laughed headline realized insulting homer simpson like peter griffin control british crown keep metric system feared journalist feared next headline uk feared journalist sued unlicensed usage disney property doh emily maitlis feared thought andrew neil feared journalist given prime minister keep running away removed 
eb21tn,1576432337.0,philippine earthquake powerful quake strike near davao city one child reported died least  14  injured local flee home shopping centre panic building collapse power line seen erupting spark,easyone,167,2,hope tsunami user often report submission site ask u ban sensationalized article oppose blanket banning news source reader responsibility skeptical check source comment flaw help improve thread linking medium verifies question article claim link could help reader better understand issue find evidence article title false misleading contact moderator review bot action performed automatically please contact moderator subreddit question concern 
