id,time,title,author,score,num_comments,text
aiqpni,1548186928.0,china reportedly made app show people standing near someone debt new part intrusive credit policy,mistakes_maker,14777,100,would want sharing filthy air poor would america like everyone china seems like glorified prison title little misleading people debt people sued incourt lost cant pay settlement lot time dispute resolved financially everything theft bar fight car accident lot people claim poverty dont pay app real show folk saying right  5 hing different title say edit article link article scmp referring english op article made lot liberal assumption original article sure chinese people saving habit  one episode black mirror anyone china daily said would let people debtor capable paying debt understand correctly mean see debtor thing person debt anything remotely expensive could alert authority say behavior could flag someone capable paying debt going useful government deleted usa would show population density someone actually inside china confirm many friend outside china chinese say news published english medium wrong time far away reality far fucked news heard social credit system draconian deleted see debt people everywhere steal one money guy hand app would easy create u x 200 b standing inside united state x 200 b yes x 200 b near someone debt someone debt oh end well debt controlled control someone afford buy house cash around  10  year ago kid middle school high school coming ridiculous idea joke still remember mine people found outrageous namely make system warns people far lower income near little know prophet idea obviously ridiculous many thing happen life would lead debt wow way meet american black mirror real life black mirror created episode people get rated based social score like score low ca get plane rent car china hold beer damn china scary like imagine believing debt somehow make bad person thinking someone debt bad person make good person religious level lunacy board train china really doubling black mirror goal black mirror going reality  3   2   1  google helping also indicate bank trillion dollar bad debt real estate peculator scam buyer entity actually threatening economy deleted wrong debt long paying obligation receive social credit boost u swap show debt otherwise never turn china literally building totalitarian  1984  esque nightmare state ca wait life cycle sometimes u need app everyone drowning debt someone explain point please america get ding standing next someone debt equivalent finding shiny pokemon deleted mental note move china chinese american shaking head glad family left immigrated people china feel paydar sound like trying use technology manipulate human emotion like guilt shame promote government approved behavior whole nation get concerning week thank bill clinton vouching could get wto everybody else wincing humanitarian record rape torture kill million flag organ donor need something lmao please become economy spend reportedly guy stoop depth right guy arrest poor petty crime put prison never see light day record never get job put debt could sworn country meanwhile america app would get notification hot chick tinder literally fuck anyone description p whoa scary dangerous u everyone would surrounded debtor like forcefully trying divide people good gained exactly cold heartless people swear china come insidious thing pass totally normal basically someone smart could figure group rich people hanging mug hmm man hope fix issue soon alienating dividing entire country causing atmosphere fear paranoia enough issue earth right first thought good know generous oh poor innocent mind good ole usa play shit cue progressive commercial insert thingy vehicle comparing apple orange slippery slope argue kinda already insurance company keeping tab argument stretched credit monitoring service linking marketing company ya know one monitor online habit wait till rat life insurance provider visited  10 x last month premium went download app crawled dark age go barreling back beyond disturbing imagine usa youd never near someone debt sound good pile china shit submit people quicker revolt replace system app called nosedive chinese people go u everyone debt day fuck really losing faith humanity either perpetrator victim middle ground allowed man hate chinese government mean plenty shitty chinese citizen really bad china fucked someone carry phone fucked seems cruel humiliating benefit anyone gain bring app u college phone explodes wow china really making thing worse citizen one set people want come usa escape poverty people feom china come usa enjoy democracy sure story line black mirror episode china use public shame tactic people life together amount comment comparing china united state apalling lived would know surely living country make meme president would lot liberating one winnie pooh book risk reason chinese mind current govt freedom ever previous one even draconian move china thing going good credit lol image app u wait log onto facebook connection debt ironically subscriber subreddit probably brainwashed china based sensationalized tabloid story average chinese citizen commie regime yes honestly nothing like medium feeding u use skin color social credit utterly terrifies literal evil genius positive reinforcement peer pressure weaponised combined penalty undesirable worst thing could sneak lot system bit bit almost society objective socially isolate debt help understand chinese people fine kind stuff like give shit privacy dystopian society gon na come crumbling economic boom stop china housing bubble burst ca rely cheap labor anymore shit fall u something similar called maga hat fucking hell orwellian beyond compare literally making citizen big brother reminds day nazi germany ddr blockleiter inform government one neighbor acted suspiciously whole social credit thing like premise movie wild remember america west test surveillance tech asia implementing little little great thing constitution  200  million gun owner keep politician check seriously fuck china bullshit law stuff like taking inspiration dystopian book making one giant glorified prison mindless sheep ca imagine generation growing extreme censorship turn someone fucking stop please edit spelling nosedive make app reveals people dick size getting eyed men woman china thing need america nazi punch consider second nothing debt way make people aware intimate detail another person without knowledge consent direct erosion basic privacy national scale wo used debt used identify people government like labeled something universally bad like pedophile trump supporter u branded terrorist none would proven would show system bill way solve debt crisis thing seem like weird way solve problem everyone agrees solved go along everyone fine eventually abused colossal scale one stop mean hell already happened india debt include mortgage car business loan mean part healthy economy black mirror shit remember thinking something like could used abuser child support payment say see facebook post lot new related stuff show time every month caption like thanks check idiot lol week later post ca afford diaper month seen shit like infuriating 
ao5k7b,1549557377.0,hailed hero rescuing sister family car plunged icy river,ComplexCheesecake,129,7,amazing kid car started going cuckoo usually supposed talk stranger mummy said ok time deleted deleted made tear sad incredibly brave acted terrifying situation would appropriate paywall b oh give break  6  year old couldnt save glass milk spilling 
aqxr03,1550245044.0,european parliament approves controversial meme ban,Zomaarwat,129,20,meme explicitly exempted copyright claim misleading headline come  2  petabyte torrent archive dank meme best tl dr could make original reduced  69  bot last night european parliament approved final text controversial online copyright law would force internet platform filter everything user upload copyright including meme charge news aggregator link news publication rule dubbed quot link tax quot would force news aggregator including heavyweight like google news get license news publisher remunerate linking article parliament member julia reda prominent opponent new law argued small publisher le brand recognition could lose law could boost fake news discouraging sharing reputable news would charge extended summary faq version tl drs far feedback  23 autotldr pm comment monitored constructive feedback welcome top keywords new  1  parliament  2  copyright  3  force  4  internet  5  article  11  spain tried google news much bigger much worse article  13  might big problem platform like youtube imgur others dmca encouraged sketchy problematic automated filtering article  13  might end pushing farther link tax google absolutely absurd love see google completely asks money enjoy greedy fuck trying stir support brexit gone read directive none news site want link seems want make informed decision categorically tell claim completely false summary tech giant must pay work artist journalist use small micro platform excluded directive scope hyperlink accompanied individual word shared freely journalist must get share remuneration obtained publishing house meme affected way shape form claimed many publication tldr directive strengthens right guy get content ripped little course action mean small hard worker creating content producing something get value back big corporation use right meme affected along small micro platform excluded directive scope   deleted god eu fucking garbage stop trivializing terrible thing calling meme ban joke europe europe restricting free speech else new interesting learning consider beneficial forward looking data protection privacy right afforded gdpr juxtaposing legistlation like eu banning meme deleted thought x 200 b oh wait x 200 b cant use meme anymore um shit cowabunga begin 
bc6duf,1555023364.0,spacex land three falcon heavy rocket booster first time ever,dbgt7,43919,67,long ago landing orbital booster jet laughably realm science fiction three aerial ballet well done mind blown launch rocket space land two stage simultaneously land land third drone ship rocking ocean technology amazing come far lifetime absolutely stunning watching three rocket full throttle racing towards heaven sight behold watching land first time also incredible footage  2  booster landing main rocket landing video come back flight back dominican pilot pointed launch u actually take indirect route back boston launch super cool experience air thisthough made day good day humankind watched work spacex customer surreal see two rocket coming like something early main booster touched signal broke one engineer commented always like totally normal landing time frickin amazin spacex making excellent progress past couple year hope keep got see person truly unbelievable sight see entire rocket go minute later back came top fact part ready another launch within matter day mind blowing definitely worth skipping night class doubter take man serious congratulation order impressive feat incredible got little misty eyed crazy couple day outer space amazing see negative news feed past month always pleased spacex achievement landing three crossing border technology magic watched live office work today blown away proud human race achievement firmly believe destiny lie star brings u one step closer realizing destiny made cry meant showing sign specie survives long enough could colonizing planet outside solar system real life kerbal space program hardest part always building first rocket land fuckin awesome another happy landing yay congrats spacex well done wish heavy would get human rated well removed musk continue yesterday bought toothpaste roller thing put bottom tube two cylinder held together tight rubber band side push toothpaste tube use mind fucking blown awe incredible society saw always felt bit sad born late live apollo era found depressing travel across atlantic fucking florida see saturn watching yesterday launch landing make must felt mercury apollo day truly exciting time alive whatever think elon musk antic really glad seems success story happens billionaire actually work advance humanity elon electric car rocket ship love buy guy beer hope musk smoking nice fat blunt right smiling blow smoke ula black hole pic week amazing week humanity science honestly believe musk meet exceed projection also hoping get mar literally get away fucking world live science victory turn flight passing cape canaveral exact time launched pretty surreal historic day let u forget top gear attempt skip amazing whenever see booster coming upright slowing landing still look like cgi really well done movie effect wore occupy mar space x shirt today sorry get rock hard idk tell great job spacex nailed actually really fucking cool sometimes get bummed alive first moon landing see new advance reusable rocket remind alive second space age science yeah bit contrast making car one point must unthinkable technological achievement working internal combustion engine work properly sat bench chugging away dying make ai assisted rocket work perfectly fall fucking sky explodes fireball meh seen flip seriously though ridiculously impressive engineering feat fuck five booster crazy kid kid kid kid look beautiful human engineering piece museum fly hover something incredible away car parking lot nice see live started early see truly capable late discover something world wide changing put tear eye skin color matter brilliant mind one thing propel human race far reach ca even dream imagine mind fucking blowing catch fairing well imagine made tesla private space x private take shit anyone look accomplished love anytime spacex musk day get mocked endlessly le knowledgeable circle invariably something historic like next week fucking giggled like school kid watching parent moon landing absolutely awesome seeing rocket touchdown together never get boring watching thing come space pull florida like ai thang congraz elon know landing dear god force take live space coast working roughly  30  mile away force launch rattled door office much thought going shake hinge second attempt falcon heavy want get used ai thank god elon musk visionary time one single people go history advancing humankind deleted watched live absolutely awesome watched launch jetty park today absolutely incredible thing even witnessed sonic boom seriously loud scared shit great advancement keep elon god damn regretted leaving home university certainly regret hope folk little brother good view watch history unfold realize happening today watch video tomorrow freaking excited spacex far favorite company cool let forget apollo  11  mission accomplished back  60  little space ship launched mothership land moon two cool guy stepped spaceship landed played around bit mothership patiently waiting orbit completing whatever moon surface went back little spaceship launched ship attach rear end mothership incredible thing happened  50  year ago fact able intersteller travel yet completely baffle great space engineering finally moving decent speed amazing pushed technology forward 
bdomvy,1555381617.0,canada join new include,,851,41,make nato blackjack hooker might ask alliance genuinely interested could really figure specific goal providing multilateral approach thing translate practice u never respected trump mike penny trump idiot supporter america become guy girl friend circle hook crazy suddenly find themself uninvited every get together aimed saving international world order destruction various world dictator autocrat president donald trump actually happy acknowledges trump issue delineates dictator autocrat totally fair know canadian itt people seeing reading headline assume canada france germany abandoned nato decade cooperation force support form coalition trump say dumb shit twitter sometimes fucking clickbait headline u respected trump tweet  2018  guess russia gotten wanted fair want least alliance consider u national security threat best tl dr could make original reduced  86  bot foreign affair minister chrystia freeland offered canada  039  support alliance multilateralism meeting g 7  foreign minister dinard france earlier month testimony last week senate foreign affair committee freeland said canada joined alliance over concern g 7  growing threat posed authoritarian regime disinformation campaign aimed discrediting democracy institution canada excluded another multilateral initiative aimed reforming wto october canada hosted  13  wto  039   160  member ottawa meeting looking way reform world  039  trade referee extended summary faq version tl drs far feedback  23 autotldr pm comment monitored constructive feedback welcome top keywords canada  1  wto  2  freeland  3   4  trump  5  homer club damn got fomo canadian read news every day hey like ww 2  u join becomes fashionable  gon na make alliance blackjack hooker bender sit u deleted bad elect idiot conservative cancel membership spite liberal belief chaos better cooperative institution see fat kid ja let start group play fat kid  3  country close civil war u wa hoohooo original red dawn movie started great going team fight hardened dictator france u vote trump back laughing stock world uk going brexit politician world wide best thinking people get mad american say glad u lesser role nato everyone else want anyway ally getting band back together time china play comintern sweet let pull nato keeping base europe seriously though laughable three country readiness level absolutely trash good u fuck deleted going pay lmao x 200 b mad trump wanted pay fair share nato rest easy europe power house canada save day military send lot thought prayer finally country could take care world problem tax paper money go county maybe fix usa problem look like fake news since newspaper reporting source back story get japan rest cptpp new grand alliance deleted canada france germany fundamental muslim western world duh begin canada demise gon na sit back let canada drift sphere glad canada joined long til something like start allowing authoritarian leader like un nato another political joke 
boe2wh,1557807865.0,whatsapp urge user upgrade discovering spyware vulnerability spyware developed israeli cyber intelligence company used infected phone call take function operating system,EnoughPM2020,885,38,know anything like malware make update remove device need factory reset think uninstall instead fam vulnerability used attempted attack phone attorney  12  may ft reported lawyer identified name involved lawsuit nso brought group mexican journalist government critic saudi arabian dissident circumstance would nso involved operating identifying target technology solely operated intelligence law enforcement agency nso group told nso would could use technology right target person organization including hahahahahahahahahahahahahahahahahahahahahahahahah gasp air ahahahahahahahahahahahahahahahahahahahahahaha someone list good alternative whatsapp please need easy enough use switch transition family friend without much fuss best tl dr could make original reduced  80  bot whatsapp encouraging user update latest version app discovering vulnerability allowed spyware injected user  039  phone app  039  phone call function spyware developed israeli cyber intelligence company nso group according financial time first reported vulnerability quot attack hallmark private company reportedly work government deliver spyware take function mobile phone operating system quot whatsapp said statement extended summary faq version tl drs far feedback  23 autotldr pm comment monitored constructive feedback welcome top keywords nso  1  phone  2  company  3  whatsapp  4  user  5  bug feature indication version vulnerable v fixed anyone guess app white house us sensitive state business small reminder buttery male absence smoking gun proving criminal intent disguise communication bar criminal prosecution clinton private server gross negligence gross negligence triggered activity resulted loss classified material foreign government since one could prove chinese russian saudi obtained classified material clinton server proof gross negligence therefore criminal act already knew kushner taking action clinton using whatsapp white house business report offer convincing evidence guilty criminal negligence  18   793  f ever mention classified information whatsapp jared kushner felon app jared kushner us official business wondering reddit reaction would title say whatsapp urge user upgrade discovering spyware vulnerability spyware developed russian cyber intelligence company used infected phone call take function operating system signal need government regulation access chat directly instead relying hack funny doesnt mention patch note upgrade using whatsapp nice hear whatsapp part facebook owned facebook first hand perspective ive heard facebooks behalf topic people happy nothing worry delt breach security lawyer victim company felt threatened spyware prosecuting thought delete whatsapp messenger technology tap cell phone microphone anyone know version whatsapp patched security flaw android use signal whatsapp facebook sifts whatever want whatsapp um urged user upgrade certainly aware til mf received call whatsapp fine viber compare trust first  2  page google result question oh fuck glad ever use ca even imagine scary must certain people close covert connection uk israeli intelligence need come israeli security system use daily online banking example willing use whatsup spy end thank alliance word jared kushner shit lol open source way people android fdroid app store vetted open source apps use sure zuckerberg know anything bbc news website stopped working hour minute story posted strange coincidence screen shot website  404  error later showed  500  internal server error warming removed israeli firm tied tool us whatsapp flaw spy activist nso group headquarters herzliya israel one firm spyware tool used break cellphone whatsapp security flaw researcher said see way keep israeli firm headline lol scumbags proprietary software strike vulnerability used attempted attack phone attorney  12  may ft reported lawyer identified name involved lawsuit nso brought group mexican journalist government critic saudi arabian dissident spy normal person nso limit sale spyware pegasus state intelligence agency spyware capability near absolute installed phone software extract data already device text message contact gps location email browser history etc addition creating new data using phone microphone camera record user surroundings ambient sound according  2016  report new york time scumbags deleted open link reddit either regard story israel option block israel connection whatsapp server country country cause much damage need position future ye update software hack try also hope whatsapp take court sue billion damage vulnerability used attempted attack phone attorney  12  may ft reported lawyer identified name involved lawsuit nso brought group mexican journalist government critic saudi arabian dissident spy normal person nso limit sale spyware pegasus state intelligence agency spyware capability near absolute installed phone software extract data already device text message contact gps location email browser history etc addition creating new data using phone microphone camera record user surroundings ambient sound according  2016  report new york time scumbags removed 
cg66ur,1563754913.0,attack office beijing representative hong kong protester blatant challenge central government tolerated state news agency xinhua said editorial monday,madam1,874,21,look like really going push way going hot august honestly believe storming office orchestrated government give excuse justify violence protestors majestic national emblem people republic china defaced black paint caused unbearable pain anger xinhua said illegal act unacceptable chinese people including people hong central government looking reason go tiananmen hong kong protestors fact many hong kong entirely ok defacing emblem repressive regime run em tank worked last time right china majestic national emblem people republic china defaced black paint caused unbearable pain anger majestic unbearable pain anger chinese government would apparently like remind everyone black paint symbol okay running people armored fighting vehicle say police force teaming triad support central government oppression assault civilian thing actually tolerated beijing get nitpick anyone behavior rotten deleted ahh reichstag fire sure gov also behind beating protester earlier really hope china figure hong kong going trouble worth people tasted freedom rule law fight hold onto right china looking iraq afghanistan saying see democracy appealing hong kong educated wealthy happy proud institution trying swallow suppress thing going hurt china far benefit eventually accomplishing task point seem like china keen keeping either hong kong rise keep resisting let whole world see beijing blatant attack human decency attack staged game next step bomb government building protester beaten silence u also deafening used guy intervening everything heard peep everyone bullshit scared china help hk thug unleashed shortly government increasingly revealed element control people working rich gorvernments need fear people considered reason mob attack mtr trying steal headline false flag 
