id,time,title,author,score,num_comments,text
e37q87,1574991764.0,trump administration grant  45  fewer visa visitor china,princey12,2291,39,stupid article  2014  obama administration u china signed treaty allowed person country receive  10  year visa many chinese citizen would receive visa good  1  year treaty reduced need chinese repeatedly apply new visa china sending spy steal tech company university decade democrat agree move fuck china deleted damn positive news trump sort downside think bad thing good move trump part ah count reddit hypocritical hive mind know getting downvoted oblivion hysterical stereotyping mccarthyist rhetoric suddenly ok popular convenient feel free call chinese pawn spy whatever probably smart use burner account shit nothing hide think cut entirely tell chinese citizen stop harassing protestors sovereign nation quit fucking putting million innocent people death camp illegally expanding territory man made island south china sea buying real estate western city making housing market price high people respective county afford rent purchase house awesome cool actually agree move trump administration abc whose parent got student visa work visa green card chinese tourist get tourist visa come give birth birth tourism wealthy chinese actually anything lead good life china however want american citizenship child chinese college might hard enter entire industry sprung around birth tourism pay hug sum birth tourism operator teach obtain tourist visa fill hospital form pay hospital bill giving birth would okay  100  thailand girlfriend master degree work law firm phuket visa denied good reduce number grant asylum uighur reddit handle one hand trump limiting immigration move hurt china trump asshole china asshole think good idea maybe even higher range never thread everyone agreeance like fuck china wonder much due policy change trump administration much due reduction interest travelling usa chinese national helpful indian student  12 k spend study good need reduce visa india visitor definitely visitor take  100  job china exceeded critical point progress west ia powerless anything worst tourist world good good see lot stupid comment plenty chinese friend spy better vetting cool making good one hate u self fulfilling prophecy keep good going convince vote lol u denying visa chinese applicant chinese applying visit u war going holy shit trump thing reddit like hate cunt condone democates social liberal hate america see better way save divide china thing trump gotten completely right hopefully doesnt betray u secure shitty deal time election normally try stay unprejudiced generalize seriously fuck vast majority chinese people come come horrible tourist litter park cheat university spy u met totally fine never seen another nationality group act entitled selfish chinese everybody trump supporter respect elected fuck china one rare time trump guess make could afford golden visa kushner huh fucking joke country lol drop  0  hong kong free whatever objective seems legit removed good fuck china band rude tourist pretty soon right line mexican fine broken clock twice day make full  100  xenophobic drastic measure taken undermine ccp corrupt grip world guy hear chinese people poop everywhere serious problem sign reminding people toilet exist 
evre32,1580324721.0,un report warns isi reasserting new leader believed behind yazidi genocide,,438,24,keeping money ca sanctioned safe house full cash deleted stable genius told isi defeated wait second somebody recently told isi destroyed ca remember said assured surprise always another boogeyman whether cartel terrorist org wait demented idiot u gave presidency tell world defeated another trumpian lie world pain never stop got ta keep blood money flowing reminder pkk rest nsdf saved yazidi isi first time betrayed em al bagdaddy v 2  loving evil sadistic religion drone cut one head two grow kind problem war terror u country scared people current country send troop stabilize country people country scared troop fight back creating war terror um hail hydra time base election around promise defeat isi long corruption unrest lack work security vacuum political turmoil persist region others like going anywhere long izlum world ca better place thought utterly destroyed last atom glorious leader whenever see un always substituting n head know ok cool fuck shit next one x 200 b edit haha reddit downvoted wanting kill killed isi piece shit stay reddit reddit sort thing look even hilarious lens history people lost fucking mind quite funny snuff fucker planet already dam genocide happened kentucky saw horrible footage fake news trump said defeated isi said must true cause jesus told obama give another  150  billion cash 
ew4xcs,1580388488.0,mask may offer sense security wuhan virus say medical expert,saurabh24_,424,12,deleted use plastic container still got couple old gas mask military look buying new filter better use mask go mask going filter air well think read work minute barrier becomes moist individual breath mask get way protect pretty much impossible good hand hygiene public people often get sick touch contaminated surface touching face mask great reminder actual physical barrier remind touch face home properly washed hand call bullshit medical expert due human behavior risk assessment work medical expert leaning heavily hope individual go ignore precaution violating every guideline mask reality individual already wearing mask likely also washing hand constantly minding bodily fluid go one consider mask  100  proof sense security exponentially much susceptible infected even usage mask clearly care started hearing bad news blow yep medical expert would know saying thing medium exactly smartest thing midst new outbreak help people really deleted doctor quoted post made big assumption feeling unwell always use mask going put trust random street right thing see lot people might mask might forehead might chin millennials 
ewrtoo,1580492035.0,expert developed rapid nucleic test kit novel coronavirus detect virus within  8   15  minute kit undergoing mass production china jiangsu province,green_flash,574,9,hopefully effective blood test lung scan could really help stop spread virus give many false negative leading virus spreading rapid hiv test margin error based number factor edit false negative false positive damn thought speed research pandemic inc unrealistically fast amazing fast stuff get done planet working nothing make feel better medical device test made within day never go peer review information regarding work kept secret lab testing given current point care testing kit influenza top  20  minute mark sceptical assay validated properly company name behind end causing healthy people locked sick people getting sick sick people released get healthy people sick outside quarantine zone chinese gon na make fortune whether kit work even self create market security false negative guess probably one last virus able seriously harm humanity survive another century pandemic probably far le deadly dangerous tinfoil hat time seems bio weapon something manifesting bat seen 
ez8egx,1580903317.0,trump sotu address derided manifesto mistruths impeachment trial set acquit today,don-mir,331,19,perhaps condemnation came democratic senator chris van hollen said wanted attend maga rally would attend maga rally president never miss opportunity divide country disgraceful performance okay senator hollen one senate acquit taking victory lap please ya queda please stop using euphemism call lie weakest stupidest people vile rich people still support america president u internal news manifesto mistruths exactly expected many actually walked ridiculous sotu speech dont blame saved bullshit maga rally get chance watch cringey heard pinned medal piece shit here fucking stupid follower single republican voted find guilty would straight faced argue ca find guilty evidence witness confirm charge little leni riefenstahl production acid trump twitter feed collection retweets great speech deranged pelsoi tantrum disturbing user often report submission site ask u ban sensationalized article oppose blanket banning news source reader responsibility skeptical check source comment flaw help improve thread linking medium verifies question article claim link could help reader better understand issue find evidence article title false misleading contact moderator review bot action performed automatically please contact moderator subreddit question concern greatest threat trump represents assault truth truth matter nothing else link shared  3  time please consider making crosspost instead reposting next time first seen last seen searched link indexed post search time feedback hate visit zorp surveyor show anytime today  5  senator running president use office political gain attempt tp remove opponent office thankfully enough vote preserve republic according medium celebrating historically low unemployment booming economy maga rally full propoganda mistruths trump basically guaranteed win  2020  pretty good speech said true wtf removed removed 
f70g7o,1582235500.0,corrupt elite siphon aid money intended world poorest,wrapityup,252,13,time fucking revolution would say business usual utter subhuman ratcunts people deify rich people greatest enemy humanity ever known else new surprised people trillion dollar million must none would orgy without woman would understand even obvious next step way past man changed much suffice say would awake really value change reason stop sending foreign aid remember guy set bbqs private airport soon eat one rich secret pheromone panic others scramble private jet catch bottleneck um duh poor need write best seller millionayahs clinton haiti 
f81at0,1582416145.0,coronavirus hubei province report  630  new case  96  new death,Ouch_that_smarts,109,4,today lie matter leader bette action together scientist look scientific information ahh asian basic hygiene skill 
four9b,1585158768.0,steven dick  37  year old british embassy diplomat budapest dy,merulaalba,296,12,know seems made difference hope uk finally acting cv 19  stay safe take seriously rip old person virus deleted damn hope dispels myth virus dangerous young people discriminate  19  year old another woman died uk zoomers boomer beware attempting body shame anything picture look quite would consider healthy especially respiratory virus deleted damn transferred sooner would dick move please tell obese chain smoker deleted coronavirus dick like steven 
g0fi04,1586769358.0,trespasser fly swastika chinese flag phone tower,blitzskrieg,118,6,really interesting time alive huawei  5 gs people really continue protest significance phone tower  5 g china government pretty fascist tbf deleted 
g3g3yu,1587177939.0,chaos medical supply shipment china delayed export restriction limited cargo space,,109,6,country need recognize outsourcing national security risk make medical supply quality likely far reliable china different super market whole customer rush buy toilet paper ca ever hope enough need many many store supply population matter talking town planet ca  1  place supply everyone also need worried quality kit around  63000  protective kit sent india pas quality test canada got planeload supply tuesday started distribute hospital standard procedure mask n 95  garbage kept sliding around smelled chemical seems like many faulty rely anyway usa ok though death rate slowed everyone going back work next week 
gcz946,1588543571.0,chinese authority shut domestic flight wuhan chinese city urging airline maintain international route wuhan,Try_Another_NO,640,18,deleted whoa look good true could considered biological terrorism u intelligence agency certainly picked whether reached correct conclusion doesnt matter ignored anyway best tl dr could make original reduced  93  bot new evidence show china locked domestic traffic internally end january  2020  pushed open foreign travel till end march issued travel advisory china travel  2 nd february ban service though virus originated china initially infected citizen  27  nation china  039  diabolic international travel policy spread rapidly totally unprepared europe mainly italy spain thereafter rest world becoming global pandemic extended summary faq version tl drs far feedback  23 autotldr pm comment monitored constructive feedback welcome top keywords china  1  traffic  2  virus  3  chinese  4  city  5  yup rememeber back china problem u problem care outrageous article decides trust china intention locked domestic travel yes optic bad within playbook manage epidemic yet number reported death accurate understood country health organization china decease willfully underestimated trusted opinion blog author written excellent piece three reason could china economic control weapon surprise surprise country concentration camp wanted export disease western medium went roar trump racist mantra wanted stop flight china one shocked information going come china aggressive dangerous country ccp evil hope combo australia western europe u continue put pressure china well start company move china act war china need sued action spoke world respone back time u get together one issue china government chinese people really bad world see ccp terrible organization respond avoiding chinese good pressure point disposal boycott china going china story today title false statement incorrect summary article international passenger route wuhan also shut time article say china maintained international route part country reduced spread corona virus within china china aggressive foreign travel policy lead virus explosion worldwide umm even mean country lock travel going outside country many eu country blocked people leaving far despite biggest epicenter virus u stopped people leaving country infected dead understand point someone help understand aggressive foreign travel policy suppose mean fuck ccp crazy reddit think china caricature global villain 
gjmrbe,1589464358.0,man called philippine president crazy facebook arrested cyberlibel,9999monkeys,7670,143,cyberlibel might favorite new meaningless word duterte crazy duterte certifiably arrest someone calling crazy proving point actually ex pat living philippine attest man totally wait hol someone door brb isnt crazy killed drug user inspite son drug something libel true crazy fucker crazy fucker whatever crazy fucker deleted wow crazy deleted filipino still fawn like god smthng make want call idiot facebook page ca reach side pond crazy po people support obviously unstable doltish wannabe dictator beyond get crime horrible thinking largely indiscriminate murder effective acceptable solution fucking nut fantasy someday duterte bolsonaro erdogan modi xi putin trump arrested made share cell maximum security lockup livestream course guest star could weekly visit random strongman dictator like nursultan nazarbayev kazakhstan islam karimov rule boil political enemy alive weekly song dance number kim jong un duterte bitch giant crybaby bitch would even able handle single match game back glory day xbox live p kill silly filipino cyberlibel man internet sure different  20  year ago lmfao hahahahahahahaha fuck cyber libel real hahahaha walk away screen like close eye haha little baby boy duerte best tl dr could make original reduced  54  bot manila philippine man arrested agusan del norte facebook post criticizing president rodrigo duterte senator christopher quot bong quot go wednesday afternoon joselito esquivel arrested reynaldo orcullo salesman living barangay triangulo nasipit town alleged libelous statement posted facebook supposedly called president quot foolish featured story member regional unit  13  nasipit municipal police station arrested orcullo residence  3  orcullo detained racu  13  complaint violation section  4  cybercrime prevention act  2012  readied extended summary faq version tl drs far feedback  23 autotldr pm comment monitored constructive feedback welcome top keywords post  1  arrested  2  orcullo  3  facebook  4  president  5  france parliament voted law criminalize teacher instructed report speech pupil guy philippine president crazy quote sadly government official many se asia country sue libel used form censorship people complain living u free speech yeah united state far perfect shit bad removed think britain arrested cyberbullying fuck duerte called bad name oh boohoo grow pussy philippine president crazy duterte crazy let get straight amoral vicious thug jail leading country long trump try make cyber libel thing people accept absurdity make duarte prove crazy would fun watch truth absolute defense charge libel filipino lawyer anyone report cyberlibel authority fact report increasing every year people get arrested majority case eventually dismissed lack evidence arrest cyber libel guilt post making sound duterte got butthurt called crazy guy idea next door neighbor suing cousin cyberlibel calling whore president law legal practitioner fully support decriminalizing libel happening anytime soon coming country near imagine someone showing home saying online comment criticized person going arrest fuuuuuck shit lol poor guy doubt hear damn week tweeted realdonaldtrump pussy everyday freedom speech important sound like censorship extra step happen trump get elected wo leave arrested saying something mean internet crazy gon na fun concerned u trying pas bill allows internet search becoming like china going consider cyberbulling future disagreement disgust senator appose right even mention arrest lie pretty sure browse internet history anyone  30  eventually find something offensive really want arrested crazy person would arrest someone cyberlibel checkmate whoever arrest calling crazy enjoy blessing democracy never go beyond think right without minding violate provision law enjoy democracy way allow communist as kinda seems like type crap william barr mcconnell trying get passed expect seriously leader fucking loon probably torture fly hour controversial statement trump crazy durerte get shat enough democracy man president philippine coo coo crazy c r z philippine president crazy say white american safely ensconced constitution u military make le true crazy fascist libel true honest said coke bitch deranged wow duterte crazy duterte made shitty country much much worse dickless fuckface supporter canada deported including old bos delusional duterte psychotic duterte deserves set fire fuck duterte crazy also heard people say tiny penis duterte stupid crazy needle dick bitch come get broski crybaby think imprisoning someone calling crazy right crazy scale dead think guy deleted duterte must certificate saying donkeybrains give trump idea asshole trump got cyberlibel found new internet alias cmon could complimenting duterte man crazy mathafacka mistake using real name photo facebook dont terrifying cyberlibel sure fun word say cyberlibel new favorite word cyberlibel one crazy mudafucka duterte small non functioning penis article alam na pattern mosalida si go konuhay siya mohangyo sa buang nga pangulo digong buang si digong orcullo wrote facebook already know pattern go create scripted demand foolish digong digong fool hey president duerte wan na smoke joint crazy thought phillipines pvp enabled talk good band name cyberlibel mean duterte prove crazy used love visit philippine jackass came power first showed warned people new pol pot proof becoming fearless leader miss philippine step foot till coup dead removed call cybel sound cooler actually getting crazy tried taiwanese government hand someone talking bad online month ago going international impossible pronounce cyberlibel correctly amazing trump would thing thought could get away guy posted pay  50 million php someone murdere president  100 m guy meanwhile vp constant online harasament president supporter like wtf would threaten vp daughter rape dd confession india google one want find crazy duterte supporter roll google police philippine quick selective justice mocha uson would make question official koko pimentel covid would direct key duterte supporter deliberately infected hospital senator btw really surprising considering philippine major u social medium company outsource shadow moderation wonder digital globalization shit man cyberlibel sound like band name ive ever heard one guess trump next law think exists head laughed idea internet troll hauled police shitposting allowed called massive cunt going extradite cyberlibel hopefully american president get idea cough cough corona fuck duterte held libel unless able make psychiatric diagnosis man certified must release people like bring u lot criticism another country certainly u face many problem wo get arrested calling trump crazy facebook wo get arrested criticizing local police speed trap happened china man locked metal torture chair making social medium post criticising police motorcycle ticketing wo even get arrested making joke poor taste fatal accident happened uk garbage truck accident tweet add shit people getting jailed said vice president senator people even threatened rape senator defending person action made people cyberlibel cyberbullying prove crazed president philippine cannibal pedophile cyberlibel sound sexy af everyone philippine tweet interesting crazy someone arrested cyberlibel cyber show cyber hatred oncoming cyber dystopia crazy come get chump guy said give  50 mil peso whoever shoot du 30  think calling crazy hate du 30  putting bounty someone head seems greatest idea use nord vpn slander resent slander spoken print libel pathetic wrong illegal president president actually president something else entirely defense easy  2 dirty crazy must get certified neutral psychological assessment prove mentally deranged one opinion another baseless happened asean country seems trend democracy extemely limited cyberlibel trump arrest crazy loud crack noise swat brings door duterte crazy also lot cocaine duterte fuck sheep goat cyberlibel man account may deep trouble gon na find river human right place sigh quite possibly man planet insecure egomaniacal trump executed like dog street president surprised shot libel requires thing probably false proving duterte crazy big fucking lift guy going die anyway cyberlibel really call libel defamation better yet call thing defamation ca libel true president philippine crazy deleted telling duterte government way authoritirianism already see continuously attacked rappler free press ph recently already ceased operation alarming lack check balance government majority people judiciary legislative ally man almost untouchable future hate speech law u would argue arrest prof president philippine indeed crazy im crazy would crazy man arrest something said internet huh problem libel true guy crazy know telling truth libel sad feel philippine feel country well kinda feel like genocide sorry phillipine president fucking batshit insane nut job sits room day drooling staring wall know really weird know single arrest literally ten maybe hundred thousand u bitch duterte online daily basis especially shitshow response didnt deplatform like u freedomloving westerner reddit wet dream china already spreading smh 
