id,time,title,author,score,num_comments,text
hzkh3s,1595962296.0,american military self isolating canada despite required,,55514,68,thing japan like became problem japan deleted removed kick keep border closed allowed fucking base ca wo follow law abhorrent cunt sorry canada cure stupid live  20  minute pissed done well flattening curve like  3  active case population  500 k entitled prick waltz like place fined going take least one full generation america start getting respect back never felt le secure canadian life feeling think government everything right entire world could get fucked psychotic neighbour get fucking shit together embarrassing american big fucking surprise u troop almost always given specific instruction ca foreign country embassy usual guidance status force agreement u host nation would surprise canadian mod told dod quarantine despite conflict provincial rule probably get buried happened john newfoundland province bad outbreak funeral home right start pandemic provincial government maintained strict rule country handful case since people returning province except  3  case last week someone came home infected child another person presumably wife child slow cautious reopening despite case thing gotten back something resembling normal last week people upset say least health care system extremely stretched sort outbreak could disastrous plus outbreak based government handled first wave could facing several month locked system place based level full  4  week wait minimum level end locked rest summer fall cant imagine pissed people going based article sound like miscommunication federal agency provincial government find odd u military adheres hotel mask policy disregard isolation policy seems like probably told ok leave cbsa line provincial policy would first time federal provincial jurisdiction conflict policy newfoundland le  10  case since may island province easily isolated american service men want spread trump virus arrogance unfathomable lock  14  day demand negative test result release ever jesus fucking fantastic christ america get shit together sacrificed nl fucking month get spike case inept dumb fucking american im gon na lose shit oh ffs ship back well see  2  thing going  1  according article cbsa said exemption isolation elaborate exemption  2  health minister say exemption would allow skip rule issue better communication federal v provincial jurisdiction check let military member know instead blasting social medium issue wearing mask inside hotel abiding rule sure would mind need someone would let know either side party involved know full story maybe quarantined traveling know unit done traveled safe way bottom line hope clear soon reach let know personally think mind requirement course american soldier required iq common sense cup poor education add teaspoon arrogance  2  tablespoon denial canadian visiting armed force exempt quarantine requirement need ban american canada maybe build wall something jeeeez guy anyone non american looking adopt  28  year old man talk embarrassing ca wait get briefed dumbshit airman like allowed canada since military job ice job export guess turn say yankee go home sending u best bad hombre kick charge respecting rule fuck embarrassing shameful way american behave disrespectful truly embarrassed usa right letting yank need build wall keep dirty american like say american serviceman woman family based southern spain rota base following isolation mask wearing rule either confront whole group walking around local mall feel exempt wearing mask public law say must voluntary worst neighbour ever build moat make pay canada need reduce amount people crossing border shit hole country buddy battalion multiple positive covid test arrived training quarantined month come back home next week tested unless decide go right back family right back normal society weird always thought military discipline people feel way feel like might start hesitating come respecting young veteran service member consensus amongst brass take temp door ignore go away eventually seeing american plate everywhere canada article like got ta say really enjoying entitlement neighbour alot lately guy alot work best get good ol self reflection sometime soon america fuck yeah comin spread mo fuckin disease yeah american canadian soil obliged follow law land need taken task canada managing spread responsibly need people care enough canadian govern accordingly fuck idiot even allowed country honestly self isolate sent back infect idiot like travel pass canada revoked sit inside house month maga retard america fuck u american entitled arrogant stereotype reason feel bad american deal shit get minority arsehole country horrible selfish people go home gi john police said received report american monday night however officer able locate duh wear camo eli 5  american military canada america get bad reputation god dammit deleted especially prudent newfoundland one oldest population na deleted sorry u military anyway deport alien trumpian flu veteran thoroughly disgusted behavior clearly fucking idea oath struggle forefather nothing arrogance pride see nothing outside emotional lens read forefather small pox maybe would see idiotic bad make uniform look military act like law police well mean killed  200  thousand plus iraqi war based lie doubt give fuck medical rule america shit green bag photo say sobeys canadian grocery store officer told order room service hotel wanted food screw going alaska take boat lol reading really embarrassing american want assure though u like suck people behave way representing u canada enforce quarantine law go fine  6  month jail time respecting  14  day self isolation stated right quarantine quarantine requirement section put jail 
i10hgu,1596166709.0,american citizen shot dead pakistan courtroom accused blasphemy,tomassfoolery,255,23,jesus fucking christ killing name religion old gag look like naseem shot dead claiming prophet particularly hazardous pakistan refuse recognize ahmadiyyas muslim naseem member ahmadiyya sect minority community barred calling islamic pakistani law group also face religious persecution discrimination country law known disproportionately target ahmadi muslim color surprised religion scourge humanity edit grammar deleted humanity never advance survive specie keep fighting religion resource fuck deleted well let pas judgment cultural value others wait particularly eve commemorating abraham willingness sacrifice son ishmael owed akbar gee really looking forward consequence religion disease practitioner carrier alleged killer told police ordered kill naseem dream somehow legally defensible motivation pakistan seems like want come something little sound fuck allows gun courtroom pakistani course deleted trump problem foreign nation brutalizing american protester american soil absolutely nothing come considering victim shitty headline shot private citizen title seems imply court sanctioned order removed smell like justification freedom let fuck entire country lot pent aggression state side aisle president looking war help save chance upcoming election also sorry islam straight archaic least live america oppressive fascist country 
i5c11t,1596799300.0, 27  human gene renamed past year excel misread symbol date,ScorchedMagic,1107,36,software developper excel meant take data make readable human meant part workflow learn code python easy enough data flow draw chart excel excel convert automagically many thing date colleague may language version excel language separate thousand power decimal seen serial number converted date like  01102045  excel place data flow opened excel stay excel bioinformatician basically data science guy biology serious problem field many time file go plain text format excel biologist need use table generated make plot excel still common way added many publication require table uploaded excel file convert excel file upon publication something like  20  paper included gene name autoconverted best tl dr could make original reduced  91  bot past year  27  human gene renamed microsoft excel kept misreading symbol date microsoft win fight human genetics bruford note dissent decision mostly seems focused single question easier rename human gene change excel work exactly fight microsoft entire genetics community scientist back microsoft excel may fleeting human gene around long extended summary faq version tl drs far feedback  23 autotldr pm comment monitored constructive feedback welcome top keywords gene  1  excel  2  name  3  bruford  4  symbol  5  excel translation e value exponent standard plate laid well address well a 1  first well a 2  one right etc row e 1  e 2  e 3  e 12  fine run prefix location plate number  1 a 3  plate  1  well a 3  cause problem e row  5 e 12   2 e 7  etc excel translates numerical value ca always saved aftet excel translation daily pain arse get datasets others scientist properly format data excel fault user fault one think using spreadsheet like word processor database manager little insane sure hate excel impossible use tech industry personally run date conversion issue repeatedly long account number scientific notation issue god forbid executive would ever want post processing report ran would programmatically insert invisible character column row changed number data type text thankfully left alone many year ago sound like gotten worse regard excel keeper human genome could possibly go wrong thought could change format cell text fixed  27  human gene renamed past year stupid scientist store data appropriate uh maybe use excel excel dumpster fire genuinely believe human progress significantly hampered due ubiquity excel within scientific business community devil lie detail boy tell quite horrible one people still seem use excel data processing actual data processing pipeline many software product suck giving help want hello auto correct ask change input excel need scientist mode simply open text setting convert anything mode blaming excel weak excuse wait till m perfectchild office home edition removed epigenetics thing everyone keep talking change format read like actual name chad karen gene powerhouse cell news stop storing bread toaster kept converting bread toast query animation construction book publishing industry industry standard software like adobe autodesk etc construction industry also deal lot data input output spreadsheet like program scientific research field biology etc standard set file format program use insight danger unsupervised ai imagine one moment life depended spreadsheet typical organisation attempt minimise workforce cost forcing worker carry duty beyond field expertise happens profession company run accountant shareholder yes let u blame excel excel pft everyone us number day easy workaround excel mar 1  becomes unless type becomes mar 1  apostrophe fuck everything else try really really annoying system biologist quadram institute uk told verge whose job involves analyzing freshly sequenced genetic data say excel error happen time simply software often first thing hand scientist process numerical data widespread tool bit computationally illiterate use say phd study well letting doctorate program instead updating program decided rename several human gene holy fuck like changing name fucking correct keep fucking ask fucking company turn shit stop fucking people mental health human race fault excel dumbass scientist really bad computer anyone life science love god use electronic lab notebook word hell science excel supposed smart people would take day figure python whatever excel outsource data handling office secretary excel brought man want vaccinate everyone corona 
i72r8s,1597057392.0,expat officer hong kong could face torture case united kingdom,cito-cy,113,2,nice tactic best tl dr could make original reduced  64  bot international coalition activist lawyer among exiled hong kong activist nathan law planning launch private prosecution uk senior british officer serving local police force police officer named far according case senior british officer accused torturing protester past year example stamping head kneeling neck employing method contravene international policing norm violate human right law quot independent police complaint council able carry objective investigation taken place hong kong national security law mean bringing action hong kong police within hong kong difficult giving evidence hong kong police could interpreted subversion quot polak said extended summary faq version tl drs far feedback  23 autotldr pm comment monitored constructive feedback welcome top keywords hong  1  kong  2  police  3  officer  4  law  5  
i9y4qn,1597452668.0,taiwan finalises u  62  billion purchase jet lockheed martin,Exastiken,246,13,number right taiwan pay  8 b  62 b includes potential buyer next decade bloomberg accurate  62  billion figure announced pentagon friday upper limit numerous contract potential foreign customer placed maximum desired number decade got ta get really stick china article wrong sale  8  billion  62  billion best tl dr could make original reduced  70  bot washington taiwan finalised purchase fighter jet u aircraft manufacturer lockheed martin friday source confirmed afp u  62  billion deal sure anger beijing taiwan already fleet purchased commentary fighter jet sale taiwan complex balance power lockheed contract come beijing flex political muscle hong kong imposing sweeping security law international business hub move caused concern taiwan extended summary faq version tl drs far feedback  23 autotldr pm comment monitored constructive feedback welcome top keywords taiwan  1  beijing  2  contract  3  purchase  4   5  come lockheed stock hope sale tax corporate income tax get paid lol chance ally spend money citizen u  62  billion like  2000  jet seriously old best kind military aircraft already enough beat defend china imagine paying price  2020  taiwan dumping yard date u military hardware since worthless wreckage takeoff airfield within chinese mlrs range even takeoff blanked sam coverage mainland china chinese ddgs offshore clear pilot would mean multiple medal already facing stealth fighter range missile deleted terrible news military spending fucked put weapon save specie 
ioeimy,1599507868.0,greece boost military amid tension turkey,guanaco55,152,4,go greek island near turkey take deep breath actually smell imminent war best tl dr could make original reduced  83  bot greece said bolster military new weapon troop development defence industry tense standoff neighbouring turkey sparked concern open conflict two nato ally last week greece raised billion euro bond auction country seek increase military spending raise fund business affected coronavirus pandemic turkey stationed ten thousand troop north island since  1974  invasion followed coup engineered military ruler greece extended summary faq version tl drs far feedback  23 autotldr pm comment monitored constructive feedback welcome top keywords greece  1  turkey  2  greek  3  military  4  country  5  europe stand behind wasnt greece broke year back got money jet ship 
iqan7n,1599766911.0,u war since displaced least  37  million people study find,NinjaDiscoJesus,293,14,also mentioned reason state longer inclined declare war proliferation law governing conduct armed conflict increased number codified jus bello law raise compliance cost formally acknowledging state war use military force nbsp infact modern warfare marked thing like drone small number special force military contractor cyber warfare pr firm opposed large deployment troop approach conflict remove barrier war inflict massive casualty invading country troop would draw attention drain support involvement nbsp western world especially referring united state united kingdom france well majority nato alliance partner involved would technically considered war crime many country middle east north africa currently undeclared war hell actually colonialism truly honest anyway defund u see lot redditors saying coronavirus bigger effect  20  year idk death toll still rising world today without would unrecognizable  7  war  17  year plus  2  attempted coup last  6  month study methodology completely flawed take conflict middle east u involved add total number refugee entire conflict list even conflict like somalia multiple faction fighting decade since fall government  80  get lumped entirely u war terror looking conflict like afghanistan iraq one thing including total refugee conflict like yemen syria spawned arab spring would continue regardless u involvement completely disingenuous yeah see raytheon return period really blew portfolio lol kinda keep getting reposted false attribute displacement conflict u even u peripheral role instance syria yemen fighting civil war several faction year u gone isi al qaeda respectively conflict involvement tiny fraction fighting mean displacement yemen syria u war anything fight isi decreased displacement allowed people fled isi go back home labelled u war majority western power went war u ca even imagine thing could achieved amount money intelligence focus energy fuel clothes gear workforce resource current economical usa driven shitshow based warfare whatever country consuming safety wellbeing space colony interstellar travel enhanced ability human quality quantity know bipartisanship action capitalism work wonder usa spend much millitary threaten nuclear war anything fall behind r fucked kind shit best tl dr could make original reduced  82  bot u war displaced least  37  million people around world past  19  year brown university  039  cost war project found toll quot exceeds displaced every war since  1900  except world war ii quot quot conservative quot estimate could even quot closer million quot state report although million longer count displaced person refugee quot erase trauma displacement mean displaced returned original home secure life extended summary faq version tl drs far feedback  23 autotldr pm comment monitored constructive feedback welcome top keywords displaced  1  report  2  war  3  country  4  million  5  well trump fault nothing 
iqqrmz,1599831963.0,china purification classroom new law era history silence teacher rewrite book,zsreport,305,14,hmmmmm wonder else see happening another day ministry truth china sound like never cultural revolution include school actually taught best tl dr could make original reduced  95  bot quot turning education tool controlling thought hong kong quot said ip lawmaker representing education sector vice president hong kong professional teacher  039  union hong kong  039  dramatic transformation largely free society one resembles tightly controlled mainland  039  expected fully take place  2047  end period britain returned territory china  1997  special arrangement known quot one country two system quot supposed guarantee hong kong high degree autonomy chill academic freedom harks back cold war era student teacher hong kong forbidden discus politics order british colonial government extended summary faq version tl drs far feedback  23 autotldr pm comment monitored constructive feedback welcome top keywords teach  1  kong  2  hong  3  school  4  student  5  history rewritten world end going well china world  1 st large xi george orwell  1984  instructional manual sound like  1619  project praise winnie pooh eternal honey bucket may head never become lodged allowed xi elevate level mao brought new cultural revolution probably going worse first one history abused moral scold nation shaming history taught learn past mistake understand got society live today another grave error attribute society history thing never determined society example patriarchy never established society largely due greater urge dominance male specie male aggressive hunter warrior female always child tow entirely due logical consequence biology history get rewritten people want control narrative create moral outrage suppress moral outrage often part bigger denial reality rewrite book ten year later china new point view argue world claim world broadcast fake new china discovered texas approved text book sort thing exclusive china u northern narrative currently riding progressive wave rewrite civil war history history written winner get used 
iwxsq8,1600683922.0,world richest  1  cause double co 2  emission poorest  50  say oxfam,filosoful,370,14,also least likely life immediately impacted climate change care welcome hell kid case  1  categorized anyone making  100 k eating shit people afford air travel suv produce carbon someone walk use scooter lucky rely public transport pull number like electrical usage rich v impoverished private jet bois lmao amazing many people jumped put simps next time third world country poor country blamed blimey need something rich poorest  50  dying consume like  1  reason want fact hundred million indian chinese working hard consume like american succeeding yet make propaganda order  99  feel bad sick world page download report oxfam headline  99  world population earn le  100 k per year  90  world population earn le  35 k per year maybe second part even billionaire exist come mod third post specious nonsense single day 
jmg6le,1604287640.0,australian police  96  child young  11 ,JackdeAlltrades,1035,29,story related one nsw police  340  boy past  3  year guardian  9  dec  2019  nsw police  100  girl including guardian  6  nov  2019  nsw police minister david elliot defends strip search say parent would happy nsw police chief mick fuller defends strip search say child need respect little bit fear nsw police told  15  year old boy lift ball strip search adult present aside cop strip search inquiry cut short nsw government sack commissioner labor question removal lecc chief commissioner michael adam attempt shut inquiry guardian  6  feb  2020  drug sniffing dog get wrong  4   5  time tl dr nsw australia highest populated state  8  million people capital sydney going year nsw police sort people child disproportionately aboriginal always sometimes suspicion drug le commonly suspicion weapon time people going day public somtimes done prisoner police prison custody time search come empty innocent person violated case police even broken state law regarding search state government police chief defending blocking investigation worry australia proven track record dealing swiftly effectively police accountability institutionalised pedophilia taken care next year child australian going mental woman getting strip searched flight middle east recently rebranded police important point note article happened disproportionate number indigenous child banned hentai anything deemed perverted next day stripping clothes little child nothing make sense anymore reason sound like pedo cop fuck australia actual fuck hope level outrage qatar strip search sexual assault woman strip search banned period literally reason drug sniffer dog weapon pat tech need cop raping citizen street name public service protecting nation interest whatever fuck disproportionate number  21  indigenous including one case police new data also revealed indigenous australian age continue disproportionately subjected strip search police see canada alone mistreating indigenous people exactly kid need strip searched first place oh wtf bruz koalakiller sick country sick culture fucking cunt strip searching underage girl going music festival may drug  1  gross wrong law sniffer dog work make people panic take drug spend money police patrol medic tent drug testing site wo well australian guess forget strip search qatar thought australia livid australian woman got strip search uae someone dumped live baby rubbish bin airport mean australia also randomly strip searching people regardless crime think meant child abuser strip searched  96  child pedos think catholic priest ok time start treating pedophile like rabid dog next week news participant hired american immigration custom australian police undress teenager karly warner chief executive nsw aboriginal legal service said follow forcing child remove clothes deeply intrusive disempowering humiliating especially aboriginal people often target discrimination overpolicing said excessive use causing extreme emotional psychological harm unclothed traumatic early encounter police something child deal long allowed put clothes back unjust violates child right undermines relationship police let get straight criticism directed police demographic disproportionately involved wrongdoing investigated demographic police supposed enforce law track area criminal wrongdoing suspected occur rational strong suspicion person abusing law indulging conduct severe negative impact others person limit due age nobody law stating otherwise set horribly dangerous precedent article answer question wanted know circumstance necessary strip search child maybe extraordinary circumstance could happen  96  time removed  pervert got ta stop crafty young bastard 
