id,time,title,author,score,num_comments,text
asa1nc,1550580465.0,bernie sander run president,Escapeadvertising,328,31,bernie sander helped make progressive idea mainstream last election cycle presence definitely good pushing debate man real idea want change country help people could lot worse deleted people actually bernie done wrong hillary corrupt trump well trump bernie done make many people dislike seen seems like make great president least weiner sander legend good see someone actually integrity running presidency person post bernie running u president default sub belong like worldnews surprise one love bernie platform dude pushing  80  time elected need get born wwii time retire vote whoever win democratic primary think bernie sander old president  79  election day reagan  77  left office think bernie entered  2016  election win think wanted move debate left got within striking distance changed whole mindset wish chosen kingmaker instead yes cant find young competent people strong personality run country  77  little emotional would still  100  time better trump might die anytime soon really want hindsight logo printed thing bright side see hillary winning nomination field last election really hope decides running mate younger candidate like booker hope hillary run jesus fucking christ reddit front page going unbearable next year hillary running campaign slogan turn dammit tired  70  yr old white men politics really many time teach lesson old man fuck america chose clinton sander letting trump white house third strike miss ball time whats relation tulsi gabbard nowadays seems nice counterpoint conservative background noooooooooo every democrat going like  500  place tie getting one vote vote white know like poor bernie sander good split democrat  100 k upvotes oh look yet another democratic candidate yaaay unless biden decides run primary winner democratic party already decided kamala harris prevent dnc sabotaging deleted long socialism never take root wasting time stop dont wan na see old guy office dont wan na see old hag lookin hillary get fresh blood someone little younger better view world gon na run another  4  year forward progress president want undo shit last one instead working make better 
avynu6,1551402728.0,trump declares isi  100  defeated  100  true ground report say,ani625,75330,43,declare victory man twice last couple month  100  defeated trump said remark american troop alaska  100  percent took  100  percent caliphate mean area land  100   100  percent true one senior official group said thursday afternoon fighting separately second official said battle still going truth mean trump lied removed worried amount idiot realize second time matter month trump declared isi  100  defeated never mind military leader say apparently draft dodger qualified matter military people actually go fight war never thought live world elderly zap brannigan would president always wonder whether goal muddle average voter sense actually fact trump compulsive liar tend lean towards compulsive liar sometimes honestly sure mix two boy trump anything draw attention away cohen damning testimony humiliation fat little hand kim remember time trump took credit reduced airline death year inauguration  5 etfw  7 ctwcamp  5 etweetembed  7 ctwterm  5 e 948195478428102657   3 a  2 f  2 fhomenews  2 fadministration almost like say anything trump bat lie deleted best tl dr could make original reduced  87  bot  28  president trump declared thursday quot took  100  percent quot territory controlled islamic state syria claim report battle front suggested  100  percent untrue trump administration official moving closer publicly declaring total rout islamic state land control time trump administration sent mixed message resource commit defeat islamic state syria extended summary faq version tl drs far feedback  23 autotldr pm comment monitored constructive feedback welcome top keywords state  1  islamic  2  trump  3  percent  4  official  5  fucking bleach even claim clean thing  100  bush said something along line iraq war well trump said tweeted assured likely untrue mission accomplished holy fuck someone deployed multiple time last year obama trump hell bullshitting defeated still causing atrocity across middle east support terrorist group across globe hell trying bull shit isi never defeated maybe organization give year jihadist band together new brand isi god know however many caliphate existed born mission accomplished mission accomplished time flat circle newsworthy say something complete bullshit story regular thursday declare bankruptcy know decipher nyt recently super hawkish pro war rhetoric like calling tulsi assad apologist fucking veteran edit spelling demoralizing must soldier fighting isi syria right terrorist organization like never  100  defeated take guy make bomb claim responsibility group name isi longer military state reduced ideal however yes trump basically right isi imagine pretty much wiped yeah handful fighter may cause occasional atrocity make news islamic state destroyed ten thousand fighter piece land occupied crushed joke around shit get like isi bad people went news state closing eradicating good news wholesome dude worth almost like something major news story trump trying deflect fine time lie public via medium new bill introducing would support people trust word say trump  100  moron god damn trump ca stop saying dumb shit le  24  hour fiasco north korea summit q barely sounded like coherent human fielding question trump supporter continuing back guy downright delusional isi started form  700  dissident attacked prison allowed joined escape managed grow dozen thousand using guerrilla conquer territory territory gone isi still enough people time completely ignore whatever say focus going background blatantly saying dumb shit point distract focus shady shit undiagnosed mental condition two option right trump desperately looking  2020  win run economy great many american living paycheck paycheck taxcut disaster middle class people ended spending thousand healthcare repeal replace utter failure remove mandate causing price continue rise faster wall best tiny fraction might get built lengthy legal battle year nk peace well hit another bump far taking credit trend started year ago either gwb obama like unemployment anyone look graph see done anything personally illogical even narcissist mean next time isi anything attack anywhere trump get egg face trump setting look like liar point trump presidency written book shame bukake breaking headline liar tell lie also remember north korea totally longer threat today failed negotiation proved still liar understand word lie still happening feel like entered another dimension whole world turn shit stained joke reality hard find day end upside realm reality isi suck ball hi outside u wanted chime let know apart right wing one outside u belief anything trump say come across like deflection excuse bragging little evidence back guess kind like north korea situation  100  solved trump family  100  innocent crime one read past click bait headline said took back  100  territory today conquered last isi held city  100  accurate fuck nyt fake news everyone voted weak minded sheep claim trump supporter seriously ca read past headline willfully ignorant deleted 
aww2o8,1551633558.0,feel cheated big telco hike price  60  plan  10  gb sparking complaint cbc news,bennyandthehumans,691,36,something seriously fishy major provider put plan amount time anything price fixing fuck useless crtc nothing per usual got phone paid waiting one deal come back wonder point major network allowed collude gigantic bait switch operation crush new competition fucking cartel different quick search show denmark get unlimited minute  30 gb data appears also include hbo nordic chromecast  3  stuff like music streaming totally fair comparison might provide bit perspective royally getting screwed fact change price month month basis b like saying hmmm much want rip month fucked forreal shit happened yep telus upped bill  10  appease gave  5 gb  70  month  15 gb big network working towards  5 g speed yet bandwidth cap still ridiculous amount like  1 gb  5 gb  10 gb good  5 g speed reach monthly cap  1  minute  5 g speed even  4 g speed typical bandwidth cap reached comically short amount time complete disconnect company consumer pay  8  per month fixed unlimited  40 gb data guy really need kind law reform data limit purely extort money refuse go anywhere near unless necessary like mobile data limit fucking everywhere month usage well  500 gb bell rogers telus said raise price  60  offer plan instead deal well telco wrong hear right  10 gb  60  point reference im indonesia get  37 gb  4 g around  7  coverage insane island perminent population mountain  8  hour bus ride across country flawless service pretty ticked canadian law firm taken class action lawsuit behalf nearly  30  million canadian firm held accountable realistically speaking would collapse require public bailout would paying back tax telco exec make billion bonus money fucking irritating tfw cheaper buy american cell phone plan roam canada google fibre sorry company make enough buy toronto maple leaf charging way fucking much money unlimited gb shithole third world country truly unlimited forbid torrent easily worked around vpn response email complaint big 3  squeaky wheel get grease let squeaky best tl dr could make original reduced  92  bot howard lorentz kitchener call  10  price hike telus  60   10  gb plan  039  bait switch week december  2017  three telco offered  60  plan  10  gb customer ontario alberta mann vancouver said  5  price hike  60   10  gb phone plan  039  justified said even  65  month  10  gb bell plan still good deal ontario big three telco  039  current rate phone plan  9  gb  110  month extended summary faq version tl drs far feedback  23 autotldr pm comment monitored constructive feedback welcome top keywords plan  1  price  2  telus  3   60   4  customer  5  get unlimited data  50  switzerland checked get letter notice bill went  5   60   65  ah free market work apparently major canadian city switch freedom mobile big  3  care cancel net neutral everybody swap company time period actually losing customer big  3  change lose revenue way switch freedom live one coverage area need switch switch stop complaining part problem shoutout mnsi lowering price second time since unlimited phone cost le  10  cad per month probably still going let fund run almost never used even turned past month pay  50  month freedom mobile unlimited everything  10 gb data go  10  throttle speed got contract back alsojust pay go lmao bad unlimited call text within country run need send text request give  2 gb extra every time text part family package tho regular price croatia glad see koodo among changing although sure soon holy shit ot expensive first place turn data saver use something like dataly similar product stop using streaming music watching much youtube boom problem solved surf good  2   3  hour day ride work since drive able keep usage  100  meg day took awhile figure though honestly plan still cheapest plan getting canada uh really people moron upset country phone service expensive personal plan still better get thinking indefinitely offer plan without rate change moronic found rogers bill went  5  inquire raise apparently downloadable pdf bill previous month stated raising price quietly sneaky way rogers app phone ability send u rubbish message regarding  100   10 gb send u message regarding price increase internet era cry loud send u link agree acknowledged regarding price increase instead adding price consumer quietly coverage provided rogers would gone service affiliated big  2  suggest filing complaint crtc first complaint coming big volume believed gov try something  60   10 gb plan audacity send promotion  100   10 gb nz get  10 gb plan  55  nzd  50  cad  70  nz plan  25 gb oh shit ajit pai still ftc chair recently discovered website compare differents carrier find best deal efficient really work guy take look hm really world news know canada exists planet earth something local stick paid phone straight talk got tired getting screwed verizon oh bill plan oh another buck part network month month agreement signed verbally agreed state pricing subject change also service agreement contract stating promising price forever wait someone still data limit really need data phone use wifi hotspot save money 
b9pcxy,1554459189.0,eu find german automaker illegally colluded emission technology,AndrewGreenberg,929,26,big fine coming way rightly knowingly tried cheat aka lying emission expense planet mankind individual could make even money greedy cking stards throw book say step  1  cheat make billion step  2  plausibly deny settle million fine step  3  spend money best tl dr could make original reduced  83  bot german car manufacturing giant volkswagen daimler bmw illegally colluded hinder competition emission cleaning technology european commission said friday  2006   2014  three german automaker conspired limit development emission cleaning technology passenger car sold europe german car giant hot water friday  039  preliminary finding latest emission scandal hit german autoindustry extended summary faq version tl drs far feedback  23 autotldr pm comment monitored constructive feedback welcome top keywords car  1  company  2  german  3  emission  4  technology  5  break give prison sentence executive responsible company big fail proven trusted gentle reminder vw tried blame programmer damn pesky rogue programmer known pollusion even first time thought eu ever shook innocent hardworking american company nothing wrong count breaking law article say vw daimler bmw colluding picture include audi porsche mercedes friend work bmw dealership kept telling emission deal volkswagen going volkswagen refused listen lol im going text today article hehe told never looked emission buying car something normal people otherwise dont get people losing mind lied directly causing buy vehicle collusion even illegal fine doled past anticompetitive behaviour anything go auto company better start buckling going get bumpy next tell german auto maker also colluding technology feature price point didnt find like  5  year ago well shit pretty obvious level especially diesel model starting think collude going dirty word watergate soon german collusion nahhhh word becoming cringey fad care u automaker colluded delaying every conceivable safety device decade u finance industry colluded create beloved fico score medical industry colluded create pharmaceutical industry collusion pure americana thought collusion crime german screwing europe go figure oh fuck stock nein collusion deleted 
be2nmp,1555468655.0,plummeting battery price make electric car cheaper gas car  3  year,abcde9999,658,27,battery getting cheaper smaller yes significantly heard big breakthrough lately could someone comment link edit well look far read electric vehicle battery wiki page price per kwh  200  compared  2010  expected fall  150  couple year tesla claim  130  volume vehicle yearly  2020  huge breakthrough rather constant reduction price actually quite significant edit 2  urethratoheaven commented reduction  130   10  year indeed fast best tl dr could make original reduced  78  bot battery getting smaller cheaper much faster expected expert bloomberg nef revise projection electric vehicle every year bnef projected  2017  quot crossover point electric vehicle cheaper upfront combustion vehicle quot would  2026  bnef energy analyst nathaniel bullard tweeted last week bullard explains bloomberg article crossover start  2022  large vehicle europe quickly spread smaller vehicle part world battery price continue plummet extended summary faq version tl drs far feedback  23 autotldr pm comment monitored constructive feedback welcome top keywords vehicle  1  much  2  battery  3  cost  4  bnef  5  deleted recharging time day long journey fuel car  5  min really want hang around hour really stop getting ev edit thanks serious reply much snark salt around topic edit people answered fantasy response downvotes unbelievable anyone else worry rapid development ev technology lead people discard replace ev carbon emission production even offset disposability culture already horrendous problem car general perhaps used early generation ev flooding market low price make though ev charging infrastructure ready rapid growth ev vehicle nice charger home solar luckily whenever charger away home worried often place hoping charge occupied even vehicle spot currently charging particular brand ready go ton company different inconvenient method payment darn thing work live southern ca decent percentage ev vehicle charging get faster range increase le issue feel like infrastructure year ready go region add cost solar home charging cost vehicle crossover point push way future mass production lithium ion battery electric vehicle tend reduce price period time however correct wrong saying real breakthrough maximum energy density achievable battery think worth noting mining process lithium cobalt heavy metal used battery worst ongoing ecological disaster planet heavy metal shit coming make battery going see increased lobbying fossil fuel company designate lithium rich country conflict zone pressure u govt embargo heavily tariff country good know ca wait supposed flying car settle car drive somewhere doof around phone original article another future industry china dominating let see keep car running long anyone know kind ecological nightmare creating making many large battery disposed safely recycled process gathering raw material said battery sure look awful lot like strip mining third world country little ecological oversight trying shame use electric vehicle concerned nobody paying attention potential problem boom use may cause conservative estimate ask getting saving wait deplete lithium start use material making electric motor yeah skyrocketing electricity price raise cost using level maybe exciting prospect consider source great happens core battery wear assuming industry boom happens demand replacement exceeds supply used sell luxury car bit still keep market trend tesla taken luxury market share car qualified already price already cheap cheaper luxury level tax incentive especially edit proof market dominance pt 2  pt 3  best benefit electric car priority lane gas saving everyone drive priority lane suck start green light beat every ice car every time everyone drive electric life le amazing please tell mass  1  reason wo neodymium deleted 
bf6gxb,1555720580.0,judge say u government sued flint water crisis,dhth7a,1384,16,well probably around hundred million dollar worth capital improvement required get pipe fixed include plant upgrade exactly zero chance rate base going absorb cost someone world news rule  1  u internal news politics guess ok make u look bad u government michigan government changed way flint got water u internal news sue community get clean water something right tax going kind infrastructure tax paying fuck paying force tax lived flint entire life served country five year two tour afghanistan served community fifteen year social worker see town news time never positive thought moving everyone care love world life know city better place stayed rather left choose stay truth people live flint good citizen pay tax obey law try think right deal live u law fund u government tax assured receive help ever need need people talk water unemployment crime rate seen one talk truly wrong city paint glue huffing think degenerate teenager slathering glue rag huffing right wrong everyone stop ten people street guarantee six glue problem transcends race income age seen english teacher stumbling back classroom getting blasted amyl seen city council member hide tube sock arm sleeve whiff town hall meeting cop crash median getting gassed job mother pas child car walmart parking lot getting bombed moon gas wan na know fix flint get rid fucking glue flint mascot would civil servant car tubular snot hand air dick dick forget water forget crime forget pothole  9 th street go glue could sue civil court negligence think challenge get blood stone even verdict repetition money try go collect think even brown family still waiting paid oj civil case deleted well duh sue anything mean win though billionaire give church hundred million fire notre dame know church enough fix fix flint water point water quality need fault deleted people need locked starting city manager replaced duly elected mayor deleted 
bjfnjr,1556707473.0,julian assange sentenced  50  week jail uk breaching bail condition,bbcnews,2012,41,brief summary old wikileaks julian assange sentenced  50  week jail breaching bail condition last month arrest ecuadorian embassy took refuge london embassy  2012  avoid extradition sweden sexual assault allegation denied swedish investigation since lapsed lawyer alleged victim suggested charge could resurrected letter read court assange said found struggling difficult circumstance apologised consider disrespected packed southwark crown court thought time best perhaps thing could done said face u federal conspiracy charge related one largest leak government secret uk decide whether extradite assange u response allegation conspired former u intelligence analyst chelsea manning download classified database face five year u prison convicted website wikileaks published thousand classified document covering everything film industry national security war link u indictment assange wonder change sentenced u surely go fucked th judge sentencing remark remindme  51  week jullian deadman switch activate guy gon na get merked guaranteed deleted u last stop extradition get ai leaving buy time actually well quick serious question uk court system much faster u way ever free man ah standard reaction country also share would treated shit outlaw government despite hollow promise protection government  50  week sound worse  1  year going leave  2008  economist new medium award  2009  amnesty international uk medium award  2010  time person year reader choice  2010  sam adam award  2010  le monde reader choice award person year  2011  free dacia award  2011  sydney peace foundation gold medal  2011  martha gellhorn prize journalism  2011  voltaire award free speech  2012  big brother award italy  2012  hero privacy  2013  global exchange human right award people choice  2013  yoko ono lennon courage award art  2013  new york festival world tv film silver world medal  2014  union journalist kazakhstan top prize  2019  galizia prize released  25  week long extradition take released complete surely seek asylum kept prison remand extradition hearing complete anyone knowledgeable stuff edit sentencing remark judge note serve half sentence  25  week typical uk short term sentence bet jail upgrade embassy he living go shitty living condition another least doe worry kitty litter saying  50  week tactic try make sound like le time say  1  year bullshit letting hooligan thug criminal silence truth quieting guy dark bullshit seeing seems like people forgotten julian assange handed uk authority condition uk government give country practice death penalty britain unlikely persuaded hand especially may corbyn power since dislike trump fiddiweeks assange break bail condition sweden u place assange need fear someone summarize international quagmire please year seven one year sentence deleted deleted let forget published classified info chic dick stole chelsea manning saying right sentence commuted yet catching shit received deleted far best possible outcome extradite journalist bad journalist good typical western aproach good lesson everybody whistleblower brave people support work russia china enemy free world want man imprisoned problem freedom happens imperium come state enemy ruining man life making world better place given stance find difficult muster ounce sympathy man really hoping would sent u really soon trump supporter expecting trump pardon dissatisfied see con establishmentist trump really swede brit american gon na pas as around till brother tell fart yawn shipped time extradition time election exposing crime u empire good luck assange world need get back work leak important truly free democracy fuck uk u breaching civilian right unforgivable sin hope sweden reopen investigation rape charge assange get extradited finish sentence uk 
bn2jgz,1557516151.0,illegal drug mexico could decriminalized radical government plan,TommyKnotts313,203,10,deleted look happened portugal little lesson mexican politics proposal sound like good plan politician either  1  enact  2  poorly backfire likely  3  corruptly steal anything imagine would happen drug need exported anymore american could go holiday mexico get wasted tax tourism potential mexico unlimited body able want real help would allow drug cartel access banking system let put money bank let bank use deposit write loan development suddenly mexico country benefitting american drug habit trump administration pissing ally mexican government easier access country sort investment new opportunity new export market think new president something right point safely conclude war drug ineffective cause harm good time start making thing right could huge would treat addiction like medical problem criminal one meaning mexico would need le assistance u fighting drug mean nobody would able police dirty job yes see corrupt police officer quitting job get hired cartel assassin mean already dirty job would forced choose side cartel collapse sound good 
