id,time,title,author,score,num_comments,text
dkjgdh,1571577272.0,turkey russia discus removal kurdish militia syrian town,shake4shake,322,11,turkey russia discus removal syrian kurdish ypg force northern syrian town manbij kobani talk sochi next week turkish foreign minister mevlut cavusoglu said turkey ambition region likely determined russia iran support syrian president bashar sdf damascus struck deal counter turkish offensive northeastern syria prompting syrian army force deploy manbij kobani town strategic importance given location syrian border turkey anywhere else assist mr putin nato member russia teaming ethnically cleanse kurd fucking disgrace deleted best tl dr could make original reduced  86  bot ankara turkey russia discus removal syrian kurdish ypg militia northern syrian town manbij kobani talk sochi next week turkish foreign minister mevlut cavusoglu said sunday ankara regard ypg main component syrian democratic force terrorist group link kurdish insurgent southeast turkey sdf damascus struck deal month counter turkish offensive northeastern syria prompting syrian army force deploy manbij kobani town strategic importance given location syrian border turkey extended summary faq version tl drs far feedback  23 autotldr pm comment monitored constructive feedback welcome top keywords turkey  1  ypg  2  syrian  3   4  syria  5  situation making uncomfortable report tonne military equipment left behind destroyed retreated russian ca get hand u military abandoned post operation centre unusual would contacted u plan much rush russia teaming turkey nato member russia influencing exit nato plenty joint confidential information also nuke stored also important military program decade hardware raptor stealth fighter f 35  mention bought russia latest s 400  missile defence system nato reminds nazi soviet divided poland e 2   80  kurd already jumped hoop turkey originally outlined working u make le prepared turkey attacked anyways would anyone trust erdogan make easier wipe russian leave want rape fleeing refugee erdogan putin removal euphemism read kill 
e383h6,1574993609.0,maduro sent  900  million oil cuba official said,Person21323231213242,192,8,regime paid russian oil company rosneft billion half dollar reduce debt said maduro also sent china  3  billion worth oil  900  million cuba  5  billion could spent food medicine said fuck abrams keep straight face spout stuff elliot criminal convicted felon way pas time leave cuba alone removed never trust give dollar amount product volume probably value like calculate drug bust u need stop meddling internal affair foreign sovereign nation u policy forcing regime change suit u ideology need change business u sovereign nation engage trade matter bright side  300  million oil totally fascinated 
e6l31q,1575569650.0,brexit one spectacular mistake eu history say tusk,pipsdontsqueak,1635,29,disagree turn spectacular bad move uk rest eu member remain line eu policy exit movement across europe die uk always special treated arised demand eu member treated different well uk rest union remain solid uk martyr unification europe maybe kind reconciliation distant future brit true european across water news news anyone global temperature rising french strike epstein kill best tl dr could make original reduced  90  bot brexit quot one spectacular mistake quot history eu followed campaign marked quot unprecedented readiness lie quot donald tusk said first interview since standing european council president last week tusk said brexit quot painful saddest experience quot five year office tumultuous period marked greek eurozone crisis bitter row migration election donald trump many eu diplomat fear second referendum leading remain result would mean festering division uk would block eu making decision view tusk strongly rejected extended summary faq version tl drs far feedback  23 autotldr pm comment monitored constructive feedback welcome top keywords tusk  1  europe  2  macron  3  leader  4  decision  5  pale behind trump remembered history pretty stupid fuck yeah mistake hardly united kingdom cut europe ukraine annexed russia ukraine state geopolitical meaning particular cultural import universal significance geographic uniqueness ethnic exclusiveness certain territorial ambition represents enormous danger eurasia without resolving ukrainian problem general senseless speak continental politics ukraine allowed remain independent unless cordon sanitaire would inadmissible iran key ally book us term axis russia need create geopolitical shock within turkey achieved employing kurd armenian minority russia use special service within border united state fuel instability separatism instance provoke racist russia introduce geopolitical disorder internal american activity encouraging kind separatism ethnic social racial conflict actively supporting dissident movement extremist racist sectarian group thus destabilizing internal political process would also make sense simultaneously support isolationist tendency american politics wrong voted leave honestly regret discision fell marketing lie misinformation thought informing misled lied yes eu perfect damn site better political power playing profit squabbling seen uk since vote part think made bed lie democracy able change mind wrong correct wrong locked discisions past voted leave wrong remains seen affect many people badly euro crisis elon tusk british history good come brexit uk wish join canada  4  new province better yet could get scandanavia sort super viking union would epic boil conservative funded putin sowing chaos west benefit one person putin figured way directly politician heart nearly endless greed  100  apple u uk describe mistake eu history brexit caused eu therefore eu mistake perfect tory aim crush exemplary nh throw entire uk population private sector healthcare u company producing medicine equipment extremely exaggerated price room bargaining position uk patient uk one world best universal healthcare system tory want bring back thatcher era worse crime trump gangster antic tory future kill many thousand well would say hate mind went right elon tusk euro printing billion note hand greece see till wednesday eu need take principle subsidiarity seriously spends much effort thing like passing law forbid selling meat pound elon tusk karma british joining start handing country sovereignty eu one spectacular mistake europe history deleted worse world war deleted elon tusk american allowed donate ukip guy going civil war like state tried leave union going eu v uk going internal uk nation work nuke nigel farage believe stuff say convincing actor would send love watch clip youtube speaks passionately snarky git love 
eb2e7s,1576433892.0,citizenship amendment act riot erupt delhi,MuslimAnon1,118,7,important view citizenship amendment act context nrc national register citizen otherwise would look like introduced help persecuted people neighboring country whereas intention completely different government planning create nrc whole india like state assam citizen asked prove citizenship many poor people legacy document prove citizenship fail prove citizenship muslim claim refugee pakistan bangladesh afghanistan get citizenship muslim fail prove citizenship put detention center india building video going viral police setting bus fire frame peaceful protest violent police beating protestors let see get front page anyone remember theory cold war spread communism well new domino theory play instead communism international movement nationalistic genocide terrible thing behold removed sure wedding 
eca7ez,1576659895.0,colombia first female mayor marries partner,Areat,3146,24,congratulation build fucking metro system interesting random trivia claudia lopez received phd northwestern year shaded part bottom block bad perspective hand still little funny gay getting hand two well congrats whatever cool head reddit earlier member congress law exist married people holding office avoid nepotism even lawsuit arguing de facto union go anywhere overall good candidate opinion yeah questionable thing politician also mayor still soooo cute must part gay agenda bigot keep whining felicitaciones claudia alegro mucho espero que cumplas tus promesas tanto en tu vida personal laboral oh yeah coming together take licking keep screaming ok give shit job correctly nobody care gender preference call false gain absolutely nothing majority people living poor nation facade removed care news care get boy pablo escobar rolling grave smh world leader forced marry sex partner yaaaaaay main export still cocaine oof aint much looker think lot lesbian ugly woman decent man wife find another woman similar situation identify problem hate men decide keep eachother lonely forever removed 
egx5ui,1577571412.0,volunteer firefighter new south wale get compensation loss earnings spending time away job battle bushfires state australia federal government say,,982,5,deleted nsw best tl dr could make original reduced  82  bot volunteer firefighter new south wale get compensation loss earnings spending time away job battle bushfires state australia  039  federal government say earlier month two volunteer firefighter young father killed tree fell truck drove towards massive fire state quot paying volunteer sustaining volunteer effort protecting financial loss extended summary faq version tl drs far feedback  23 autotldr pm comment monitored constructive feedback welcome top keywords volunteer  1  new  2  south  3  fire  4  wale  5  yair really good way stop vollies starting kind fire ya dickhead post saying volunteer firefighter paid yet hit front page  50 k vote post  300  know medium always worked way love outrage damn shit incredibly obvious right 
eicrmw,1577845975.0,without evidence trump accuses iran attack u embassy iraq fear war grow,speakhyroglyphically,2257,98,news saying  750  bragg soldier deployed iraq iraq group known supported iran trump partly right iran provides logistical financial support group make decision way headline phrased make assume article biased start prevents taking seriously others stated entirely accurate demand news source tuesday morning hundred protester gathered outside u embassy baghdad along politician militia leader hadi proceeded storm embassy compound set fire embassy compound raised flag kataib hezbollah hezbollah brigade militia u airstrikes targeted u force remained inside throughout afternoon crowd swelled protester set tent hoping stay compound evict u evidence iran backed militia answer quds force openly admit fuck commondreams dross commondreams considered relevant source headline false iraq journalist confirmed presence militia leader funded iran directing protester fuck website evidence fucking hezbollah flag suppose believe iraqi terrible history iran orchestrated war iran also seems incredibly unlikely one american contracted killed good enough justification war especially considering trump would need house actually approve war going get bipartisan support need start war thinking result probably either economic sanction airstrikes hezbollah target claiming war possibility fear mongering point would need iran perform large attack u force citizen order start war think iranian leadership stupid weird source like rt come credibility disclaimer common dream site basically left wing propaganda people choose exist echo chamber crowd moaning trump start war many time last four year heard actually happened imagine hating trump much willingly shill iran escalation tension time election home predictable article suggesting iran absolutely nothing proof another entity funding hamas absolute garbage shit tier news network ever one sooner listen clown anyone dispute hezbollah carried attack anyone still denying iran fund hezbollah thats pretty well verified fact without evidence hahah funny go back living rock fucking libratds almost like get intel briefing get scroll like  7  article sub pretty clear iran medium reporting bombing  25  terrorist country may may funding skewing incident light orchestrating kind stretch medium sure helping well ca new u president leave office pop invasion cherry heart iron community called justifying war goal deleted let get iraq syria saudi arabia kuwait need let handle internal affair hundred year edit say latter two could save taxpayer money bringing troop home mean like evidence tube video caused libyan ambassador hero death gulf tonkin must prot er gulf arabia must protected current presence iraq anything improve situation antagonizing going take long time country heal yesterday every news posted iran backed militia something news corp first trump think war get trump need get stay prison trump dangerous man planet right iraqi blame attack embassy differnece militia group bein backed iran milita group composed iraninans iraq doesnt let based iraq simple fact believe reason targeting iran instead deciidng eradicate militia would solve problem dead people cant spend money matter money come wear welcome happy new war course iri irgc thug protest launched shia backed likely hezbollah backed group fed armed current iranian government pretty obvious iran attacking embassy specialty many attacker even dressed militia uniform well iraqi people sure gladly align iran use help almost iraqi people really care american ungrateful bunch really stop endless war unless start iran made local bar run corona lastnight bastard best tl dr could make original reduced  78  bot quot strongly responded always iran orchestrating attack embassy iraq held fully responsible addition expect iraq use force protect embassy notified quot quot iran directly responsible orchestrating storming embassy iraq must held accountable safety every american serving quot tweeted rubio longtime supporter regime change iran pentagon trump claimed iran behind rocket attack iraqi military base last week killed american contractor iran denied responsibility condemned airstrikes quot clear example terrorism extended summary faq version tl drs far feedback  23 autotldr pm comment monitored constructive feedback welcome top keywords embassy  1  u  2  iran  3  iraq  4  iraqi  5  rick wilson postulate trump may promise bolton war iran exchange testifying war may also distraction trump need amid impeachment scrutiny well fuck ffs let iran iraq become persia done literally pissing money away foreign affair shit home crazy divert attention ram ranch siege interestingly enough iran deny involved let know capture president send certain senate leader negotiate release like forget flight home dumbest lie headline ever direct evidence several picture orchestrated hezbolah guarantee moron made headline work washington post cnn one fake news outlet get journalistic integrity hack know iran backed militia stop lying surely evidence iranian contractor working overtime sofa referring could negotiated better secure iraq iraq wanted obama want wanted safe isil friend murder people stay office give shit people casket side effect reelection campaign unworthy consideration beyond whether end net positive could supported israel israel love u fight anyone deleted shit brain know evidence probably desperate distraction understand invaded iraq like  70  support war donald trump going get anything close never get funding would worry starting war really think ball risk driving price gas right election could determine go jail simple fact start war going make le popular america still war weary iraq afghanistan global domestic economy weak right taking big risk gain lot chance thing go catastrophically wrong pretty much scenario go war anything similar iran get kind big boost favorability like going win anything nothing going win go back american people like hey look got something gas already cheap really nothing iran want end day problem continued military spending middle east need oil american much interest spending tax money child life war term textbook start war let end year bang need evidence left white house nancy reagan moved yet return happy new war obviously err side stupidity w trump decision  100  confident proof iran involvement somewhere crowd littered smg flag iranian backed kata ib hezbollah badr corp aah confirmed ppl trump trying save couple question  1  kataeb hezbollah part pmf pmf fighting isi pmf part iraq armed force recently integrated iraq armed force receiving rank salary iraq military according wikipedia washingtonpost  2  yes q 1  possible u army work alongside iraqi army includes pmf kill time  3  possible pmf easily enter green zone compared previous protest protester shot killed war iran would help trump reelection impeachment going lot uglier midst war iran ill honest super surprised actually said something contractor death many private contractor die american die yet noyone bat eye fucking garrett nbc pompeo never asked evidence deleted without evidence except evidence iran backed attacker ever wonder people mock propaganda garbage spewed daily news propaganda war good distraction senate impeachment trial trump may think knowing much greedy oil men wanted irani oil soon heard embassy attack thought gulf people let u see proof come another fake war boost patriotism deleted type delusional thinking evidence lead attack iranian proxy drawn line oil tanker evidence talk reasoning reason massacred  400  russian soldier long ago attacking small base think peaceful protester hail hydra worry donnie preparing way make sure involved war everyone know ca change president middle war right u launch airstrikes iranian backed militia people surprised protesting embassy iranian backed militia iran fairly instrumental removing isi blind idiot god real truth iran need distract population trouble home need new conflict give people new real bogeyman call b e n g h z level investigation take well year complete people know started american mercenary got killed attacked hezbollah branch considered paramilitary group iraq response killed saying fire rocket killed contractor group saying bombing unwarranted act aggression u action condemned iraq iran syria russia israel lone country supported bombing violent protest bad u started sunday whatever reason launching attack behalf military contractor iraq caretaker prime minister adel abdul mahdi monday condemned u air strike said attack would dangerous consequence prime minister described american attack iraqi armed force unacceptable vicious assault dangerous consequence mahdi office said statement iraq national security council said targeting iraqi paramilitary group force reconsider relationship work international coalition stationed added attack violation sovereignty u force acted based political priority conclusion deleted everything fat fuck say without evidence none real mother fucker spews fake news else evidence need another vial washing powder thing going harp till base belief true thread hit downvote brigade everything trump say bullshit usually projection trump goon must orchestrated learn law broke next trial distraction trump wanted impeachment war impeachment president anything complete lack evidence research planning forethought kind pretty much given reminder trump want war want remembered war time president think guarantee reelection ability suspend election war fox news beating iran drum since started thats evidence cheeto need deleted sound like fear anymore deploying several thousand ofc need drum public support war he president doesnt time supporter maybe derp without evidence shit bush talking wmd obama talking chlorine gas like keep also late never stop well proper casus belli hope nobody find fabricated reputation tank nobody want trade anymore done great expansion work tho pulling bush maneuver start b war iraq secure second term trump need war rally patriotism stand better chance winning upcoming election using washed script possibly least credible president history particularly interested helping saudi arabia establish hegemony region people killed far american civilian iran president impeached oh lookie war 
enn1in,1578833116.0,thousand evacuate taal volcano philippine continues show sign eruption,,540,12,living nyc extended family immediate area volcano know hundred thousand people live evacuation would nightmare situation get worse following morning right looking good volcano cam filmed phreatic eruption inside taal volcano main crater taken january  12   2020  eruption captured phivolcs ip camera interval  1  pm  3  pm handaangmayalam taalvolcano taaleruption 2020  ash steam rose foot ashfall spreading north philippine moment everyone advice wear n 95  mask  94  year old grandma spends hometown batangas philippine avoid canadian winter december  2018  suffered stroke volcanic eruption happens magnet bad luck lola seems thankfully relative managed get tagaytay used spend summer little village near taal volcano beautiful place dangerous hopefully loss life human animal minimal ash fall great even affect live quezon city north manila bulletin issued  4 hours ago phivolcs philippine institute volcanology seismology announced alert level  4  meaning hazardous eruption imminent deleted wife going take trip lake caldera today driving taal yesterday afternoon eruption happened got closer pulled highway  25 k sight sound incredible dust plume boiling volcano booming lightening flashing across long drive back highway ash fallout fell like grey snow long day change vacation plan incredible witness close thankfully casualty hope situation get worse best tl dr could make original reduced  82  bot manila philippine taal volcano spewed massive cloud ash sky sunday forcing precautionary evacuation thousand resident authority said advisory state volcanologists note detected eruptive activity main crater taal volcano continuous eruption generated tall kilometer tephra column rock fragment particle ejected state volcanology bureau say taal volcano  039  main crater escalated eruptive activity generating eruption plume  1  accompanied volcanic tremor felt earthquake taal volcano island barangay agoncillo batangas extended summary faq version tl drs far feedback  23 autotldr pm comment monitored constructive feedback welcome top keywords taal  1  volcano  2  eruption  3  volcanic  4  activity  5  l 4  threat level wtf wrong  2020  deleted anybody idea long could last flight booked manila  10  day sure wait start looking book flight 
et5xoc,1579843830.0,wuhan virus spread doctor wuhan say face patient enough protective gear,vannybros,241,9,wonder china get like fuck get rid wuhan best tl dr could make original reduced  86  bot doctor chinese city wuhan said thousand patient waiting hour see doctor two source direct knowledge situation told scmp doctor nurse medical center hospital wuhan infected quicker rate reported quot many initially informed potential transmission even  039  enough protective gear test kit supply quot one wuhan doctor told xinhua news january  24   2020  extended summary faq version tl drs far feedback  23 autotldr pm comment monitored constructive feedback welcome top keywords doctor  1  told  2  wuhan  3  hospital  4  disease  5  chinese hospital wo prepared poor medical staff make total sense keep duty real quarantine resource arrive sacrifice limited staff already right every person cough fever china trying get hospital indication percent people line actually virus resist fear mongering watch happens real information come hope country chip gear matter think china think everybody interest helping doctor strategy play plague inc highly infectious visible symptom long possible infect many possible would think current report low staff inadequate facility enough chemical suit proper equipment big honcho chinese government would ask donation help someone pitty people worst live every day knowing country government even remotely close able assist type situation prayer sent everyone dy virus dy protective gear guy chernobyl  
