id,time,title,author,score,num_comments,text
bukjfr,1559165595.0,trudeau abortion right cbc news,Spez_Dispenser,17216,81,best tl dr could make original reduced  63  bot prime minister justin trudeau said today quot deeply disappointed quot quot backsliding quot abortion right around world promised canada remain staunch defender woman  039  right choose prime minister justin trudeau speaking paris comment quot disappointing quot law restricting access abortion particularly state saying quot  039  shame increasingly see conservative government conservative politician taking away right hard quot quot  039  shame increasingly see conservative government conservative politician taking away right many many year generation woman male ally quot said extended summary faq version tl drs far feedback  23 autotldr pm comment monitored constructive feedback welcome top keywords right  1  abortion  2  conservative  3  woman  4  state  5  honestly understand feel like distraction tactic government bud yeah trump tweet calling trudeau loser loser everyone say real sad loser hear loser people tell loser loser sad wish trump call someone loser retort coming guy lost billion dollar  10  year thats rich state passing abortion ban  1  alabama  2  arkansas  3  georgia  4  kentucky  5  louisiana  6  mississippi  7  missouri  8  ohio  9  utah state highest infant mortality rate  1  mississippi  2  arkansas  5  alabama  8  georgia  9  ohio  10  louisiana  15  kentucky  18  missouri  26  utah dissapointed lack electoral reform promised sure alabama deeply regret upsetting governor north north dakota trudeau feel sorry usa think problem canada drowns u medium politics sometimes news coverage u centric focusing canadian politics guess actual fear u stupidity stream upwards canadian conservative wanting ban abortion something similar think touched election near swing voter even consider voting conservative personally high ranking conservative said plan touch abortion elected party would immediately lose vote likely tactic trudeau try frame conservative crazy religious nutjobs wanting revoke woman right could possibly work news already airing video bloc mp house stating anyone supporting woman right choose stand entire conservative opposition sat liberal ndp stood clapped already know scheer personal stance abortion decides touch abortion religious moral stance would loose election united state shit stay south border around would make look bad disappointed surprised met ethic comissioner agree diplomatically good idea comment ally internal policy achieve ca stop u state changing abortion law comment distance trump administration good thing considering much canadian economy depends u virtue signalling upcoming election nothing canada u trump admin also defunding ending humanitarian program might kinda sorta occasionally provide family planning service third world nation occasionally quick guide handling controversial topic  1  denounce anyone extreme opinion  2  cornered say everything power truly understand hurt feel  3  offer half price lift ticket u man u trudeau also disappointed trudeau backsliding promise get rid fptp reneged ok file one give shit trudeau reaching straw trying remain relevant commenting u politics worry lot u american disappointed real resurgence retarded religious ideology lately two state responsible le  4  u representative entire u nice people stopped framing republican misogynist primary goal restrict woman right issue see abortion killing living human motivation malicious course today political climate opposing opinion must malicious intention effort understand side met anti woman sympathizer sure canadian disappointed backsliding economy fucktard opinion trudeau worth le dogshit trudeau happy distraction shitty governing corporate cronyism deleted fan trudeau right worry driving force behind changing abortion law religious extremism still stuck trudeau well thing heading canada get ready disappointed u well conservative going sweep election tell stay fucking country well instead progressive country united state becoming regressive drawing line conception drawing line point consistent place draw line know worse parent get angry say disappointed  trudeau trigger trumpet another fine day reddit  partner serious conversation child legit worried right decide get pregnant unexpected happens birth control  100  effective scared blame live alabama georgia south think everyone living country concerned enough business attend prolife deplorables actually prolife abortion right bodily autonomy need worry damn country classic trudeau berating u instead focusing problem home smh buddy wtf canada meddling politics obama help one give damn think fucking care american disappointed generous holding back growing world whole care buy pipeline money fuck trudeau agree trudeau disappointed shady dealing disappointing mean trudeau sjw idiot really nothing abortion trudeau idiot civilized human being would disappointed decision happy see agreement jt garbage commented make look like canadian conservative party going try canada usa people see say conservative associate canadian politics running october trudeau like look good remember elementary school drama teacher trade say lot thing get picked medium commenting controversial issue ever actually anything really people think social medium friend got new generation voter voting booth voted becuase liberal good marketing wow crazy care disappointed backsliding oil pipeline indigenous people land  live u want win ideology war first rename side letting bad guy call recipe lose every fight start calling lost trudeau deleted perhaps concerned criminal allegation moment worry taking away freedom area next uk care think like right business like usa business canada u trudeau u yeah disappointed packingy wagon moving family west toward see ca strike rich hittin main vein silicon valley half day ride past north fork care think country citizen disappointed embarrassing american immigrated canada glad u keep getting worse one disappointed quite frankly bullshit rearing ugly head trudeau child nobody take seriously deleted sit spin disappointed taken long disappointed meek loser still prime minister trudeau opening useless mouth anything say matter one iota deleted make similar procedure counseling free healthcare refugee u come put rio tinto money work surprised make news let alone course trudeau going abortion change u would news regarding saying would newsworthy anyone interested opinion guy nothing changing policy wo result action quite useless information dude fuck happened u politics feel like whole fight energized talk  3 rd trimester abortion comment northam another virginia politican well least set u better analog handmaid tale rest world quotation trudeau disappointed backsliding reproductive right freedom state im bad trump vote trudeau 
c2e02a,1560929049.0,low trust vaccine global crisis,divansh_mehta11,198,17,plus side game plague inc getting easier nobody got vaccinated almost  100  infection rate among child around  25  developing serious sickness illness around die measles directly symptom developed would follows  98  would develop fever rash  8  would get dangerous diarrhoea  7  ear infection could lead permanent hearing loss  6  child would develop pneumonia one biggest danger alone would kill child develop encephalitis inflammation brain lead permanent brain damage autism lifelong learning disability develop sspe progressive neurological disorder virus lingers brain year killing child even child beat measles would damaged immune system suffer harsh  2  week illness point disease significantly dangerous mmr vaccine completely risk free however significantly lower overall may develop serious side effect treated developed country  10  develop fever  5  get mild rash could get allergic reaction require treatment boy develop inflammation genitalia could develop encephalitis far serious risk side effect autism related autism way evidence suggest develop autism result vaccine despite multiple study one disproven source claim link dangerous risk allergic vaccine people advocate strongly vaccine need herd immunity shield infection work  95  population vaccinated kurzgesagt great explanation sourced data tl dr vaccine significantly le dangerous measles think go beyond vaccine global trust expert declining mommy blog much weight medical doctor right think issue loss implicit trust medium loss implicit trust authority figure probably linked ease spreading new authority figure replacing old conflicting medium source modern life essentially percieved nothing bad ever happens last point important public perception life everything fixed bad thing happen someone else must deserved problem someone else fault life biology accident happen genuine mistake made injury ca fixed medical decision procedure outcome statistical nature certain statistic show even everyone everything right certain low percentage population die due disease accident people realise medical policy decision statistical nature incorporate public cost screen x using procedure starting age z stats show produce best overall result given cost implement suck person got early stage  4  cancer could picked earlier screening though parent example trying avoid perceive bad outcome almost none u background statistic ca understand source material add bad reporting distrust medium add people perception severity disease low due vaccination past asking someone choose perceive outcome measles versus serious outcome autism yes know vaccination cause autism think population necessarily dumber lot information sift delegating decision authority figure tv paper government problematic trust realistically bob past black stump living  1920  probably believed whatever written paper difference probably one read headline stupidity global crisis time new plague first people realize vaccine actually work got rid polio smallpox vaccine coming back due stupidity survival fittest  2019  meh provide medical assistance unvaccinated also bar government building problem solved either get vaccinated die street job available body cleaning issue spreading small portion individual influence entire herd process destroys herd safety strict policy answer question thank russia agree sentiment imagine people afraid harm child hearing triggered young user commit suicide softanon disaster eating fat worst eating sugar mother son friend ignorant bitch read much internet scared hurt child talking brother trust society fraud heavily punished dk compared murder trust society important trust legal institution important corrupt police man get punished worse ensure trust police however lack trust based non working vaccine vaccine cause autism case none exists purely stupidity lie global crisis amazing title misleading say low intelligence crisis deleted think main issue rising mistrust government public institution worldwide translates indirectly mistrust vaccine public service mistrust regulation supervising institution big pharma make vaccine agree actually serious concern think stem allowing stupid people breed said say required law licence child like need one drive meet health financial psychological fitness test otherwise subjected heavy fine tax punishment basically shit together pas test good otherwise nope else everyone else suffer people recklessness like compare child developmental success tl baby recieved vitamin k shot really vaccine related pro denied vitamin k shot baby developing year ahead counter part recieved shot 
c8ub9r,1562191333.0,china shown bid contain african swine fever approximately  50  china breeding pig either died african swine fever slaughtered spread disease,,132,8,great first move plague inc got quality pork sale canada hoping wipe entire market lift ban canadian pork expecting u simply resume export question asked tell em go fuck removed best tl dr could make original reduced  59  bot beijing china shown shortcoming aspect preventing african swine fever situation remains complicated severe country  039  cabinet said wednesday management transporting live hog strict enough insufficient capacity testing african swine fever virus hog slaughtering processing circulating procedure china  039  state council said guideline prevention control pig disease many half china  039  breeding pig either died african swine fever slaughtered spread disease twice many officially acknowledged according estimate extended summary faq version tl drs far feedback  23 autotldr pm comment monitored constructive feedback welcome top keywords pig  1  china  2  disease  3  swine  4  fever  5  bullet meet foot poor pig  50  huh china population swine  2018   150 m died hardly 
cbesan,1562752708.0,quarter world biggest firm disclose emission,viva_la_vinyl,440,9,shocking considering generally required place bit surprising really government organisation estimate much producing list official number company doesnt produce number free give firm burden urgency proving wrong tax audit least indicates prefer fabricate amount total emission respective report maybe next step alternatively quarter world biggest firm boasted zero emission capitalism  98  green shop reminder human history economy relied premise atmosphere free common dumping ground fuel burning long could acquire fuel could burn pretty much free atmosphere restriction radioactive dangerous material occasional zoning law soon become apparent world premise sustainable fundamentally change human civilisation know coming year decade world population continues grow wo stop several decade everything think know economics business built absurdity continual growth relative freedom abuse earth carried grantham research institute climate change london school economics commissioned transition pathway initiative group investor supportive paris agreement  14 tn fund management  14  trillion investor expect roi hope motive dark manipulative 
cj3jzk,1564358824.0,russian opposition leader alexei navalny hospitalized sunday suffering acute allergic reaction one doctor said may result poisoned unknown chemical substance,madam1,204,13,make sense russia like poison people russian government even trying hide anymore use method poisoning repeatedly ensure people know work allergic reaction prison kind important point allergic poison allergic radiation allergic bullet allergic drop apartment window complaining ragweed fsb putin alexei fuck pretty soon commit suicide shooting back head  3  time fuckin russia man overt murderer power vodka check pollonium russia response opposition leader enemy poison let god sort mean got ta say allergic point neurotoxin oh smirnoff putin version bone saw removed 
ddahq7,1570209995.0,hong kong protest boy police officer thousand demonstrate new mask ban,,1123,13,x 200 b video reddit analyst gon na arrest everyone happened country like north korea iraq trump would one want bad side china shot fast growing sub deleted aww damn left finger print gun deleted protestors try burn cop alive retaliation user often report submission site ask u ban sensationalized article oppose blanket banning news source reader responsibility skeptical check source comment flaw help improve thread linking medium verifies question article claim link could help reader better understand issue find evidence article title false misleading contact moderator review bot action performed automatically please contact moderator subreddit question concern kind irresponsible parent let kid participate riot people mad mask ban reason would want wear mask public plan committing crime  14  year old boy front line protest 
djbz1a,1571343173.0,adam silver chinese government asked nba fire discipline daryl morey,starsmoonsun67,57244,103,government asked company fire someone said something government liked fire discipline mkay employer either fire someone fully done discipline via demotion ca certainly ca expect corporation apply external punitive thing china demand extradition daryl morey twitter available china like lot chinese saw morey tweet whole business get chinese feel feel little thin skin fuck ccp  1  million people concentration camp west china marshall law democratic uprising east worried tweet houston texas someone cartoon grow fucking ball start standing something fire discipline jesus china nba muslim concentration camp man wonder blizzard went ape shit punishment gamer poor bystander china demanded discipline blizzard tried deliver master ordered organize audience nba game hold paper together spell fuck china china interfering country business internal affair also china mess internal affair much crybaby china fucked head chinese government think discipline fire someone going fire anyway fuck right discipline fuck chinese government stand hong kong fuck china damn west taiwan really getting salty china trying dictate policy world freedom speech cornerstone american society brushed aside placate dictatorship good silver saying despite cost nba boycottblizzard lebron probably want fired tweet could cost lebron lot money kind wokeness cool something something lebron bitch china go fuck chinese government one terrified ramification another country imposing american culture company without repercussion deleted fuck lebron son asks thing time teach receive early mean morey work rocket nba could fire wanted fuck chinese government running nba cba fire discipline firing someone china enough fuck china also take organ honestly ccp dumb angry influence daryl morey tweet would make big deal blow gave morey much traction would ever commotion deleted f china good adam silver progressive movie star athlete singer using platform shine atrocity chinese government asking write  4  page essay asking tweet freehongkong work people idea happening hong kong probably busy life fuck china bro nothing stopping china fielding basketball league winnie pooh little bitch goddamnit nugget finally gon na good please make boycott nba statement step right direction chinese government suck labron fuckchina lmfao fuck china need put end china fire discipline lol nba totalitarian one party state chinese piece shit fuck china reminder blizzard expects u believe china care much something small tweet clearly lying ccp greedy fuck chinese shill posting american social medium check decade bought influence reshaping american medium toward pro communist pro chinese message check publicly exerting power american company getting away almost ccp got ta biggest hardcore little man syndrome ever seen sad see anyone acting like position let alone entirety governing body world power hope people chant fuck china nba game season fuck entire country nba pull china stop game stop licensing merchandise move production take sport money china free speech profit beat game make china make one dime nba china retaliation copy illegally broadcast nba game communist party try conceal crime humanity world know may also google forced organ harvesting living falun dafa practitioner uighur want learn fuck chinese government lebron woulda said yes fuck china james paraphrase told silver knew player caused type uproar something said tweeted player would able skate would type repercussion james wanted know silver going morey case silver pushed back reminding player league never doled discipline publicly criticized president donald trump morey exercising liberty challenged china regardless financial fallout one versus matter silver might disliked ramification morey tweet would defend right say report happened nba discussion china silver come looking great player want preserve million dollar china endorsement deal lebron take note respond every issue everyone problem fire discipline xi xinping yup make sense democratic nation heed call communist enemy nation duh china one saying wrong meddle affair country hypocrisy win kind award tell u opinion contradict government official need country listen opinion act behalf communist nation dream prc law stifling free speech prc perfect image look get butt hurt called oppression bunch big baby china right glad silver said china china really think whatever want happens dictator control good adam silver nba really say yes bottomline nba business goal maximize profit nba truly abandoned loyal international fanbase appease china censorship demand financial reason would total disaster pr least adam silver emphasizes nba american business product nba follows american core value wo bend backward completely china money important fan know wrote something like one college class scenario something like nation whose culture see woman inferior men wish business company deal go would windfall deal signed ask manager woman replaced man response would american company american value going compromise value sake money paper came conclusion struggle continue supporting suggested enforcing value end border say opened branch another country scenario obligated follow cultural norm country regret answer value value reason want compromise integrity money truly value anything willing defend value practice whole devil mantra sacrifice value money slippery slope series unethical anyone wanting fucking xi jinping winnie pooh la google translate enough get point across like spineless weasel many company around world continue fold bow china give bj even though justifiable reason sad watching surrender easily fuck ccp government anyone ever worked cowardly little snowflake cry run away everything criticizes expose endless train genocidal human abuse glad adam silver backbone unlike lebron nba bent would led major company bending send adam silver winnie pooh shirt wear next time meet chinese representative would funny thing finally caused west stop getting thing produced china imagine completely restructured production fight climate change sick beholden authoritarian regime expects u censorship mild seasonal band like got ta step actually become paying fan team rep american city let show china need fucking view enjoy sport played free continent thing china stop business country china nothing else going tbh need u need adam sliverwia best commissioner ever fuck china pretty sure ca discipline someone fire china expect nba throw family reeducation camp fuck chinese government fuck communism hey china go fuck give shit say almost like chinese government real piece shit swear saving  10  money incoming china  2030  would  30  money contreversy forsee could effect much harder fan turn away stop purchasing could cost almost much great job become china bitch possibly make amount money decided join right side moral compass definitely agree point stand public expression glad know nba world competitive basketball association taking order country inferior basketball league might well ask nba loose chinese team spur fan life hope rocket win year discipline someone fired kind crazy shit china citizen god help fire discipline work well han rest u know china people aint han like uighur love adam silver sticking value standing freedom lebron shamble china involved international business decade first time would done apparent one public seen something like enough make people want government something limit ability try thing like want know entire city houston make voice heard china embassy motherfucker arent welcome htown thats sure pleeeeeease let china buy whole planet sweatshop ty nba nfl china suck fat chode pooh bear lookin as bitch lebron pussy as bitch story keep getting weirder weirder seems like lot reddit get stunning lot general public get bad glad see silver open even though know cost company hope people get behind morey simply decide business regime like china maybe lebron start gofundme page fuck ccp asked fire chinese government party dealt government business said chance happening chance even discipline silver said time  100  health summit thursday shout adam silver way come strong agains bullshit best commissioner sport finally fuck lebruh james blizzard take note wonderful see grassroots angry people actually effect f u c k chinese government embarassing twisted time live fuck chinese government bunch slime ball try make china company buy team sponsor much nba enough bargainning power association happened hong kong  20  year ago fucking refreshing see people finally waking shit happening year fuck ccp fuck china perfect example fuck ccp getting fired speaking human right become missing person probably deleted like person never existed kind lot people china know tiananmen square fuck chinese government fuck lebron jinping james walk company fire discipline employee wow lot demand west korea fuckchina fuck china oh fuck china moment silver said china fuck money spineless pussy 
