id,time,title,author,score,num_comments,text
fbcapb,1582981827.0,thousand rallied central moscow saturday call president vladimir putin stay power indefinitely first major protest russian opposition since kremlin chief announced controversial plan change constitution,DoremusJessup,56669,51,putin answer sure going power indefinitely day die single minute best tl dr could make original reduced  84  bot thousand rallied central moscow saturday call president vladimir putin stay power indefinitely first major protest russian opposition since kremlin chief announced controversial plan change constitution rally marked five year since assassination opposition politician boris nemtsov organiser also want event send message putin proposed major constitutional change organiser including country  039  prominent opposition leader alexei navalny called mass turnout show putin must consider staying power mean current mandate end  2024  extended summary faq version tl drs far feedback  23 autotldr pm comment monitored constructive feedback welcome top keywords putin  1  power  2  russia  3  moscow  4  nemtsov  5  imagine clean corruption russian government recover money stolen people russia could build nice little paradise billion oligarch ol vlad siphoning decade democratic russia would really good world tbh recently travelling  3  month russia hitchhiking altai yakutia far east seeing lot place assure  70  population nothing good say current government president frequently told driver car truck felt trust scared sound opinion anyone interested trip profile instagram motivational stuff name bigmapidea good luck guy hope wrong see ending well unless gain serious traction remains vocal minority fear dealt deleted thousand commit suicide gunshot back head jesus people thousand people dead tomorrow joke protest pretty frequent russia happens always  1  one care world move  2  people get arrested super misleading title rally activist murdered year ago sure opposition chant mean original intent everyone visiting surely another hoax democrat pushing everyone love putin russia hear great thing lot people talking sad hol expert russian politics new constitution actually going elimante ability president serve indefinitely protesting fact new constitution going allow russian government fully ignore eu court soon enough america issue russian much offer world really bad keep getting stuck ruler know fucked want putin king forever putin agreed people signing law stricter guideline  100  prevented anyone staying power xd last time happened china got tiananmen square pray russian folk street brave russian people cynic wanted say accomplish nothing historian say russia lovvvvves revolution link absolutely toxic never many pop video ad website old enough remember wall came feeling optimistic russia future putin basically stoled russia potential turned personal wealth oligarch power struggle begin boy collapse soviet really worked russia eastern europe huh maybe sign petition govt know pick mad prop people dude dictator give trump half chance thats right fight back country small dicked lunatic hong kong protest might hope world weird people dictatorship day russian spring pls brave soul putin ca kill u course let dimitry ride big boy seat every decade anyone link source current protest dictator screamed dictator hope keep like hong kong russia immovable object china suicide rate russia increased mysteriously night person attended rally rally like actively aware political situation rf country say perhaps important opposition rally recent year yashin predicted delusion nothing happen oppression putin whatever unless opposition grow pair take example bratislava budapest belgrade bucharest least  100 k people went protest government various frankly much petty reason take example prague quarter city population marched protest corruption abuse power pm made difference czech somewhat funny political involvement putting together insignificant amount people trigger change even pointing finger seoul long literally million people marched south korean president park corruption resulted investigation followed impeachment conviction  25  year jail time unless opposition even pronounced competent leader well understandable political program apart shitting government every possible occasion ca agree anything among since  1993  get even  1  moscow population street nothing happen nobody give shit rally protest irrelevant insignificant general population even people power vsem pohui sad true young people russia want change awesome single photo mass wo matter exactly sure change positive authority stay power said filip kazakov small business owner read article people protesting even aware protesting even looked proposal sure power forever insert shadow president rip attended america start undermining russia way russia undermines america backing party point view hope creating chaos know putin care rally public opinion history taught u one thing fascist release power forced people dead huge ball protestors holy shit putin one evil people world right putin mental capacity think grand scale order make russia incredible country instead think term old school kgb tactic corruption since fact small man physically napoleon complex insecurity keep considering people russian people fact wonderful sad putin keep living condition hope removed soon russian news thousand rally support putin remaining power forever 
fjntjj,1584376519.0,saudi prince  79 million superyacht capsizes partially sink greece,the_boz_man_cometh,3872,146,much gold bedside drawer could happen anyone  79  million must pretty low level saudi prince edit yep king grand nephew grab another one shelf bro let get world tiniest violin finally good news curious european royalty anything like gofundme word nelson muntz ha ha bro pocket money someone losing head heart bleeds man deleted nice see happy story shit going world thought prayer wonder many rape committed boat fuck em glad still good news world ohhh nooooooooo deleted lmao good hilalalalalalalalalalalarious crew executed asap simply upgrade opportunity lol yacht world would better place many saudi prince saudi prince saudi clown grandfather rode camel father rode camel drive mercedes son drive land rover son drive land rover son ride camel started page prince turki bin mohammed bin fahd al saud bet dude homies simply refer turkey fat faced fucker probably caused sink waste money waste article best news heard today finally good news day sure insurance cover cost many prince saudi arabia  79  million probably like  79  yes unfortunate loss whatever poor guy gon na use  50 m superyacht instead imagine embarrassing haha good provided working people harmed ca wait republican find way bail plus side company built yacht get pay worker build another one afford  79 million super yacht afford lose  79 million super yacht smell like insurance fraud musta ton toilet paper lol bahahahahahaa best news day ha ha nnnngh good ah sad alexa play name carnival superyacht rumored house leonardo da vinci salvator mundi sound like somebody gon na get head chopped hope went terrible news upsetting must hope scrape together mean get another wonder many instagram thots shat thing royal family playing battleship saudi edition hope crew alright probably insurance money know laughed loud even feel bad curious managed screw cleaning boat badly darn feel absolutely terrible guy yes finally good news today picture accurate royal dude paid way much repair yard going get shiity trip advisor review  1  star  0  star screw head bet someone spoke prince magically happened die aww bad least good yacht allahu akbar bitch gold bullion ballast must shifted one side finally good news today thanks could use positive news trying time  3  bad completely sink imagine kind human amount cash lying around nothing good like know wealthy people absurd cruel weird mutiny made finally good fucking news hopefully saudi prince keep salvator mundi yacht cuz fuck extra edit imagine dumbest place hang cultural piece lol boat size lift water put dry dock sailing flag cayman island x 200 b course love bad thing happen bad people definitely coronavirus symptom boat immune fuck  79  million super yacht betsy devos spare rich guy lost toy tf care eugh really annoyed clicked sun link saudi prince guy make donairs haha read saudi prince  79 million superyacht capsizes partially sink greece must one one movie  bunch asshats uckin idiot lol mean frick talk actual article minute read like handed  14  year old boat hoe woot woot  wonder insurance cover rich care buy new one quick let assuming nobody died good fuck mb saudi prince manages score  5  yacht sea bummer news important u tmz gossip  230 ft nourah riyad owned prince turki bin mohammed bin fahd al saud lifted water repair capsized holy crap expensive mistake hate person responsible one probably stocked much hand sanitizer one side oh shame lol rich people problem tot pear dude suck suck delightful apart ecological damage come guy earned money fair square oh wait never earned anything life pic article different boat yes partially ha give shit greece value double listens curb enthusiasm music playing smirking heart bleeds mashallah sad story care pretty sure boat priceless painting aboard like one ninja turtle renaissance edit wrong prince mega yacht bad going one superyachts sank loose lip reddit love hilarious fuck dude end camp make sad considering paying fill car american probably bought yacht priceless artwork think speak everyone maybe could make payment hope priceless work art sank probably shrug buy another one music ear given saudi arabia russia seem oil war could perhaps sabotage cool fact article nourah riyad equipped stabilization system reduces roll motion effect result smoother cruise cheering news change many dead journalist one side lol poor princey wincey wost wittle boat even news fate many life sinking due corona virus read headline wow really mean business  waa waa waa waa fuck care waaa waaa waaa thought prayer given oil fight surprised one else mentioned potential foul play  oops  79  million dollar yacht deserve k poor guy alhamdullilah fucking good excellent week hating rich folk good fuck piece shit 
fnv578,1585008786.0,coronavirus economic impact severe least bad great recession say imf,eugray,11090,61,putting house market tomorrow cool welcome roarin  20  welp better invest suspender child teach play stickball street removed ok currently stuck guatemala wife went visit parent right kicked fuck right however go realize probably better back state mayan living like thousand year agricultural society everyday guy coming house mountain offering u fresh egg whole fresh chicken avocado lime orange far  20  case coronavirus curfew  4 pm  4 am think stick strange time indeed edit pic stuck already door shut getting new job work edit door job interview business open shop big american flag always across stock exhange maybe stop funneling money hyper rich build sustainable system another great recession throw new generation bus like game plan situation f ck sake come fast enough jesus fuck serious  29  year old go  20  jesus article title say great depression article content say gfc maybe weird standard work seems like pretty big difference edit title say great recession apparently relabelling gfc bad seems needlessly confusing still bad word wealthy even asset resource soak great closing buying house coming week even sure move quarantine worry bank even honor mortgage offer wether job everyone get hope house price coming etc remember caused financial crash  2008  remember benefitted form financial crash  2008  rich nt recession certainly come people working question long setback last booming business kick back gear devastating crisis every  12  year perfectly normal move along serf fact worker staying home crash economy proved worker one drive economy maybe ought decide run union important ww 2   30  worker union today  10  picked wrong time born seriously economic inequality pandemic feel like many country around world get even politically socially unstable revolution coup taking place thank god got rid bloated big government pandemic response team job killing regulation gunna ball business get back booming lot job opening increase production catch missed time life find way would thought working class work effect much people running show really swap role importance  5  year everybody telling financial breakdown imminent coronavirus convenient least internet distract land stock dropping faster prom queen skirt bought house  3  week ago even paid first mortgage payment fml bad world basically boat imf go hell shark wait bite country economy struggling guess time going saving money finally pay buy house cali  1  like money lose going nothing like great recession like great depression major twist let realistic capitalism based growth literally stopping cold turkey difference time fed treasury pump unlimited fund economy market keep going even almost everyone stuck house happens individual pull money stock market cover bill crash house price crash gdp drop level make current ever expanding debt unsustainable run made u dollar u becomes zombie economy plan get left cold great depression long event actually wo anywhere near bad dust bowl farming crash ww 2  starting look little bit like great depression really going look like two three month going see significant recovery leader screw unbelievably bad going lasting effect year wo like great depression bail pump money temporary relief program whether orange terror like time change system long overdue cue republican saying hyperbolic everything control  6  month financial free fall claim one warned u democrat fault maybe time rethink economic model everyone learn real painful lesson instant gratification get debt rich get dump stock make cool hoping sort political shake come maybe put head pike warning others drinking wine skull stuff like parent took massive hit retirement account stuck like supposed held recovery lost saving gon na say great depression chinese people getting infected people coming outside thinking wo go away vaccine created like  18  month everyone panic please know many able find opportunity keep option open back  2008  short end wife purchased land built house initially planned repeat every year however found underwater mortgage yet got housing market  2008  realized great benefit historically low interest rate still true today able get depressed market made long run chase curve instead played long game rode bump urge understand shall pas set take advantage opportunity good luck cheering much much worse financial recession actually hitting everyone lot low wage worker barely noticed  2008  crisis end already huh telling friend might happen january called tin foil hat extremest cant wait shove article throat fine allowed friend country go hitler time set graduate college le month exactly fucking luck stock vested ike  20 th february went time high proper free fall intended withdraw next day dropped  15  overnight thought wait go back  35  sign recovering smh know would even worse people dying left right street seriously people suggesting go back work normal let die completely delusional think economy fully functional completely overwhelmed medical system country booming economy u europe could pressure footing much bill bonus point country virus originally came tried cover deleted since impossible mission force exist people said wanted go back roaring  20  like spelled depression wrong cool hoovervilles professor university scranton business school told economic impact probably bad great depression unemployment reaching  20  recovery taking decade impossible mission force said ethan hunt job roaring  20  jesus christ dude read title great depression mind started racing thinking thing like breadline modern era thing worse great recession great depression yikes begin remindme  2  year trump biggest recession 
g5fja5,1587476925.0,chinese rapid test kit faulty complaint indian state,0xTKB,154,4,well made china expect almost like china deliberately hindering global recovery effort deleted many chinese product ppe test poor unreliable 
g8bo3j,1587894381.0,richard branson put virgin atlantic sale attempt save airline collapsing,Tys0nz,8857,104,old saying become millionaire get billionaire buy airline something like poignant feel sympathy guy stop suing nh letting buy service branson subject bailing failing airline circa  2009  think good enough put taxpayer cash biz prop came airline first place come bezos got dollar best tl dr could make original reduced  52  bot sir richard branson seeking buyer virgin atlantic set deadline save airline collapse taxpayer bailout proved beyond reach sunday telegraph learnt pursuit pound  500 m government package effectively shelved airline focused securing new private investment shadow potential insolvency interested rescuing virgin atlantic understood include lansdowne partner hedge fund founded george osborne  039  best man peter davy singapore sovereign wealth fund temasek northill capital fund backed swiss ernesto bertarelli extended summary faq version tl drs far feedback  23 autotldr pm comment monitored constructive feedback welcome top keywords fund  1  potential  2  airline  3  atlantic  4  virgin  5  headline virgin fucked worth remembering  12  year ago branson campaigned vociferously bailout british airway time hair breadth insolvency good fuck branson whole empire karma virgincare suing nh guess one giving bailout asking uk give million stopped paying tax worth billion bit cheeky lol released virgin cruise ship two worst business right man know missing lot point virgin atlantic far favorite airline gotten truly beyond service people actually sad see go think ever feeling fucking airline thought prayer maybe instead launching rocket space hobby paying tax take large fortune make small fortune aviation industry really cry lmao delta half anyway let face airline money buy vaa right even emirate saudi would cash purchaser cash flow issue price oil private equity play buy knockdown price prop recovery exit investment year selling delta emirate huge profit  1200  highest bid sir correct wrong read far branson selling share airline sale  51  would go branson virgin unless mistaken missed anything raise fund virgin solve problem using money know still fail might well try get someone else money first worthy captain industry p basically virgin feel birthright chinese going start buying stuff know lot thing seems crazy wealthy company go hiatus couple month without failing deleted alright guy gal assorted internet pal hear want crowdfund buying airline back promise leg room flight drink reasonable price redlining profit favor passenger comfort know government give u massive loan anyway gon na happen may well happen airline actually let tilt seat back take nap without crushing ball guy behind virgin china airline wonder many bidder get industry thriving obviously hit hard enough extra cash lying around expert much uncertainty right ca imagine lot place mood acquisition unless get dirt cheap relatively plus looking like going least  2021  substantial air travel may optimistic capitalism work got five sell employee fuck branson fuck dyson start offer  6  maybe spent much video game starbucks come china selling say company planned developed contingency deal external shock like ought go business bigger company le reason save end company responsible robust resilient least theory go reality government corrupt print endless ribbon cash save even reprobate company bailout going cost  12  trillion dollar mean baby born january  2020   40 k debt thought kind genius case taxpayer money safety net sell trump might give free bottle disinfectant every passenger basically happen capitalisim got  1  like change back though hahahaha get fucked doesnt sell shit oh thats right he really good bad mind one larger airline buy absorb shrink choice consumer little bit airline need broken anyone know caused name virgin airline dumb yet curious question richard branson going back blowing pensioner virgin longer shame good airline interesting see govts bail national airline ba lufthansa whatnot also private one think ireland particular hardly afford lose ryanair one biggest company market cap country god forbid throw couple billion saving employee good rely private sector government maybe virgin paid fuckton tax might worth proping thought prayer know use fortune save sad thing whilst hate branson truly wish worst know personal wealth affected negatively whereas many thousand employee course totally fucked rich always win hope serve warning asshole pay tax locally expect bailout money could put island sale buy  10  airline fuck buy damn airline wait  500 m screw take u island got  5  beardys fucked right mind would buy airline today long since read airline success story wish country law could allow buy close didums poor oompa loompa heart bleeds got  30  fuck paywalls stop  1  bid real offer least could actually use england must way poorhouse welcome probably newbie question way affect business like virgin galactic company within virgin group could daft cunt pay  20  buck branson never really offended like billionaire ca feel sorry guy pay member looked picture first read airline hairline gave chuckle look like cooked chicken topic anyone know happens credit card virgin atlantic day difficult business thumbnail lmao dye eyebrow facial hair red anything branson selling garbage good look shame virgin probably coolest airline flown hahahahahahaha dick must international fairly certain alaska bought virgin airline u flew one clearly rebadged virgin airline plane based tacky colored interior leg room billionaire use money stashed shore account  supposed cut dick back something choose photo run article clearly deliberate heard else earlier today applicable quote come expected average worker save black day survive unemployed  6  month profitable company go bust time mean virgin galactic expensive plaything becomes expensive get rid lesson teach people ruthless businessman want bailed government u decide delta want know location wonder cruise ship started advertising adult sailing recently play hbo succession theme poor billionaire give mike oldfield like key bentley sukkel cunt private island holy frick branson survive lol mean put sale cut loss end someone else balance sheet look like virgin finally getting please rename teenage pregnancy airline deal gracious cunt next pay tax alaska airline already buy year ago  12  trillion  320  million citizen  40 k per head rough math reality money generate value part offset cost borrowing really rule fact ordinary people trained docile face brutal economic oppression miss mortgage payment laid told find new job find one fast enough house foreclosed politician lecture bought house afford saved enough able mange month without income well rule apply large company take airline government guarantee debt default get loan grant tax exemption executive failed plan foe emergency keep enough reserve get paid bonus save company 
