id,time,title,author,score,num_comments,text
ex57e1,1580558644.0,nigerian one america best educated immigrant group trump banned,maxwellhill,52182,92,like know wtf friday trump administration announced new wave blanket ban people certain country time around includes one particularly vulnerable group one tends successful arrives newest iteration explicitly ban people eritrea kyrgyzstan myanmar nigeria sudan tanzania receiving immigration visa lot worse country africa nigeria people know real reason done nigeria responding nigeria creates committee tackle issue led visa ban presidency college one best friend nigerian hardest working sob ever met diplomat slaving look like op posted amp link often load faster google amp threatens open web privacy might want visit normal page instead bot mention summon rationale country lack proper safety check international travel fundamental characteristic nigerian american terrified parent hard pronounce name graduate degree hard working yeah ban son nigerian immigrant living america really warms heart hear positive thing guy said u sadly truth matter u came better life want good people hope sort reminder country actual terrorist come saudi arabia current administration tell u time time trust saudi government make sense right country part want helpful variety different reason simply failed meet minimum requirement laid acting homeland security secretary chad wolf told reporter friday said official would work country bolstering security requirement help get list removed garbage title way nice someone posted actual reason far scroll see display level ignorance racist prejudice trump say immigrant nigeria trump made disparaging comment african nation past complaining nigerian entered united state visa would never go back fact nigerian one best educated immigrant group  17  percent nigerian u hold master degree  4  percent doctorate corresponding number white american  8  percent  1  percent still turkey still saudi arabia still qatar still uae majority muslim make great work many nigerian student hardest working people ever seen sad see nigerian indeed one best educated immigrant group u country population bachelor degree higher india taiwan russia bulgaria egypt france australia nigeria malaysia saudi arabia source headline feel like emotional manipulation want people hate trump banning immigrant even successful case homeland security say nigeria comply security standard established criterion assessed performance metric homeland even said official would work country bolstering security requirement help get list unbiased article bbc people country still able visit u official said new measure result failure six country meet u security country part want helpful variety different reason simply failed meet minimum requirement laid acting homeland security secretary chad wolf told reporter said official would work country bolstering security requirement help get remember nigeria third place global terrorism index whopping extreme leftist actually think trump making decision racist removed check show bob heart abishola comedy surrounding nigerian family living america good stuff removed sound like political stunt ban minority country appease voter reality immigration ban achieve nothing beneficial love see report reading show myanmar threat national security lol fucking myanmar seriously got ta love half story tell trump temporarily restricted travel country provide better detail flying  6  country asked meet minimum security requirement long time ago u whatever reason failed edit never life would think defending trump would get gold thank kind stranger ban saudi arabia thats sound like done prevent espionage anyone make fake credential  3 rd world country verified non combatant threat fine lmao laughing nigeria rn even mad way complex fair stop posting picture omar many nigerian prince trying give u money know headline read nigeria country need help improve communication policy security issue valuable immigrant continue enter u something along line biased posting help one party gain power nothing illuminate problem help nigerian think democrat care group republican care money vote anyone took bait headline got trolled people need stop outsourcing thinking fox cnn npr living atlanta area ton nigerian nice super smart never met nigerian enjoy around seeing nigerian wedding amazing fashion sense nigerian thank support however really much big deal u really market strategic partnership shifted east past couple year suck student tough read article reasoning givin time confrom identify security title misleading reason country banned follow security background check u requires people applying visa country properly vetted current system soon country comply get removed belarus also one racism know trump love eastern european lady removed deleted article neglect mention fact temporary visa tourist business people student worker nation affected united state suspend issuance visa lead permanent residency myanmar also stand among new group unlike every banned country significant muslim population fact rohingya muslim people faced severe persecution rampant genocide turned survivor refugee literal fuck done pissed angela  90  day michael supposed get visa nigeria according wikipedia  51  muslim  47  christian rest unspecified way religious run state sorry christian nigeria apparently make cut got ban hammer sure would happened norway similar religious breakdown statistic article eduction girlfriend citizenship ceremony  93  people becoming citizen asked country citizen stand name called girlfriend mexican  8  stood group second largest group canadian  20  nigerian  37  citizen become naturalized ceremony actually baffling many citizen potential citizen good percentage educated turned away problem cited ranged passport technology failure sufficiently exchange information terrorism suspect criminal excellent one best friend college grew nigeria went harvard business school year later sibling similarly successful lame got usman beat covington unpopular opinion kinda support cause brain drain really bad africa side note iran one top country produce stem graduate specifically engineer world unfortunately ban distinguish effect government people educated blackman feared know shit governmental system someone become president issue many negative change based whatever feel like something wrong fucking system disgraceful obviously republican hate people educated brown people educated ca country people also stand particularly nice wonder asshole stand said love uneducated surprise surprising trump educated two thing mix nigerian north likely muslim south christian sort like lack subtlety syria killing christian supporting radical islamic fundamentalist try overthrow assad almost one u government ever studied country geography treat world game risk board without nuance reality wierd people complaining ban people point finger usa biggest carbon footprint per caput let evrybody country reduce carbon footprint time one confuses also rest world like point fault united state yet country people immigrating america bad place immigrate personally feel usa look helping people worrying desire dream immigrant seen american dream go away replaced immigrant calling dreamer divide american already american struggle dream president need help american struggle help american dream people country dont even care poor struggle america see u privlaged wrong trumper like even playing ground great article even include reason ban imposed get baiting salty usman beating champion colby royally generous people know alot prince princess country email time deleted lol italian think nigerian worst immigrant aggressive built mafia taking control many commercial illegal need biggest prostituion obligatory downvote trump spamming mod stop complaining everything country famous fake university list expands still contains single country actually produced citizen committed act terrorism united state ca well educated intelligent black people would certainly make racist head explode obama era rule simply werent enforced orangemanbad amirite theyre also banned actually know youre talking reddit usually removed around nigerian american country  327  million people perspective million japanese american million hispanic american talk nigerian sort highly educated model minority bullshit pulling pool small course going seem like one best educated minority group really click bait headline could wrote trump bad deleted piss ilhan omar odds good thing go back whole reporting shithole country conversation reportedly saying needed norway insinuating would help economy even though immigrant african nation highest level education executive order congress whatever agree educated government fool work heap uk hoot question purpose use education indian chinese grad degree engineering might agree af fee cut nigerian immigrant already living u educational level basis allow immigrate op nigeria one country nigeria family friend eldest son  14  one smartest kid know going academically selective high school entrance exam score well curve want doctor nigeria like south east asian africa one emigrate super driven highly educated respecting elder trump probably even place nigeria map banning like yet china totally fine okay asking cause nigerian title always keep hearing nigerian look woman true trump must recent victim nigerian scam one best supervisor pediatric infectious disease doc nigeria country hosptial much better ban outright bullshit lot nigerian doctor america know nigerian nigerian person know specialty doctor two sibling one software engineer top  3  law school would fired show week one afraid lose election nigerian prince heard trump fell scam nigerian prince desperate find way pay back debt bolstered orange asshole repulican party complicity senate used repulican thought unhinged wait see start getting even worse state union criminal band certain behave without punishment good bye check balance welcome nightmare trump ignorant cunt nigerian prince always want give american money sure would want move u already money 
exkarm,1580624811.0,australian health minister announces australian type one diabetes soon free access new glucose monitoring system save person type one around  2400  year,,4180,38,wife  42 year type  1  diabetic past year total game changer tell food meal etc sugar level result diabetes far far better control canada pay full price every two week new sensor using freestyle libre cgm australia  12  month per sensor average  10  day per sensor falling accidentally ripped etc pretty expensive hba 1 c fallen significantly control much better much better understanding happening blood sugar game changer stoked going funded must nice need concession card access system one use well paid german health insurance since  2017  pay additional payment per quarter ca stress enough great system comparison old blood sugar measure system abbott completely crushed market would want ever go back good news australian surprised everything else government suggests want poor die unless provide slave labor unfortunately story heard news half australian living type  1  diabetes actually access subsidy despite great quite disappointing edit get downvoted twice lol literally said disappointing knowing many people miss meanwhile american diabetes keep getting told need socialized medicine evil praying heal u wife got one definitely game changer faster easier readout even possible phone situation previous able measure breeze using phone even uploads number automatically doctor sweet save person regarding freestyle libre nice device abbott really screwed people making u version encrypted prevents application like glimp diabetes reading new u version read freestyle app feature others luckily bluetooth attachment read libres interact better apps willing trash current government crap great thing genuinely commend mean scummos government actually something paying two sensor month changed life nh even better australia health care excellent quite happily pay tax knowing secure health take turn another accident requiring surgery u cadillac health insurance wo pay girlfriend finland got one great best tl dr could make original reduced  53  bot australian type one diabetes soon free access new glucose monitoring system  300  million morrison government initiative government  039  continuous glucose monitoring system provide fully subsidised product march  1   2020  help australian health minister greg hunt said statement sunday quot without government subsidy australian would normally pay every two week freestyle libre flash glucose monitoring system per year quot mr hunt said extended summary faq version tl drs far feedback  23 autotldr pm comment monitored constructive feedback welcome top keywords australian  1  glucose  2  monitoring  3  diabetes  4  hunt  5  good gesture libre kind shit inaccurate number good seeing trend though amount time stop working pretty infuriating though reliable product ya know scientist develop free style libre tech monitor cancer blood tech used way help patient see cancer metastasize destroy cancer small prevents surprise deleted thats socialism cost insulin president announced cost american payment program carry undetermined amount time assuming manufacturer make enough uk there currently four week delay supply due increased demand since became available nh manufacturer able keep source talking colleague type  1  diabetic us earlier week last one run uk national health service region decide type  1  get mine say get diabetes control mother used one like month total game changer paying new sensor applicator plus fee made damn expensive though real shame understand developed nation claim without paying least condition people little control agree definitely see people might believe forcing smoker pay cancer treatment could discourage smoking free market way wtf making type  1  diabetic pay accomplish drive price trying find cheapest way die sound worth fair government cover cost encourage innovation buying cheapest certain quality give insulin germany already covered year however retail price one sensor deleted great thise affected also worth remembering politician greg hunt opened great barrier reef current state abuse wary swinging praise way que u healthcare hahaha people diabetes actually die diabetes great fix fucking environmental protection law stop raping country resource unfortunately push plan back least another year whole fucking country fire going evolution supporting complete downfall human race throw extra shrimp barby 
f0dhzy,1581095611.0,pope francis call tax cut wealthy sin tell vatican conference world must end poverty,saurabh24_,101204,33,reading comment reminded certain quote poor complained inequality said bitter rich complain inequality say hypocrite beginning think want talk inequality russell brand really point post grew catholic stopped attending church mom stopped forcing consider agnostic know people hate church many reason say interaction local church family history done many thing help others noble cause anything appreciate presence supporting community always wondered mom strong catholic talking year know grew outskirt hong kong  2 nd youngest  11  freaking kid family fled japanese nothing skin back provided food shelter catholic missionary west sure country supported family even got donation send older brother college  40  eventually mom married dad american moved u relocated current state friend except catholic community  1  year old dad diagnosed cancer died month later church supported mom family much time community came together  400  person church packed funeral divisiveness racism despite u asian mostly caucasian church support care get religion debatable doubt catholic community blessing need pretty sure bible clear catholic even religious comment thread tying particular pope greed establishment nonsense man literally first jesuit pope like super humble sleep papal apartment stay guest house inauguration know pope tbh take special pope car back rode bus friend church instead sit golden throne congratulation cardinal stood instead wear white instead fancy refused golden cross pope past opted instead kept original iron one buenos aire first pope francis chose guy really really cared poor despised luxury pride vanity church leader promise man offended golden throne sit think literally sinful opulent easier camel go eye needle someone rich enter kingdom god literally jesus fucking christ even though christian definitely true  100  agree pope clearly unaware trickle going start working minute reddit user need change need pope francis let start change reddit user omfg dare understand everyone frustration hypocrisy praising statement ridiculing definitely make sense trump support christian pope coming policy definitely step right direction reddit pope francis life palace eats veal breakfast pope francis one humble pope ever casually living normal apartment taking bus instead luxury car perhaps catholic church make start comment thread dumpster fire religious slightest something get behind itt people unable comprehend someone could support legislation would monetarily adverselt affect say louder evangelicals back hell yeah pope meanwhile church paying tax keeping gold money real estate oh fucking kid right good luck rich really care user often report submission site ask u ban sensationalized article oppose blanket banning news source reader responsibility skeptical check source comment flaw help improve thread linking medium verifies question article claim link could help reader better understand issue find evidence article title false misleading contact moderator review bot action performed automatically please contact moderator subreddit question concern great start taxing fuck every religious organization hahah guy life pedophile palace sits stolen rich trying tell pedophile world solve poverty rich evangelicals clutching pearl christianity wrong bernie sander shouting  40  year pope francis fishing good press woke medium one francis first action pope make friend gustavo zanchetta bishop argentina appointment disaster zanchetta found pornography phone left diocese finance ruin pope accepted resignation created vatican job incredibly managing church money argentine court charged zanchetta abusing seminarian misusing fund yet remains vatican protected mentor francis perhaps disturbingly back  2009  julio grassi argentine celebrity priest worked street child convicted performing sex act boy one several alleged victim argentine bishop commissioned report attempting smear grassi accuser instruction cardinal jorge bergoglio buenos aire ambushed reporter st peter square francis denied commissioned report simply true grassi biggest supporter vicar christ bullshit wokepope saying pope endorsed bernie sander maybe start taxing religious institution well reason ca also made fund greater common good tax dollar like every citizen business also antone complains ground help others directly know taxation fund would go social program one give best optic pope man agree everything say religious guy give shit love scared single bit say feel getting rich since voted francis hypocrite poor exist rich exist rich world ca end poverty without disappearing vatican catholic church francis part rich world ca expect destroy christianity suicide sin matter much fuss francis making speech populist idea coming public seem written bad pr dude find job megacorp like mcdonalds coca cola coming one richest tax free institution world unfortunately fall deaf ear u catholic would probably vote trump francis deleted 
f40y0s,1581723496.0,highest number mumps case decade blamed information,breaking_bass,437,20,great thanks karen plague society according provisional data released public health england phe  2019  case mumps confirmed england mark highest number confirmed case  10  year fifth figure confirmed  2018  agency reported  546  confirmed case viral infection january  2020  notable increase  191  case confirmed across country january  2019  uk case  2018   2019  january  2019   191  january  2020   546  people moving u towards dangerous environment call information call anything implies credibility none misinformation would wish print bullshit instead got  6 m old little man date vaccine love death always protect duty obligation mama continue vaccinate  18  year age honor joy please protect kid new jersey recently failed pas bill would eliminated religious exemption vaccinate school child new jersey home ton pharmaceutical company also ranked  2  state education still could pas simple senate measure mob besieged state house going ruin everything sigh prefer called people instead get fact straight hopefully contract preventable illness die mumps affect testis causing viral orchitis promoting future change organ setting one cancer later road victim sequence mmr available kid vaccine prevents cancer meanwhile right reddit use doterroa young living essential oil karen told user often report submission site ask u ban sensationalized article oppose blanket banning news source reader responsibility skeptical check source comment flaw help improve thread linking medium verifies question article claim link could help reader better understand issue find evidence article title false misleading contact moderator review bot action performed automatically please contact moderator subreddit question concern like cancer society society living body  17  year old fully vaccinated got mumps get booster folk thankfully case milder completely unvaccinated husband  30 m  29 f mmr vaccine got mumps two week ago currently obviously case vaccine help propaganda also organised reddit moderator spreading misinformation kickback banned user critical bullshit adamantly pro vax idiot big pharmaceutical company medicine consistently outright lie people different medication would far fewer regressing like bunch feebs well uhh hopefully evolution work intended people stupid enough believe shit removed gene pool thank deserve humanity true hannity deserves 
f5n5qc,1582005677.0,eu threatens big tech company tougher rule hate speech facebook meeting,JLBesq1981,203,12,best tl dr could make original reduced  79  bot top eu official digital policy warned monday big tech company could face tougher rule penalty europe failed adequately curb hate speech disinformation meeting founder world  039  biggest social medium network also owns instagram whatsapp emphasised importance better controlling hate speech disinformation platform without muzzling free speech paper submitted commissioner facebook stressed way limit unwanted speech make sure platform put right system place holding liable speech extended summary faq version tl drs far feedback  23 autotldr pm comment monitored constructive feedback welcome top keywords speech  1  facebook  2  breton  3  brussels  4  platform  5  arbitrary moderation dystopian world go gay reddit mod wet dream hate speech law exist pure censorship every person right hate person group inane reason consequence social legal belief never legislated thing hate speech excuse censorship false equivocation hate speech free speech tired argument yes danger overstepping trying limit hate speech mean protected umbrella free speech word phrase change time social norm without resorting slope trope everything conceived way reasonable argument ca free speech without hate speech trying start argument think tougher regulation fb good much freedom speech adding mandatory censorship post link tax upload filter copyright directive require regulatory burden becomes much social medium could simply block eu ip concentrate le onerous market many american medium web site gdpr eu want social medium speech control copyright enforcement data protection let create leave rest world alone russia china shown way keep hate speech campus agree ok express hatred speech hate speech stuff feel backward almost medieval fucking retarded eu dont understand want happen god damned fucking tech company retarded fucking twat 
