id,time,title,author,score,num_comments,text
ei8zg3,1577827049.0,prince william launch new environmental prize help planet warns earth point short video official kensington palace twitter page voiced sir david attenborough mark launch prestigious environment prize history,Molire,4244,68,best tl dr could make original reduced  76  bot prince william announced ambitious new plan quot repair earth quot within next  10  year promotional clip voiced sir david attenborough mark launch quot prestigious environment prize history quot quot aim generate new way thinking well new technology system policy solution earthshot website build analogy stating quot moonshot john kennedy proposed  1960 s catalysed new technology mri scanner satellite dish want earthshot challenge create new wave ambition innovation around finding way help save planet extended summary faq version tl drs far feedback  23 autotldr pm comment monitored constructive feedback welcome top keywords new  1  challenge  2  year  3  planet  4  prize  5  oh clever great idea promote right attitude need grow parasitic relationship change mutualistic relationship mutualism party benifit itp people shitting trying inspire hope think great ca enough attention money thrown saving planet hahahahahahaha repair look done planet look much worse still going get realistically people best known revolutionary innovative thinking shake business usual ah british monarchy bet prize human go extinct want rain anybody parade decided prestigious award  1  stop military expenditure record well past tipping point australia fire deleted green new deal give prize think know prestigious mean like saying something came existence iconic since everyone blaming william like committed top crime worthy hanging done help planet besides whining moaning bag moon sapphire le solution repair planet  stop traveling world private jet curious maybe could use land environmental project probably easier ask people thing though take win back palace prize get handed know actual problem get solved greta already summed tried give award recently nobody deserves fucking prize need done like anyone listened anything meh garbage company going lobby cheat bribe way getting award using smoke screen biased influence short sighted blind society lol well family money make difference guess deleted life massive house jet around ya ok cunt first earth tipping point prince william life golden palace lead life decadence multiple child certainly done fair share contributing problem guy figure here pittance back life excess tra la la cherio ah yes took  30  year teenager get attention anything save uncle andrew eh got ambitious new plan abolish royalty status highly tax rich highly tax individual transportation make vital commodity resource public think get consideration though want something look good give royal lifestyle deleted little late already lot solution consumer still lot answer feel playing blame game saw clever aisle tesco month ago banana half loose bunch half plastic wrapped plastic appeared going quicker although obviously stats prove one many change could make wo prestigious fuckin really stop royal flying world collect prize sorry still extremely interested andrew happen tipping point hmm let see imagine jump bridge hurling doom ground tipping point life death indeed moment hit ground obviously real tipping point jump bridge likely even event happened lead jump bridge tipping point long past reason read prince edward almost choked coffee fuck royal look like someone trying salvage royal familie reputation prince andrew eh easy take low road shit hypocracy royal family using private jet welcome challenge could drive growth green technology sequesters carbon granted big oil fossil fuel patent fuck everybody let put money mouth close palace stop taking private sick rich ppl especially socialite contribute nothing society making contest b like he concerned stop living life give tax dollar back ppl let something meaningful instead making self feel important royal family full whore pedophile shame focus trying rather respond end scene war world prevalent human wo change dire situation require everybody bad available everyone seems quick forget last  100  year lot changed progress need slow fully quantify impact change look fukoshima chernobyl prime example specie ca charge new research whack everywhere even electric vehicle look banning old way still unanswered question ask dramatic change life time selfish dangerous change always come safety paramount risk damage  1  turn would ever old way maybe start taking many private jet giant entourage etc well least step right direction prize dancing environment fine damaging people really get prize would think point would reason enough people reddit anyone royal family something good despite prompt royal family bad earth still buddy  5  billion year talk elite year ago problem hail hero say want tax save environment mean nothing china india controlled persuaded clean true earth tipping point called great awakening epstein kill self use money power actually something instead creating new prize wait someone come bring magic solution still understand mess irrelevant people living nothing acting year late ride hype wave wonderful crown prince know physic mean type physic need take constipated distract whole prince andrew epstein thing thing like opinion best way west going help fight climate change need encouraging innovation private company consumer government investing green technology stuff like paris climate accord carbon tax going drop bucket biggest threat climate developing country mean country western central africa even really started develop yet way country develop like west without releasing fuck ton co 2  provide alternative coal power plant cheaper something like nuclear solar energy developing country use need improve renewable technology point economically practical replace dirty technology despite medium tell people renewables level yet cool pedophile island mr williams yea late fucking royal royal finally serve purpose people need goddamned prize get pay attention problem need week  130  degree water problem solved idea william shut boris johnson fracking britain make uk invest green energy instead fossil yes william actually power take king turn one country around bullshit prize influencing distance wo save asking others save world make mouse king x 200 b give indefinite prize indefinite goal king william power ask u gather deleted weird one rush defence unlike barely legal teenager thanks pr stunt le talk action give mr beast prince andrew world deleted one obama award see think charles eisenstein win default sacred economics climate new story beautiful world heart know possible 
eyebiu,1580765296.0,oil hit low coronavirus cut demand,,121,6,bad reason good outcome huh coronavirus save world kill u nice best tl dr could make original reduced  82  bot new york oil price fell lowest year monday coronavirus outbreak curtailed chinese demand sparked potential supply cut opec ally outbreak hit fuel demand china world  039  biggest crude oil importer refiner sinopec corp told facility cut throughput month barrel per day  12  steepest cut decade rating agency fitch monday said coronavirus outbreak could push global oil market surplus may need cut production outbreak last several month extended summary faq version tl drs far feedback  23 autotldr pm comment monitored constructive feedback welcome top keywords oil  1  cut  2  crude  3  china  4  price  5  mean gas price go real demand come consume thats good investment go buy oil month two price grow sell bigger price 
f0cx6k,1581093260.0,coronavirus russian medium hint u conspiracy coronavirus outbreak china provided fertile ground conspiracy theory misinformation web everywhere russia spread primetime news programme,saurabh24_,210,18,one wilder idea aired vremya recently presence word corona mean crown latin russian word coronavirus hint donald trump somehow involved apparently used preside beauty pageant handing winner crown knew along ok bad form bbc would translate name program news everyone know koranovirus sent allah punish china treatment uighur kind country prime time news outlet serve vehicle government propaganda fox news demand know russia spreading misinformation propaganda literally decade obviously true trump would twitter bragging sound like alex jones level shit usa legal use news spread propaganda given way thing going lately could considered admission russia really responsible coronavirus russia seems begging world daring world anything misbehavior got ta kidding got box full pepe  russian state medium say must true waiting trump agree blame deep state russian might actually something american military handed blanket native american polio smallpox virus infected syphillis dropped atom bomb  2  large japanese city american psychopath edit american removed like reverse fallout 
f7zlas,1582408738.0,deleted user,,315,19,week ago  70  indian girl studying college gujrat forced stand line stripped naked check whether menstruating allowed inside dorm period go hindu culture india love display false modernity swear vagina work working vagina come along ride nonsense need stop third world country india love pretend worthy world player know  1 st world country india indoor plumbing primitive wrong people believe ever acceptable poor woman deleted prostitute sex toy tester drug mule test nothing work fitness ahh india news fkd reason relating woman another day india pls mean india woman getting violated surprise point wtf creepy tradition india become hell earth woman amazing world leader never speak lack humanity sickening indian give kashmiri human right back one day world put pressure india hard china kind abuse job sound like someone trying pull fast one deleted people get upset india remember ally chinese show little restraint case happen read thread removed wait conducting fitness test wannabe employee bad article mention test men probably fact private company conduct fitness test employee may required strip male female really serious problem india highlight useless news 
fa1l52,1582756083.0,coronavirus case surge  400  italy,,678,21,go vacation plan deleted dang vacation planned summer wonder better way worse wow sad sat arguing dad getting supply blowing thing hate supposed going venice saturday france situation able least slow eventual passage italy including thousand way spread chance thousand  400  confirmed via testing waiting number netherlands france spain germany poland basically european country  400  known likely  1000  booked long weekend milan april girlfriend  10  day ago  3  week trip planned across europe march  18  still trying decide going definitely option skip italy go greece longer gon na intense important week coming reason spreading area still end winter season tropical area get affected much may case many death thing spread first place chinese travel country spread disease would prevented thwarted early kept secret week blew proportion making world go panicking like crazy best thing stay safe everyone remember guy virus problem let calm panic everything control right lol poor redditors realize serious  10  human population already affected people actually think spreading accurate information fear mongering careful people try pacify mass promise everything ok dangerous one also people run towards fire people panic slightest inconvenience hence terrified admitting virus serious mama mia changed plan fly venice stuck florence rome two week see happens highly doubt see infection number scale china cat bag already every government hard work hit peak already got trip booked think still going go friend whose elderly parent live asked today going looking response medium blowing thing even though outbreak bad medium u believe know spaghetti fuss virus low mortality rate young healthy population general mortality rate comparable seasonal flu wild naples mum around  2  week ago case jesus caucasian vulnerable virus asian 
fdh5sn,1583345819.0,iranian authority killed  23  child november crackdown protest amnesty report find,TheNewArab,352,6,man iran really fucking  2020  badly best tl dr could make original reduced  68  bot death certificate least ten child revealed shot head torso indicating security force shooting kill boy age  12   17  one girl eight child recorded killed  13  city six province across country according report reflected quot widespread nature bloody crackdown quot conclusion report call member state un human right council mandate inquiry unlawful use force unarmed protester bystander including child  15   19  november  2019  extended summary faq version tl drs far feedback  23 autotldr pm comment monitored constructive feedback welcome top keywords report  1  amnesty  2  child  3  kill  4  least  5  ha  30  senior government wuflu karma good thing culprit jewish else un adopt resolution left winger campus get mad ten thousand upvotes nazi comparison second u killed child iraq invaded basis killed another hundred thousand least get worship evil empire edit downvote hahaha ah sad accept truth forever lost everything wrote  100  proven fact deal slowly quietly 
fij7xp,1584196298.0,china may prevented  95  virus case acted silenced whistleblower warning,,425,20,actually enforced kept wild animal ban sars would prevented  100  wuhan coronavirus case truth offends lie lie longer remember even still every lie tell incurs debt truth sooner later debt paid following doctor tried warn everyone hearing died shocking really hope china learn something doubt world need bring china court sue continously country demanding china pay medical cost incurred damage economy virus ccp completely blame world wide pandemic edit spelling still sitting usa waiting effective response instead tell bad style testing may bit high estimate probably lot could prevented  95  case china almost certain world still found way rest world happens squarely shoulder government mostly nothing prepare responded soon enough information available could see coming best tl dr could make original reduced  82  bot china could prevented  95  per cent coronavirus infection measure contain outbreak begun three week earlier research university southampton suggests china took vigorous action late january week police silenced doctor trying raise alarm coronavirus case could reduced  66  per cent measure taken week earlier study suggested  86  per cent action began two week earlier extended summary faq version tl drs far feedback  23 autotldr pm comment monitored constructive feedback welcome top keywords china  1  week  2  early  3  measure  4  january  5  instead made sure whistleblower came case illness dead whistleblower xi jingping winnie flu really taken china new shit level country need take supply chain china lot potential country china seems care censorship want control narrative hijack message great number fine china great oops idiot charge realize thing uncontrollable uncontainable put world risk sad part seems current administration usa different link shared  2  time please consider making crosspost instead reposting next time first seen last seen searched link indexed post search time feedback hate visit china asshoe hate whole fuck china going reddit ever since hk protest seriously need bring court whoever let thing go wild didnt want act would silence besides intention let spread cant mass protest corrupt government mass cant come together disease outbreak glad back calling china truth instead praising forget china responsible wuhan virus failing enforce law regarding wet market china government authoritarian genocidal regime china enslaving systematically murdering minority uyghur population china refuse accept responsibility wuhan virus accusing cia developing reddit need decide whether authoritarianism stop praising china propaganda campaign free hong kong china territory taiwan way around think china massively populous anywhere else allowing someone basically scream fire crowded theater could cause mass panic reason time happened fire understand investigate angle far reported detail went medium mean come story obvious propaganda opposite side many case could prevented trump acted sane manner article sinophobic  99  time real thanks xi campaign sarcastic lol would imply tho wanted prevent spread 
fjmwsy,1584373205.0,first human trial vaccine seattle today,,110,2,read vaccine coronavirus hard make tend make immune system freak kill host process read bypassed animal trial look like op posted amp link often load faster google amp threatens open web privacy might want visit normal page instead bot mention summon 
flp175,1584679938.0,coronavirus global death toll surpassed according john hopkins university,Nothing_But_Despair,909,20,fun going online looking internet people still comparing number middle break end result outbreak claiming look bad monumental idiot care scared virus go lick pavement care try coax people unsafe  3  week seem small remindme  3  week death toll pass  10 k removed remindme  3  week remindme  3  week free press let sahi know lot death represented pneumonia  1 k people died yesterday still flu guess real fucking bad flu like time worse actual flu remindme  1  week thanks china shit stain supporter deserve everything coming love deny continue go daily life number accurate china telling truth number keep mind every day  3700  people die traffic accident surpassed long time ago china fact anyone belief country telling type truth problem shame medium taking china almost recovered virus bullshit remindme  2  week great ow people died flu year basically nothing peanut compared worldwide road traffic accident fatality time frame 
