id,time,title,author,score,num_comments,text
an7ukr,1549323203.0,teacher sentenced hang raping indian schoolgirl savagely needed intestine realigned,WiseAnon,195,28,disembowelment first justice hanging almost seems simple take yeah purge existence planet poor girl much pain wtf wrong people gond currently prison jabalpur state madhya pradesh central india still alive prison would killed impaled light post u prison probably order different culture guess deleted sound like job vlad impaler karma seems completely dead got sentence right could make suffer like little girl would great sorry man crime like got ta die harm innocent child face punishment parent stab death india allow best tl dr could make original reduced  77  bot last year law changed allow death penalty rapist attack child aged shaken series sexual assault since  2012  student murdered moving new delhi bus four men sentenced death raping torturing medical student new delhi although remain death row india  039  top court upheld death sentence  2017  petition overturn rejected last year extended summary faq version tl drs far feedback  23 autotldr pm comment monitored constructive feedback welcome top keywords death  1  attack  2  last  3  india  4  gond  5  hanging good break wheel mortified hear reason heart rest bit easier knowing monster getting destroyed comment section never fail put best humanity display kind thread give nice glimpse barbarity hidden beneath benevolent facade society put forth ffs deserves tortured killed felt sick story want understand people like guy look child want thing wtf know last meal anyone know intestine realignment entail google find anything useful answer question female value virgin vagina shock male rape youngest marrying  14 yo virgin making bleed wedding night paradise  13 yo even better  12 yo even better straight line course dumped like trash value vagina tarnished toss rape next one even younger need die like mr hand ah india wrong devastatingly broken sure comment filled people respect sentence law wishing ridiculous vigilante justice user often report submission site ask u ban sensationalized article oppose blanket banning news source reader responsibility skeptical check source comment flaw help improve thread linking medium verifies question article claim link could help reader better understand issue find evidence article title false misleading contact moderator review bot action performed automatically please contact moderator subreddit question concern jeeeeezus nail testicle fence post let m bobbitt pay visit better get right hang high neck snap drop slow might get one last orgasm deal strangulating slowly raise rope struggle little set fire shoot random place struggling stop kill monster properly 
aosq8h,1549722195.0,england knife crime epidemic see  54  rise young stabbing injury  5  year,horizonhorizon11,219,21,cut police officer  10  year crime go shocked pikachu face impossible knife banned fake news cnn worldnews strong supporter knife right make sad bad england ca brexit article total people aged  10   19  admitted hospital wound caused knife sharp object last year  656  hospital admission period five year earlier according nh england total  103  people aged  24  killed sharp object year ending march  2018  compared  58  briefing paper uk knife crime stats also like add total sharp object homicide jumped huge number massive  25   268  homicide currently recorded using sharp instrument including knife broken bottle accounting  33  homicide increase  216  recorded article u gun death stats amongst similar age group  3 a  2 f  2 f  2016  recent year national data available firearm injury close behind death  15  total death among child tory working magic removed people suck education key wonder anything else risen comparable amount last  5  year removed hardly epidemic lol way human always find way hurt kill one another matter many object outlawed law make u safer since criminal follow law anyway let take away everyone knife lol much tea crumpet england gun control policy wonder violent england would gun easily accessible could worse total people aged  10   19  uk admitted hospital wound caused knife sharp object last year article firearm used kill people  2015  excluding suicide wikipedia lol ban gun people hurt think living knife attack prolific area even carry gun taxed shit even carry pocket knife people stab eachother prison best ban knife people england go daily life without carrying pocket knife society function pocket knife ok 
av1x04,1551201509.0,white house press corp booted hotel medium center kim jong un arrives,progress18,290,11,witness take personally sure rest white house staff translator get kicked important stuff well learn russian press feel like people reading journalist still staying hotel press getup wont happening like journalist wo still skulking around camera crew aswell bet yeah super annoying move workplace around short notice dictator aint yeah plural odds donald trump hire hooker pee mccain old bunk vacationing hanoi white house reporter outside hotel allowed back inside instructed use phone record video north korean leader arrival fucking worldnews little better evicted still pretty faky newish type title however comment trash least called title dramatic lol america president weak worthless many time going repost story untill comment agree narritive better luck next time kicked curb deserve deleted 
awjh6v,1551544626.0,u seizes billion isi gold,AQuentson,891,54,gave isi gold post according state run news agency sana voice america voa previously reported sohr previously said previous report cracking journalism think wait something random website report trust node stfu rebuild mosul least sell money buy concrete rebuild mosul damn billion lot gold handed iraqi syrian government official order rebuild war torn nation best tl dr could make original reduced  75  bot cover darkness  50  ton gold worth billion lifted u helicopter area syria  039  deir ezzor according state run news agency sana gold transported military base kobani left united state portion given kurdish led syrian democratic force fighting isi sana claim deal struck spared hundred isi field leader expert return gold citing unnamed local source previous report suggested isi raised fund bitcoin europol stating asked bitcoin zcash donation extended summary faq version tl drs far feedback  23 autotldr pm comment monitored constructive feedback welcome top keywords gold  1  isi  2  syrian  3  force  4   5  sound bit like kelly hero hey almost enough pay wall pirate stealing pirate maybe give syrian people damn stole ridiculous leave terrorist alive gold point fight terror yoink current price ton  56  ton military tank locomotive engine weight  56  ton possible isi move much pillaging long time doubt stored one place likely cache trump gon na make new toilet white house match one trump tower apartment  1  person critical source information coming  127  people reading title take blind truth tick tock wait trump claim maybe could used build wall scored sick loot trump already planning going convince everyone get billion bonus defeating isi know trump trying figure way steal finder keeper deleted nice heist sound ethical like opposite marshal plan three king stealin gold wonder much actually found number reported information local source said u army helicopter already transported gold bullion cover darkness sunday transporting united state hmm suspect story say least paying back loan excellent ca wait share u billion isi gold nice going buy u weapon math work lb gold billion per ounce  16  oz lb oh boy fund whole bunch rebel group cool split shit among taxpayer soooo pay le tax returned country isi stole oil sigh take deal struck spared hundred isi field leader expert return gold fucking asshole coward leave woman child dead enders fate use gold save left head dozen yazidi woman piled trashcans example time say one thing another dude run woodchippers build wall score syrian government claim yee god rather true next thing hear would pres trump saying gold someone pay effort spoil war bout trillion dollar worth oil guy finally build wall anybody say wall deleted yes u seized billion gold isi donald trump confirms u seize  1  billion gold  500  million gold seized added treasury  5  million gold added u treasury smell like freedom deleted yo could get sooooo plan giving back syria since mostly going keep dip like usually wall money smh trump another golden throne sit shit hate tweet white house hahaha love america thia shit fighting isi let hundred isi leader go exchange fucking stupid well least gave gold kurd guy kicking as ill wait isi leader find atrocity start 
ayrhpz,1552058884.0,german academic author call end nonsense,,167,21,title include specifically german language prevent inevitable shitstorm comment section discussion old go back least  1980 s base problem german language heavily us grammatical gender approach avoid using grammatical gender doomed awkward difficult use thus widely accepted oh well title hiiighly misleading german academic aka really small amount linguist absolutly represent majority german linguist topic also sadly german article group tl dr club backwards opposing pretty much english influence germany including song etc tend throw good old lying leftish press opressing german people refugee content idea guy absolutly represent academic author group get way attention removed realise gender controversial see time austria gender specific pronoun native language whatsoever feel bit privileged say least learned still learning english best ability must say hard getting used first kid like firefighter instead fireman gender complicated male female people need get check box move along next question  thank calling end nonsense ich gebe vor geschriebenes deutsch mit einem zu verstehen come shitstorm deleted deleted even worse mean without taking stance start use third gender neutral term publishing job posting past job title would smith getting sued gender discrimination wrote smith indicate male female apply writing smith also diverse gender know apply job weird position one one hand never one side han georg maassen hand making word gender neutral thing getting hand article neglect say die lehrer example mixture gender pronounce die feminim lehrer masculin literally able make pronounce gender neutral without fully butchering language opinion gender star already butchering language enough one thing language without pronoun deal see people tired fact quite language group men group group singled fact profession often gendered well bit odd considering fact really brings attention femaleness anyone version profession used attempt shift complete culture language tend receive backlash valid objection since often deemed necessary whatsoever understand reaction right idea gendered noun thing gender nonsense time put end throw away whole language start late hollywood already decided everything girl girl gender goodbye 
az3f2n,1552137548.0,norway starting world biggest divestment oil gas norway said  1  trillion sovereign wealth fund world biggest sell stock oil gas exploration company move biggest divestment hydrocarbon yet,,123,3,headline pretty misleading read article divesting due price volatility environmentalism three biggest oil investment continue run statoil norway petro state country high standard living compared european country strongly integrated welfare system norway modern manufacturing welfare system rely financial reserve produced exploitation natural resource particularly north sea oil country crashed new warship oil tanker causing warship sink 
b0iz6t,1552460580.0,italy begin enforce vaccine school policy deadline expires,MunaN15,4270,20,removed let hope eu follows maybe usa learn thing two stupid group deleted went different school different u state northeast always asked bill verify lived immunization record prove vaccination college made everyone prove vaccination also thought developed western country might poor taste never hear child died measles news hear rumour actual story want newspaper news channel update kylie jenner income get ugly homeschool parent like get together socialize kid homeschooled kid predict start seeing small cluster previously eradicated disease kid get together since everybody group explode homeschool group become incubator kind infectious disease school poland required bring medical card vaccination stuff proven something missing school required fill never though big deal bum think vaccinating even school something missing much understand reason behind strike yet another blow unfortunate born idiot parent instead vaccine kid taking nice  6  month vacation prison really wish would bring united state dont agree way isolating child abusive neglectfull parent vaccine mean medical neglect punsihing child even work next step could country socialized medicine would cover measles related care unless person vaccinated given medical exemption saying hospital would deny care bill would given responsible party hope policy make obvious exception immunocompromised people handle vaccination must rely herd immunity people involved enacting said policy sniff bsers trying get away faking immunodeficiency weird ok sending school indoctrinated evil government school system wo vaccinate government conspiracy control bet ruled unconstitutional every one presumptuous idiot first fuck assuming know everything know vaccine researched rehashed mass produced overly hyped medium bullshit blitz dummy drone regurgitated scientific proven news article put guy fucking dumb period every article study news briefing many opposite dreaded label oh god spare one give fuck guy trusting agency historically proven fuck people one care might long term deadly effect pumping garbage kid everybody else well say looming disease waiting pounce better safe sorry guess riiiiiight say nothing though let choose fucking monkey see monkey asshole bunch gullible fucktards fuck get back stroking pretentious dick read policy vaccination education like holy shit report frontpage dozen time week religious exemption italy bullshit thank god would another plague came wiped city filth lowered population something sustainable horror fuck italy fuck as nazi tactic 
bckgoi,1555112537.0,jp morgan ceo ca explain one employee budget salary,romans310,206,27,jamie dimon fucking serpent never ever poor fuck could put one credit card  24  apr people arguing need work  5   6  job make end meet people complain welfare state unreal people wonder capitalism popular day love video go viral people feel like something accomplished type dude chilling mansion yacht could give shit le reddit deleted cause impossible know wonder father mix unfortunately take two income make end meet day raise minimum wage would expect otherwise number seem quite inflated  400  ramen diet really take someone seriously making claim like like pack ramen day lol could pay let honest totally could knew would make look even worse urging get debt god damn everyone comment sound like bunch pussbags make much pay bill supporting two people even little save working job literally human could perform deserve bunch money something provide value someone enough make pay care ceo responsibility budget employee income responsible setting employee wage labor market kid  1  bedroom apt irvine ca found way hypothetical woman end  6000  per year instead  600  rent average apartment deleted could get second job could get married could get another job could kid yet soooo many option jp morgan ceo get paid budget employee salary really supposed financial babysitter employee isnt real hypothetical good god fucker privileged wish lived black white world making wage agreed accepted job employer fault make enough money making enough money get  2 nd job get demand skill knowledge allow get higher paying job  1600  living  400  car definitely cut support child ca afford  400  food also fairly high come ridiculous situation theoretical employee easily cut anyways somehow everyone gain amount money really big difference different people company contribution said company sound like need cut expense get second job shared earlier today 
be29ij,1555466266.0,arctic enters unprecedented state warming new study show emission potent greenhouse gas thawing permafrost may  12  time higher previously thought,maxwellhill,2958,54,sadly arctic going warm much faster rate rest world colder place general proportion warming hopefully sort phenomenon know exists pop co 2  temperature rise fast sooo faster expected keep wondering best place live going model living garden eden others underwater fearful dislocation mass migration people might cause one way probably heading toward mass extinction going come sudden event like asteroid impact likely slow painful process first affect ability produce good service ability feed downvote post catastrophic impact climate change go fuck starting desensitized type news really really seriously post like getting frequent make feel like effort fucking worthless like fucked interesting also worrying side effect russia kid died anthrax poisoning came animal frozen defrosted might really weird superbug stored permafrost human alive ever encountered hihi managed get fund rebuild notre dame saved tumbling tumbling tumbling also saw yesterday anthrax russian permafrost climate get u epidemic broke dam nothing stopping time herd start grazing expected fucking tag line dare say become laughing matter best tl dr could make original reduced  82  bot arctic enters quot unprecedented quot state warming new study show emission potent greenhouse gas thawing permafrost planet  039  northernmost region may  12  time higher previously thought nitrous oxide greenhouse gas nearly  300  time potent co 2  stay atmosphere average  114  year per environmental protection agency team researcher led harvard university scientist used small plane measure greenhouse gas level  120  square mile thawing permafrost north slope alaska extended summary faq version tl drs far feedback  23 autotldr pm comment monitored constructive feedback welcome top keywords permafrost  1   2  study  3  emission  4  greenhouse  5  fucked meanwhile new conservative government alberta stated first mission repeal carbon tax replace nothing fucked yup doomed die mean unprecedented state warming exist one point least go laughing building lot nuclear power plant rejoice oh ye young men thy youth charlie sheen second tet offensive  2134  x 200 b meme cultural reference aside felt like beyond point return long time many others posited known bad least twenty year perhaps x 200 b call paranoid really think mass shooting seeing fact military psyop designed justify seizure firearm number nation foresee general economic collapse immediate future probably believe must maintain total control order prevent general societal collapse add million hungry men starving baby bolt action rilfes autoloading rifle high quality optic shake cock well going pretty x 200 b feel like disarming west specific set reason mostly enable control event cataclysm like know mass influx climate refugee maybe x 200 b oh look certain nation europe america recently practice managing kind situation pure coincidence surely dry run model response runaway train effect get certain point wo able stop scary shit say fucking hypocrite driving car work every day hopefully electric car advance faster use widespread live canada infrastructure good enough conveniently live without car everything far apart get anywhere quickly requires car ipcc model even account melting permafrost feedback loop like  2030  fix number always bullshit going suddenly boiled alive plant enough tree soak shit like scale need plant people still give shit wo put paper pocket near future noone give fuck insane people ca understand care going fuck literally whole planet genuinely pissed start going gym study dietology understand much food need stay healthy learn use gun even access one theory help learn identify armored vehicle military uniform nearby country make network people trust keep trust ignited engaging often make sure inner circle know basic first aid farming construction time left study radiotechnology electrodynamics optic able sustain communication society start showing crack government internet stem tide pessimism slows economy happen economist try finding u way modern economy perpetual growth cancer killing u loss since popular alternative like socialism fascism state capitalism every bit environmentally destructive look cunt going denial straight past acceptance seppuku wow fucking surprise rearrange deck chair great needed geodude used magnitude concerning live northern alaska family beginning consider maybe move wonder long poop hit fan live ca say warned surprised seeing effect within  1   2  decade  5   10  decaces predicted far like domino see piece connection go much faster expected way effect expected well denier surprised probably even ignoring building spaceship mar seems quite nice time year tl dr shit hitting fan stop human whole capable foresight scale react change behaviour late billion die left humanity adapt die well well f ck pretty sure dad pointed ten year ago really news damn always worse thought serious trouble could worse least  12  time higher previously thought like  13  something well trump co gon na get oil get never going end unless population control start part solution go green want uncontrolled growing population eventually drown everything earth human issue like blame everything else work feel like see one headline everyday thing always worse thought previous researcher shitty job new researcher far better awesome great news canada point child title read like clickbait article hell everybody sing fucked fucking fucked enough energy coming directly sun melt actic ice  3  month enough year would need order magnitude energy concentrated time frame find funny scientist found plant year ago baffin island prof world cycle climate change hoax trump trump trump trump trump trump trump trump trump trump trump trump trump trump trump trump trump trump trump trump trump trump trump trump trump trump trump trump trump trump trump trump trump trump trump trump trump trump trump trump trump trump trump trump trump trump trump trump trump trump trump trump trump trump trump trump trump trump trump trump trump trump trump trump trump trump trump trump trump trump trump trump trump trump trump trump trump trump trump trump trump trump trump trump trump trump trump trump trump trump trump trump trump trump trump trump human contributed acceleration earth warming cause cause destruction life help maintain balanced climate volcano erupt methane burst ocean water earth circulate natural assume alone spread energy stored planet said imagine volcano erupting antarctica imagine much green house gas would released would blame humanity rapid increase temperature 
bynctl,1560105008.0, 1  million protest hong kong organizer say chinese extradition law,AntifaTaipei,124,2,gosh maybe try something like removed 
c1zq5a,1560846985.0,chinese government top diplomat warned tuesday world open pandora box middle east denounced pressure iran called drop landmark nuclear deal,madam1,404,19,box opened looong time ago every country need pressure america abort madness noone buying bullshit intel anymore republican president reality catching improve middle eastern country bomb much hate chineese regime true od israel saudies usa want fuck another country backed false flag od usa iran conservative religious shithole want mess china touch primary provider oil else think hilarious china give diplomatic advice anyone rounding muslim putting concentration camp stealing organ translation please impload international oil market enough shit deal right pot meet kettle seriously people wake china friend china playing long hard authoritative game undermine democracy come top fuck pill course conflict iran absolutely contrived unnecessary sick saudi arabia controlling u foreign policy measure good faith china also like see china ease pressure hong kong carrie lam let step stop appointing puppet hk govt stop kidnapping hk citizen torturing deleted known lying technically china would biggest beneficiary war iran war iraq seriously degraded u military combat capability put america debt china distract u neocon persuing conflict china oh plus john steward pointed  50  iraqi oil shipped china message might well crafted goad john bolton push button u would want commie pinko tell would shut start treating people decently maybe give fuck opinion chinese government top diplomat work organization steal minority organ moralizing beyond absurd pandora box also probably name concentration camp china muslim china disingenuously argues supportively muslim theocracy sigh believe secretly want happen would take away heat head funny considering china world muslim abusing country box opened  20   50  even  1000  year ago well convinced attack carried china distracted iran russia saudi arabia entire world coming together chinese 
