id,time,title,author,score,num_comments,text
djvffu,1571439986.0,giuliani pushed trump administration grant visa ukrainian official promising dirt democrat,noscreamattheend,5704,44,guy listen okay think electing trump guy might bad idea starting think administration consistent stance toward immigration removed point president lawyer pushing president illegal thing cool trump first funny american sorry guy gave good distraction politics see someone living embodiment word definition gotten real boring people say unpredictable predictable wrong dumbest thing possible way bet tweet would easy money joke literally worn thin skin ca grasp cult still thick ca grasp blind retarded genuinely look ca grasp full embarrassed truly feel sorry average american put shit must frustrating thing frustrating duh duh offends left frustrating see walking lemming human form brain capacity amoeba trump boring boring predictable desperate pathetic god loser remember name obama personal lawyer yeah neither ya see patsy probably seems like gop behind scene folk really setting giuliani fall guy corrupt person corruption help others commit illegal action impunity yup everyone know one sent jail wtf confused kind dirt think would actually make democratic voter say hmm trump guy really seems like upstanding honest guy election imagine would take point torrent shit crooked administration stop trump rudy gone whole life avoiding good old fashion as whooping seriously wondering absolutely crazy poll show winning economy never mind fact inherited obama yes record unemployment number guy  99  yard final yard get credit one brief glorious millisecond thought going say giuliani pushed trump front subway train ny giuliani ran city limited knowledge start stop action seemed like smart level headed guy actual fuck happened lose sense intellect decide right course action deleted removed swampy deleted guy terrible lawyer giuliani fall guy great mean trump wo impeached remember used think people running thing smarter rest u seems like bunch people accident end position handle nope trump take blame rudy go give senior slimeball hall pass yet another official act performed exchange partisan campaign contribution shocked think important point gas lost someone mentioned cat fact subscription say subscribe dirt even found sure trump huge cluster fuck dirt beat unless reliving  1935  case hope cancer kill leaking trying distance involved chain migration trump personal lawyer next time go mastercard trump fan lottery system definitely like actually lottery term obtaining free visa string attached rather use negotiating tactic highest bidder whoever may get one matter long awaited immigration reform let fill country goon foreign agent pelosiclap america everyone dirt could possibly get could sacraficing baby still think change mind feel need shower interacting lawyer would ghoul personally take mantle dig dirt trump could easily pin staffer something prove bullshit like rudy could spearheaded effort brownie point something get caught like know really bad conspiracy seem tried involve many people possible thought first rule conspiracy keep small deleted hang god people dumb shokin ton info lot corrupt shit biden tiny portion george soros former ukrainian president ton people actively trying prevent going u fact soros attempted squirrel away georgia got held austria granting opportunity extradite u testimony shokin actively threatened prevent going back ukraine could testify u want question new ukrainian government want question major tie billion dollar missing money tie russian meddling election u lot dirt people connected lot high power democrat terrified talk dirt aka evidence criminal activity reddit weirdest echo chamber ever seen true thing hillary one reddit cared remember hillary dnc meeting ukrainian official dig dirt trump remember ukraine donated money hillary country gave  10  million dollar edit little test went reddit news page first one anti trump odd went politics section first  35  post  25   0   0   7   3  fell category bias echo chamberish mean guy fired biden mean let speak dnc paid ukrainian company entirely false steele dossier joe biden publicly bragged withholding aid ukraine unless fire prosecutor investigating son go ahead hit arrow deleted digging dirt biden lol plan refuse visa entry keep info rug great plan cnn fake news ridiculous bullshit help guess lol 
dnf9iv,1572103541.0,turkey erdogan threatens send million refugee europe unless back syria safe zone president vow open gate unless country support ankara plan,ManiaforBeatles,358,39,next threaten attack europe next really obligated house people threat sending europe europe horrified prospect say say want either deleted alt headline europe cant handle refugee either support effort make safe zone syria return take turkey major dick recently seems every headline present thing worst framing possible turkey absolving europe u blame erdogan total loose cannon tried war crime crime people real insanity turk claiming syrian democratic force fought isi literally bad isi honestly let go european country need resettle country treated like shit live squalor turkey anyway solves issue allowing erdogan keep using bargaining chip basically extort country  1 st kick mofo nato wait second thought motto refugee welcome europe since immigrant good economy part vibrant diverse culture really threat stop buying loukoums show turkey great ally u kind stale hearing nerdogan removed user often report submission site ask u ban sensationalized article oppose blanket banning news source reader responsibility skeptical check source comment flaw help improve thread linking medium verifies question article claim link could help reader better understand issue find evidence article title false misleading contact moderator review bot action performed automatically please contact moderator subreddit question concern already saw movie going let inside europe anyways there point say x 200 b yes imagery meant pornographic want world war hide get one mister see anyone else asking question go refugee right stuck concentration camp come tell asshole go right ahead completely isolate country fuck open gate rather million refugee instead mass murder war genocide working funnel isi fighter europe seems like sociopath dictator holding lot ace card playing real well turkey acting buffer zone eu syria hosting refugee region stabilized eu agreed aid turkey financially matter since eu loyal agreement also ungrateful fuck like take another step support terrorist group pkk ypg pyd syria akp would support decide open gate brace motherfucker agree either work nato would good policy get kicked ef ally sic semper tyranni build kurdistan turkey ash turkey part nato shitty thing expose interesting double standard part eu spoken like terrorist turk flock turkey get feeling safe zone includes kurdistan mean right wonder got idea ehem trump without democracy hold check whoever thought weaponizing refugee scary diabolically genius ok bring spend billion processing running refugee camp beat held hostage asshole really need kicked nato zone kill kurd annex northern syria probably refugee detention center good job erdogan understand massive migration million pakistan afghanistan india china casued climate change europe undoing ca wait 
e1ct1a,1574668416.0,australia probe disturbing allegation chinese political interference,Blockhead47,149,3,continue gladly sell every resource imaginable fucking australian politician underhanded corruption self servicing give corrupt leader run money best tl dr could make original reduced  83  bot quot find allegation deeply disturbing troubling quot morrison told reporter canberra adding government beefed australia  039  law security agency counter foreign interference quot hostile foreign intelligence activity continues pose real threat nation security asio continue confront counter foreign interference espionage australia quot said latest allegation came day medium reported chinese defector said intelligence operative told asio china funded conducted political interference taiwan australia hong kong extended summary faq version tl drs far feedback  23 autotldr pm comment monitored constructive feedback welcome top keywords australia  1  asio  2  security  3  report  4  china  5  
e77m14,1575680941.0,australia bushfires combine form fire north sydney,drunkles,407,19,deleted stop fire keep burning condition ease try contain told public broadcaster abc fire like become common globe people feel helpless nothing stop fire magnitude something change diminish rain change wind lack material burn etc really almost nowhere safe region become multiple year even one enough massive fire start leading situation going right north sydney australia voted climate change denier beholden coal utter insanity someone state fire bag packed evacuate completely different fire getting close article make sad god hate state federal government coal coalas australia many fire lit fucking idiot one guy lit fire distract fire brigade would find illegal weed growing farm fuck fucker thumbnail photo taken mustafar friend bushfire refugee wife kid  2  horse  3  dog staying u hubby local bushfire brigade saving house  12  hour day waiting see house go back fire front  6 km away property moment actually like sidney day well way becoming ultrafire cricket good tho yay reality trump scyfy channel movie man wind start blowing towards sydney going utter disaster well bright side land look great  50  year live long fuck au saw system voting back felt impressed fuck way voting produce shit hazy day result smoke spectacular sunset boot  2200 km away new zealand awstralia least instead two fire fight one fire 
e8kgtz,1575945869.0,democrat introduce article impeachment trump tuesday,inmyelement,11800,48,advice get rid distinct feeling screaming void congress introducing article impeachment gop might part democrat congress hate medium report thing like take away really happening ca help remember mike penny fake as secret republican revolt yesteryear anonymous letter rep white house fighting trump behind scene sent wapo whatever please tell donald stand middle amphitheater senator start throwing peach think great way explain abuse power american following news analogy made pamela karlan expanded scenario hurricane natural disaster hit home state congress us taxpayer money allot hundred million disaster aid fund governor request meeting trump discus situation aid still released phone call governor trump say meet lift aid hold like governor favor though want governor look son bernie sander side note evidence illegal activity bernie sander son want public announcement everyone know aid end withheld month confusion state government dozen official give warning file complaint aid withheld official complaint made public would think action president trump first took office thought constant blunder would eventually make politically radioactive gop would run cover get away year one impeachment trump able mock family veteran relative impunity god gun country group year whatever document house hand senate assured enough fox meme successfully isolated huge bloc voter reality thereby insulated gop political consequence fucking nation people publicly available read ready republican officially record supporting traitorous criminal history senate vote agaisnt removal office thursday end deleted bad senate already decided trump nothing wrong go  0  chance removed office reading action beeing held trump impeachment yet seems like nothing really moving farce really something changing happening trump draining swamp filling radioactive sewage wish luck need group people affinity truth watched daniel goldman summary evidence pb list evidence house collected long damning u internal news yeah never show suck comman american blow subpoena get arrested nothing happen burn bitch burn hope  2020  anyone least bipartisan oh wait moscow mitch read laugh put trash bin take russian money funneled via nra want honest watched majority inquiry someone explain clear evidence support impeachment seemed like evidence presented based bias opinion know maybe wrong yes trump supporter yet open mind accurate headline house representative introduce article impeachment trump monday course want removed even impeachment without removal stain never get clean clinton removed otherwise good administration always impeached asterisk thank voter turned house blue evidence trump anything wrong lock lock lock lock lock lock lock lock lock lock everyone talking matter president democrat always try impeach republican president republican always try impeach democrat president series question voting booth almost like phycological political profile test  3  choice seat position took test voting figure closest result made choice contrary test result showed would held accountable allowed outed position random change opinion voted corporate payout make sense appeal moral always voting blue red like sport team really care player going get better something changed edit even little discussion blue red feel like evidence towards impeachment overwhelming politician following impeachable offense monumental waste time great way democratic party take sander campaign trail week right iowa ca wait republican majority senate hold fast trump popularity get ten point boost anyone even remotely interested theater sucker wo even make house forget gop may shut removal trump office mean point trump impeached congress could also making unable run upcoming election option republican leader better least cheeto would gone backfire loaded deleted put reminder comment nothing happen lot screaming wont get impeached removed power gon na blatant cheating guy u fucked stuck orange turd could happened deserving guy call paranoid dnc pushing impeachment harder ever get biden corporate candidate elected electability high due default voter tuning mcm get wrong trump impeachable principle prod dnc work whose speaker actually said think go path divide country worth poll continuously showing corporate shill like biden buttigieg harris making blunder dropping populist like sander rising even beating trump red state mention rust belt state hillary shat dnc becoming desperate cash early possible people keep getting fed lie mcm realize bullshit getting served call paranoid want remember low dnc willing go  2016  election hoping circus sideshow entered final act year hard evidence corruption crime committed president come forward obstruction impeachment reason impeachment used impeachment justify impeachment better fkkn street senate vote convict get ass get good ole fashion protest would ya jes chrice dude spoiler result excellent know rule matter stand thing getting juicy bet dollar republican shoot country foot fails get vote collusion israel 
ee4pmd,1577020136.0, 175  child abused mexican branch catholic church report,Magistradocere,3165,67, 175  people abused catholic priest mexico title wrong  175  people abused catholic priest one small congregation mexico total number certainly way higher fucking shit happened frequency organization would wholly disbanded branded criminal organization  1  many  2   5   175  fuck deleted way small number definitely case could confirm claim moral high ground busy telling live life cue apologist happens everywhere church people scrutinize church way others im sure lot worse church sending problem mexico south america decade priest sent useally got caught state place sent somewhere spot light anywhere left kid abused catholic church yet million people still actively support one catholic please tell continue support organization proven covered sexual predator assault child especially sheer number reported incident one enough many child must catholic church scar life leave faith amount evil change mind honestly child rape sexual assault one evil thing ever heard brainwashed removed church rage homosexuality priest practice sexual abuse child wtf know biblical christian god exist killed onan coitus interruptus yet allow shitbags live god may exist god one described christianity clear problem child rape abuse institutional problem catholic church going century entire hierarchy complicit sympathy priest victim structurally embedded catholic church organization reform problem extend entire organization including reformer position something deleted still people support fucken church unbelievable like last hour orrrr definitely  175  oh determining branch made quota look  1  parish legionarios de cristo vey influential sect mexican politics society run preppy exclusive school child religious high society go even kid abused open secret decade tell powerful  175  reported amount amount specific congregation overall catholic church mexico guaranteed number astronomically due people wanting report church paying people suppressing report know bad deep go whole wikipedia page detail country problem catholic church paedophilia bueno burn stake swear global organisation many count pedophilia across whole planet would systematically dismantled ten thousand last  2  decade thats know recently one vatican head dropped covering hundred count child abuse pedophile catholic church one despicable evil institution human history actually considered movement umbrella catholic church much like dominican franciscan order legionary christ along lay movement called regnum christi started mexico global institution incident abuse happened school boy like one new hampshire older brother attended year attended version girl rhode island thought many incident exclusive mexico personally know many people still dealing trauma stemming experience group shocked maciel secret life supported negative feeling towards experience left got ta pump number rookie number racket pope francis catholic church headquartered vatican city turning single largest pedophile network history jeffery epstein compared men jebus every country everywhere kind investigation catholic church everywhere obvious people fucking understand catholic religion god damn cult many kid need abused something done one day rid disease call religion anybody believe god think good care u individually larger format beyond give credit good never blame shit like point bring kid church criminally negligent pope john paul ii patron saint pedophile christianity colonial plague seems catholic priest preferred job choice pedos fucking sad first thought worry involved incarcerated one trump border control cage past year well everyone except offender sift sure happening everywhere swept carpet year think castrated talking priest talking priest teacher dad taking pedophile general anyone look child way number seems small assume referring  1  church mexico catholic church comforting home pedophile world rest quite certain number much higher  175  doubt last week count surprising ratzinger allowed quietly retire fade background pope francis bringing instance light likely one would ever known would make idiot today  175  sound low doesnt mexico regularly marry young guessing like always wo go prison wow pope knew catholic church satanic since creation designed make turn god falling trick yes like dinosaur roamed earth  6  year ago technically correct underselling bit read somewhere estimated  10  priest abuser basis estimate  aztec hundred year abuse mexican boggles mind anyone mexico could ever christian considering religion used destroy entire culture thats solid number  176  like naaaw filthy abramic religion filled pedophile terrorist seems like child abuse catholic go hand hand clicked article yet assume going congratulating small number compared rest child abuse religious people get f outta embassy pedofiles still active day cristo  175  padre whipped taquitos  175  odd number would say fuck pope vatican catholic reddit allowed criticize country leadership would accused crazy blow mind people say anyone mean anyone support trump racist even racist supporting one one catholic boston got beat easy pfft mexican lazy 
ej1ozh,1577988324.0,thai retailer kicked  2020  ban plastic bag joining battle throwaway carrier southeast asian nation citizen use average eight every day move taken several major mall operator ubiquitous convenience store,DoremusJessup,118,6,good lao last year go back week every patch grass covered plastic trash best tl dr could make original reduced  69  bot thai retailer kicked  2020  ban plastic bag joining battle throwaway carrier southeast asian nation citizen go average eight every day thailand one largest contributor ocean pollution plastic bag recently turning stomach dead marine mammal like dugong green turtle prompting national country continue produce plastic packaging lack proper waste management policy added reusable bag typically made fabric spun extended summary faq version tl drs far feedback  23 autotldr pm comment monitored constructive feedback welcome top keywords plastic  1  bag  2   3  ban  4   5  eight see possible counting little food sauce packet bag counting bag used back room grocery store restaurant one would reasonable highly impressive feat visited thailand everything came plastic bag soft drink came plastic bag swear bought plastic bag would put plastic bag thank making change thailand country beautiful littered trash everywhere u basically cricket thailand 
