id,time,title,author,score,num_comments,text
gg7kd9,1588993473.0,coronavirus pandemic may started october say study,anupsetafternoon,170,16,pandemic may started early october according new joint study genetic researcher university college london university reunion island pathogen wreaking havoc world known scientifically thought made jump initial host human point october  6  december  11  finding based analysis genome sequence assembly collected around world since january published forthcoming edition scientific journal infection genetics evolution researcher studied evolution mutation since jumped human order work back molecular clock common starting point separately chinese government information seen previously south china morning post suggests one first patient emerge resident hubei province november  17  patient zero yet confirmed theory virus circulating earlier thought came french athlete fell ill competing wuhan october said told doctor likely caught claim olympic pentathlete elodie clouvel bolstered theory coronavirus may carried around world people taken part international competition chinese city m clouvel  31  said boyfriend valentin belaud also pentathlete fallen ill military world game held wuhan october  18   27  featuring athlete  109  country french team member since spoken french press mainly condition anonymity say become sick fell ill symptom m clouvel military police officer told rtl radio recently contact military doctor said u think lot people ill afterwards french army denies knowledge anyone contracting disease game week french doctor informed old man mystery disease contracted december  27  left requiring oxygen testing frozen swab first confirmed case france january  24  discovery france potential patient zero prompted world health organisation urge country investigate early suspicious case look actual figure paper beware suggest started october conclude method estimate date  24 th november  2019   95  confidence around  6  october december  2019  already reported  2  month ago guess supporting evidence wonder statistic flu death higher normal november  2019  yeah people talking  2  month ago virus spreading around prior january called conspiracy theorist demonized interesting article think however news outlet report scientific paper journal provide reference public cross reference copy paste article please paywall dad breathing difficulty mid november high fever nasty coughing also breathing difficulty even tho well allergy season mild fever november dad non smoker live healthy worried surprised symptom never flu cold infection heavily leaning towards theory even also checking medical stats flu season country higher pneumonia hospitalization december usual blame man called ferhat ataman news make sick turn og virus came america definitely meme universe december article thought made jump initial host human point october  6  december  11  would quite hilarious turn year reporting usual death care started admitting patient  0  idk smart 
gmf4yx,1589852538.0,south korea donate  100  million dollar country vulnerable public health system korea collaborate across border ensure vaccine distributed equally among country public good,HeftyArt4,2880,31,south korea going diplomatic victory ensure vaccine distributed equally among country public good way hell trump would ever say really like new south korea yo south korea cool world bro suffering filipino people uncompetitive corrupt government waving want help u america south korea saving world like movie u invested  600  million one french pharmaceutical company u cut funding steal shipment mask meant country demand research center around globe make private vaccine feel bad american deal fact president making country come looking like petty vindictive bully world stage contrast action ccp throwing tariff country dare question handling coronavirus include u send u fucked hard enough need u group cause  100  vulnerable health system suck design nice south korea going donating  100 million u wow comment page negative apparently korean approve south korea flexin entire pandemic timeline hope give washington dc south korea n rise shit together okay american expect money vulnerable health system going donating united state include u wonder taxpayer feel guess overcollecting tax whole time otherwise would excess  100 mm come south korea come pretty close title korea sk president become president earth angela merkel u getting money deleted south korea tao  100  mil little honestly donate damn people live fuck korea look first distributing vaccine equally noble let wait see promise worth actual vaccine become available 
gvzycz,1591210222.0,china warns india economical repercussion support u cold war china,nimobo,253,14,lol india ever going support china opposition china literally trying diverted major river run india depriving india massive amount water china realize large import market market simply encourage market develop deal instead china china seems think invulnerable basic economics bold move cotton let see work china warns india economical repercussion well chinese thrifty yes threaten neighbor trading partner manufacturing likely move india made china label see clothes appliance could become made india minimal disruption point china need either quit risk permanent damage gdp lol india could replace china new manufacturing hub time hope learn covid china positioning aggressively need move away god awful basket case nation china india trade deficit china win win situation india bounce back without china within month bringing new chain supply india win long term lessee china ally pakistan sell  2 nd rate warplane u longer sell f 16 s pakistan china us belt road initiative lock muslim place concentration camp sell young woman chinese businessmen become wife wife sex slave reality u trying get india replace china source inexpensively priced material people india speak english instead mandarin large language barrier yes see india stealing china lunch especially u start limit chinese import retaliation agricultural limit like soybean halt import fuck u well shut food product including pork china watch population go rampage eat soy import feed pig cost triple tough shit chinese owned pork producer u want export china fucking deal roar paper tiger china warning really threatening everyone day start sound little paniked warn dick india take china population lol world news source hardly public third party information available linked news outlet company headquartered new delhi  4  employee according public record official twitter account follower website traffic stat quite sparse chinese need think like western world thing scenario always winner take world stage west successful china weaker west suggest win win cooperation facing india weaker country probably going supress front like usa china india divided culture religion would imagine prone split talking skih colleague really see hindu one guess go muslim 
gz1h12,1591630247.0,shutdown prevented  60  million coronavirus infection study find,FPS_Yusuf1999,498,18,prevented delayed wait postponed two month hi submission behind metered paywall metered paywall allows user view specific number article requiring paid subscription article posted accessible everyone submission removed flaired user discouraged upvoting commenting information see wiki page paywalls please try find another source news site reporting story contact moderator bot action performed automatically please contact moderator subreddit question concern seems article estimate real world number provide hillbilly neighbor say fake news believe believe protest gon na bring em right back protest subsequent community infection might get u  60  million anyway sure removed mission accomplished reopenings trying get number back fast possible lie removed true leadership making hard necessary decision  60  million infection riot protest help believing lie anymore lockdown kill 
h88jow,1592058513.0,second time month police northern new brunswick shot killed indigenous person quebec police watchdog said called investigate circumstance around shooting death civilian,maxwellhill,8883,42,might stupid question quebec police watchdog called new brunswick police watchdog charged police knife several attempt taze seems like reasonable escalation police able protect report true charged guy knife think job problem see several person charged knife shot report witness body cam person get tell story person killed guy think ever case police officer openly admits shooting killing someone justified despite happening far frequently worldwide result people charging cop knife native get tired seeing story like know trust dude acted like cop better lying truly mentally unstable fighting demon everyone close say failed mixed knife expect happen brother held knife cop got shot devistated dead would blame cop mom would mother lot family member would probably jump hate cop bandwagon know lot would use excuse ca trust live nb fairly big lady edmundston charged officer weapon far hate crime simply accident hell post trying call canadian police racially motivated retribution lot case involved weapon victim acting like idiot zero reason canadian medium supporting many headline video cut right word right moment make police look terrible knowing outrage addict take time looking situation organization pushing narrative canada pretty hard disgraceful according linda rodney became paranoid visiting pastor rcmp called tasered dropped knife rcmp shot twice dead centre chest heart lung said linda say got information pastor witnessed incident hospital doctor came tell u passed away died first shot said need stop hiring immigrant south border nothing violent criminal charge cop knife care cop shoot problem police report seem reasonable video learn truth maybe event happened way maybe trust shaken know believe like feeling people understand going around reading headline twitter feed confirmation bias crowd local rez indigenous police force work friend mine mental breakdown blockaded road rez cop showed threw rock craziness rcmp police force would shot dead believe rez cop took hospital community policing work think article really show narrow mindedness limitation police focused thinking sort incident especially canada police called unstable person knife take lot thing escalate point big picture person life mental health issue already hard enough even good environment lot native people prevalence kinda thing due police handle important happens way call made really driver kinda incident mental health resource broader issue much bigger deal police shooting canada tend least somewhat justified police racism hot button issue focus click attention real issue native community messed economically socially physically people unstable officer police handling badly addressed situation cry help certainly help racebaiting going medium yesterday cbc editing video  4  min full video  5  min longer show much different context arrest would even make fox news blush little clear liberal demand story focused blaming police side thing even seem appropriate see article mention reason think police version suspect quote people understandably tired trend thing edit adding body cam going change read change behavior much favour priority think worth pointing case month people charging police knife case police allegedly used stun gun several time without success said bei news release man reportedly shot charged police saying bad police profession bad people canada think police hiring process reasonably good officer decent pay good enough training process fairly long think police brutality big issue poverty problem especially first nation community seems like something need rebuilt ground reserve system simply working hard vast number tribe individual system government lot social program general could use improvement covid 19  going test deal poverty increased crime come specific watchdog called anytime death serious injury police intervention regardless whether justified independent investigation use term report weird however slight use language like continues militarize police police civilian pretty sad case kingston back man mental health issue stabbed killed random man attacked elderly man man survived attack police arrived man began come shot leg sat curb stabbed repeatedly neck filmed unsure initial murder broad daylight people cell phone footage facebook briefly starting police arrival arrival personally watched knowing outcome began watching officer placed paid leave pending investigation charge laid nb police people really like knife acadian low key racist mf er canada funny work since long storied history raciee usually excited see province reddit post course disappointed something shitty happened compound shittiness situation second indigenous person shot rcmp province last two week second time month police northern new brunswick shot killed indigenous person theyve trying job keep getting nosy noserton outrage tards making massive deal every incident general population stupid shit seems wild people see suspect weapon think yeah absolutely deserved impossible subdue someone without killing also really trust rcmp act judgement come indigenous people anyone really considering fact starlight tour thing ilm indigenous life matter canada call action always record folk abomination humanity remember canadian said living next u like living next heroin addict well think like crackhead living next heroin addict removed stop using civilian use citizen fucking war people cop example militarization police force must end removed death acceptable outcome twice week alone say indigenous people killed twice week rcmp shot gun normal acceptable ask keep making excuse racist system racist outcome ask keep agreeing system keep killing abusing indigenous people people idea head fuck police get away  100  support rcmp everything unless charging train derailers domestic terrorism neoliberal hypocrite metooers get nut victim black person nobody give dumb native ethnicity race handed cpt indigenous police brutality disgusting much brushed rug civilian shot citizen love rhetoric medium dang canada getting america shit feel like white supremacist law enforcement getting many legally sanctioned homicide kkk party going shit seen time time damn mountie trying get street cred making american cop look weak murdering minority inspected found nothing wrong go back home citizen nothing see every single officer involved shooting likely subscriber ringleader probably mod oh quebec going investigate okay make  100  transparent board oooh waving knife option shoot kill thoughtful video floating around reddit cop subduing suspect waving huge fucking machete forming shield wall maybe could throw large kevlar blanket grab le lethal option cop need start thinking outside box 
h9yrjs,1592291173.0,north korea blow joint liaison office south border town kaesong korean official say,Pussypants,60913,74,korea explosion expected actually followed situation north korea come surprise tweet last week even predicted demolition ever since trump walked away hanoi summit deal kim jong un stuck leverage nuke use get wanted sanction relief unpopular opinion even north korea never intended give nuke would much better agree partial partial denuclearization long fundemental issue resolved talk military tension continue actually surprised waited long escalate harder time nk come bogus excuse raise tension since south korea done literally nothing wrong break treaty current administration generous receptive government north korea would probably ever partner catch u attention nevertheless use punching bag south korea ca much despite really wanting pursue economic intergration project north without breaking un sanction u still hold key global sanction north korea yet short attention span flare nk seems like legitimate threat like back  2017  thus north korea would inevitably test boundary using threat compromise reached mad neighbor blow home instead btw guess kim sister establishing sort authority right making scene  2020  continues damn guess time year north korea act like child tantrum get international aid stop blew building side warning going happen north sending petty message towards south balloon keep flying north korea leaflet north korea respond look tough remember iran launched missile onto air base retaliation assassination sulemani done precision ensure minimal casualty looking tough state medium shit artillery barrage brief firefight korea year ago nothing came news china killed  3  indian army personnel ladakh border happy ww 3  seeing building side border essentially blew building mostly symbolic almost petty like cry attention showy sister might really charge remember took ordered navy blow south korean ship show old men army mean business feel bad south korea constanrly deal crazy psychopath brother deleted well escalating quickly chinese soldier killed  3  indian soldier ongoing border dispute south korea retaliate blowing one building oh wait yup clearly covid issue north korea time external enemy prevent internal revolt fuck wrong kim jong un sister somebody need aid anyone got shrek meme template shrek humanity asking donkey  2020  stop trying kill u  5  minute double bingo cause getting close full sheet feel awful oppressed people north korea wish world state would liberate oh god  2020  disaster meme might reality well rude deleted nk annoying like kid learning disorder bully others everyone leaf alone feel bad well least world news actually somewhere else world besides uk hk usa deleted calm  2020  sister angry great see ww 3  still option year almost forgot one still remember dad defending trump purely based prediction trump done something one else reunited two korea together bet kim might even step let democracy reign ca believe happening lifetime rolled eye said sure dad sure going happen assume kim jong un dead surgery sister trying get power aggressive movement mass propaganda preparation transfer power exactly north korean feel woman power know nothing surprise anymore really wish guy jib jab would come retirement nobody suspicious kim jong un sister suddenly calling shot thinking may replaced dead gee like kid throwing tantrum kim jong un dead long live dictatorship sister flexing muscle telling world unpredictable brother mess exhibit mean new season h get along see july disaster  2020  coming early implodes ball fearmongering ranting ww 3   3   2   1  country equivalent child throwing tantrum case tantrum yet another internal power move chinese diplomat leak actually likened dealing country dealing spoiled child deleted bet kim flexing threatened violence recently blew huh bit melodramatic north korea bomb bruh still  6  month  2020  left aswell could possibly go wrong destroyed site north territory opened  2018  help two korea technically state war communicate another propoganda move thats someone please tell extend truce next year  2020  booked full karen could find manager blew liaison office damn blow joint good fun nk evil shenanigan north korea blow deleted obviously happy china grabbing limelight like little child getting enough attention corona protest trying goto nk capture kim sister guy get new  2020  end world bingo card mine full ok new korean war  2020  apocalypse bingo like newest episode black mirror stay perhaps korea decimated covid ploy drum much needed aid saying positive perhaps operating strong position hopefully flare country verge collapse maybe wishful thinking someone go take piece shit wonder call trump back talk recent spectacular failure make easy target manipulation seems kind silly even symbolic gesture correct building developed sort sanctuary sk nk family place reunite never got used essentially blew nice thought damn bbc played right nk hand want attention everyone focused thing world right kim one paying attention jong un generally try keep going around world unintentionally forgot tension korean peninsula covid george floyd resulting protest president idiot netanyahu bolsenaro million awful thing world forgotten maybe baby man deluxe wanted attention world built south korean tax blown north korean bomb north korea war bingo sheet suck first thought blow literally figuratively hard tell headline wrecking destroying people day thought trump fixed like china conflict middle east deleted rodman aware 
hjz1xa,1593703622.0,democracy activist nathan law say fled hong kong,HKnational,1940,23,better life taiwan one lucky one lot people get tortured hk probably smart move writing wall stay hk much longer end involuntary organ donor whatever happened joshua wong major voice thing change drastically next year truly personally feel sad smaller aspect change hear le bad critical ccp news medium outlet hk get shutdown hk connection western world mainland smart tough watching democracy die real time best tl dr could make original reduced  65  bot hong kong nathan law one hong kong  039  prominent young democracy activist announced thursday fled overseas response beijing imposing sweeping security law city quot already left hong kong continue advocacy work international level quot law said short english message journalist declining say country gone statement hong kong  039  government said phrase illegal quot contains indication hong kong independence alienating hong kong china changing legal status subverting state quot extended summary faq version tl drs far feedback  23 autotldr pm comment monitored constructive feedback welcome top keywords hong  1  kong  2  law  3  beijing  4  illegal  5  listening npr public radio interview believe gentleman went silent middle interview minute later dead silence put different segment already middle interview minute activist made point saying fled hk undisclosed location normally conspiracy theory sometimes coincidence seem coincident nathan law voted become youngest lawmaker history hong kong  2016  second highest number vote disqualified technicality july  2017  imprisoned august  2017  forced become political refugee today democracy dy country scared shit cause money one guy left something happen one want world war hoping people open eye lie ccp hopefully china crumble inside got ta sway international student people return china eventually people tell slippery slope necessarily fallacy many suspicious comment thread wonder many poster paid astroturfers flee stack money stole people believed democracy lol damn much changed hope live safely glad day numbered think remember playing dude tekken going get tough tough leave nathan law setting government exile mean funded another government guess government maybe one history toppling government including toppling democratic government installing government exile vacuum reason fleeing called sedition law country probably even named differently fake revolutionist knowing nothing lose much gain removed 
