id,time,title,author,score,num_comments,text
at9zqi,1550791279.0,going shot top bureaucrat say partisan mudslinging gone far cbc news,idarknight,124,9,one one lady representative already get shot cause ridiculous divide political discourse gotten completely hand personally think come rise identity politics used growing school phrase discus idea people debate idea say think idea without merit problem seen lately modern discourse attached identity idea person color believe demographic idea based experience ca debate idea considered invalidating identity come along debate idea without debating person think idea without merit without saying person behind without merit opinion anyway edit identity politics politics well right wing political figure ca discus left wing policy without accused left winger ousted base left wing person ca discus right wing policy without accused right winger ousted base caused side double move extreme edit  2  thank silver king stranger wow scumbag oil lobby must paying guy lot encourage running liberal semi umm someone already get shot name congressman steve scalise security detail bernie sander supporter opened fire congressional baseball game kind disturbing people already forgotten best tl dr could make original reduced  89  bot wernick career public servant worked senior role conservative liberal prime minister said find recent remark conservative saskatchewan david tkachuk recent rally particularly distasteful addressing quot united roll quot convoy alberta trucker travelled ottawa week tkachuk said quot know  039  rolled way  039  going ask one thing want roll every liberal left country quot know  039  rolled way  039  going ask one thing want roll every liberal left country quot conservative david tkachuk said united roll convoy rally ottawa ont extended summary faq version tl drs far feedback  23 autotldr pm comment monitored constructive feedback welcome top keywords wernick  1  roll  2  liberal  3  minister  4  people  5  impossible gun controlled canada think gop plan exactly keep pushing till someone push back scream oppressed probably maga moron weapon suck 
avo4js,1551337387.0,u judge let abu ghraib torture claim go trial delay  10  year delay federal judge ruled three former inmate say tortured iraq abu ghraib prison go forward lawsuit military contractor,tristan_isolde,2366,19,reason delay purpose somehow insulate chain command responsible punished honestly know asking certain fact like identity interrogator state secret ca declassified identity declassified convicted otherwise oh yeah gave  3   10  year ca tell could deduce identity reason assume got jail time abu ghraib invade country torture people fight back hey guy know business get military interrogation never come back bite u guy caci everyone homework determine  2  psychologist came spokane involved hope lose million made advocating torture justice delayed justice denied military contractor torturing people huh really dosent sound much like good guy think fucker best tl dr could make original reduced  66  bot  10  year delay federal judge ruled three former inmate say tortured iraq  039  abu ghraib prison go forward lawsuit military contractor district judge leonie brinkema acknowledged caci  039  frustration said lawsuit move forward even though government say certain fact like identity interrogator state secret  039  declassified inmate filed lawsuit assistance new center constitutional right say suffered abuse mirroring incident shocked world  039  conscience photo abu ghraib publicized  15  year ago including stacked naked human pyramid extended summary faq version tl drs far feedback  23 autotldr pm comment monitored constructive feedback welcome top keywords lawsuit  1  inmate  2  interrogator  3  caci  4  judge  5  mercenary word looking mercenary stop garbage white washing war crime good guy usa counting day see cia guantanamo bay worker trial jail boat jail plane jail island torture international water time last thing want look forward old age tax continue pay salary pension torturer disgraced country made potent recruitment tool terrorist group worldwide people victim terrorist organisation sorry actually telling like couple service member get short stick first came think least female private center faced charge maybe punished within military though related thought american soldier want immune responsibility accountability according law exactly awarded circumstance suit successful would money go would receive reduced sentence better accommodation yep nazi would still get charged today well yep nazi would still get charged today well yeah good luck iraqi government granted complete immunity war crime u military personnel protecting claim like immunity expired  2011  iraqi government refused renew saw bad contractor obama pulled troop x 200 b unless happened time  2011  waiting ten year trial doubt pretty much shit luck 
b1eptl,1552655134.0,whale watching japan rise even commercial hunt set resume new data show japanese citizen prefer whale watching whale meat,b12ftw,48447,66,thought saw whale might fluke whale meat actually popular whale hunting politics japanese really eat whale meat  100  case whaling company lobbying politician make nationalist case people find japan equivalent idiot trump supporter nationalist sushi chef source lived japan whaling outdated pointless find funny people jump attack japanese even worst offender canadian kill twice many wasted sold commercially amoungst aboriginal people whale watch local walmart awareness actually come drastically help reducing whale hunting reminds another article chinese people aware elephant die ivory harvested deleted boil education awareness sharp decline consumption shark fin recent year e 2   80   93 present large part action taken celebrity like yao ming jackie chan raise awareness convince people curb consumption endangered animal fair actually bad whale hunting whale specie endangered obviously hunting endangered one allowed whale hunting general seems heavily demonized lot people love deer watching people love deer hunting whale meat really good though know would prefer meat like mix good tuna delicate steak norway hunt whale dog food production til norwegian get whats big deal whaling whale countryman hunt endangered people actually eat meat animal considered cool hunt dumb give plenty great meat le cruel industrial livestock ask eye whaling old tradition kept alive sake kept alive serve traditional purpose edit spelling error surprise moreover nobody ever responded well outright criticism greenpeace would better use money fund production cartoon showing whale equivalent bambi lose mother whale let public opinion change time come never see scandinavian country spotlight hunt whale japan norway alone hunt japan combine two whale watching ship people go pick whale want eat oppose whaling open mind uninformed topic whaling giving someone golden opportunity change mind disagree stand currently see reason whaling believe whale hold worth cow willing eat meat support beef industry see ideological reason oppose whaling humanitarian ground opposed form hunting long population prey control prey population issue becomes issue proper wildlife management enforcement opinion opposition whaling based idea whale meet sort value threshold make people feel different hunted animal basically believe way whale hunting opponent ideological consistent oppose hunting ground oppose hunting really oppose meat hunting far humane raising animal captivity leading slaughter nutshell oppose whaling ground hunting inhumane really must argument meat general much broader topic focus whale particular opposition whaling based opposition hunting practical basis nature ecologically damaging lack fundamental understanding proper wildlife management work otherwise push would proper management outright opposition hunting finally opposition whaling based idea particularly inhumane compared form hunting practice opposed ideologically consistent however would posit question could make humane hunting would opposed ideologically inconsistent true opposition different reason goal push humane method whale hunting halt hunting altogether nutshell see path ideologically consistent opposition whale hunting open hearing might wrong feel free change mind problem sustainably harvesting whale would actually like try whale meat  whale smarter domestic animal eat whale provides lot meat one life taken v say chicken really unethical eat supposing whale meat consumed specie whale near extinction personally see differently eating fish game whale meat even good compared say quality brisket pork shoulder asking friend whale number way ask people would rather cuddle lamb lamb chop would similar result chicken cow chicken cow matter citizen want unless want capitalism democracy  10  people pay cost profit whaling crew go kill whale  10  people going getting shit ton whale meat forget whale hunting look fishing habit worst meet whale meat whale japanese eat whale whale watch  99  people eat whale meat whale watch pretty sure watch whale foreign tourist lived japan  5  year never seen whale menu super market japanese wife family never talk either common dish local something edit weirdest thing raw horse meat fuku weird great either maybe sashimi fish still move though leave footprint shoot picture take memory whale meat bad thing fattyness raise internal temperature super beneficial cold climate fuck whale fuck dolphin  scuba dive fish support japanese whaling industry way saying enjoying nature eating necessarily mutually exclusive especially believe sustainable population japanese claim actually annoys see many people hypocritical whale hunting topic japan nobody talking western country largest whale consuming recent history northern european country like norway iceland also hunting whale one ever talk norway whale hunting issue major news medium japan always target whale japan hunt common minke whale consider endangered specie anyway comparing u early  20  century japan whale hunting even anything major western country disgusting one actually created problem whale hunting think start throw shit japan even japan tradition whale hunting hundred year ago never problem environment great news japanese people better whale hunting like try whale meat whale cut certainly good news   nah like go red lobster pick lobster want eat culture tradition make right human ate human early day plucking random human house snack post unpopular someone say remember correctly norway iceland canada sure finland hunt whale whale japan hunt research lmfao also endangered curious read several paper issue conclude much cultural imperialism aka imposing cultural belief others exactly jp gov fighting much  1980  memorandum pause whaling allow population around world recover passed japan agreed people want make whaling ban even whale japan want allow whaler hunt endangered memorandum cause whale cute animal western culture seem positive character animated show european canada hunt whale endangered say protecting indigenous culture japan hunt whale everyone flip point demand issue want jp government stop propping whale industry stop ridiculous pr assault whaling region world cultural preference never seen indian vegan india come canada slam meat eating remain vegan comment meat eating habit loudest vegan come trying convince much others vegansim right thing respecting difference culture belief make world better place edit self righteous idiot tell whaling primarily scaled ww 2  previously part mainstream jp culture say matter certain community jp whaling long time matter small studio ghibli need make film whale whale raccoon porco rossi whale osaka actually pretty tasty downvotes expected case anyone wondering whale meat fucking disgusting antiquated traditional whale meat need staple anymore thing imagine alone hopefully upcoming generation keep marketplace open u prefers watching bambi venison stop hunting wait let criticize japan whale meat disgusting account heard extremely fatty doesnt taste great well someone eating fantastic news really hope ecotourism take becomes lucrative meat industry surrounding finland real lppp maybe going day dream sale meat like bunch people salivating study compare watching something eating something majority people like whale people sell whale meat food porn aye wow title got ta watch harpoon captain ahab make money tourism comment whale joke lost younger japanese citizen dont like whale meat whaling outside protective water hurt japanese whaling cant get best whale thus shriveling whale market two fold ca responsible request permission treat whaler like treat whale harpoon sight cow fun watch eat dolphin watching tour marketed whale rarely seen woman counter said expect see one might get disappointed saw one coming surface twice never forget like watch dinner build suspense 
b3og0r,1553160423.0,deleted user,,3170,41,response inadmissible nobody country neither president parliament ambassador stop prosecuting whether crime continued let hope true deleted sound like handy list people prosecute best tl dr could make original reduced  79  bot ukrainian prosecutor general yuriy lutsenko told  039  john solomon interview aired wednesday ambassador ukraine marie yovanovitch gave prosecute list first meeting quot unfortunately first meeting ambassador kiev gave list people prosecute quot lutsenko took post  2016  told last week yovanovitch previously served ambassador armenia former president obama george bush well ambassador kyrgyzstan bush extended summary faq version tl drs far feedback  23 autotldr pm comment monitored constructive feedback welcome top keywords  1  ambassador  2  embassy  3  general  4  prosecutor  5  guy report mouthpiece trump admistration note last paragraph former pete session time house rule committee chairman voiced concern yovanovitch letter state department last year said proof ambassador spoken disdain trump administration frequently used trump campaign whitehouse plant story need distraction omg hillary clinton uranium one mueller first started indicting trump associate wrote article used trump friend imply comey leaked classified information memo went public wrote article claimed attorney general lynch gave russian lawyer attended trump tower meeting special permission enter country used trump trump jr deflect confuse republican congress course calling investigation see obvious agenda article nothing attacking fbi doj comey rod rosenstein cohen clinton mueller congressional democrat etc frequent guest hannity pretty much nothing defend trump try undermine fbi doj probe circa news medium outlet launched eight month ago embraced republican aggressive reporting russian meddling  2016  election run counter reporting mainstream outlet circa chief operating officer john solomon national security reporter sara carter appeared fox news channel hannity almost every night past week giving outlet valuable primetime perch one conservative medium cable news show sean hannity one trump biggest booster medium repeatedly lauded circa gold standard blasting counterpart mainstream medium lazy overpaid circa news considered friendly trump white house new york time reported late tuesday night president personal attorney marc kasowitz planning use site counter damaging story legacy medium surrounding debacle washington post wrote article staffer hill angry john solomon blatantly obvious happening story  1  plant whitehouse  2  setting story hillary obama plotting ukraine  3  attempt deflect something big coming mueller report edit oh look latest opinion piece hill russia collusion fade ukrainian plot help clinton emerges  2 nd edit look another shocking coincidence  5 etfw surprising  3 rd edit finally shocking coincidence mueller report finished like speculated preparing story course guy usa government planted uranium one story thanks suspect list ambassador reasonable chance simply marie yovanovitch comment slow rate reform lack political push reform agenda would link mobile basically tore apart willingness ukrainian government engage execute good faith reform needed development surprised ukrainian justice official part group critical saying order defend locally trying portray corrupted prosecute translation people definitely absolutely investigated mean america bad guy start trump let kid fucking around smaller country year registered comment guy ukraine really sorry shit guess ag lying although do pursue u interest entitled certainly way subtle smell like typical ukrainian political fight reckless dimwit pushing kind bullshit without second thought actively trying cover corruption time case embezzlement government technical assistance worth  4  million dollar regard dialogue u ambassador telling justice official others country seen report allegation state department spokesperson told united state currently providing assistance prosecutor general office pgo previously attempt support fundamental justice sector reform including pgo aftermath  2014  revolution dignity political genuine reform successive prosecutor general proved lacking exercised fiduciary responsibility american taxpayer redirected assistance productive project good god said tried bribe would take actual fuck state department go suck egg evil bastard release list show u name got ta keep trumpmotels open list russian asset ukraine likely literally give detail supposed prosecuted actually inclined believe state department likely fabricated looking real life karma country late trump mueller already know everything manafort ukraine guy fucked everything got caught got sentenced sure singing like canary  puppet regime installed washington take order washington would thought lutsenko also said received fund amounting nearly  4  million embassy ukraine supposed allocate office saying situation actually rather strange pointing fact fund designated never received something tell going receiving u fund quite nice see trump administration exporting obstruction justice send list den haag let investigate lot ambassador must thought dealing republican senator lying going get poisoned sure meddling internal affair much list criminal useful u make public afraid cia also known list people need investigated show list shut deleted clinton podesta whatever evil jerk name r carrying putin mail know fellow texan would call u ambassador liking trump sometimes think republican actually believe bullshit sometimes standard u backed coup led obama co created another miserable colony sad kremlin control trump never end corruption good ol crooked hilary using channel mob behavior con revolting yet cult continues fall endless lie pathetic official clown never mind ukrainian politics joke politician 
beeo17,1555544212.0,european parliament voted wednesday fine firm like facebook google twitter  4  percent turnover persistently fail remove extremist content within one hour asked authority,Amamazing,99,11,csgo player gon na suffer deleted cool hope includes pro antifa similar terrorist group post right wing idiot undemocratic totalitarianism taking shape best tl dr could make original reduced  80  bot strasbroug european parliament voted wednesday fine firm like facebook google twitter  4  percent turnover persistently fail remove extremist content within one hour asked authority eu official moved regulate believe internet company enough voluntary measure even though first hour vital stemming viral spread online content company rely mix automated tool human moderator spot delete extremist content extended summary faq version tl drs far feedback  23 autotldr pm comment monitored constructive feedback welcome top keywords content  1  authority  2  new  3  company  4  parliament  5  response industry concern smaller platform resource comply speedily tougher eu rule lawmaker said authority take account size revenue company concerned draft measure call bloc national government put place tool identify extremist content appeal procedure rule would apply point notification national authority thats really tough timetable especially everyone facebook google even problem notification national authority mean get notified specific person person office vacation watching movie asleep assuming sitting desk ready go need first speak national authority figure whats going need call dept head brief even immediate meeting take bit organize find relevant people head department work lunch toilet airplane department head need briefed department head need brief subordinate people actually thing people front line need search stuff remove take time every step take time one hour lot time technology like enterprise computer ca order computer block content related x thats thats technology company work case smaller company wo support something happens  6 pm friday going get response limited effectiveness least noon monday smaller company staffing budget operate people waiting around chance eu call order remove thing hmmm censorship two edged sword beware slippery slope suppose donald trump fascist authority suprised want company install terrorism filter surely nifty artificial intelligence thing sort like copyrighted material one hour time limit arbitrary eu authority repeatedly claimed certain type social medium lead spike hate crime within first hour posted authority want limit exposure censoring post motivate dipshit something terrible europe pretty strict hate speech law making sure company provide service european citizen abide law seems pretty reasonable  4  high bad worked physical stuff bad think  1  hour enough tbh eu know much work eu putting boot neck freedom must tuesday 
bk74cn,1556881218.0,spain refuse hand venezuela opposition leader taking refuge embassy government envisage circumstance handing leopoldo lopez venezuelan authority asking leave ambassador residence spanish foreign ministry said statement,ManiaforBeatles,322,11,spain probably one important country maduro side yet heard juan guaido legally interim president long read venezuelan many journalist regularly write south america extremely biased qualm lie consider anthony faiola mariana today washington post rally wednesday next miraflores presidential palace drew  500  people far fewer multiple rally thousand people supporting watch drone clip described rally venezuela coup failure necessitates new policy bolton stache pushing war good job spain guaido legitimate u jail call want attempted regime change putsch soft military supported call constitutional opposition strategy based article  233  constitution grant national assembly power declare president abandonment office course kicker maduro done anything sort supreme court disqualify sitting president despite cry dictatorship opposition win last election assembly late  2015  using platform try overthrow maduro assembly insisted seating legislator charged election fraud supreme court declared legislature contempt since seen standoff legislature judiciary break deadlock maduro called election national constituent assembly article  348  constitution empowers opposition boycotted election citing unfair electoral condition handed victory chavismo maduro reelection last year refused participate despite brazenly unconstitutional power grab government across latin america beyond recognized legitimate leader venezuela x 200 b run office hardly bitch winning election almost sure seen photo exactly like portrait sale well well well coup failed people listen want maduro president little chicken hide embassy next step come get seat corrupted party pp like father time type immigrant worry new leader venezuelan right far right juan recently elected president counterrevolutionary national assembly proclaimed president called supporter take street force fall maduro government immediately reactionary government latin america world jair bolsonaro brazil donald trump usa head recognized venezuela legitimate main difference coup compared perpetrated u led anti socialist force  2002  parasitic corrupt reactionary venezuelan right managing mobilize young university student professional small owner belonging middle class lie distortion cooked washington think tank happened violent guarimba caused  100  death march july  2017  occasion significant sector youth unemployed even worker desperate economic situation brutal price increase caused washington forced sanction marching poor neighborhood called onto street right extreme right first task working class politically conscious combative people venezuela organize resistance washington led coup must begin denouncing true objective right wing imperialism organize assembly company place work discus need demand economic plan policy right mean mortal danger urgent create action committee defense right worker people work center neighborhood defending genuinely socialist class program proposes expropriation big u private monopoly banking end u sanction caused hyperinflation corruption abolition destruction privilege proposed u led right wing bureaucracy needed socialist government strives transfer real power hand working class oppressed must organize massive mobilization legitimate people violence right time lose massive resistance must waged blow reaction u led imperialism mass mobilization raising revolutionary socialist internationalist program people working class whole world beginning latin america duty reject bloodbath u led capitalist coup international mentor preparing working people save people opposition leader stop bunch armed militia attempt coup storm military base disregard nation sovereignty disgusting got skateboard eh  5  buck say maduro idiot raid embassy ecuadoran said assange wait 
