id,time,title,author,score,num_comments,text
dafgwb,1569674426.0,boris johnson could forced uk prime minister next week,,8650,133,damn tenure pm messier hair good start borris would fitting end worry vitriolic backlash brexit death section society long cummings go one person say may chance vote confidence lol doubt boris crash burn even harder already crashed burned one person said chance x happen chance happening may lead resigning really news teresa may rest knowing remembered worst prime minister ever exist shortest serving pm lol bojo fucking clown many mooch would many scaramuccis one boris imagine trump going week would glorious day planet bet fucking care madlad ca believe got far drop responsibility everything soon someone competent show like piggy boy took cry saw naval officer beach except boris wo cry smile get pm wo work indian happening uk simultaneously entertaining pitiful removed good finish boris heard antonio brown still looking job going happen even conservative hate johnson would prefer corbyn confidence vote work opposition would get onboard plus liberal democrat keen idea corbyn either read stuff like foreign press wonder much stuff press get wrong country dicker need get forced barber boris donnie need voted island could pretty quickly assorted anti johnson coalition could agree temporary prime minister jo swinson latest one silly thing time natural working majority nothing fear jeremy corbyn know worried bottom line parliament trust boris johnson drawn account prepared risk lending happen liberal democrat various mp vote corbyn pm labour plus snp still le mp conservative hugely unlikely lib dems vote corbyn would really hurt electorally next general election many mp left party hate corbyn seriously unlikely compromise figurehead like ken clarke might work lib dems corbyn previously stated labour would vote anyone state play since conservative party kicked  21  mp start month odd cnn reporting news think look tired remainer mp give people another referendum correct first result like remainer mp later nooooo let election constituency hate u funny idiot taking mick win vote confidence believe set reminder post  10  day believing much slander medium problem even nobojo conservative turned would rather keep give corbyn win deleted like trump impeached soon per source like  10  shit article daily god much rejoice good news force motherfucker disgrace well quick quite obvious get go wanted pm long completely messed quickly fucking hell article spends time ragging corbyn johnson know guy title talk guy found acting government calling unusually long proroguation guy seeing tory mp leave party every week guy continues threaten break law established parliament must ask extension eu deal made reading think corbyn incompetant labour leader century rather opposition leader blocked government legislation history going happen remainer parliament want election soft control nation minute ge risky end tory majority possible hope holding breath would love see sanity take place country set example big brother well ca wait see comment week let see age wait tory fuck get power fair u live horrendous mistake  3  year yay take note america fuck fast forced pm role turn green like hulk claim turd discount trump good riddance fascist little twit twist send back sandbox trump damn britain taking page outta australia book move onto next one piss boris wait could happen nicer guy spaffed wall spaffed wall spaffed johnson spaffed wall seriously libdems perhaps uk party really playing party politics national interest know corbyn ai perfect week really bad world news speculation happened yet news next week man might sandwich maybe next week wait see america worked quick three year still orange monster ruining shit man guy really clue going end year boris pm pass thing affect brexit deadline god real like genie granted wish wanted prime minister everybody would remember well go going happen least week remain party declined general election want assurance article  50  wo enacted despite fact voted vote confidence next week would lead dissolution parliament general election remainer party wanted general election could accepted offer boris gave wo accept know vote hugely split snp labour green competition conservative come brexit party pretty quiet recently might even compete given right assurance reason could see taking poor gamble general election truly think boris either wo ask extension per benn act know boris loophole avoid together headline like considered terroristic pretty rough month authoritarian nationalist sack deleted american hope follow suit think corrupt domino fall fall fast hard turning record speed stop brexit please world slowest train wreck unbearable watch uneducated uk election process matter elected people via democracy voting apparently zero understanding england parliment work vote pm appointed couple pm past year everybody seems hate like people bother voting bunch yokel got stuck shall named us hair narcissist fetish man sick see take trump ok brit much better give hope wait didnt corbyn also promise new referendum misread cameron resigned may resigned whole snap election nonsense johnson forced possibly american guy okay good riddance bojo boris jerry happening quickly bit shocking watch many mooch would lib dems wo support largely pointless hahaha suck boris personal brexit number mooch last make many mooch read would forced uk wondered sith lord time go bed borxit sick tory almost  1  leadership contest per year good finish boris ousting delay wrong reason reading lib dems unsure corbyn pm interim pm get hope people stranger thing happened though like boris becoming pm good start room one unkempt blond moron national government want gone u brazil uk like everyone competing see bigger mess hair good start middle end boris maybe trump go time shipped back russia engage  3  way golden shower putin hopefully spark backlash old etonian hope going pm like chelsea go manager look like tide finally turning ragnarok nationalist fascist trump johnson brother another mother love see man british politics weird would kick leader country removing office boris johnson look like flatnose inkheart gotten author fix beak anyway really save uk point political system politician shown mess internationally burnt many bridge good solution mess created last year good god hope yes please let loose  2  malevolent wind bag johnson trump great start boris maybe become measurement time like scaramucci wait see uk ability course correct sooner  4  year bit jealous yes want wake news scumbag deserves shamed remaining lifetime point winston churchill would make better prime minister removed please another fucking conservative toff asshole please messy combover fook guy many mooch work yes please awesome hope thrown politics good need caretaker pm late summer love wait wrong shit storm sandwich randy brit always trying one u yank lol daily mail say legitimate prime minister year fuckem pm leaf party someone else team give giggsy till end season anybody calculator lazy many scaramuchis hell idea come another delay possible real effort made produce working solution backstop delay trump gon na hurry want keep one uping sound hopeful realistic hope rid soon boris waste time opposition accept corbyn clear path extension followed election basically political agenda besides given fptp hope prominent former conservative deselected still run independent split conservative vote hair jesus h force election instead coalition horse hockey democractic labour want people vote lose thats everything general election want people vote 
df6mi0,1570570172.0,white house say comply impeachment inquiry,hookemflip,43661,50,understand american history supposed point claim crook go aroooo something nixon failed give stuff looking would suck reading thing last day reminded something lawyer said might right power said reference situation nonprofit board director member board trying oust founder started nonprofit venture imho bullshit petty reason based personal drama anyway legally right founder also employee key control daily function turned power locked building board member left  2  option either spend next several month long protracted legal battle possibly losing nonprofit back intention force backed seem see trump thing legally thin ice best standing basically saying going betting house wo energy follow power trump legal right end stance might work well contractor hired paid woman claimed sexual abuse etc think underestimate torque congressional machine house need start exercising inherent contempt power arrest jail everyone wo testify get subpoena get subpoena everybody get subpoena obstruction trump  5 th see right deleted house begun impeachment hearing regarding obstruction justice impeachment inquiry please democrat please trump ran president get tv sell shit didnt think would actually win fucked good lord much longer senate republican support surely must see badly going end mean alienating country population refusing comply rule law really seems trump prepared set u legal system fire save ca tell long senate willing support one hope house lead u back sanity order organize protest guy least country call perfect hear anything else people blew whistle murdered sooner die provide evidence testimony forget perfect continues tell self via television bad move trump put republican senator terrible position also inquiry pretty popular flat refusing comply pretty dumb make look much like something hide toeing line outright coup terrifying clear cut obstruction subpoena time everyone avoid see cell something like ask lot day would republican reaction obama x start arresting people see many wh official suddenly start working congress check balance working well u innocent people case anyone wondering constitutional crisis look like know really crazy least second time admitted would willingly obstruct justice one actually anything useful even fathom solution somehow live fantasy land dipshit say something everyone appeases continually get away blow mind action innocent person deleted ca wait trump term hear something else going kinda stupid as shit removed imagine look rest world let pretend second trump track record backing deal screwing ally exist world leader seeing man completely ignore sacred document exists country absolute rule law fact ignore defy alone would make leader hesitate consider u reliable man respect principal law country sworn uphold hell expect honor anything say law principal damn disaster feeling implication alone decade come legal cool oh shock ground impeachment deleted cant wait watching documentary panning crowd trump supporter red hat shown giant text come across screen titled trump america biggest mistake political expert please educate read republican congress changed house rule vote necessary impeachment inquiry true blatant obstruction evidence trump administration anything trump stay jail house  60  america v coalition stupid work matter white house complies would process rely cooperation expected white house would cooperate impeachment administration literally got banned saying look innocent comply inquiry snowflake eh since honestly know going ask happens president entire executive branch basically say fuck going anywhere u accept new emperor recourse  6  day ago always cooperate surprising sick constant lying bullshit everyone right either directly indirectly via support enabling nixon smart enough resign copying post tl dr entire argument bullshit read find tl dr part least ok think people missing completely insane letter checking ome source source absolutely white house think let go key one argument want focus footnote  8   9  kind entire crux white house argument president get due process proceeding say relevant paragraph committee inquity also suffers separate fatal defect despite speaker pelosi commitment treat president fairness  6  committee established procedure affording president even basic protection demanded due process constitution fundamental fairness chairman nadler house judiciary committee expressly acknowledged least president member party power impeachment demand rigorous level due process context due process mean right informed law charge right confront witness call witness assistance counsel  7  procedure abandoned due process right matter discretion committee dispense contrary constitutional requirement supreme court recognized due process protection apply congressional indeed recognized due process clause applies impeachment precedent right witness call witness present evidence date back nearly  150  yet committee decided deny president elementary right protection form basis american justice system protected constitution treated unfairly ok lot bullshit unpack let start citation  8  see watkinsv united state  354   1957  quinnv united state  349   1955  watkins u  354  case brought supreme court man convicted contempt congress specifically petitioner convicted violation  2   192  make misdemeanor person summoned witness either house congress committee thereof refuse answer question pertinent question inquiry basically refused answer question congressional hearing felt outside scope brought committee discus say example brought congress testify specific crime may witnessed start asking ate breakfast requirement answer question supreme court case ruled whole bunch stuff going itemize thing think relevant current situation  1  power congress conduct investigation inherent legislative process broad unlimited  2  congress general authority expose private affair individual without justification term function congress  3  inquiry end must related furtherance legitimate task congress  4  bill right applicable congressional investigation form governmental action  5  congressional investigation individual affair invalid unrelated legislative purpose beyond power conferred upon congress constitution  6  simply assumed every congressional investigation justified public need overbalances private right affected since would abdicate responsibility placed constitution upon judiciary insure congress unjustifiably encroach upon individual right privacy abridge liberty speech press religion assembly  7  congressional investigating committee restricted mission delegated acquire certain data used house senate coping problem fall within legislative sphere witness compelled make disclosure matter outside area  8  unless subject matter inquiry made appear undisputable clarity duty investigative body upon objection witness ground pertinency state record subject inquiry time manner propounded question pertinent thereto okay lot ruling basically congress conducting inquiry must related thing congress legislative power inquiry whether bob marley smoked blunt one time congress legislative reason investigate congress call witness inquiry need make clear going asking witness would courtroom also reveal private affair citizen front congress unless specifically legitimate function congress ask testify whether soup breakfast relevant function congress witness asks clarification must provided remember come back later also cite another case quinn united state  349   155  similar case three people summoned congressional committee one used first amendment fifth amendment refuse answer whether member communist party guy bringing case court quinn asked question responded way convicted contempt congress court held conviction overturned specifically invoked fifth amendment therefore protected constitution second citation want discus  9  relevant text indeed recognized due process clause applies impeachment citation see hastings united stales  802  supp  490   504   1992  vacated ground hastings united state  988   1280  cir  1993  first thing first right fucking citation white house openly admits ruling longer valid vacated literally right vacated ground hastings united state  988   1280  cir  1993  come back point ruling vacated one actually incredibly damning white house argument let look case said hastings united stales  802  supp  490   504  supreme court ruling need stated right justicia link entire ruling summarize case brought judge alcee hastings impeached federal district court  1989  remove senate important thing ruling court removed charge regular court previously acquitted judge case ruled impeachment decision justiceable court also argued fundamental constitutional concept due process also demand impeachment tried full senate particular case tried senatorial committee full senate valid case actually cited case white house cite letter quote ruling essential element constitutional system check balance impeachment must invoked carried solemn respect scrupulous attention fairness fairness due process must watchword whenever branch united state government conduct trial whether criminal case civil case case impeachment court hold trial senate mean full senate committee senate merit plaintiff claim  1  constitution requires senate provide sufficient financial support guarantee impeached judge effective assistance counsel  2  double jeopardy barred impeachment  3  laches also barred impeachment charged five year acquittal jury seven year alleged receipt bribe took place finally plaintiff claim denied impeachment trial constitution requires evidence heard committee twelve senator rather entire body senate defendant dispute claim court dismiss first three claim continued politically trump isnt giving cover gop member senate know cooperation reveal really bad there also fact petulant as counting scaring shit gop member senate wrath dare defy hollow threat cause gop member lose primary red state problem strategy wont work gop member senate  20  gop member need vote convict right impossible however say richard shelby alabama running reelection decides enough might give cover going take guy like romney collins utterly sad situation sorry judge agree  10  year sentence manslaughter going home play world warcraft treason profoundly disturbing got ta love hypocrite right fuck harsh rule draconian punishment everyone else never seem want follow rule procedure affect removed subpoena followed contempt court jail time everyone show 
dfq3yg,1570667344.0,u gaming firm blizzard win support chinese user punishing esports player support hk riot,,144,18,blizzard made bed must lie enjoy commie friend blizzard hope worth many thousand cancelled account boycott blizzard free hong kong blizzard gang bang porn suck multiple dick chosen dick chosen poorly boycott blizzard jesus christ someone tell blizzard chinese brand shit insane psyched wow classic guess boycott doesnt mean much unless hurt goodbye forever blizzard pretty funny mention many westerner unsubscribed cancelled account blizzard disabled account option best tl dr could make original reduced  77  bot quot stand one  039  right express individual thought opinion player participant elect participate esports competition must abide official competition rule quot read statement issued blizzard blizzard  039  penalty kong government player highly praised chinese social medium platform saying u firm made quot right decision quot let chinese esports player quot world difference nba showed western arrogance double standard treated chinese blizzard respected sentiment chinese people china  039  territorial integrity quot liu dingding industry analyst told global time extended summary faq version tl drs far feedback  23 autotldr pm comment monitored constructive feedback welcome top keywords blizzard  1  chinese  2  player  3  blitzchung  4  competition  5  oh yea chinese blood money like blizzard make better game u hey diablo  4  forget add tibet uyghur hong kong people new enemy boycott blizzard universal value v money pick side blizzard say blizzard money people think obvious oh mighty fallen blizzard disappointment fuck would user people jail forced mine game token etc sure completely free express unbiased opinion move headquarters china fit culture perfectly fuck shit love old blizzard wtf man maybe keep playing starcraft  1  bring revenue want get fix shit whole world stand united tyranny china fuck xitler jin pooh like post get social credit score someone make post cover everything bring front reddit horrible writer loose american continue buying blizzard product blizzard announce new game unless controlled stick insert arse everyone 
dgrqe1,1570863740.0,google funding climate change denialism,ilivedownyourroad,3176,25,sponsor organization across political spectrum advocate strong technology policy google spokesperson told earther extremely clear google sponsorship mean endorse organization entire may disagree strongly issue position climate change similarly clear since  2007  operated carbon neutral company second year row reached  100  renewable energy global like lobbyism know long fuck u making money give shit moral evil company actively trying kill u organization funding sort thing basically two kind defense business people democracy libertarian course latter pretty much version former engage climate change denial since inconvenient problem business philosophy libertarianism look document funding something like  300  different lobbying organization including identity politics lobbying advertisement lobbying libertarian lobbying sustainability lobbying forth  google realizes facebook twitter figured money conflict profit polarization life google cancel google account use duckduckgo  dear liberal rich corporation friend fuck google left year ago firefox duckduckgo ftw google facebook machine designed broadcast advertising biased information fake news realm care truth ethic news anyone us google service finding suggest start educating google tech giant business stand lose world changing betterment humanity foogle yoogle google apple removed app china upvotes outrage google fund climate change denialism  2 k upvotes reddit always focusing stuff matter creepy company creepy thing evil big enough get away new google motto use ecosia one reason engine search plant tree every  45  look legit glad use nothing google edit shit realised use chrome macbook safari terrible use search engine ecosia search engine help plant tree course clue much power single google datacenter suck investment renewables entirely saving benefit well start wonder hurt upcoming sale stadium even climate change propaganda guar wait gizmodo report guardian published friday revealed tech company contributing dozen organization questioned need action pushed back climate regulation legislation lol go ogle removed 
do31p9,1572230804.0,erdogan indicted war crime investigator,feelthepress,134,5,beep boop bot look like op posted google amp link google amp page often load faster amp major threat open web privacy might want visit normal page instead mention summon load crap sure indict war crime well bush trump netanyahu blair hypocrite international law selective erdogan angel compared would love see behind bar really let take trip back week ago putin birthday trump unconditionally handed northern syria turkey silver platter statement today president donald trump spoke president recep tayyip erdogan turkey telephone turkey soon moving forward operation northern syria united state armed force support involved operation united state force defeated isi territorial caliphate longer immediate area united state government pressed france germany european nation many captured isi fighter came take back want refused united state hold could many year great cost united state taxpayer turkey responsible isi fighter area captured past two year wake defeat territorial caliphate united state note anyone donald trump written second paragraph conveniently ex investigator user often report submission site ask u ban sensationalized article oppose blanket banning news source reader responsibility skeptical check source comment flaw help improve thread linking medium verifies question article claim link could help reader better understand issue find evidence article title false misleading contact moderator review bot action performed automatically please contact moderator subreddit question concern 
