id,time,title,author,score,num_comments,text
agwlv2,1547722419.0,new project us technology track movement food supply chain aim inform consumer whether item fish buy restaurant produced legally sustainably,ManiaforBeatles,325,17,sound like nice idea wonder people willing give favorite restaurant burger place whatever find eat snuff maybe legal fish died purple something haha best tl dr could make original reduced  73  bot new project us technology track movement food supply chain aim inform consumer whether item fish buy restaurant produced legally sustainably new venture called opensc us product qr code consumer scan smartphone automatically display information product caught produced journey supply chain looked like even carbon mile temperature stored work business dealing product seafood must make choice attach digital tag point catch point production link product blockchain platform extended summary faq version tl drs far feedback  23 autotldr pm comment monitored constructive feedback welcome top keywords product  1  consumer  2  fish  3  track  4  opensc  5   could track illegal fish could never even end retail shelf consumer need involved buying fish know saturated microplastics ocean toxin river ai worth absolutely love eventually somebody going end good place happens people discover certain unsustainable source taste way better could potentially become tool greed rather good doubt always remember nice may appear humanity trash evidenced well look around sound like use blockchain blockchain ftw hell buy fish wow  2019  article blockchain application strictly blockchain blockchain blockchain crypto blockchain invest bitcoin blockchain cool let secret good price buy people interested saving money luxury picking food buy based sustainably grown one care like restaurant put many calorie meal menu inform u fish fish plain dont tell u nongmo created lab cause real info want consumer really care made legally illegally want know taste delicious 
aslf13,1550647282.0,nasa happily report earth greener tree  20  year thanks china india,,9265,85,dude india made life mission plant like ridiculous amount tree single person backing people also pay attention rapid deforestation amazon roll honour top  10  country edit china billion india billion ethiopia billion pakistan  1  billion known billion tree tsunami  12  mexico  789  million france  723  million turkey  716  million peru  646  million nigeria  626  million kenya  542  million egypt  500  million united state  315  million keep good work read somewhere china trying reduce desertification annual dust storm planting tree good luck best tl dr could make original reduced  85  bot world literally greener place  20  year ago data nasa satellite revealed counterintuitive source much new foliage china india quot china india account greening contain  9  planet  039  land area covered vegetation surprising finding considering general notion land degradation populous country overexploitation quot said chi chen department earth environment boston university lead author study land area used grow crop square mile comparable china india changed much since early  2000 s yet region greatly increased annual total green leaf area food production extended summary faq version tl drs far feedback  23 autotldr pm comment monitored constructive feedback welcome top keywords green  1  india  2  china  3  earth  4  data  5  make tree planting olympic sport country compete plant tree shout pronhub planting one tree every hundred video watched genius tagline pornhub give world morning wood happy india planting tree lot people taken tree planting heart including popular actor often tell people plant tree birthday delhi court recently told guilty defendant plant tree reptence planted tree last weekend serious question globe warming open huge swath land become treed forest deleted brazil hold beer west pulling weight need vote lobbyist office replace something green jill stein read back initial estimate tree earth almost three trillion excited read actually many tree earth initial mapping revealed continued read still way reaching number global number tree fallen approximately  46  since start human civilization x 200 b x 200 b added deleted thank china india lmao wonder thread gon turn india location lost considerable tree cover last  20  year hopefully turn around first good news read long time live netherlands would love question plant land private afraid somebody pull good news superb work country anyone else encounter meme say something along line tree gave free wifi planting like crazy bad provide oxygen breath bring next time someone tell part fight climate change pointless china exists deleted pornhub helping bet considering rate global warming occurring going get lot greener lot faster interestingly also increase co 2  output coming misleading greenery co 2  atmosphere industrial production put carbon dioxide atmosphere resulting growing plant population time climate change make possible plant grow place covered permafrost himalayan mountain lie country rise green paradoxically sign world green enough  2016  report nasa technically whole solar system got greener mean tree mar titan brazil groot israel look yatir forest negev  5  million tree planted effectively reclaimed part desert amazing see person along drip irrigation greenhouse feel many forget fact china much science based nation may using large quantity coal oil energy profit plastic yet understand long term solution look investment green energy solar farm desert article also prof also nation likely feel forced use coal oil switch technology deleted mixed feeling indian one hand people planting tree another answer deforestation experienced degradation biodiversity human afforestation tends substitute sustaining forest world may green far fewer habitat wildlife today  20  year ago tree planted important question tell whether truly benefitting degraded wildlife enough possible earth become greener even lifeforms grow deader except actual article based point greenification india largely due irrigation farmland actually harmful environment increased fertilizer insecticide pesticide runoff good news everyone europe also part maybe area might significative forestation increasing year year way go might giving start china india saving world wait baddie wait mean whole reverse damage next  20  year late save earth thing averted mean stronger hue green planet think ever seen good environmental news much tree stopping global warming way going work every tree plant replaces human even guess one propagate faster oh good climate change sorted nothing worry awesome next north american west drier part becoming desert nevada utah foothill like area need tree also thanks part increased co 2  level green breathes wow got as kicked thinking johnny appleseed tall tale yeesh yall harsh europe steadily becoming greener century pretty good pakistan well alot country awhile africa pakistan come mind waiting western country something operation plant tree easy nasa let forget u inspired forestry multitude factory built company china make cheap good avoid pesky health hazardous material safety regulatory malarkey tree earth star milky way galaxy true great news enough would argue still deforesting vast swathe amazon africa indonesian archipelago least something reforest unproductive area taken together greening planet last two decade represents increase leaf area plant tree equivalent area covered amazon rainforest two million square mile extra green leaf area per year compared early  2000 s amount  5  increase think india greening come agriculture actually really bad nation water resource actually bad news least removed known tree get planted monoculture mixed forest taking account  80  trash ocean come asia well good definitely forest europe  20  year ago really badly written article scot trying reforest land burning coal le wood energy finally replanting year deforestation environmental abuse offset damage loss natural vegetation tropical region brazil indonesia shame china still destroying many forest deleted article wrong according something heard npr day true satellite report seeing green necessarily tree place like india largely due industrial farming impact forest tree approve good news demand didnt release bunch photo showing impact global warming deforestation problem greener wait tree planted india actually grow die sapling feel like china india playing long game climate changing going tree awesome yall could slow whole dumping trash ocean thing great worry westerner still need pay carbon tax anybody checked nasa fair coming low base stripped land year ago undergoing reforestation still positive china india also two largest polluter u europe protected forest need increase forest space xx get back forest  100  year ago china india lower  20  forest u  33  big freakin difference well two country responsible much pollution least shame west world wealth reason majority climate deterioration india china wealth could done much world done nothing chaos deleted tree forest well good china india responsible reforestation also two rapidly growing dirtiest fossil fuel economy misleading almost ca believe nasa lost respect honestly telling  20  year cutting rainforest growing population china india overpopulation tree earth greener even author research actual press release said x 200 b beneficial aspect co 2  fertilization promoting plant growth used contrarian notably lord ridley hereditary peer house lord rupert murdoch owner several news outlet argue cut carbon emission mitigate climate change similar agreed  21 st conference party cop meeting paris last year framework climate change unfccc fallacy contrarian argument first many negative aspect climate change namely global warming rising sea level melting glacier sea ice severe tropical storm etc acknowledged second study shown plant acclimatize adjust rising co 2  concentration fertilization effect diminishes time say coauthor philippe ciais associate director laboratory climate environmental science france contributing lead author carbon chapter recent ipcc assessment report x 200 b left important factor tried diminish fact green growing place like north white source x 200 b yet still worst pollution 
asxqjs,1550717514.0, 40  american chinese tourist taken hostage venezuelan colombian gang peru,,554,40, 5  country  1  title nice job lol f cked supplier consumer good luck one way get two powerful nation intervene country robbery hotel gift shop one worker killed see hotel blog scroll english tourist invovled happened stay specific hotel x 200 b x 200 b well madlibs headline ever read one sound like opening movie joint task force elite special force must overcome cultural difference work together free vip hostage clutch ruthless south american drug cartel staring someone slightly overused like matt damon handful chinese actor american would know might recognize big movie rip tour guide horrible situation hope safety ca find article noob spanish language report canal 21  reputable organisation nothing venezuelan colombian unsurprising madre de dios inaccessible far south peru police arrested brazilian jail breaker may may involved un grupo de delincuentes taken forty hostage amongst american chinese recent post focus detail peruvian guide attack hotel owner last ten hour denied hostage gang broke shop store stole mostly food communication madre de dios poor away puerto maldonaldo jungle full informal gold miner spreading mercury contamination shooting bolivian coca also region wild south east speak right bias medium source moderately strongly biased toward conservative cause story selection political affiliation may utilize strong loaded word wording attempt influence audience using appeal emotion stereotype publish misleading report omit reporting information may damage conservative cause source category may untrustworthy daily express factual reporting mixed site reporting user often report submission site ask u ban sensationalized article oppose blanket banning news source reader responsibility skeptical check source comment flaw help improve thread linking medium verifies question article claim link could help reader better understand issue find evidence article title false misleading contact moderator review bot action performed automatically please contact moderator subreddit question concern one reading peru god awful article oh express course headline rubbish article tell absolutely nothing value peru horror  40  american chinese tourist taken hostage venezuelan colombian gang two people killed following kidnapping  40  american chinese tourist peru venezuelan colombian gang gang kidnapped tourist amazon reserve inkaterra madre de dios region peru regional governor madre de dios luis hidalgo okimura confirmed kidnapping happened last night tuesday february  19  around  9 pm governor described worrying situation one victim named local newspaper la republica leon humani local guide mr okimura said regret death dear person area tourist lodge forced flee mountain due situation inkaterra lodge  35  wooden cabana remote area amazon question political extortion demand many u many chinese anyone else venezuelan colombian gang yeah help much worrying situation yeah shit like  5  word article able scroll blank page irrelevant article posted side equivalent length  4  page journalism big brain let kidnap several dozen citizen world two powerful wealthiest nation hope brutal mexican kidnapper took hostage left wing guerilla paramilitary oh right absolute shite downvoting story get picked le sketchy source contains specific would huge deal true make sense would widely circulated gang location side peru yet shit tier agency reporting doubt another example fake news propaganda could find news went research spanish specifically peru guess something close article location approx number local woman rescued sex trafficking zero american chinese fake propaganda uk interesting article spanish talking madre de dios fueron rescatadas  44  de trata de persona en la pampa cant imagine anything terrifying u china joint terrorism task force hunting jungle maybe israeli iranian joint task force would pretty scary one country technical know experience global reach nonsense shoot kill take prisoner end justify mean approach ca help think would make great buddy movie like one american gun smuggler one chinese guy official prc tech thief know kung fu team kick as cocaine fueled bloodbath look like beheading video going available soon situation dude smart gang never target super power least ecuador involved convenient sound like rush hour plot plot new rush hour movie justification invade venuzwayla end wrong country getting payment hostage getting released wrong country fake sorry bad english live part peru yes real city taken gang local international brasil venezuela colombia people ask venezuelan many people come venezuela crossing brasil preffer live peru corruption easiest way live goverment dont ask visa police doc colombian came give loan charge high interest suspected venezuelan people didnt got job tracking luxury hotel robbery street puerto maldonado far town police corrupt city dangerous illegal mining inmigration saludos desde reason launch right afraid humanity right whoever took hostage good dead u delta chinese sof probably already scene making plan time make meme saying knew fucked boom never leave home translation local rounded group foreign intelligence service go reason invade note self stay fuck south america perfect  5000  marine stationed somewhere colombia could come handy rescue hostage toppling maduro democratically elected government order install somebody nobody voted would guarantee handing venezuela oil u corporation sometimes convenient pretext fall sky 
bcy5t8,1555208116.0,bacteria discovered bottom mariana trench,Khaleeasi24,8235,83,thought article well written take unnecessary liberty like discussing possible implication cleaning future oil spill feel like article lacking information beyond initial discovery though hope future research really tell u whether discovery really make global impact another one discovered every year never heard specifically let call ford cause mine eats oil sweat saudi arabian really mystery bacteria evolved specialized enzyme designed digest oil allow eat food source amazingly hungry oil scientist shocked observe  10  year ago million barrel oil spilled gulf mexico deepwater horizon disaster eaten thing one interesting theory scientist currently looking possibility descendant ancient bacteria buried sediment many million year ago continued live million year deep inside earth inside petroleum sediment adapted evolution live hydrocarbon particular theory go hypothesize bacteria brought surface earth oil drilling somewhere entered ocean oil spill sometime last century theory hold could give hope idea ancient bacteria might still clinging life deep underground planet mar well silly bacteria oil float top water united state announces plan eradicate planet find cameronium inevitable would find life found water sample taken without contamination mile sea intrigued article mentioning organism producing hydrocarbon common conception oil methane result organism dying billion year ago undergoing geological change organism alive active producing hydrocarbon seems like quite lot discovery happening lately seen headline post least  5  sub last day almost like someone want give impression worry oil climate change look solution already reality game changer climate change need stop presenting understand article go detail could utilized kinda problem headline game changing bacteria eats away oil one largest factor climate change common assumption huh guess climate change issue huge deal thought look like already found way deal reality idea could utilized aid repair planet still f cked un submitted report time place futuristic theory however serious problem right solution could enacted today take action current factor got u mess first place article oil prepares invasion article abort invasion faster say kwyjibo got ta wonder weird shit lurking know know much chemistry maybe someone knowledgeable could fill bacteria eats oil mean could eat plastic bacteria everything basis clive cussler novel wonder byproduct may know bacteries also live asphalt road eat existence bacteria really old news like  50  year maybe older hype finding bacteria place thought year two ago also found bacteria floating trash island literally breaking eating plastic know bacteria used produce  3 d printable biodegradable plastic know one news american scientist begun research new bacteria killer designed deep oceanic condition gulf mexico also water ca dump ton gallon oil fine eat slowly take year animal die meantime contaminated water would shit energy reminds zodiac neil stevenson someone explain surface oil pollution sank oil much lighter water especially salt water hearing miracle story change eat oil plastic year oil executive eating bacteria found yet dislike part called bps oil spill  2010  natural disaster man made disaster could prevented cut corner put bacteria world oil supply let card fall may united state would like know location megalodon sample taken without contamination mile sea blow mind mother nature adapt change depending going around world george carlin put really well earth care u scarily true change make really hurting future generation million year earth figured regardless life uhh find way leave new headline read oil eating bacteria discovered deep ocean trench used clean oil spill also resistant antibacterial method destroying rubber treees ruining oil store worldwide modern society know doomed chemosynthetic apple get wallpaper begin found human looking meg big shell floated yeah never go wrong taking bacteria somewhere spreading face earth wonderful news great potential hope exhaustive test could go wrong though elon musk try hurray iphone wallpaper fat eating bacteria please donald duck already explored concequences oil eating bacteria end well america nuke mariana trench would hydrocarbon surface pollution sink level hydrocarbon heavier water look cousin plastic eating one hungry politician wait till find marker figure use gulf mexico hope unintended consequence anyone actually believe shit america new terrorist organization formed prepare trench warfare try use clean oil spill accidentally alter consumes world supply plunge u decade darkness return wwii level society release world oil reserve restore climate  100  renewable energy black monday upon u botryococcus braunii ozuma even bacteria american interesting bring top mount everest produce free oil america greatly disliked usa believe bacteria bottom mariana trench hiding weapon mass destruction given united state know yet another extinct specie directive  51  john barnes anyone leftover last batch daybreak  200  year ago look like iphone background bottom toilet year let bacteria taste human flesh ca wait scientist go missing u declaring war bacteria zombie two step away go neature found right next global warming eating bacteria checkmate environmentalist thats gon na take highly witted businessman convince settle oil field america producing antibiotic soon enough got take waste oil dump mariana trench problem solved know mariana trench lady oil company probably going suicided protect bottom leader dcrg since micronation territory  1 cm squared bottom mariana trench bacteria usa army exterminate specie lol usa sweat profusely life uh find way matter time u put load anibiotics water republican hold beer call oil drilling lobbyist somehow use destroy saudi oil field asking friend 
beqm53,1555620914.0,chairman nadler statement redacted mueller report even incomplete form mueller report outline disturbing evidence president trump engaged obstruction justice,EnoughPM2020,379,10,statement full today house judiciary committee chairman jerrold nadler released statement initial reaction redacted version special counsel mueller report even incomplete form mueller report outline disturbing evidence president trump engaged obstruction justice misconduct report concluded substantial evidence president trump attempted prevent investigation campaign conduct contrary attorney general statement morning white house fully cooperated investigation report make clear president refused interviewed special counsel refused provide written answer question associate destroyed evidence relevant russia investigation special counsel determined would make traditional charging decision part department justice policy sitting president could indicted rather special counsel office conducted incredibly thorough investigation order preserve evidence future investigator special counsel made clear exonerate president responsibility fall congress hold president accountable action today past week attorney general barr appears shown unsettling willingness undermine department order protect president trump redacted report directly contradicts several statement made press conference earlier today example special counsel concluded thorough fbi investigation would uncover fact campaign president personally president could understood crime would risen personal political barr excluded critical finding version event attorney general decision withhold full report congress regrettable longer surprising willing release evidence clearly damaging president imagine remains hidden view barr far refused work committee provide u information customarily provided past entitled concern many others addressed barr testifies committee may  2 nd additionally formally requested special counsel mueller testify committee may  23 rd contrary public report heard department receiving version report congress requires material order perform responsibility issue subpoena full report underlying material continue prepared make every effort work attorney general find solution allows congress review entire merely fragment chose share u today gon na nothing like nothing cheney bush refused testify separately commission overt display impervious highest office actual justice way trump friend said show thing going produce majority vote agreement deleted salt people care deleted log thrown 
c2ew9p,1560936392.0,china forcefully harvest organ detainee tribunal concludes,spacelordmofo,165,8,diagrace world turning blind eye really exaggeration compare china dystopian society  1984  china world news like watching black mirror would last two second prop keeping amidst b surprised communist harm others greater good still believe regardless evidence contrary maybe great leap forward admirable asshole mean million people starved death due collectivisation another million people executed tortured death state pretty soon  50  cent army show say proof falun gong say money say criminal death row yet statistical analysis prof china harvesting organ keep program secret reason money power  hong kong business settled predict market flush available organ tribunal bullshit click link article organization activist china trafficking organ chose likeminded people play judge real judge defendant present defense cross examine witness like chinese government chose tribunal decide whether control tibet legal saying china saying kangaroo court ruling make likely criminal mercy second chance 
