id,time,title,author,score,num_comments,text
aesfto,1547186848.0,saudi arabia jerry seinfeld activist partner disappear,highpitched,312,19,comedian known jerry seinfeld homeland groundbreaking activist pushed woman right drive nobody seems know happened saudi arabian celebrity power couple comic fahad used shoulder biggest hollywood star partner loujain close friend meghan markle pair suddenly disappeared among  11  woman arrested saudi government brutal crackdown march allegedly confessing conspiring enemy came two month partner arrested jordan reportedly handcuffed blindfolded put onto plane saudi arabia deal beheading thing saudi arabia well much mb plan modernizing sa insecurity resulted wave repression wonder found found jamal khashoggi wonderful see lack comment almost admin trying close interaction public one guy performed woman drive deal halal food sa shit hole yeah saudi arabia barbarian hellhole actually need america bomb place wo busy selling gun dead meeting embassy get saudi arabian george kramer case newman look like trump given green light saudi go around world pick anyone like different opinion government believe closest thing royalty america people get ride little cart airport hate thing come nowhere beep beep cart people look cart people scurry way like worthless peasant ooh cart people hope slow wave cart people timmy best people world fat slow disoriented get gate time ready air travel people hate people get onto moving walkway stand like ride excuse animated pirate bear along way leg work aaah jeez get started prison mohd bin salman locked month ago seen wife daughter age probably already dead consolation since muslim probably raped well love say week probably going beheaded tomorrow good night user often report submission site ask u ban sensationalized article oppose blanket banning news source reader responsibility skeptical check source comment flaw help improve thread linking medium verifies question article claim link could help reader better understand issue find evidence article title false misleading contact moderator review bot action performed automatically please contact moderator subreddit question concern would make jerry u master domain wallah hallah hallah regular jerry seinfeld would disappear 
an6bz0,1549314352.0,norway intelligence service add huawei national security threat list,ahm713,960,15,lol got huawei ad article chinese military hacking unit stole billion dollar american western intellectual property chemical microchip organized governmental operation harm economy take manufacturing real dangerous technological war reap huge profit stealing invention spend money buying land house business fuck huawei deleted tell u people know deserve know zte scenario repeated american spying fine though lol mocrowave huawei mobile phone people going back forth saying china u insert country country dick really difficult people dick problem trump sometimes unintentionally right chinese government smart longterm strategy hard see deep really run removed industrial espionage would expect second biggest economy world think folk quick forget fiveeyes used purpose since late  1960  member satellite phone radio routinely intercepted translated meta stored information used form leverage underbidding contract misleading misdirecting global dominance buy huawei product part problem stop worried phone ok seen lot huawei lately idea going anybody mind eli 5  canada wondering government ban hauwei already pretty much every nation allied done 
arxep1,1550497783.0,facebook suspends page targeting american millennials,HenryCorp,215,13,deleted propaganda control free speech valid move russia censorship common user true thought best tl dr could make original reduced  62  bot facebook reportedly suspended page targeted millennials garnered ten million video view revealed account backed kremlin social medium behemoth suspended page friday said would ask administrator disclose russian affiliation according cnn page run maffick medium whose majority stakeholder ruptly subsidiary rt company hired contractor los angeles company registered germany cnn reported quot people connecting page  039  misled  039  behind  039  stepped enforcement coordinated inauthentic behavior financially motivated spam past year  039  continue improving people get information page follow quot facebook spokesperson said statement hill extended summary faq version tl drs far feedback  23 autotldr pm comment monitored constructive feedback welcome top keywords company  1  page  2  facebook  3  cnn  4  channel  5  thought old people used facebook list russian backed site  1  maga  2  national rifle association  3  abortion murder  4  ok christian  5  donald j trump  6  freedom thought multinational corporation get influence people medium foreign nation state ca deleted china europe u government ultimately figure control social medium decide view awesome hmm looked one seems like good sight dedicated helping people learn reduce waste output would want suspended facebook millennials even use facebook actively way parent sad read headline day must russiagate turning everyone brain mush  1  revealing source funding fb page requirement enforced npr al jazeera bbc telesur host medium explicitly mention page government funded  2  nobody criticizes content sorry page checked youtube reporting critical leftist medium opinionated seem false guess whole point exercise get u used reflexively reject message whenever someone scream russia think healthy huge company acting gatekeeper information censoring content demand whole saga triggered german marshall fund funded u nato feeding info cnn report ask facebook suspend page well wonder debunked weekly nonsense medium logic fact ca especially cheap war propaganda year like even claim information wrong simply ops interest nice company bed way censor witout critcized abroad oh private company content pushing millennials unfortunately article say large maga touting crowd 
atkbkc,1550856596.0,thousand pay tribute american air crew british town sheffield crew died  75  year ago diverted crash landing avoid hitting schoolchildren,nuktl,112,3,explain well watching bbc morning whilst getting ready work presumed old chap pilot raf american plane crashed attempting get plane path later read bbc website schoolchild time became even confused presumed plane crashing anyway slightly diverted course avoid hitting heroic act exactly sacrifice reading article realise american plane might well survived gone ahead controlled emergency landing instead sacrificed child playing park would hurt quite touching story explained properly best tl dr could make original reduced  82  bot foulds parkinson  039  disease became internet sensation bbc journalist dan walker stumbled across one morning walking dog walker began online campaign make foulds  039  dream come true properly commemorate air crew died flypast attendee crowd come far russia u one terry martin travelled bristol give artwork memorial foulds painted seeing tv stephen clark  47  war veteran said taken aback foulds  039  dedication felt compelled come quot today one man done bring memorial back life next step form award  039  done cracking job extended summary faq version tl drs far feedback  23 autotldr pm comment monitored constructive feedback welcome top keywords foulds  1  walker  2  memorial  3  park  4  flypast  5  must dust air 
azf2dl,1552219657.0,survivor ethiopia plane crash,jaykirsch,690,22,ethiopian airline ceo tewolde gebremariam told press conference passenger  30  country board said included  32  kenyan  18  canadian nine ethiopian eight italian eight chinese eight american seven briton seven french citizen six egyptian five dutch citizen four indian four people slovakia woke saw relatively new plane lion air recently crashed wonder many service currently boeing article following lion air crash last october investigator said pilot appeared struggle automated system designed keep plane stalling new feature boeing  737  max system repeatedly forced plane nose despite effort pilot correct finding suggest bet also caused new flight control system max  8  jet decided train pilot new feature second crash  6  month directly caused penny pinching thing happened lion air crash make nervous going flying china air china next month sad terrible small comfort plane full open seat bane cant keep getting away need ground max fucking disgraceful boeing condolence family may rip sad news crashing plane part plan rest peace figure reason asap boeing problem rest peace victim crash shit incredibly fast plane stalled however pilot reported difficulty wondering exactly said removed removed may rest peace fear may consumed taken better place deleted mission success said cable 
b1dqh7,1552649080.0,isps new zealand completely blocked liveleak  8 chan website nationwide level prevent spreading livestream christchurch attack,,134,23,already late live since least  7 am uk time plenty people would saved let face ca stop internet unfortunately incident forgotten mainstream medium wider audience eager able find deleted deleted likely hundred mirror sure pop stop unfortunately extremly ineffective logged vpn website load turned vpn get  503  error strange deleted ca stop signal mal wait shooter live streamed im curious kind people find sort thing entertaining bit overreaction end futile denmark tried squash video scandinavian hiker getting beheaded morocco still easily find video sorry blocking isps video worried become far right propaganda dumb move want find find medium already showing clip people wanted watch already deleted oh look government abusing fallout tragedy enact censorship guise think child sorry say video going anywhere give  6  month everywhere saved onto drive sd card available website host disturbing content give year douche probably make mlg remix video air horn hit marker sound effect ear rape music simply going make people want watch intention watching really want ive told cant seems liveleak banned uk cunt every video shooting liveleak stop right shot fired even though video say  3  min long stop  37  second every video deleted late x 200 b excuse censorship utilize block violent movie news anybody want watch beyond sure really purpose blocking liveleak x 200 b someone watch video enjoys content already something deeply wrong individual question already extreme danger society good shut round anyone site 
b2e8z6,1552882820.0,energy analyst forecast end coal asia japanese investor back renewables australia largest export customer thermal coal scrapping plan build power plant,ManiaforBeatles,97,2,interestingly article good end thought happen worker australian coal industry gone backlash person like trump often lot good 
b30b1c,1553016832.0,nazi themed owner charged possessing objectionable material christchurch,,168,7,guy seemingly racist douchebag government arresting someone based viewpoint whatever material posse troubling well first thought font company truck seems basis logo business sun wheel colour scheme match nazi imagery wheel look like swastika think alone basis nazi maybe there evidence sure cracking new zealand gun owner political extremist attacker australian bad taste really crime also whats wrong wearing camo dirty insulation work open company send logo government approved check violates copyright x 200 b get past government organ decides weather appropriate im sure country regulation policy use logo seems like outrage culture stuff understands avonside home company owner phil arp raided police tuesday guy home raided armed police possession objectionable material literally afraid fascist symbolism employed fascist method orwellian far way far disturbing weird nazi fetish guy guy home raided cop objectionable material rip kiwi sure never lead anything bad objectionable material becomes anything could fall within narrative excluding little pony doll get remind keep g joe action figure nz well seems ridiculous actually par flat earth conspiracy 
b498ki,1553282549.0,vladimir putin missile unlimited range expensive kremlin yet fly farther  22  mile,aubonpaine,1096,44,unlimited range russia developing interplanetary missile icbm already hit spot earth maybe missing point unlimited range classic russia cheap effective propaganda country miniscule gdp ca afford make weapon terror shocked wait russia russia official kremlin response best tl dr could make original reduced  60  bot kremlin produce weapon yet complete successful test expensive develop according source direct knowledge intelligence report weapon program assessed longest test flight lasted two minute missile flying  22  mile losing control crashing test showed heart cruise missile failed initiate weapon unable achieve indefinite flight putin boasted extended summary faq version tl drs far feedback  23 autotldr pm comment monitored constructive feedback welcome top keywords weapon  1  test  2  missile  3  report  4   5  missile unlimited range expensive kremlin even sanction indeed working embargo become kremlin modus operandi overt chest beating followed covert tail tucking recall back  2014  showing new super tank armata threatening everyone inevitable demise battlefield guess many planned purchase military none gave due cost putin basically beta desperately pretending alpha unsustainable like putin self pic expensive kremlin putin stolen kremlin money russia actual capability far le obvious propaganda machine hyperbolizes fucking shocked putin version star war program vlad private show big tipper become sugar daddy status get access video deleted loudest mouth often resides limpest dick russia nuke propaganda little else man importance sanction yeah let keep proliferation hypersonic missile minimum please last aircraft carrier bottom dry dock vlad led country used pioneer science decline hope someone better sense follows sound right wonder he trump supporter answer salvation mar unlimited range missile strap spaceship golden worry u intelligence aspect bygone year kind info would never released protect source possible released current admin counter collusion suspicion range unlimited range perfectly normal men age performance issue seems like taunting crazy person weapon yeah russia posturing ahead inevitable revelation meddled u election bit good old mutual annihilation deterrence need viagra welcome world russian defense big boast vague spec zero demonstrated capability practical use surprise military industry suffering government essentially mob putin maintain bare minimum need control country foreign interest going sacrifice money could pocket national military oligarch really care russia country exploitable resource putin need military grab control neighboring area probably privatized military completely charged rent operating company also personal shareholder wagner group step direction anyway like soviet grandparent russian people enthusiastically embrace living rotten potato worm ridden cabbage order finance mad leader dream world domination unlimited range mean  22  mile never knew get oofed bald vampire article hearsay hearsay conjecture word propaganda go anywhere want go love brag shit ca make one city next hypersonic missile outclass  22  fucking mile get wrong usa ca figure hypersonic missile either brag matter vlad ca get first one dump russia read like spin keep folk panicking bet whatever handle  22  mile fine thing soviet would fuck spec going one got supersonic right fucked something sleep doubt everything okay folk nothing see thing true  22  mile furthest tested far nation drunk threat world power program coming along sure putin wall fair guy take unlimited fuel get kind moeny economy j 1 egq sound like someone problem getting believe half see none hear make ukraine pay 
ba1cof,1554530196.0,union removed uk passport,nehakarmaayurveda,158,18,deleted well ca say making progress x 200 b start revising wording passport soon enough complete supply chain provide medicine food population snowball change design uk passport proved rallying point brexit supporter former ukip leader nigel farage describing  2017  decision bring back dark blue design brexmas worth noting eu require burgundy colored passport croatia blue passport thats fine eu country decided standardise passport even use different shade total clusterfuck clearly worth next make blue remove northern ireland angry left remove united kingdom scottish also angry left x 200 b remaining cover great britain strong stable x 200 b edit two word see still northern ireland well since jumping gun ireland scotland remember ah theresa may orderly brexit northern ireland next sad development deleted god horror ouch news  deleted european union go back trade bloc rip eu 
bci79t,1555099767.0,microsoft collaborating researcher linked chinese university artificial intelligence elevating concern u firm contributing china surveillance censorship apparatus,rieslingatkos,464,21,got ta get beta test china start using tech part world huh capitalist corporation shady thing lot lot money would thought surprise inept u corporate executive china best friend everything china today given u corporate executive willingly sending job technology save dollar per hour wage fuck worker china piss ten time angry ten thousand executive willingly built china screw worker course fucking china test government start trying implement see population freedom mad china stealing tech mad u firm hand willy nilly cause wan na save buck nation would pas opportunity take tech superpower hand silver platter aww come market force choice market made compete partnering chinese give market share nobody would suggest wrong microsoft anything gain market share right private company compete market demand building alliance authoritarian state natural step towards market domination fool would drop chance take powerful ally microsoft compete everything win sure building police state import back state using money stupid asshole paid year year destroy market insists correct right market must decide fate mankind right clearly winning strategy facilitate authoritarian police state overseas bring home win market winner loser along dominating bitch would surprise one shocked company one goal profit anything would put profit microsoft supporting chinese providing core product decade american people shocked hint waaaaait minute mean tell corp shady shit money find hard believe seems quite strange microsoft always one ethical technological big company everything throw rubbish helping chinese army doubt many enraged people going dump window move linux today none bet money make world go round sweet would wan na give away technology free save buck drive paycheck american firm stripe helped nazi regime even war surprising profit motive still doesnt care human right global village fine china subservient position ok guess nadella could afforded ivory backscratcher otherwise give fuck censorship apparatus contributing espionage apparatus trade china need stop 
bu8s1m,1559095097.0, 30  year tiananmen chinese military insider warns never forget,VerbotenPublish,100,6,deny history whole world know large amount people know owning mistake compensate family stop lying best tl dr could make original reduced  93  bot jiang  039  account wider significance shed new light military commander tried resist order use armed force clear protester square taken seven week captivating world jiang  039  decision challenge silence carry extra political charge army veteran also daughter military elite researcher previously shown several senior commander resisted using military force protester jiang gave new detail extent resistance inside military officer tried push back order extended summary faq version tl drs far feedback  23 autotldr pm comment monitored constructive feedback welcome top keywords jiang  1  military  2  army  3  protest  4  people  5  oh please absofuckinglutely nothing resist order one charge weapon tank shit refuse use else use one else trying sound sanctimonious like pathetic oh tried resist fucking hi verbotenpublish submission behind metered paywall metered paywall allows user view specific number article requiring paid subscription article posted accessible everyone submission removed flaired user discouraged upvoting commenting information see wiki page paywalls please try find another source news site reporting story contact moderator bot action performed automatically please contact moderator subreddit question concern never forget forget nothing happened fine m jiang said believed china stability prosperity would fragile long party atone bloodshed built sand solid foundation said deny people killed lie intelligent people lie wise people know necessary speak truth point know one gon na fare better 
bvm5ej,1559403966.0,germany green overtake merkel conservative poll first,Pilast,646,8,one reason might merkel conservative anymore woman named akk neither charismatic basic communication skill look like outlier look like western world heading towards future versus centrist currently power watching sideline sound like return depression europe green party conservative still rising europe clear eu election fascinating follow see whether trend continues thought party since become conservative seeing merkel conservative sentence make laugh deleted expect germany economy commit seppuku driven fanatically religious communist 
bwk18f,1559619024.0,miracle helsinki radical solution homelessness finland eu country homelessness falling secret giving people home soon need unconditionally,MyNameIsGriffon,641,29,imagine much productive citizen stable home try utah last heard going well least year since heard anything miracle real civilization look like think cold winter finn laugh mortal call cold fucking mosquito live outdoors summer well uk fucked enough house even private landlord live city rent delapadated house poor single parent way house worth live issue slum lord way around renting slum lord either coughing rent deposit admin plus check usually around add name credit check wait council house social housing wonder many hundred year would pas united state anyone seriously tried removed would love see u least provide something veteran studio apartment condition either therapy trying fix mind drug problem would job assistance weird give people base necessity tend contribute society dont turn crime solve problem woulda thunk salt lake city solved homelessness well ship really bad one another city free finnish government formed set goal halving homelessness  2023  eliminating  2027  deleted mean direct correlation alright prevent cavity brush teeth get home unconditionally unconditional part end condition like using drug alcohol also cost quarter billion dollar although recent study claim saving  15 k every homeless person street curious many people got street program expect enough pay even accept  15 k figure face value sensible program get homeless back foot wary miracle solution always seem cost excessive amount money end really working well originally claimed really work homeless person want home want help period isnt semantics yeah homeless person home longer homeless walk around street la sf people need lot roof head know treat human human actually help thing get better actually society social democracy housing issue work america dear finland ai holy crap right someone pay would anyone pay rent get house free courtesy taxpayer long country implodes also want open border breakthrough study show giving home homeless decrease amount homeless people say might miracle kidding aside novel approach rehabilitation survival truly hope work finland u handout generally met abuse rather crutch help build towards future independence largely mentality operating individual rather collective immigration finland  8  million people entire territory arguing cost homelessness cost giving someone house bother  2  reason  1  op convinced literally best thing without thorough research  2  hard quantify much homelessness cost looked uk government paper make great point case different say hard know whether drug use crime mental health issue support cost come caused homelessness cause homelessness unrelated therefore hard know whether include cost give pretty broad range figure result torille pretty easy finland lot lot land mostly privately owned put also strong moral duty rough sleeping summer literally impossible given climate ummm like cheating cool need free house said unconditionally remember 
